game,review
미르M,ㅋㅋㅋㅋㅋㅋ00시오픈이라면서 잡아먹은 데이터만 몇기가인데 이거 어떡할건가요????? 초과 데이터 뜨면 민사 걸어도되나요???
미르M,6월30일 게임잘하다 멈춰서 재접하니 중복 접속이라고 접속이안됩니다 이거뭐하라는건지 ... 주작 3섭인데 과금은 안할수없게 만들어놓고 게임은 접속이 안돼면 하라는거임?? 말라는거임?
미르M,아쉬운 부분도 있지만 100% 만족할 순 없으니.. 대체로 좋습니다. 할만해요.
미르M,인 겜 다운 속도를 개선 해보세요 게임 자체 다운 속도라면 이해가 되는데 인 겜 다운 속도 나무놀보보 다 느리면 어떻게 하라는 것인가요?
미르M,아니 무슨 중복 접속 이라고 접속도 안돼고 겁나 짜증나게 현질도 겁나 했구만 돌겠네
미르M,겜초보가 하기에도 플레이는 쉽네요 ㅋ 미르M 화이팅 ㅋㅋㅋㅋㅋㅋ
미르M,버그 투성이에 퀘하는데 길도 못찾고 왔다갔다 튕기고 쓰레기 겜
미르M,"과금 하게 만들었네요 리니지 오딘 따라한 느낌 그리고 그래픽도 젼혀 좋아보진 않구요 저는 그냥 삭제 할랍니다 예전 미르의 냄새가 젼혀 나질, 않습니다."
미르M,이모탈 하다가 이거해보니 캐릭이 너무작고 조작도 불편 타격감도 제로
미르M,사냥이랑이동속도 너무느리고지루하네요 그리고 중국사람들이많고 홍보하는지 오토쳇해놓은건지;;이런거보고있으니 별로하고싶은맘사라지네요;;
미르M,리니지 따라 만들었네 ㅋㅋㅋㅋㅋㅋㅋㅋㅋ 캐릭터 클래스별 뽑기에 영물에 탈것에 그냥 싹다 과금이네ㅋㅋㅋㅋㅋㅋㅋ 타격감도 없고 그냥 쓰레기 게임 ㅅㄱ
미르M,게임 몰입감 최고! 짜릿한 조작감 최고! 극강의 게임. 모바일게임이 이정도라니 놀랍습니다!!!!
미르M,오홋 과긍요소가 조금 아쉽지만 재미는 있네요 대작입니다👍
미르M,아니 왜 잘하고있는대 관리자님이 접속종료 시키는겁니까 퀘스트 보스몹 하나 잡겟다고 몇시간을 기다렷는대
미르M,보안정책 어쩌구저쩌구 000000033 오류 계속 뜨면서 설치 조차 안됩니다 방법이 없는건가요??
미르M,쓰레기 양산형게임의 하나일뿐 그이상 그이하도 아닌듯. 리니지과금에 짱꿔전투력수치 탑재한 그냥 생각하는 그게임
미르M,현무3서버 호날도 캐릭이 갑자기 사라졌어요 구글결제까지한 캐릭인데 캐릭찾을수가 없다네요 대형게임사위에이드에서 게임관리를 이런식으로 하시나요?
미르M,이런 병맛 게임 처음 본다 게임 망하고 싶은가 보네 2D에 케릭터 겁나 느리고 타격감도 없다 ㅎ
미르M,도사 모든 무공 이펙트가 색깔만 다르고 다 똑같음.. 이펙트좀 다양하게 바꿔주세요. 미르2에 도사느낌이 전혀 안나요
미르M,버그도 많고 그냥 왜만든지를 모르겠어 주가도 폭락했다가 왜 올랐는지도 모르겠어 비제이들 프로모션으로 구글매출올라서 그런거야? 아니면 다른요인이 있는거야?
미르M,오토다시 누르는데 자꾸 바로 앞에 몬스터가 있는데 다른곳으로 이동해서 사냥을하네요 고쳐야 할꺼 같네요
미르M,점점 겜들이 시작 땡부터 지갑을 열지 않으면 사람취급도 못받는듯 하네요 위메이드는 특히 더 심한듯 그냥 절레절레 입니다 ㅎㅎ 별하나도 아까워요 -별은 없나요?
미르M,캐릭터 밸런스가 너무 안맞는거 같군요 말그대로 전사는 몸빵 캐릭인데 체력 물약을 한없이 먹고 약값이 없어 사냥도 안되는 이런 어처구니 없는 일이...
미르M,아니 술사인대 무기상자를 질러서 장비를받고 시작해도 22랩에서 퀘스트다막히네 잡질못하네 계속죽고..
미르M,하지마라 시간 아깝다 각종 버그에 1%확률에 장비 파괴 자주되고 현질안하면 개노가다. 할라면 25랩찍어보고 현질ㄱ
미르M,이것이바로 국산모바일 게임 변신뽑기는 기본 펫뽑기와 다양한 탈것뽑기 나를 강하게 만든다 제작시스템 도감까지 변하지않는 국산모바일게임 많은이용 부탁드립니다 는 개뿔
미르M,"공홈, 게임 서버 시작도 하기 전에 동시에 터지다니..."
미르M,다운받는 시간 잠깐 해본시간 합이 두시간 색다른 게임은 없나? 탈것 변신 인형 무공 게임에 한계인건지 한국 게임에 능력인건지 모르겠네
미르M,다운이 안됨...진심 빡침 새벽에도 그러더니만 안녕히계세요 여러분!
미르M,리니지 짝퉁 k게임 신작내고 탈거 뽑기 비제이들섭외후 돈빨아먹고 다시반복반복 똑같을거면 그냥그래도 메이저회사 리니지하지 개토악질나오네 그래도 돈되니까 하겠지만 이런게임내고 잘되길바라는게소름돋는다
미르M,디테일과 타격감. 남다르네요. 아직 초반이지만 아주 기대됩니다.
미르M,아직 출시 전이지만 cbt때 즐겁게 플레이 했어요. 빨리 오픈 하길!!
미르M,역대급으로 재미가 없다 템은 안나와 흑철은 작업장이 와서 다 캐고 돈써봐야 변신도 안나와 제작은 재료 모으기도 힘들어서 손도 못대 뭘하라는건지..
미르M,돈쓰면 접속대비 4시간으로 현질 의미 사라짐. 빠른 환불처리 바랍니다.
미르M,아이템 무공 슬라이드 자동사용 자동사용해지가 안되네요 고쳐주세요 s21 안드12
미르M,영물을 보유하고있는데 합성했다고 도감 등록이 안되는건 너무 하는거 아닙니까?
미르M,"게임이 왜 이렇게 빡세게 구성했는지 모르겠다.Bm설계가 오딘를 훨씬 뛰어넘는다.20렙넘으면, 게임의 진도가 아에 나가지 않는다. 오딘보다 훨씬 빡세다. 오늘 내일 내로 빨리 밸런스 조정 안하면 유저들 다 떠나간다. 오딘을 배워라 자식들아, 초반에 인심좋게 팍팍 풀어라 멍충한 넘들아, 블소도 게임이 너무 빡세서, 2,3일 사이에 다 떠나간것 모르더냐. 일요일 되기전에. 빨리 난이도 조정해라 지금 유저수 급감한것 보이지. 않느냐. 소잃고 외양간 고치지말고"
미르M,오픈시간도 못지키는게임 안한다 어떻게 운영될지 수준이 보이네요. 정신건강 지키기위해 삭제함.
미르M,버그천지 이건 게임도아닙니다. 진짜 신입사원개발자가 주도해서 만든게임같은느낌 랩업은꿈도꾸지마시요 물약값이 모자라 허수아비잡다가 끝나는게임
미르M,지금 창고 늘렸다고 해서 창고 정리 하려고 아이템 빼고 다시 넣으려니깐 공간이 없다고 하고 1대1 문의 하려고 하니 대표케릭 설정하라고 하고 글 조차도 못쓰게 만들고.. 전체 환불 해 주세요
미르M,"극악의 끝을 달리는군요. 리니지가 혜자 스럽습니다 예를 한가지 들게요 술사 무기중에 청혈마장 이라는 무기를 만들어보죠 5단계 무기중 중간 단계 상급 정도랄까.,..,.. 순수재료 채집과 시간입니다...채집시간은 한 개당 10초로 잡았습니다 철광 원석 22만 5천개 광석 75만 500개 진화제 20개 뿌리 만 5500개 이끼 5만개 모두 합치면 100만 41020개 계산해 보면 순수한 체집 시간만 121 일 나오네요 하루 24시간 잠안자고...후 여기선 실패 없이 재료 제작이 되었을경우 입니다.... 또 한 가지 아이템 제작 성공확률은 40% 입니다 무기 만들기 참쉽죠??? 애정때문에 떠나지 못하는 난 바보인가 봐요 ㅜㅜ 절 욕하시는 분이 계신데 100만개를 얻기위해 성공률 50% 잡으면 200만번 채집해야하고 채집한걸 50% 확률로 조합성공 한다면 400만 개가 필요하다는거죠 마지막으로 무기제작 성공률이 40% 라는거구요"
미르M,누구나 알고잇눈 익숙한 리니지라이크지라 까일순잇어도 재밋게 잘만듬 과금쌘거빼면 깔이유가없음 또니지 지겨우면 우마무스메 하면됨
미르M,제가 좋아하는 종류의 겜이네요 너무 재미있게 하고 있어요
미르M,옛 미르2유저며서 정말 많은기대를 했는데... 1.옛날 미르2에서 못벗어남 2.캐릭이 뛰는데 슬로우 모션 (속도감 없음) 3.캐릭의 다양화 없음 4.그래픽 별루임 개선 요망
미르M,스킬 연출이 상당함. 각 캐릭터가 가지고 있는 컨셉에 맞춰 연출을 보여주며 너무 화려하지 않게 그렇지만 보는 맛이 있도록 스킬 연출을 해놓아서 만족감이 높다.
미르M,"역시나 k게임. 리니지bm 그대로다. 무빙하면서 싸우는게 그렇게 어렵냐. 원거리캐가 말뚝하고 근접에서 쳐맞으며 싸우는게 뭔 원거리캐야 에라이..이것만봐도 얼마나 신경써서 만들었는지 감이 온다. 상점 판매, 확률 대단하다. 언제까지 이런겜이 나올지.."
미르M,오늘 3300원최소과금으로 게임을해봤네요 유저끼리 싸우는데 과금하는게임은 많이봐왔어도..메인퀘 깨기위해스펙올리려고 과금해야하는이유가 도저히이해가안가네요.케릭딜도안나오고.메인퀘가더이상진행이안될정도로 약하네요.전사라는케릭은 과금하지않고는 게임을도저히 안되게끔 만들어놓았네요. 어느정도 진행되게끔해주시든지.파티던전은 아예 진행조차 안되고...좋은게임을 완전 거지처럼 만들어놨네요.
미르M,야 숙제 다했는데 완료 버튼이 안눌려 아직 완료 되지안은거 머냐! 아주 좋은 게이이다
미르M,너무 잼나네요 하루종일 할게많은 바쁜겜이네요 낚시 채광 채집 사냥 지루하지가 않아요~^^
미르M,업데이트했는데 왜 게임이 실행안되는지요? 잼있게하고있었는데...
미르M,생각보다재밌네요 pc로 하면 더재밌을듯 린저씨 횽들 요기로 모이겠네요 잘만들었습니다 무협느낌 굿!!
미르M,"사냥해서 물약 벌 돈도 못 모으게하는 밸런스를 만들면 우짜나요. 레벨 29인데, 빨리 밸런스 조정하세요. 이런걸로 유저 다 떠난다."
미르M,여타. 게임은 어느정도 레벨이 올라가야 찐 콘텐츠를 즐길 수 있는데 미르M은 낮은 레벨부터 도전할 수 있는 필드 보스들이 있어서 좋았어요
미르M,그냥저냥 향수만 맡ㅇ고 갑니다 길게하건 못되는거같군요 맛ㅇ보기전에 현질유도가 심함 유저없으면 진행두 불가 .
미르M,너무 재미있어요! 단언컨데 2004년 올해 최고의 게임이 될 것입니다!
미르M,타게임들 처럼 9900원 패키지 좀 내주지 넘 비쌈 그래도 할만하네요
미르M,그냥 개돼지게임 엔씨게임을 너무 따라함 나가뒤지세요... 6렙 키우고 삭제 너무 쓰레기임
미르M,미르의 향기가 안남 그냥 다른게임 이렇게 내놓다니..... 리니띵이 차라리 구현은 제대로했지..
미르M,이게 뭔가...한달을 기다리고 8시간 게임을 했는데 시간이 너무 아깝다. 확실하게 배끼던가 그게 안되면 좀 독창적이던가.앞으로 개선의 시간이 많으니 발전이 있긴 바람. 하지만 오픈과 동시에 실망한 유저들은 돌아오지 않을 거 같음. 그리고 진심으로 한마디만 더 하자면 댓글 알바 쓰는거 너무 티나는거 아닌가.ㅎㅎ
미르M,"그냥,현질 유도겜,,조금 하다접는겜,,먼 중국 말이 채창에 도배하냐,,,"
미르M,게임은 잘 만들어서 즐겁게 하고 있으나 몇가지 버그롲인해 불편이 있읍니다 27일 정검보상 우편버그로 인해 못받아 사라짐요 또 인벤에 강화석 몇개 사라졌어요 복구 신청합니다
미르M,자동사냥 조금 오래(몇시간정도) 켜 놓으면 다음 접속할때 로봇이냐고 물어봄 접속 후 또 자동사냥 돌리면 얼마 안되서 운영자에 의해 접속이 끊어짐 멘트뜨면서 접속이 끊김 렙업하려면 자동사냥하면 안되는건가?
미르M,"장르가 장르인 만큼, 시스템 자체가 상당히 익숙해서 아마 어렵지 않게 다들 스킬과 아이템을 사용하며 플레이를 즐기실 수 있을 거라 생각되요"
미르M,ㅋㅋㅋ 실망시키지를 안네 리뷰지우지 말아라 3번째쓴다 겜 오픈 날에 오픈 하지도 않으면서 별점5점 받기를 바라지도 말아라 공지도 없고 에휴 추가파일만 4번째 받는다 듀랑고 삘 나는구만 12시27분이다. 할말없으니 일단 로긴화면까지는 보여준다 이거네12시31분 추가파일5번째 받는다. 위메이드 역시 실망시키지 않는구나
미르M,주작 1섭 서버 좀 늘려주세요! 생성제한이 풀리지를 않네요...
미르M,타게임과 비슷한 컨텐츠인데 최근 게임인데도 먼가 좀 떨어지는 느낌. 플레이도 하드하고 채팅창은 중국인들 홍보글만보이고 1시간하고 지움. 다운로드 시간과 플레이 시간이 아까울정도임. 여긴 중국이 아니라 한국입니다.
미르M,게임 로그인이 안되서 게임조차 못함 오류코드99999 ㅡㅡ;;
미르M,중국게임인지 한국게임인지 알수가없음 서버에 중국사람들이 더많음 버그 졸라많음 환불도 안해줌 업하기 개빡시고 현질아니면 답없음
미르M,처음에는 스토리를 진행할 때만 그래픽이 좋은 건 아닌지 걱정이 되었는데 본격적으로 게임을 즐겨봐도 그래픽이 좋아서 매우 만족했습니다!!
미르M,20렙까지 키우면서 느낀점 자동사냥 자꾸 이상한 곳으로 가려고 함. 그거 하나 조고 하는데 답답해서 지움. 뭘 해도 한마리 잡고 이상한곳으로 가려고함
미르M,언리얼 엔진을 기반으로 한 만큼 그래픽이 굉장히 고품질이네요 게다가 쿼터뷰 방식으로 멋지게 보여줘서 보는 맛 하나는 제대로 잡은 것 같습니다 ㅋㅋ
미르M,"스킬 이펙트 진짜 내 취향이다... 화려한 것도 과하면 괜히 눈뽕만 맞고 제대로 스킬 쓰고 있는지도 모를 때가 있는데, 미르M은 그런 것도 없고 딱 적당하면서 타격감은 제대로 살렸네요"
미르M,모든 부분에 있어 만족도가 높지만 가장 마음에 드는 점은 유저들과 몹 타겟팅이 최대한 겹치지 않게 자동 전투가 진행되는 점입니다~!
미르M,꿀잼입니다. 처움엔 망인줄알았는데 점점 어느샌가 pc버전으로 2클라 돌리는 저를 발견했습니다. 하악
미르M,ㅉㅉ 이걸 게임이라고 한건가 과금하고 아템 구매도 제대로 안되는게 무슨 게임이라는건지 ㅡㅡ
미르M,모든겜이 그렇듯 첨엔 글치요 앞으로의 운영 잘 부탁드립니다
미르M,"접속 안됨...아마,사전 다운로드만 가능한듯? 23일 출시예정"
미르M,그래픽은 좋은데 이건모 초반에 몹 마자 죽고 피 마나 먹기 바뿌고 좋 아닌듯 싶네요 이 게임
미르M,컴퓨터로 게임해볼려는데 보안정책상 게임을 종료한다는데 어케해야 할수있어요?
미르M,"타 게임에서 무조건 고등급이거나 공격력이 높은 아바타만 좋은 것으로 취급하는 것과는 달리 미르M에서는 각 화신마다 채광 시간, 낚시 대성공 확률과 같은 생활 콘텐츠 능력치가 별도로 있어 어떤 플레이를 하냐에 따라 화신을 바꾸는 재미를 선사해줘요"
미르M,이겜은 장비파괴가 문제다 1강에서 5강까지 넘 힘들다 파괴확률 6프로가 되지않는데 자주 터진다 좀 지겹다 이건 겜을 하지 말라는거다
미르M,초반이라 오류 있는건 인정 탈퇴하고 그만두려다가 또 접속하게 되는 중독성
미르M,집에선 컴터로계정두개 돌리고 출근해서는 핸드폰으로 만 게임 합니다..재미있게 잘하고있었는데 오늘아침.. 제가 무슨 위법행위를 했다고 계정 블럭인가요?고객센터는 통화불가능 . 짜증나게 하네요 빨리 확인하고 처리해주세요
미르M,진행만 꾸준히 하면되니 천천히 재밌게 즐길 수 있는 게임이라고 생각이 드네요. 짬짬히 하면서 시간 좀 쓰면 될 듯. 서비스 오래오래 부탁 드립니다.
미르M,완전 개실망임. 진짜 기대했는데 중국겜보다 못함 그래픽은 고사하고 움직임은 할배들 무용보다 못함.진짜 쓰레기 겜. 내가 넘 열받아서 태어나 첨으로 리뷰담. 별 하나도 주기 싫음.
미르M,전투가 ㄹㅇ 재밌어요 적의 공격에 맞춰서 대응을 하면서 이동과 공격을 이어가는 손맛을 느낄 수 있어서 좋더라고요
미르M,이게임도 아이템드랍 확율 케쉬로 올리는거 나올듯. 역시 위메이드게임은 할게아님
미르M,게임이 되들않아요 추가 다운로드에 공지사항은 뜨지도 않고젠장
미르M,웬만하면 1점 안 주는데 기대감이 커서 그랬던 건지 실망감이 이만저만이 아니네요. 이건 아니죠.
미르M,걍 리니지 카피작 ㅉㅉ 역시는 역시 개노답 한심하기 짝이없는
미르M,렉 땜에 진행이 안되네요 무슨 게임을 이따구로 만들어서 오픈한건지 파티던전은 시작도 안되고 탈퇴하고 다른데 참가할려니 탈퇴안되어 있다하고 내 파티 들어갈려면 없다하고 이거 말고도 렉 진심 빡치네요 재미도 별로고
미르M,평점 주작 오지네요. 23일 00시에 오픈 한다면서 00시 30분이 다되어 가는데도 게임이 안됨
미르M,ㅋㅋㅋ그냥 리니지랑 판박이네 돈뽑아먹고 싶어서 아주 난리구만.....변뽑 인형뽑 탈것뽑 도감 등 뭐 도대체 다른게 뭐냐??
미르M,70% 다섯번 연속 실패 + 뽀각 현타와서 접어요 내가 로또급 불행을 자랑하는지 아님 주작인지 ㅋㅋㅋ
미르M,무슨 이유로 블럭상태가 됀건지 확인좀 해주세요 핸드폰으로만게임하는데 어이없네요
미르M,재밌네요 지금껀 해본 Rpg 중엔 제 취향엔 제일 맞는거 같습니다
미르M,겜접속후딱10분했음 상점 변신 펫 등등 리니지가 이름바꿔서 나왔넹 아지겹지도않냐 그넘에 리니지 따라하기 별하나도아깝다...
미르M,도대체 리니지류 게임들의 차이점이 뭐임? 맨날 나오는데 뭐가 달라진거임 이거?
미르M,친구가 미르M 게임을 하고 있어서 저도 오늘 처음 해봤는데 생각보다 너무 너무 재미있네요.👍최고!
미르M,추가다운로드 다받앗는데 또다시 1%로돌아가는건먼가요? 열심히 기다려서 추가다운로드다받앗는데ㅠㅠ 저만그런건가요??
미르M,환불문의에 절대 답변 안해주는 완벽한 쓰레기!!! / 1:1문의 10일째 미처리다!!!
미르M,나이 먹어서 못할줄 알았는데 게임하기 편하고 좋네오ㅡ....
미르M,"미르4때도유저돈겂나쓸어담더니..미르4를더완벽하게보안해서더확실하게뜯어먹을라고만든게미르M이네.. 곡갱이질로활력충전미르4때는가능..지금은불가능..더군다나내구가달면사냥도못함..곡갱이질,채집..다못함.. 일단13만원현질해봄..아무의미없음..게임내동전약도못삼.. 화신뽑기6단계까지있지만중하단단계인보물단계구경도못함.. 결론..예전의PC 미르2때의의위메이드가아님.. 매스컴에요즘안좋은기사도나오던데.. 내댓글에유저님을만족시켜드리지못한점죄송어쩌구..이딴댓글달지말고..난이제두번다시PC포함..위메이드게임안함.."
미르M,중국인에게 서버가 먹혀서 접속할수도 없는 게임..린m 양산형 버전.
미르M,할만해요. 나중에 글로벌 나오면 쌀먹할겸 미리 연습해놓는거죠.
미르M,"버그는 넘쳐나고 50만정도 현질을했어도 인게임 동전이라고 있는게 더럽게 모자람 무과금분들이야 말해뭐하겠음 리니지는 과금상품이 악랄했지,, 여긴 뭐 무과금뿐만아니라 소과금도 물약살돈없어서 사냥도못함ㅋ"
미르M,"해보고,와쏘,옛날게임,느낌난다,고로,내스타일, 아니네,수고,"
미르M,최악 도사 소환 핵심인대 그거 너프시켜버리네 버프는 못할망정 개발자놈들 대가리업네 왠만해서는 1점안주는대 겜망햇다
미르M,미르2를 모바일 그대로 내면될껄 뭘 굳이 돈쓰고 욕먹으려고 발악하고있음. 장신구 내구 안다라지게 수리하는템만 팔아도 돈벌었겄다.
미르M,참 한심하다 이런걸 게임이라고 계속 만드니 어이가 없고 개발자들 월급이 아깝다
미르M,와...성별 커마 없어요? 진짜 변신뽑기로 외형바뀌는거에요? 리니지랑 다를게 없네요?ㅋㅋㅋㅋ 와...진짜 어이가없네
미르M,진짜 게임 엉망임 자동사냥은 멍타고 물약은 무슨 링거액 맞느수준 계속 빨아댐
미르M,제작 진짜 확률 맞는건가?? 몇 번을 해도 실패네 제작 확률 5프로인듯 ㅋㅋㅋ재료 구하기도 힘든데 제작은 터짐
미르M,ㅋㅋㅋ아니 파티가입버그 개선좀 하세요 거기는 일 안해요?
미르M,"와, 댓글관리하시네ㅋㅋㅋㅋ막말로 사전다운로드 날짜 6월 22일에 플레이도 안하고 만점 주는건 사측 조작 아닌가? 이 글도 삭제되려나?"
미르M,처음 이런류의 게임을 해봤는데 생각보다 괜찮네요 벌써 시간이 ㅠ
미르M,택아 서노야 너희도 해봐라 처음인데 다운받는건 쫌 시간걸렸지만 기대된다
미르M,홈페이지 문제있나!!!! 카카오접속해서 대표케릭 설정이안됨!! 로그아웃 제접속 해도 안됨 닉네임도 설정이안됨 !!! 어떻하라는거죠!!!
미르M,잼있는듯한데 근데 저녁에 겜 접속 대기 600 명;;;기다리다 지쳐 그냥포기
미르M,"미르4글로벌 섭관리나 똑바로해라~ 며칠째 접속안된다. 토벌,보토안되~ 미르m더럽게 재미없어.. 과금유도 장난아니고.. 그나마 남아있는 미르4글로벌 유저나 신경 좀써라~;; 서버가 개판이안.."
미르M,다운만 패치만 3번째임 접속이안됨 4번째 이번에는 추가다운로드하라떠서 4485MB 또 다운로드중 밧데리 86퍼였는데 4퍼남은 이거 다운받고 패치하고 추가다운 받느라
미르M,왜 재밌지?솔까 시디 또는 게임팩 산다는 마음으로 6만원정도 지르고 하니 세상 편해지네ㅋㅋ
미르M,대단히 기대가 됩니다 이미 미르4로 전세계 블록체인 1위게임을 배출한 위메이드 이번 미르m으로 더욱 성공을 거둘거라 확신합니다 장인시스템이 그것을 증명해줄것입니다
미르M,CBT해보고 반해서 시작해보려고요 ㅎ 적월마를 무찌르고 비천성을 지켜야
미르M,중독성 강한게임^^ 할수록 빠져 드네요 가끔 진행이 더뎌지는 구간은 있지만 또 그리 오래걸리는 않구요.
미르M,스토리 진행 몇몇 구간에서 고퀄리티 연출이 등장하는데 이게 또 한번 게임을 몰입하며 즐길 수 있게 도와주는 것 같애요
미르M,역시 이겜도 캐시 땡기려는 수작밖에안보임.미르에 왠변신뽑기ㅋ 다른게임들 그렇게 망하는거보고도 느낀게없는듯 물론 회사수익이야 있어야겠지만 해도너무함 그리고 폰으로 겜하면 랙도심하고 이동퀵바는 지멋대로 움직이고 이럴거면 애초부터 pc전용으로만들던가ㅡㅡ
미르M,그래픽 부분에 있어서는 어떤 게임과 비교해도 우위에 있다고 할 수 있을 정도로 깔끔하면서도 한국적인 정서를 잘 표현했어요
미르M,아오 중국겜...중국사람이 대부분인 국적불문 고전그래픽게임 중국놈들하고 서버 좀 나눠주세요
미르M,으휴 사전다운로드 받으라고 그리 호들갑 떨더니 정작 오픈시간은 아무 공지도 없이 지키지도 못하네
미르M,원작에서의 중요한 특징들은 제대로 살렸지만 그래픽 자체가 완전히 달라져서 마치 다른 작품처럼 느껴져요
미르M,해보니까 생각 외로 잘 만들어진 게임이네요. 언제까지 할지는 모르겠지만.. 질릴 때까지는 조금씩 지갑도 열어가며 열심히 해보겠습니다!
미르M,자꾸 팅기고.돈은 돈데로 쓰고.머 주는것도 없고. 성물 한개 뽑아 낼려고 해도 나오지도 안고 돈만 지르라는건지? 진짜 겜 답없네. 어쩌자는 겁니까? 쓴돈을 생각 하면 화가 나네요.!
미르M,초과금 게임 하다가 느끼실꺼에요 조선시대 리니지!!!!!!
미르M,사랑하는개발자님 뮤료한 시간 되지 않게 해주셔서 감사합니다 ^.^
미르M,"전투 상황 시 타이밍에 맞게 구현되는 피격 모션과 이펙트, 여기에 사운드가 더해져 전에 없던 깊은 타격감을 느끼며 플레이하고 있어요"
미르M,2022년도에 이런 수준의 게임이 나온게 신기하다 ㅋㅋㅋㅋㅋㅋ 혹시 10인 개발 게임 인가요 ㅎ..?
미르M,"아니, 십얼럼들아. 그냥 막 줫꼴리는데로 업뎃하고 그래? 그럼 과금을 하지 않게 만들던가. 무슨 개짓거리야"
미르M,미르m 기대하고 있었는데 백만년만에 출시하네요 어서 서버 열어주세요 ㅋㅋ 게임하고싶어요
미르M,리니지 매운 맛! 극한의 BM! 극한의 노가다! 별 하나 주면 리뷰 지우겠지?
미르M,"편하게 할수있고, 이벤트 많고, 질리지 않고 할 수 있는 컨텐츠도 많고, 육성하는 재미까지 수많은 재미를 보유한 게임입니다"
