game,review
미르M,이정도 자본과 인력이 투자되었는데도 재미가 없다면 개발자들이 무능력한게 아닌가...웹디자이너 대려와서 만들어도 이거보다 나을듯 이러기도 쉽지 않기 때문에 5점드림
미르M,밸러스 최악입니다. 현질을 해도 게임내 동전이 없어 진행할 수가 없네요. 애초에 시작을 안하는걸 추천힙니다.
미르M,다른건 둘째고 추가 다운로드를 도대체 얼마나 받아야 끝나는건가요?계속 로딩이길래 껐다가 다시키면 또 추가 다운로드.. 0시부터 지금 몇번 추가 다운로드를 하는지.. 오픈은 한건가요? 일부러 안자고 해보려고 버티다가 열만받고있내요
미르M,너무하드합니다. 과거 보스잡고 터지는것도 없고. 앞으로 목룡혈이나 지옥 고대 비천같은 고랩 던전도 생길텐데 초반부터 오마동굴에서 막히는건 문제가있어보여요.ㅠ
미르M,일단 .. 플레이 해본결과 ... 진입 장벽이 너무 높다 .. 사냥 🐕 빡시다 . 장인 시스템 시간을 갈아서 사골을 우려 내야 되겠단 판단이 든다 ... 이러면 쉽게 게임하고자 하는 사람들은 이게임 진입과동시에 초반에 . 떨어져 나간다. 사냥을 주로 하는 사람 채집을 좋와하는사람 둘로 나눠 놓고 채집과 사냥의 드랍 템을 거래로 교환해 가며 사회 시스템을 구성 하겠단 건데 .. 이건뭐 .. 하는 사람만 하는 게임이 될거 같은 . 아쉬운게 처음은 어차피 낮은 등급 아이템들이 필요한거자나 .. 그 아이템들 만드는건 쉬웠어야지 ... 처음부터 응 너 개노가다 해야 하나 만들어 도 아니고 만들까 말까야 .. 만들게 해줘야지 .. 무한이 시간만 갈아넣어라 야 ...시간아까우면 시간단축 상품 준비해서 팔려고?? 그럼 성취감이 있냐 .. 가치가 있다고생각해?? 뭔가를 만들기위해 준비하는 과정이 즐거워야 되는데 .. 이건... 과정은 지루해 ... 너~~무오래걸려 ... 누가 장인 하겠어
미르M,게임내 치명적인 오류로 인하여 환불 신청했습니다. 캐릭터 사망시 소모성 아이템이 전량 사라지고 있습니다. 6월 25일 10시 30분 패치 이후에 해당 증상 지속적으로 나타나며 이 게임을 해야하는 이유를 모르겠네요. 환불요청이나 빨리 처리해주길 바랍니다
미르M,미르 시리즈 몇개 접해본 유저로는 이것저것 유용한거 다 접목시켜서 해볼만하네요 이제부터는 현질은 안해야지ㅋㅋㅋㅋ 위메~ 계속 새게임 출시해주세요 홧팅 ㅋ
미르M,꼭 과금하지 않아도 게임 시간만 투자 하여 흑철 팔아 어느정도 따라갈수 있어서 좋음!! 다만 화신 뽑기 확률이 너무 안좋음 ㅠ 신물 성물이 너무 안나오네요
미르M,아 장난하시나요 업데이트 하고 들어갔는데 다수ip어쩌고 하면서 계정 10년 블럭ㅋㅋㅋ 한땀한땀 템 맞추려고 재미있게 하고있었는데 정털리네요
미르M,폰에서 용량이 커서 내장메모리 용량 부족으로 게임을 할 수가 없네요 SD카드에 저장 될수 있도록 변경이 되어야 할거 같아요
미르M,인증하기를 매번 접속할때마다 해야하는 번거로움과 스트리밍할수있게 개선좀 해줬으면 합니다
미르M,서버 접속이 원활히지 않습니다가 도대체 몇 번이나 뜨는거냐... 게임을 아예 하지도 못하겠네ㅡㅡ
미르M,처음에는 별로였는데 하면할수록 할수있는폭이 넓어지는게보여서 잼있네요
미르M,현질 1000만원 이상 안할거면 냄새만 맡으세요 그래픽도 좋고 다 좋은데 현질 100~200가지고는 택도없는 게임이네요 아... 후회스럽다
미르M,그래픽예쁘고 다 그냥 좋은데 왜... 물약 자동 안걸리나요ㅡㅡㅡㅡ??? 설정가서 90프로 까지올려놔도 죽을때까지 물약 안쓰고 죽어버리네요 ㅠㅠ 이거 어케하는거에요 ㅠㅠ
미르M,미르란 게임을 처음해 보는데 첫날부터 준비를 덜 했는지 팅기고 대기열 길고해서 짜증났지만 게임은 생각보다 할만하요. 리니지접고 도저히 할게임이 없었는데 나름 신선합니다. 과금요소도 린m을 해서 그런지 아직은 적절한거 같은데 너무 빠르고 과하게만 안늘어난다면 정착할것 같네요. ㅎ
미르M,게임은 좋은데 서버안정화 버벅거리는거 던전 파티 이런거 너무 렉이 걸려서 힘들어요 확실하게 점검을 해서 고쳐주면 좋을꺼같아요
미르M,"1점도 아까움 핸드폰으로 1계정 1케릭 유저로써 조용히 게임하는 사람으로써, 게임으로 거래를 한다든지 여러계정파서 작업을 한다든지 그런일이 없음에도 불구하고 게임한지 2주가 되어가는 시점에서 바로 블럭을 당해버려서 어처구니가 없네요"
미르M,사전다운 받아놓고선 계속 추가 다운로드 하라고 ㅡㅡ 3번째 추가인데 장난하나.저장공간 60기가 이상 남았고.추가로 컴에 다운 받을때도 처음과 다른 용량과 추가 다운로드는 똑같은데?
미르M,유저들이 싫어하는거 전부 만들어 놨넹 뽑기는 그렇다 치고 길막 시스템에 이동도 안되고 버벅거리고 바그 투성이... 리니지 스타일 고전 게임은 이제 그만 만들어라
미르M,도저히 못하겠네요. 확률 극악에 리니지를 완전카피했나봐요.. 과금요소가 너무많고 재미가없어요 . 기대했는데 실망이네요
미르M,게임에 스토리나 구성은 예전과 비슷한듯한데 아이템은 결제 안하면 안주는듯... 노력하는자라도 결제 안하면 죽는다...
미르M,와 핸드폰으로 하는데 기종은 노트20울트라.. 퀵슬롯 좌우 밑으로 당기는거 겁나 안되고 움직이는것도 지면터치만 자꾸되고 패드가 안뜸 여러번해야 뜨고 ㅋㅋ
미르M,게임이 어려워서 오히려 몰입도가 좋네요 옛날 미르2 감성을 잘 재현해낸듯 합니다
미르M,이건 너무하네요. 게임하는중에 팅겨서 다시들어가면 대기중이라고 뜨고.... 렉은 왜이렇게 심한지.... 기대하고 시작했는데 실망만 크네요
미르M,별한개도 아깝다. 추천서버가 접속이 안되면 시마이다. 바로 삭제 하고 간다
미르M,촌섭에도 대기열생겨서 500명에서 98명까지갔으나 다시 대기열초기화만 2번째임 게임을 어케하라는건지? 그리고 게임 난이도 너무높음ㅡㅡ
미르M,"재밌네요 서비스종료만 하지말아줘요 끝까지 해볼래요 국내를 테스트용으로 한다는 소문이있는데 국,해외 둘다 잘하기를"
미르M,화신 뽑으면 보물이상 부터 필살기 광역스킬들 따라오니 갓혜자겜 과금요소는 있지만 상대적으로 적게든다 원작향수 충분하고 소과금으루도 충분히 즐길수 있다 그래픽 괜찮고 적어도 27렙 경매장 판매렙 정도면 파티재미 즐기면서 느낄것이다 초심 잃지말기 바란다~
미르M,재밌고 무과금도 충분히 즐길수있어 대만족하는데 장시간 플레이하면 발열이 살짝 있는거같애요 근데 뭐 나쁘지않아서 ㄱㅊ
미르M,1. 말도안되는 용량이면서 빌어먹을 백그라운드 다운로드 채택 안함 2. 또 똑같은 과금 구조 3. 미르만 한사발 내놓는데 대체 어떤게 주력인지 모르겠음 4. 아직도 유저들 개돼지로 보는 정신나간 과금게임 리니지 한번에 70계단 떨어지는거 보고도 정신못차림
미르M,재미없습니다 타격감도 없고 공격속도도 느리고 화려한 스킬도 없네요.삭제합니딘.
미르M,신물 등록 퀘스트가 안깨져요 퀘완료하기전에 등록을 해서그런지 등록이되어있어 퀘스트가안깨지네요 어찌좀해줘요
미르M,기대 이상입니다. 짜임새 있는 스토리 뛰어난 그래픽까지...간만에 쓸만한 게임이 나온것 같습니다. 플레이 하자마자 몰입되는 게임입니다
미르M,파티퀘가좀줄었으면함.독고다이스타일인데.혼자꾸준히할수있는퀘스트가많았으면좋겠습니다.
미르M,그냥 쓰레기임~스킬도 변신시스템에서 뽑기로 캐릭 뽑아야지만 추가스킬 쓸수있고 ㅋㅋ아님 제작해서 스킬 만들어야 하는데 ㅋㅋ그거도 실패확률이 있어 ㅋㅋㅋ그리고 사람이없어 벌써 ㅋㅋㅋ
미르M,접속조차 안되고 렉때문에 공격조차 잘 안되네요 미르4만큼이라도 만들었다면 대박났을텐데 너무 아쉽네요ㅠ 2시간 기다려 대기자가 10명이었었는데 갑자기 700명으로 ... 뭐죠 이건? 실망이네요
미르M,일단 자동 매크로 정상 작동 안되고 몹밸런스 안맞고 22렙부터 다른겜48렙 이상 만큼 업이 더딤 렉도 심하고 오류도 심함 별점 4점이상 준게 이해가 안되는데
미르M,퀘스트 완료되고 나면 렉이 걸립니다 이점 꼭 확인해주세요 항상 걸리는건 아니고 걸릴때마다 게임 끝다 키네요 그때마다 너무 피곤하네요
미르M,버그 덩어리 게임이네요. 퀘 완료가 안되서 진행이 안되요. 중국산 싸구려 게임 느낌. 시간 버리시는거예요. 하지 마세요.
미르M,패키지사서 탈것얻어보려고 임무달성하고있는대 자꾸점검만하니 결국 금화사서 완료누르라는건가요? 그렇다고 임무종료시간이 멈춰있는것도아니고 ㅡ.ㅡ 게임은 재미있눈대
미르M,"사람들 평가가 하도 안좋길래 얼마나 똥겜인지 궁금해서 해봤는데... 생각보다 게임 괜찮더군요? 중간중간 수동조작 요소가 들어있는점은 상당히 마음에 들었습니다. 타격감, 그래픽도 그럭저럭 괜찮은거 같고요."
미르M,난 재밌는데..bgm도 좋고 선혈효과 있어서 리얼하고 부드럽고 단지 개인적으로는 빡쎈 렙업인데 천천히 즐기기로해서 좋다! 하지만 중국인들이 한자로 도배해서 그게 좀 거슬린다.도대체 걔들은 뭐라고 쓰는거예요??
미르M,다 좋은데 pvp가 너무 빨리 끝남 전체적으로 피통을 늘려주던지 pvp간에 데미지를 좀 줄이든지 해야할듯 스킬쓰고 무빙도하고 해야지 싸움이 3초를 못넘기는건 문제가 있음
미르M,움직임도 느리고 10년전 게임에 그래픽만 좋아진 느낌. 특별하지 않다. 오분 했는데 지겨운..
미르M,그래픽 좋고 작업장 걸러내려는 의지도 좋은데 현질 상품보니 무과금유저는 삭제하는게 정신건강에 이로울거 같아요.
미르M,미르4가더 재밌어요 카톡오면 끊기고 접어놀수도 없고 크기도너무작고 여러모로 기대했는데 최악이에여 오딘이나해야겠어요..
미르M,게임 초보자가 하기에는 좀 어려운게임 난이도 최악 퀘스트진행 과금해도 진행 어려움
미르M,그냥 무게 두지말고 해도 충분히 즐길 수 있게끔 시스템이 편하게 잘되어있음
미르M,23일 오픈한다고 기다렸는대 접속할려고 하면 계속 추가 업데이트하라고 하고 그래서 계속 업데이트함 연속으로4번하고있음 이게 당최 머하는건지 그리고 22일날 게임했다는 인간들은 당최머지 ㅠㅠ
미르M,리니지 현질 시스템 다 따온 쓰레기게임 몹을 몇십시간째 잡는데 장비템 하나도안나옴 그 흔한 일반 하얀색템 조차안나옴 그리고 물약값버는것보다 쓰는게 더많아서 현질하거나 10렙은 낮은 몹잡아야하는듯 동렙몹 잡는데도 물약빨이 못따라감 제작도 일반템 만드는데도 까다롭고
미르M,유저들의 피드백을 잘반영한다면 더욱 재미있는플레이 가능할것 같습니다!!
미르M,폰으로만 잠깐씩 하는데 블락이라뇨? 이게 무슨일이죠? 계정도 1개 캐릭도 1개 인데 제대로 알고 블락 걸으신게 맞나요?
미르M,매일업데트에 접속하면 귀찮은 봇체크하고 쎄지려면 너무오래걸리고 에휴..
미르M,무과금으로 해도 렙업하고 장비 맞추는재미가 있네 버그만 좀잡아주면 좋을듯
미르M,기대보다 많이 아쉽다 과금요소는 참 충실하고 알차게 다른겜처럼 잘카피했구만 물약값도 충당 않되는겜을 어찌할까
미르M,시간이 없어서 자주 게임을 못하지만 재미는 있습니다. 이벤트를 자주 했으면 좋겠어요
미르M,사전예약후 사전다운받고 새벽에 드디어 접속 10분해보고 삭제.....뭐지? 내가 다른게임을 다운받은건가? 다운을 잘못 받은건가? 생각했음...게임만드는 회사들이 창의력이 없는거같아 너무 아쉬움이 크네요 리니지m + 오딘 + 블소2 네요. 기존 도박성게임들 배끼기만 하는 게임 이제 지긋지긋합니다. 미르2 미르3 다했었던 사람으로써 이제 그 추억의 미르를 추억으로만 간직하렵니다. 굿바이 미르~~
미르M,s22 그래픽 깨지는 게임은 처음보네요 음..진행이 불가능 합니다.
미르M,너무 재미있는 것 같습니다. 기대한만큼 만족스럽네요 국내에서도 P2E 가능하면 좋을텐데ㅠㅠ 해외사용자는 더 재미있을듯 하네요 ㅋㅋ
미르M,"이건 뭐 몹 타겟팅이 완전 병맛임 내 케릭이 몹한테 쳐맞는데 몹 잡을 생각은 없구 돈과 물약 주서먹으러 겁나 멀리 돌아니질않나, 가까운 몹 놔두고 왜 멀리있는 몹한테 쳐 뛰어가는지.... 퀘 진행하는거 보고있자면 화딱지나고 속터져서 더는 못하겠음 아~ 젠장 아까운 시간 5일 날렸네요."
미르M,cbt 영상보고 설치했는데 전혀 딴겜이되었네요? 캐릭터도 좀 크고 쿼터뷰 형식이었는데 그냥 리니지m 하고 똑같은데요? 좀 하다가 이건 아닌거같아서 삭제...
미르M,버그고쳐준거 아주 좋게 생각하고 있어요 pc미르랑은 차원이다른 아주좋은 서비스 감사합니다
미르M,미르의전설2를 굉장히 좋아했던 유저로써 정말 이렇게밖에 못하나 싶네요. 이게 리니지지 미르입니까 ?? 한심한 그래픽 한심한 무빙 한심한 스킬 미르라는 이름이 아깝네요
미르M,BM 은 좀 안타깝지만 PC버전 최고사양시 그래픽이 좋으며...성장하고 키워나가는 재미 쏠쏠
미르M,시간 가는줄 모르게 재밌는 게임! 그래픽 좋고 타격감도 좋아요.
미르M,21렙부터 키우기 최악 죽으면 장비손상 경험치 떨구기 녹템 만들라고 하는데 성공확률 50%?? 장비분해하시고 싶어도 템이 안나옮 최악게임 리니지보다 더 한듯?
미르M,미르 M 게임다운로드기다리고있는데 어떻게 추가 파일다운로드하는데 시간이 이렇게 많이 소요가 드나요? 이제야 16% 추가파일다운로드하는데 너무 천천히...라 기다리기 지쳐요ㅠㅠㅠ 다운로드가 빠르면모르는데 ...느릿
미르M,퀘스트 진행 안되는게 넘 많코 겜 만든게 중국애들이 만들었냐 중국 스타일 계속 반복되는듯 ㅋ 한계점이 광고비 아깝다 현질 하지마라 돈아깝다
미르M,위메이드의 게임은 미르4도 재미있게 플레이 했었는데 미르m 또한 재미있네요~! 즐겨봅시다~!
미르M,버그 개쩐다.... 버추얼패드 는 클릭하면 엄한데로 가고 이동 가능 한지역인데 이동 불가 지역 이라며 렉걸리고
미르M,그래도 다른 게임들은 무과금이라도 어느정도로 할수 있는데....이정도면 진짜 무과금이면 하지말라는 수쥰....
미르M,버그도많고 무슨베짱으로 오픈했는지 1년은 더 손보고 오픈했어야죠 돈도안벌려 업도빡세 컨트롤러 터치도 이상해 파티도 안돼
미르M,사전예약하고 공지사항이라고 명시해놓고...그것도 못지킬려면 오픈하지 마세요!
미르M,진짜 재밋다 문제는 20랩때 닥치는 한계 버티느냐 진짜 게임이 어렵다 깊이가 있고 알아가는 재미를 찾아야만한다
미르M,임무수행서 결제 해도 되지도 않고 혹시나 결제가 안됬나해서 다시결제했는데도 안되고 환불신청했으나 환불도 안되고 뭐하자는건가요?
미르M,시스템오류가 있어요 일반사료가 인벤토리에 있는데 사용할수도 없고 파기도 안되요 파기하면 시스템오류가 뜹니다
미르M,재미있고 무과금으로 한 번 쭉 가보려고 합니다. 근데 보상이 너무 짜긴 한 것 같네요..ㅎ
미르M,이동이 너무불편해요.. 조이스틱 항상활성화떠있게해주고 바닥클릭안되게좀해주세요..
미르M,졸라 흥미진진하고 기존 미르 시리즈랑 완전 다른게임인데? 어색하다고 칭얼거리는건지 겜 좀 안다고 척하는건지. 부모애게 맞고자란 겜충들아 뭐가 그리 삐뚤어졌냐? 니들이 현질을 몇천씩하냐 ? 개발 언어를 알고 참여를하냐? 이 무식한것들아
미르M,여태 과금 33만한 30랩 3600투력 전사인데 몹 몰리는사냥터는 사냥 엄두도 못내고 어제 파템도끼 며칠 노가다해서 먹은거 몇강 강화도 안했는데 파괴떠서 날아가버리네요 너무허망해서 현재 캐릭터 삭제시켜놨습니다.. 만약 파템떠도 계속 해봤자 지금처럼 단순한 사냥구조였을것 같네요
미르M,투폰으로 돌리니 잼나네요. 다만 아이템 드랍이 극악이라...좀 그렇네요...아이템좀 나오게 해주세요
미르M,홈피에서 pc버전 다운로드도 안되고 앱플레이에서 도 실행안되고 너무 불편하네요
미르M,딱 RPG게임의 정석입니다. 재밌습니다. ㅋㅋㅋ 더 이상의 설명은 생략~~~~~~!!!!
미르M,재밌습니다.미르2 때 매일 밤새가면서 지내던 고등학교 시절이 기억나네요.
미르M,예전에 미르를 생각하고 하면 조금 실망스럽지만 게임 자체는 고전게임 느낌으로 잘만든거 같네요 무협느낌이 고전적이고 향수를 불러일으킵니다
미르M,즐기고 잇습니다~과금에 차이는 잇겠지만 소소과금 무과금 유저도 할만하게 잘 운영해주시길..
미르M,처음에 퀘스트에 대한 설명이 부족해요. 뭘해야 할지를 몰라서 그냥 걸어다녔습니다.
미르M,퇴화한 수준. 게임 개발하고 만드는 시간에 술 먹고 놀았나? 아니면 그 시간에 돈 뽑아먹을 생각만 했나? 수준 낮다.
미르M,기대했는데 버그 오류가 심각하게 많습니다 리니지 라이크여서 싫은게 아니라 그냥 미완성 게임
미르M,"리뷰는 왜 지우는거지 ? 이런 겜 내놓고 별두개 이상을 원하는건가 ? 독창적인 컨텐츠 하나 없고 조작, 인터페이스 모두 불편하거나 형편 없음"
미르M,드럽게 재미없네 미르 이름달고 나온 똑같은 게임이 벌써 몇개냐 왜 자꾸 만드는거야 그냥 원래 있던거 캐쉬템이나 팔아먹지
미르M,상당한 재미와 그래픽적 요소가 뛰어나고 과금 유도도 적어 추천드립니다.
미르M,겜 자체 다 좋은데.난이도 조절좀여 단순 사냥만 말하는게아니에요 제작이라던가 등등
미르M,"확률표에 영웅,전설 잘봤다 ㅉㅉ 따라할꺼면 똑바로 따라해 싸구려 게임 티내는것도 아니고 ㅋㅋㅋ"
미르M,역대 최악의게임! 뽑기 시스템은 그 게임이랑 비슷한거 같은데 재미는 오질나게 없는 ㅋㅋ
미르M,완전실패작 미르4보다 못하네요 내구도시스템이랑 물악값부족 무게등등 게임이 너무하드합니다.
미르M,뉴스보고 별로일줄 알았는데.. 시간가는줄 모르겠네요..재밌어요
미르M,추가파일 무한 다운로드... 오픈한다면서 데이터만 잡아먹네요
미르M,재밌게놀고있어요 화신 고급만 디지게뜨네요 태고의소환권 도 고급만주네요
미르M,메인퀘하면 자꾸 팅기고 진행불가 과금해서 랭킹이였는데 레벨업이 점점 밀림
미르M,아이템드랍율최악 퀘스트 로 받는매직템으로 얼마 못버팀 한마디로 최악이다
미르M,과금 없이도 제작과 솔플로 어느 정도 이상 게임을 충분히 즐길 수 있어 좋습니다~
미르M,난이도 헬.. 무과는 20랩 이후 힘들어지고.. 퀘 진행도 힘듬..
미르M,게임 준비가 한개도 없네요 버그가 많다가 아니고 그냥 버그자체임 겜하다 열받긴 첨 그냥 미르4함 그거나 잘키우세요 어중간한것 내놓지말고
미르M,갑자기 블럭? 정지? ㅋㅋ별ㅋㅋ 퀘스트하다가 검은화면으로 멈춰서 껐더니 켜지지도않아서 다음날접속했더니 2023년까지 블럭이라고 게임도안됨ㅋㅋ 레벨11 지하던던같은곳에서 퀘하고있었음ㅋㅋ
미르M,게임접속 안돼요 접속자 너무 많고 몇시간째 기다리고있는데 안돼고 서버용량 늘어주던지 빨리좀 해결좀 해주시면 좋겠네요
미르M,창고관련 불만 쓰니까 바로 개선해주고 좋네요^^ 겜 잼께하고 있어요! 인벤토리부족 어쩌고만 좀 다시 개선해주세요!
미르M,주작03 서버 술사 22렙 6일차 무과금 유저입니다 장비도기본이고 오토돌린적도없습니다 뭐했다고 2035년까지 블록먹여서 접속도못합니다 아무것도안했는데 참쓰레기게임이네요 이딴게임하지마세요 위믹스 주주지만 더러워서안할랍니다
미르M,우선 게임상 파티사냥이라던지 랭킹이거나 오류가 많은데도 고쳐지지 않고 현금유도만 하고 있음
미르M,이런 겜렉은 20년전에 보고 처음본다 최신형 핸폰으로도 구동이 이러면은 더 이상 할 필요 없다고 봄
미르M,리니지보다 나음 요새 심심했는데 꽤 할만함 단 과금이 해야 재미게 놀수있음
미르M,알바 천국이 따로없네 그래픽억망 케릭 움직임이 너무느려 시작이라서 그럴수도있지만 좀더해보고..... 폭망겜 될수도있음.
미르M,첨에는 물약 자동으로 사용되더니 어느순간 갑자기 안되네요? 제가 사용할줄모르는건가요 아님 문제가생긴걸까요ㅜㅜ
미르M,물약 70프르 설정 되 있는데 왜 자동으로 안차죠? 설정 어딜 바꿔야 하나? 한시간여 찾다가 포기
미르M,"파티던전가입하려고하면 이미파티중이라는 개소리문구계속뜸, 아이템에서 보감누르면 그아이템에 관련된 보감뜨는게 아니라 그냥 보감창이열림(게임개발자들 일안하냐?) 그냥 오딘이랑비교했을때 개허접한 쑤레기게임"
미르M,파티모집 시스템도 관리못하는 게임 첨봄 아무리 오픈초기라지만 오류에 렉에 너무 심한대
미르M,그래픽 구리고 타격감 제로에 인터페이스 조작은 쌍욕나옴...RPG계에서 꺼져라
미르M,리뷰도 지우네ㅋㅋ 게임도 삭제. 서버 0시에 오픈 할거 처럼 공지 올려놓고 공지 게임종료 버튼만 있네. 사전예약 한 내가 바보다.
미르M,진짜 개좇망겜 1점도 아깝다. 컨텐츠를 떠나서 버그 개 많아서 겜이 안됨
미르M,그래픽이 미르4보다 한참 떨어지고 덜준비된채로 오픈한것같은 느낌
미르M,게임그래픽이나 현질유도가 적어서 좋고 잼있습니다. 위맥스 만원가즈아
미르M,천천히 느긋하게 즐기실분들에게 강추 소과금으로도 즐길수 있는 게임
미르M,업그레이드 짜증나고... 키 조작 어렵고...과금 심하고...
미르M,아니 게임 종료후 다시 시작하면 계속 추가파일 패치하네ㅡㅡ 뭔짓거리인가요 공지고 나발이고 그런 내용없고 데이터 계속 550메가 쓰고 게임 해야하나요?
미르M,어제 점검은 왜 한건가요? 그리고 몇일전 폐광서 사냥하다 막보서 전부팅겼는데 보상도 없고 템드랍?? 하늘에 별따기이며 제작재료 수급도 어렵고 좀전엔 사냥하다 렉 걸려서 접아웃도 안됩니다 환불 해주세요 게임내 1:1 문의 이상한말 하지 말고 환불규정도 이 상황에선 게임 오픈한 위메이드 잘못인거 아닙니까? 회사 전화 했더만 환불은 게임내 1:1문의 하라고 당당히 말하던데 이렇게 만들고 게임내 유로템들 가격은 심한거 아닌가요? 메크로 답글은 사양합니다 리뷰 올리신분 운영진 전부 메크로 답변;; 다른 세계관을 가진 겜???? 더운날에 더 열 오르네!! 환불 빨리 해줘!!
미르M,아니 게임설치하고 들어가자마자추가설치파일다운로드만20분넘게해요!!!아겁나느려진짜삭제삭제
미르M,미르2전설 했던 유저인데 좀 하드코어하긴한데.. 뭐 이런 게임들 다 그렇고..잘 만들었네
미르M,그래픽 장난 아니네요^^ 위믹스 잘 활용해서 P2E시대가 잘 정착되길 바랍니다!
미르M,관리자가 접속끈었다면서 자꾸팅기네요 장난하나. 들어가려고보니 서버포화
미르M,시간 가는줄 모르고 하고 있어요 파티맺어 같이 사냥하니 스트레스 없이 즐길수 있었습니다 앞으로 출시 예정이 미르m글로벌은 너무 기대됩니다
미르M,그냥 양산형게임 같은데 묘하게 중독되는 느낌입니다. p2e버전 기대돼요
미르M,그레픽도 구리고 케릭 움직임도 그지같고 퀘스트 왼료도 안되서 할게업다
미르M,"무과금들은 어느 게임을 가도 징징징 스타나해라 그냥 아 스타는 머리가 굳어서 , 손이 느려서 힘들가? ㅋㅋㅋㅋㅋ"
