game,review
미르M,이런 게임을 찾고있었음... 수많은 게임을 깔았다 지웠다 하다가 결국 미르M을 발견함. 플레이 방식이 쓸데없이 복잡하지 않고 간단해서 좋음
미르M,타격감도 좋고 그래픽도 괜찮은 편입니다 초반이라 그런지 몰라도 아직까진 시원시원하게 진행되서 좋네요~
미르M,어떤 유저라도 쉽게 할 수 있는 느낌입니다. 그만큼 어려운 부분이 없고 시작할때부터 이해하기 쉽고 확실히 스토리가 탄탄한 느낌
미르M,리뷰 지우지마세요 다시 씁니다. 현질 유도하는 게임에 현질을 해도 확률은 극악이고 7강셋 패키지 질러도 여전히 퀘는 막히고 답은 현질변신 밖에 없는게임. 그와중 환불도 안해주는 개 극혐 게임 지들 돈 밖에 생각안함
미르M,MMORPG 장르를 좋아하는데 재미있게 잘 나온 것 같네요 스토리도 괜찮고 그래픽도 짱짱해서 더욱 몰입이 되는 것 같아요 스킬도 화려하고 재미있네요
미르M,"미르4 생각하고 왔다면 대 실망,. 퀘스트 렉 걸려서 안넘어가고... 겜 자체가 너무 느리고 채팅창엔 중국 말이 계속 도배.. 대체 중국 겜인지 한국겜인지 알수가 없네"
미르M,일단 생각보다 완성도가 높아서 놀랐고 무조건적으로 게임에 많은 시간을 투자하지않아도 틈틈히 즐길수 있는 게임이여서 좋습니다
미르M,생각보다 너무 재밌어서 놀랐어요 친구들과 즐길수 있는 잘빠진 게임이네요 조작감도 너무 편리하고 너무너무 맘에 들어요! 굳굳~
미르M,나도 노력을해보았다 이 게임의 단점을 찾기위해 근데 초반에 렉있는건 다른게임 다그렇다 솔직히 앞으로의 대처가 중요한법!!!! 그외는 단점없다 ㅋㅋㅋㅋ
미르M,"모...바일 게임이 발전하는 속도가 무섭다, 아직 미완이긴 하지만 점점 더 퀄리티가 높아져서 더 재밌는 게임으로 자리잡길 기대해봅니다"
미르M,과금 안하면 할수있는게 거의 없다고 보면 됩니다. 이거 할바에 오래되서 과금효율이라도 좋은 리니지시리즈를 하시길. 사람도 별로없어요
미르M,광고해서 들어왔습니다. 디자인 색톤도 좋고 스토리도 흥미진진해요 추천합니다.
미르M,"다양한 컨텐츠들이 있어서 지루하지않고 재미있고, 무엇보다 게임을 편리하게 플레이할 수 있는 점이 가장 마음에 드네요!"
미르M,현질유도도 없고 육성도 쉽게 할 수 있고 키우는 재미도 있으니까 안하면 손해! 하면 꿀잼!ㅋㅋ
미르M,운영진 운영 뭣같이하고 멀쩡한 유저 블럭시키는 게임. 거지같아서 10일하고 게임삭제.. 미르4때는 참을만했는데 이건 뭐 완전 노답. 주식 폭락하는데 이유있음.
미르M,RPG 정석 잘 만들었는데... 배경 하고 캐릭터 따로 논다... 이럼 배그 처럼 눈 아퍼... 배경 캐릭터 같이 만든 게임은... 안 이런데... 잘 만들었는데 아쉽다...
미르M,렉때문에 자동사냥할때 자주 멈출경우가 많습니다 고쳤으면 즐겜할수있을텐데요
미르M,"게임 이펙트, 사운드가 상당히 이목을 끕니다. 진짜 이펙트가 말도안됩니다 너무 섬세하고 잘만들었어요"
미르M,퀘스트를 진행하며 대부분의 아이템을 제작할 수 있어서 누구나 열심히 플레이하면 게임 본연의 재미를 느낄 수 있습니다
미르M,80년대 게임을 보는듯 싶다. 2022년에 이런게임을 하라고..! 솔직히 이게 무슨게임인가 싶다. 2시간해보고 바로 삭제함 별점 한개도 아깝다.
미르M,도입부와 퀘스트 중간중간 보여주는 시네마틱 영상이 대작 모바일 MMORPG라는 것을 느끼게 해 줄 정도로 뛰어납니다
미르M,이벤트나 플레이 보상으로 성장에 필요한 재화 및 아이템을 충분히 주기때문에 과금하지않아도 무리없이 깔끔하게 즐길수 있는 게임입니다
미르M,실제 플레이를 해보니 그래픽이 영혼을 갈아서 만든 것 같음ㅋㅋㅋㅋ 타격감도 좋고 사운드도 좋아요~ 만족스러운 게임입니다 :)
미르M,강화확률 참...ㅋㅋㅋ 어이가 없어서 성공확률이 62%인데 3번연속 실패하고 4번째했더니 5% 파괴확률에 걸려서 장비 파괴되버리네 ㅋㅋ 장난질도 어지간히해라 양아치 xx들아 소과금 이지만 나름 현질하면서 했는데 제대로 접게만드네 ㅋㅋ
미르M,"그래픽 퀄리티가 진짜 좋은편이고 게임의 분위기하고 잘 어울린다고 생각해요 다른 게임들하고 비교할 수도 있겠지만, 그렇게 말하는 사람들은 진짜 겜알못"
미르M,스토리를 밀며 시네마틱 연출을 하나씩 보는 재미가 꽤 쏠쏠한 편이라 직접 모험을 즐기며 스토리를 하나씩 즐겨보시길 추천 드리고 싶습니다
미르M,그래픽 진짜 장난없다ㅋㅋㅋ 캐릭터와 배경은 물론이고 작은 오브젝트까지 디테일하게 묘사해둔 것에 감탄했습니다
미르M,기대없이 시작한 게임인데 그래픽이나 타격감 전개되는 스토리가 넘 좋네요 즐겁게 게임합니다.
미르M,도대체 이 게임의 매력의 끝은 어디일지… 파면 팔수록 재밌어서 앞으로가 더욱 기대되는 게임입니다
미르M,배경 뿐 아니라 등장하는 인물들이나 요소들마저 디테일하게 구현해놔서 보는 재미가 상당합니다
미르M,CBT때 해보고 반해서 출시일만 기다렸습니다 그때보다 더 다듬어져서 나와서 그런가 더 재밌게 하고 있어요^^!
미르M,그래픽도 좋고 렉도 안걸리고 버그도 없으니 게임 도중 빡치실 일 절대 없음!!!!
미르M,물약자동사용하려면 퀵슬롯 등록후 아래로 드래그하라는데 먹통이네요... 재설치해도 안되는데 대체 이게 뭐하자는건가요
미르M,정말 재밌어요 그래픽이면 그래픽 컨텐츠라면 컨텐츠 하나하나 최고더군요 앞으로 더욱 발전해주세요!
미르M,모션이나 이펙트도 훌륭하고 강화나 수집 요소도 많아서 내 캐릭터가 성장하는걸 지켜보는 재미가 있습니다.
미르M,내 스탈 아주 재미있습니다 진행하는데 무리도 없고 캐릭터도 멋있고 MMORPG게임 오랜만에 하는데 즐겁게 즐기고 있네요
미르M,아직 랩업을 많이 하지는 못했지만 다양한 스킬들이 많고 해볼만한 게 많은 듯 해서 일단 좀 더 해볼랍니다.
미르M,컴터 게임처럼 복잡하고 그러지 않고 편하네요 뭐 모바일 게임이니까 당연한 거겠지만ㅇㅇ 괜찮은 게임성 입니다
미르M,아직은 초반부 진행중이라 조심스럽긴하지만 그래도 고민하는분들이 한번쯤 설치하고 직접 경험해볼만한 가치는 있다고 생각해요. 괜찮게 플레이중입니다
미르M,"각 지형들과 오브젝트, NPC, 캐릭터의 묘사 등 실제 게임에서도 그래픽이 만족되었어요."
미르M,그래픽도 이정도면 엄청나고 스토리도 꽤 탄탄하게 잘 구성되어있다고 생각합니다!
미르M,재밌는데 사실 이런 게임이 그래픽 취향을 좀 타는 편이긴함 ㅋ 그래도 이정도면 무난히 즐길만 함
미르M,처음 접하는 장르임에도 쉽게 다가갈 수 있게 게임을 구성해놓아서 좋네요 잘해볼게요~
미르M,넘넘 재밌습니다 앞으로도 꾸준한 패치와 초보자를 위한 지원 잘 챙겨주시면 좋겠어요!
미르M,현재 초반진행 중인데 시원시원하게 진행되고 인터페이스 간편하고 좋습니다
미르M,완전 재밌게 하고 있습니다! 개선이 필요한 부분도 조금 있긴한데 일단은 믿고 플레이하겠슴
미르M,솔직히 이정도면 레알 상타치 아닌가? 국내 게임 중에 몇 안되는 고퀄리티 게임인데 진짜 이 게임은 잘 됐으면 좋겠다...
미르M,좋쿠만 재미있어요 점점 게임에 스며들고 있는 중입니다 ㅎㅎㅎ 이대로만 잘 유지해줬으면 좋겠다 는 생각이있음ㅎ
미르M,캐릭터간 밸런스를 잘해놔서 어떤 캐릭을 선택해도 육성하기 좋을 거 같애요
미르M,매우 재미있습니다. 친절한 설명으로 접근성이 좋고 부담도 많지 않아서 직장인에게 좋은 게임이네요.
미르M,핵과금 게임들과는 다르다. 스토리가 있고 진짜로 게임을 하는 기분이다. 진짜 진정한 MMORPG게임이다.
미르M,성장이 어렵지 않기때문에 무과금 유저도 쉽게 접근 할 수 있는 게임이라 생각해요
미르M,"재미있는 스토리, 매력적인 캐릭터들 그리고 중독성 있는 플레이가 좋아서 잘하고있어요 이 게임 강추 합니다!!"
미르M,우선 시각적인 부분은 굉장히 만족스럽구요 플레이는 좀 더 해보고 다시 리뷰 남길게요 :)
미르M,전투가 개꿀인듯.. 다른 게임 전투랑은 차원이 다름.. 스케일이 어마어마함
미르M,지금도 좋지만 앞으로 어떻게 발전될지 기대하도록 하겠습니다. 업데이트만 꾸준히 해줘도 평타는 칠 듯합니다
미르M,출시 전부터 많이 기대한 만큼 재밌게 시작했지만 막막한 현실에 떠납니다. 시간을 써서 해보려해도 노가다가 너무 심하고 제작을 해보려 해도 언덕이 아니라 산을 넘어야 하는것 같아서 의욕이 사라지네요.. 그리고 파밍이 매우 어려워서 보감작도해야하는데 분해하고싶어도 할수가 없습니다.. 다시 돌아오고싶지만 가능할지는 모르겠네요
미르M,고객센터 문의해도 읽지도 않고 환불해주십시요.진짜 잼있게 겜할려한건데 스트레스만 겁나받음. 무과금으로 진행안되서 과금했더니 차이없음
미르M,아직 모르는것도 많고 게임 자체를 더해봐야하는 것도 있지만 기존거랑은 좀 다른 구성이라서 재밌는 거 같음
미르M,이유없이 블럭날림 하지마요 힘들게 키우니 블럭날림 25년 겜 하면서 첨 이런거 당해보는데 어이가 없음
미르M,다양한 콘텐츠로 보상을 획득할 수 있어 결제없이 진행 가능할 것 같군요 좋은 이벤트 많이 해주시길...
미르M,무과금인데도 막힘이 하나 없습니다 스토리 그래픽 게임성 다 최고입니다. 퀄리티 대박겜❗❗
미르M,정말 좋은 게임입니다 요즘같이 현질에 의존하여 진입장벽을 돌파하는 식상한 메타의 게임들과 다르네요
미르M,프레임 뚝뚝 끊겨서 멀미가 날지경 중국산겜도 이러진 않음 ㄹㅇ 미세한게아니라 버퍼링걸리면서 뚝뚝 끊김
미르M,제발 리니지 좀 그만 따라해라! 너희들만의 개성은 놔두고... 말 하면 뭐 해... 댓글 알바로 평점이나 높이고...
미르M,"이건 진짜 띵작이에요.. 그래픽, 스토리, 컨텐츠, 이벤트 진짜 부족한게 없음!!!"
미르M,뿌려주는게 많아서 현질없이도 할만할거같고 이것저것 다양한 컨텐츠도 좋습니다.
미르M,알바들이판을친다 아칙 출시도안했는데 갓겜이라는둥ㅋㅋㅋ알바쓰려면 대갈좀쓰세요 정성과돈을많이들인 게임이라면 이런거조심해야지 망겜인증을하고있네
미르M,오잉 그래픽이 정말 예술이네요 시각적으로 압도적이니까 게임이 한층 더 재미있게 느껴져요
미르M,솔직히 별 기대 없었는데 그래픽도 괜찮고 일러도 예뻐서 열심히 해보는 중.. 나름 할만하네용
미르M,무궁무진한 컨텐츠와 절로 빠져들게 만드는 그래픽이 미르M의 장점 아닐까 싶습니다.
미르M,돈없으면 놀지 마시오 중국서버인지 채팅창에 온통 중국말뿐
미르M,좋은 운영 감사해요. 앞으로도 좋은 시스템 개편과 운영 기대하며 게임을 플레이 하도록 하겠습니다
미르M,이 게임의 장점은 매력적일 정도로 뛰어난 완성도. 라이트 유저도 게임을 할 수 있음
미르M,요건 양~~산형 게임의 완성판같은..!! 너무 잼있게 잘하고 있구요 롱런할 수 있게 운영잘부탁드립니다!
미르M,아낌 없이 퍼주는 덕분에 보다 빠르고 쉬운 성장이 가능해서 좋아요
미르M,노가다성 심하고 머리만 아픈 여타 게임들과 달리 정말 가볍게 즐길 수 있는 게임이라 즐거운 마음으로 하고 있어요~!
미르M,지금 이대로도 좋은 게임이지만 지금처럼 편안하고 즐겁게 게임을 할 수 있는 환경을 유지해주시길 부탁드립니다!
미르M,레벨업 빠르고 전투도 재밌어요. 할게 많아서 하루종일 해도 지루하지 않네요
미르M,광고보고 궁금하기도 하고 해봤더니 너무 재밌어서 놀랐네요 취향저격!!
미르M,양산형게임 생각했는데 아니네요~~ 재밌구요. 초보자도 할만한게임이에요. 그래픽이 부드러워서좋아요.
미르M,"쪼렙몹 늑대잡는데 물약이 안따라가네, .. 시작부터 현질해라 이건가? 그냥 삭제할란다"
미르M,굉장히 재미있네요. 복잡하지 않고 심플해요. 간간히 즐길만도 하고요 짱~!
미르M,이게 4.2라고요? 사람많은곳만 많고 없는곳은 엄청없고 그럽니다 생성제한을 풀어줘야 넘어가두할거아닙니까 없는서버끼리 합쳐주던지 신규서버를 열어주십시오 사람없는곳은 광부들빼고 다 갔습니다 백호서버 언제 열어줄겁니까
미르M,그래픽만 향상된 그저 흔해빠진 핵과금 RPG게임 10분하고 끕니다.
미르M,퀵슬롯 안되는거 나만 이런가? 물약 일일이 먹는거 개귀찮아서 때려침
미르M,굉장히 재밌고 타격감도 좋은 게임이다 그리고 각각의 캐릭터를 성장시키는 재미도 있다
미르M,재미는 확실히 있네요ㅎ 유저도 배려하는 모습이 많이 보이고~ 아무튼 좋습니다.
미르M,개취일수도있는데 단점이 없다고 생각됩니다 다른 게임은 현질이벤트 많이하는데 이 게임은 현질유도도 많이 없구요
미르M,초보들도 초반에 좀 .. 뭐지 할틈을 얼마 안줌 진짜 금방 이해 할 수 있게 간단하고 쉽게 준비된 게임
미르M,그래픽도 좋고 다 좋은데 다른 캐릭터가 나왔으면 좋겠음. 엄청 재밌게 하고있어요~
미르M,너무 재미가 없음. 무과금 성장할 요소 매우 부족. 운영 마인드가 적나라하게 보임.
미르M,아직 플레이한지 얼마안됬지만 아주 맘에 들기는 합니다. 그래픽이나 사운드도 좋고.
미르M,돈에 미친집단이 만든 쓰레기 무과금은 메인퀘도 못밀게 해놧네 과금러랑 격차는 이해한다쳐도 ㅋㅋ 초반구간부터 막아버리넼ㅋㅋㅋㅋ
미르M,2시간을 기다려서 추가 파일 다운로드했더니 버전이 낮다고 업데이트하라고요? 하지 말란 뜻이죠?
미르M,뭐 21~22정도 넘으니까 솔플이 아얘안되게 해놨네....
미르M,초반부터 다양한 아이템들을 시원~하게 쏴준 덕에 ㅋㅋ 즐겁게 즐기는 중입니다
미르M,계속 플레이를 할 수 있게 다양한 컨텐츠가 무궁무진하고 과금없이 모든 플레이를 즐길 수 있다
미르M,벌써부터 유저가 대박많네요 ㅋㅋㅋㅋ 유저없으면 게임이 재밌어도 노잼되던데 그점은 마음에 듬
미르M,"깔끔한 그래픽에 좋은 게임이네요 스킬도 화려하고 멋지고- 멋진게임, 재밌게 하는 게임 만드시길"
미르M,게임조자도 실행도안되고 추가파일 추가패치 게임지우고 다시깔아도 이모양 이런게임 왜만들었는지 욕먹을려고맘들었는지 이해가안감 1점도 아깝다
미르M,"폰 게임 중 거의 유일하게 그래픽,자유도,재미 다 좋은 게임이다 진짜 강추!!"
미르M,ㅋㅋㅋ리뷰에 과금이 심해서 키우기 그렇다는 글보자마자 플래이해보기전에 바로 삭제함 ㅋㅋㅋ
미르M,언리얼 엔진을 기반으로 미르 IP 특유의 오리엔탈 판타지 풍의 느낌을 제대로 담아낸 모습이 굉장히 반갑게 느껴졌습니다.
미르M,스토리 라인 맘에 드는데 스토리 다 볼때까지 게임 장수했으면 좋겠네요~
미르M,복잡하지않고 초보자도 쉽게 접근할수 있어서 좋습니다. 설명이 잘되있네요.
미르M,뭐야이게 좀비도 이보다는 빠르겠다 느려 터져서 슬로우 모션인줄 알았네 설치하고 5분만에 삭제
미르M,"재미 보장, 게임성 보장, 그래픽 판단은 개인 취향, ㅎㅎ 우선은 추천합니다."
미르M,전투력을 뒷받침해주는 시스템이 다분해 성장의 재미를 충분히 느끼실 수 있을거라 생각합니다
미르M,이게임 이렇게 지주 튕기나요.. 아님 현질 안한 사람은 접속울 안시켜 주나요?
미르M,찍...어내듯이 나오는 게임들하고는 다르다. 전혀 게임에 대해 모르는 사람 관심없는 사람도 한번쯤은 해보길 추천
미르M,나 모바일겜 리뷰 세상살다 첨 써본다 별그지같지도않은겜은첨해보네 웬만하면 겜하다 이건 아니다 하면 지우는데 이건 오기로 하다 욕으로 끝나네 Pc로할거 아니면 하지마라 모바일로하다 욕밖에 안나오네 뭔 이딴겜을 만들은건지
미르M,고퀄리티에 컨텐츠도 많고 재미있는 게임 즐길 수 있게 해주신 개발사에 감사드립니다.
미르M,우선 좋은 점수 주고 시작합니다. CBT때 재밌게 했어요 ㅋ 배가본드로 키울 생각
미르M,사냥도 재미있지만 채집이나 광질을 통해서 제작하는 재미도 상당해요
미르M,진~짜 즐길거리가 무궁무진해서 한번 시작하면 시간가는 줄 모르고 하게 됩니다
미르M,여기 위메이드 주주들 놀이터임? cbt해보니까 아직 고칠게 수두루한데 ㅋㅋㅋㅋㅋㅋ 인터뷰보니 일단 ㅎㄱ들 돈좀 빨러 내놓고 고쳐나가겠다? 장난하나. 블소2꼴 예상한다
미르M,타 게~임에서는 좀처럼 보기 힘든 시스템이 많이 갖춰져 있어서 더 많은 사람들에게 사랑받는 게임이 될거 같아요
미르M,확실히 매력도 있고 무과금으로도 쏠쏠한 재미를 볼 수 있을 것 같은 좋은 예감이 든다
미르M,클베는 왜한건지..홍보용 클베였다는 느낌.. 몹밸런스 캐릭밸런스 채집등 하나도 조정안하고 그대로 출시라니..참 답답할뿐
미르M,"재미 없다고 하시는 분들도 물론 있겠지만, 딱 내 취향이네용. 천천히 즐기고 있어요~"
미르M,랩20부터 현질유도 시작되고 활력시스템이 기존 타게임에서 있던 아인보다 더 괴랄함 돈 갖다 부을 사람만 하면됨 리니지라이크겜중 미르m이 최악중최악이었음
미르M,훌륭한 게임 그래픽을 통해서 스토리를 만들어 놓아서 확실히 몰입감이 좋네여
미르M,5시간 해보고 20렙 찍구 삭제했다 그 맘때쯤 현질 없인 쾌 못밀게 설정해둠 또한 리니지 오딘 흉내내기 뿐... 자동사냥 개념도 너무 웃김 서버창에는 중국 광고글 뿐임 던전 2번팅겨서 접속하니 던전 못들어감. 현질을 할만하게해야지 죄다 빨아먹을려고 비싸게 둠 위메이드가 이런 회사였나? 답답해서 적는다. 엔씨 돈마블 질려서 딴 겜 좀 해볼랬드만 더하네 아주
미르M,이게임을 추천합니다. 광고보고 들어왔다가 이정도로 잼나게 할거라고는 상상도못했네요. 게임 잘 만들었어요~
미르M,이벤트로 여러가지 아이템을 뿌려줘서 상당히 재밌게 즐기고 있네요 ㅎㅎ
미르M,슬슬 빠져들고 있습니다. 조금 지켜보면서 해보면 재미있을 듯 하네요
미르M,미르2가 아니다. 중꿔가 장악한 망게임이다. 돈에 눈이 멀어도 너무 멀었다. 현질 오지게 할 거 아니면 눈독 들이지 말자
미르M,가볍게 즐길만한 게임 찾다가 발견! 시작단계지만 너무 재밌게 하고 있습니다^_^
미르M,그래픽퀄이 딴게임들보다 좋고 컨텐츠나 이벤트들도 잘 만들어놓았다고 생각합니다
미르M,쏟아지는 보상으로 결제없이도 플레이가 충분히 가능할 것 같군요^^
미르M,튜토리얼만 잘 따라해도 쉽게 게임을 익히고 즐길 수 있어요
미르M,사전설치네요. 다운로드 금방 되네요. (다운로드 부스트 씀)
미르M,고퀄리티 그래픽이 플레이하는 내내 눈을 즐겁게 해주고 몰입감을 높여주네요
미르M,오잉 막 서버 오픈한 게임임에도 문제 없이 만족 하고 있는 작품입니다.
미르M,완~~~성도가 높은 게임. 성장 방식이 복잡하지 않고 단순함
미르M,재미있게 즐기는중 지속적인 업데이트와 많은 컨텐츠 기대합니다.
미르M,다른 유저들과 타겟팅이 잘 안겹치니까 퀘스트 진행에 막힘이 없어요
미르M,한번하면 잘 모를수도있으니깐 꼭 두세번은 해보시길 추천합니다~~
미르M,흔한 시스템에 지겹도록 구린 쿼터뷰 그리고 특유의 답답함과 중국인 취향이 가득한... 게임에 들어간 자원을 이렇게 낭비해도 되는가 싶을정도로 그저 사업만을 위한 게임
미르M,갓겜 인정.!!! 굉장히 만족스럽게 플레이하고 있습니다. 앞으로도 꾸준한 업데이트로 인생게임 될 수 있도록 운영해주시면 감사하겠습니다~
미르M,그래픽 퀄리티는 원작보다 더 높아졌지만 그럼에도 그때 그 시절 향수를 그대로 느껴볼 수 있어서 좋았습니다
미르M,설명도 잘되어있는 것 같고 템도 쉽게 얻을 수 있고 매력있는 게임이네요.
미르M,오픈도 안한겜에 알바 역겹네 유저가 빙다이 핫바지로 보이나?
미르M,나온지 얼마 안됬으니 시작하기에 늦은 것 같지는 않고.. 재미있게 해볼게요
미르M,아니 렙20인데 업적이 안깨지고 견문록 등록해도 안내퀘 안사라지고 걍 하지말라하시죠?
미르M,"짜임새가 있는 구조에 부담걸리지 않는 스무스한 진행, 괜찮아요."
미르M,보상이 많은 편이고 퀄리티도 이정도면 괜찮은 편이고 이게임 진짜 최고에영 다들 해보세요 ㅋ
미르M,퀘스트 및 던전 등 다양한 요소가 있어서 재미있게 잘하고 있습니당 ㅎㅎㅎ
미르M,개인적으로 게임은 잘 모르지만 재밌으면 장땡입니다. 이겜 장땡입니다. ㅎㅎ
미르M,일단 운영자가 일을안합니다 버그터지고 난리나도 나몰라라패밀리들입니다
미르M,확실히 그래픽이나 스킬 이펙트가 아주 깔끔 화려하니 좋네요
미르M,"딴 게임들은 이동 중에 폰으로 자사하는거 보고만 잇는게 너무 지루했는데, 이건 보는 맛이 있어서 좋음"
미르M,파일 다운받다가 날밤새겟다. 유저와의 약속을 개떡으로 아는 회사네
미르M,개노가다 토나와!! 채광노가다 채집노가다 낚시노가다 사냥노가다.. 과금아니면비빌수없는 시스템의게임방식 너무어렵다..뽑기로 화신존거못뽑으면 게임접길추천한다.. 너무어려운게임이다스트레스만땅!!
미르M,화려한 그래픽에 한번 반하고 탄탄한 게임성에 두번 반했습니다
미르M,CBT 시즌2냐? 개발자 늬들은 꼭 주 120시간 일해라.
미르M,난이도가 너무 쉬우면 흥미가 떨어지는데 적당해서 딱 좋은 것 같습니다
미르M,평소 보던 양 산 형들이 아니라 새로운 방식으로 전개되는 게임이라 상당히 마음에 들었습니다
미르M,드디어 정식오픈했군요 캬~~~ 아직까진 단점은 안보여요 앞으로도 좋은 운영 기대하겟음~!!!!
미르M,"리뷰 삭제하네 ㅋㅋ 미르엠 졀라구리니까 애초에 시작도 하지 마셈 계속 물약만 쳐먹다 뒤지기만 하는 게임, 초반부터 이런데 초핵과금 아니면 겜 못한다 이거ㅋㅋ 하루도 안되서 탈퇴하고 삭제 했음 기대했던 내가 바보... 그리고 리뷰 지우지마라!"
미르M,필드에서 골드가 잘 벌려서 무과금으로도 충분히 성장하는 즐거움을 만끽할 수 있을꺼 같아요
미르M,23일00시에 오픈되는거 아닌가요???22일날 미리다운받았는데 접속이안되는데요ㅡㅡ
미르M,캐릭터가 너무 매력적이네요! 타격감도 아주 그냥 최곱니다
미르M,레벨20 만들고 자사 돌려놓고 이제 잡니당~ 재밌어요 ㅅㅅ
미르M,게임하면 못따라가고 접는 경우가 진짜 많았습니다 근데 이게임은 잠깐씩해도 게임이 잘되니까 포기안하게되네요
미르M,미르M은 캐릭터별 밸런스가 잘 잡혀있어 자신이 좋아하는 스타일의 캐릭터를 선택해도 필드 사냥에 어려움이 없습니다
미르M,"글씨가 너무 작고, 자동 사냥도 비효율적이고, 조작도 어색하고.."
미르M,게임이 탄~~탄하고 매력적이어서 죽도록 달리고 있는 중입니다 ㅋㅋ
미르M,대놓고 시간 잘 가고 자꾸 접속하게 만드는 매력이 있습니다
미르M,거짓말안하고 이것만 합니다. 어떤게임할지 고민하는 사람있으면 망설임 없이 추천할 정도로 재밌고 좋네요.
미르M,진심 ㄹㅇ 패키지 실화냐 ??? ㅋㅋㅋ 그냥 한탕이 목적인거냐 ??? ㅋㅋㅋ
미르M,접속도안돼 패치 받으래서 받고 들어가면안돼 다시 접속하면 또 패치받으라고하고 이게머지
미르M,아직 시작 단계지만. 갠적으로는 다른 미르시리즈와는 다른 신선한 재미가 있어서 좀 더 잼난 것 같아요
