game,review
뉴스테이트 모바일,폰에따라렉이걸릴수도있지만 그래픽좋고 플레이감이좋아 상당히재미있게플레이하는중입니다''''다만 팀킬을하는 인원에대한제제가없어서그런가 활개를칩니다''또한 듀오도만들어주셨으면 합니다. 리뷰중에 게임이계속튕긴다하시는분들이계시는데 앱복사(멀티계정)하는앱삭제하시기바랍니다 .그거때문에 막히실겁니다.모조리다삭제해보세요
뉴스테이트 모바일,정말 재미있어요!! 원래 배틀그라운드를 하셨던 분이라면 처음에는 쪼금 헷갈릴 수 있겠지만 괜찮은것 같아요. 그런데 아직 렉이 좀 많이 걸리는 것 같고 버그도 조금 많은것 같아요 제가 자꾸 맵을 뚫어버리고 핵을 쓰는 것처럼 땅 속에 박히기도 하는데 자주 그러더라고요.. 그것만 빼면 스릴있고 재미있는 게임입니다!
뉴스테이트 모바일,"뭉개진 그래픽,기존 배그 맵에서 크게 벗어나지 못한 부자연스러운 미래 배경의 이질감,불편한 조작감(직결감이 떨어짐),전작에 비해 퇴화한 타격감,조잡한 인터페이스,여전히 많고 멍청한ai,많은 버그와 핑 차이까지.. 기존 모배 하시던 분들은 딱히 할 이유가 없습니다. 그리고 리뷰 삭제까지...."
뉴스테이트 모바일,"그래픽 자체는 좋습니다. 하지만 아직 처음이라 그런지 서버와 딜레이가 좀 있는듯 합니다. 제가 조작하는것보다 묘하게 늦게 적용됩니다. 그리고 기본으로 배치된 키가 너무 작아서 불편합니다. 기존 배그에서는 굳이 안바꿔도 괜찮은데, 여기선 바꿔야 하는 점이 좀 불편합니다"
뉴스테이트 모바일,"전작 초기 한본섭 랭커였습니다. 간만에 느낌이나 한 번 느껴볼려고 잠깐 설치했습니다. 전체적으로는 상당히 비슷하고, 초기 봇들이 갑자기 소환되는것도 전작과 같네요. 최적화 면에선 전작보다 더 나은 것 같고요(물론 전작도 몇년전에 접었습니다만) 재밌게했던만큼 크게 불만은 없으나, 차량 조작감, 너무나도 이질감드는 스킨만 어떻게 바꾸면 좋을것 같습니다."
뉴스테이트 모바일,"게임 하는데 문제는 많이 없습니다. 하지만 로비가 너무 문제가 많아요. 저만 그런거일수도 있지만 받기 버튼을 눌러도 받기가 되지 않고, 상점 시스템도 버튼이 안 눌러 집니다. 그리고 로그인을 해서 게임에 들어갈때도 들어가지 않고 멈춰 있을 때가 있습니다. 이 문제좀 고쳐 주세요."
뉴스테이트 모바일,다른건 다 괞찮은데 프레임이 울트라까지 나와야하는데 최적화가 안되어있어서 울트라까지 안나와있네요. 그리고 서버 최적화도 안되어있어서 게임을즐길때 어려움이 있을때가 있습니다. 이런건만 고쳐도 최고의 게임이 될수있을것 같습니다.
뉴스테이트 모바일,"저사양 폰은 그래픽을 최대한으로 낮추고 프레임을 최대로 끌어서 해야 할만합니다. 최적하는 그나마 나쁘지 않고, 이번달 내에 사녹이나 다른맵이 나오지 않는다면 유저가 대량이탈 할것같습니다. 조금만 더 수고해주시면 훨씬 나아진 뉴 스테이트를 즐길수 있을것같습니다. 화이팅!"
뉴스테이트 모바일,네 정리해드릴게요 1.렉이 엄청심하다 2.메일을 받지못한다 3.창문소리만 개크다 4.조작이 터치한데로 안되고 0.5초후 된다 5.렉땜에 적이 쏘기만하면 피가 한꺼번에 다단다 6.앉기 2번누를때 구르기가 되는데 이러면 앉기 컨트롤이 안된다 7. 똥폰은 38%에서 멈춘다 8.한판에 26명밖에 안되서 al만 보인다 9.렉땜에 반응이 어렵다 이럼으로 답 나왔쥬 모배로 튀고 1년뒤에 만납시다
뉴스테이트 모바일,게임플레이하면 아시아서버에서는 고티어갈수록 핵들이 많아져서 올리기 어렵고 다른서버들은 핑이 높아서 계속 네트워크 지연 감지 뜨면서 게임이 안됩니다 핵쟁이를 없애던지 서버를 1개더 많들어주시고 네트워크 지연감지 되도 모배처럼 로딩하다가 다시 정상적으로 플레이 되도록 해주세요 계속 네트워크 지연감지 떠서 계속 나갔다 들어온다고 게임도 제대로 못 플레이하고 죽습니다 이럴꺼면 이게임을 왜 만들어습니까 빨리 수정해주시기 바랍니다
뉴스테이트 모바일,기존배그에서는 차로 팀원을 쳐도 기절을 안했는데 뉴스테이트는 차로 팀원을 죽일 수 있어서 친구들이랑 재미있게 게임을 할 수 있게 되었고 상대방을 기절시킨후 영입시킨다는 점이 너무 좋아요.약간 아쉬운점은 플레어건을 쓸거면 플레어건 뿐만 아니라 총알도 사야한점이 좀 바뀌면 좋겠네요...
뉴스테이트 모바일,"안녕하세요! 모배를 플레이중인 유저입니다 정말 기대하며 사전예약도 하고, 오랜시간동안 기다리며 게임을 깔았습니다 그런데 막상 들어갈려니 부적절한 행위가 감지되었다고 뜨네요 정말 설레며 기다렸는데 할수가 없다니 정말 실망이네요.. 이 문제점좀 고쳐주셨음 합니다 항상 재밌는 게임 만들어 주셔서 감사합니다! 화이팅!"
뉴스테이트 모바일,"리뷰를 다시하라고 구글에서 지속적으로 보여줘서 자세히 씁니다. 11일 정식 런칭전에 약 2분? 걸려서 다운로드 최적화가 다 되었고, 접속 플레이도 잘 못하지만 잘 되었고 이후 12일 낯까지는 접속이 안됬고 이후에는 아주 잘 됩니다. 폰사양이 많이 좌우 하는것 같네요. 시간이 가면 다양한 폰에서도 잘 돌아가도록 최적화가 잘 될것으로 생각 합니다. 게임다운 게임을 만드는 회사 응원해요"
뉴스테이트 모바일,"드론은 적 위치 브리핑으로 전투의 편의성을 높여주기 위한 것임에도 몸체를 앞으로 기울여야만 아래에 핑을 찍을 수 있어 핑을 찍기 어렵다. 핑을 찍기 수월하게 드론의 1인칭 시점에 제약을 조금은 풀어주는게 낫지 않을까 생각한다. 몇 판 하며 느낀 건, 서버렉이 심하다. 레이턴시 때문에 죽거나 죽이는 일이 잦은 것 같다. 내 내트워크가 안 좋은 것일 수 있으니 함부로 말하긴 어렵다. 플레이 하면서 굉장히 마음에 들었던 건 무기 커스터마이징이다. 무기 편식이 확 줄어든다. 비주류 무기들도 호기심에 쓰게 되고, 좋은 경험을 일궈내면 그간 외면받던 총들도 주류 총기들 못지 않게 사랑받으면서 쓰일 것이라 생각한다. 이제 다이니마인지 하는 방어구가 계륵이 되지 않을 방법을 생각해봐야겠다."
뉴스테이트 모바일,배틀그라운드 모바일을 3년 넘개 플레이한 평범한 플레이로서 솔직히 게임을 다운받고 1시간도 않되는 플레이시간으로 감히 리뷰늘 작성해봅니다 개인적으로 17년도에 나온 (free fire)이라는 게임과 펍지랑 콜라보한건가? 싶을정도로 너무 비슷하다는 생각이 계속듭니다. 게임 그래픽도 진짜 안좋고 스킨은 모자이크로 보입니다 솔직히 이건 제 핸드폰이 안좋은 것일수도있지만 그래도 이건 너무하다고 생각될정도로 그래픽이 않좋습니다. 진짜 기대 많이했는데 진짜 별로입니다. 이게임을 할바에는 차라리 펍지모바일이 몇천배는 재미있을겁니다. 진짜 재미없습니다.
뉴스테이트 모바일,서버에 연결할수 없습니다 라는 문구가 나오면서 들어갈수가 없습니다... 근데 지웠다 깔면 렉이 안걸려서 1판 할때마다 지웠다 깔고 있네요... 게임을 플레이하니 모배와 비슷해서 딱히 어색하진 않았고 새로운 총도 도 있는것 같아서 좋았습니다. 그래픽도 좋은데 과열이 좀 심하네요.. 이러한 문제점들만 없다면 모바일 FPS 게임중에 가장 재밌는 게임이라고 말할수 있겠어요..!
뉴스테이트 모바일,사실 좀 충격 먹었습니다 별점 2개에 응원 메시지 써놓았더니 삭제라니... 그래도 게임은 잘 뽑았네요 좀더 차별성을 주어서 연령대가 약간이라도 높게 만들어주시면 감사하겠습니다 화팅~! 그리고 차가 약간씩 움질일때 그 방향에 있으면 약간 슬라이딩 버그 있더라구요~
뉴스테이트 모바일,아 정말 재밌습니다. 기존 배그만큼 재밌는데 버그가 좀 많은것 같고 이제 막 출시해서 그런걸 수도 있는데 렉이 좀 샘해요..그리고 버그중에 계속 보상이 안받아지는 버그가 있는데 점검하시면 그것도 확인부탁드려요! 아무튼 재밌으니 별4개 남기고 갑니다!!
뉴스테이트 모바일,"죄송하지만 중국 서비스를 없애면 안될까요? 중국 때문에 게임이 제대로 되질 않아요. 왜냐 핵 때문에 중국인들 때문에 핵이 멈추질 않아요. 그거 때문에 순위랑 승리가 줄어들었어요... 얘를 들어 중국 서비스를 없앴어요 네? 그런데 스토어 말고 탭탭,빌리빌리 등등 거기서 깔 수는 있잖아? 깔면 ""지원이 되지 않는 앱입니다."" 이렇게 하면 되요. 그래서 그냥 배그 롤 콜라보 한거 그거 글로벌 버전 있잖아요 까니까 ""거주 국가에서 사용할수 없는 앱입니다."" 이렇게 써있어요 그거랑 똑같이 뉴 스테도 할때 중국은 ""거듀 구까에떠 따요할뚜 없는 구까입니따!""(?) 이렇게 하면 좋을것 같습니다. 우리나라도 사용 해요! 근데? 플레이를 하면 30펀 핵 ㅅ1ㄲ입니다. 그래서 핵 사용 비율을 줄일수 있지 않냐! 그래서 중국 막으면 좋겠다는 생각입니다. 크래프톤은 잘못이 없지만 중국은 8개월전 PC에서 핵도 썼고 그런데 왜 서버 안 막나요? 중국을 아예 서버를 막아야 하는데.. 제발 막아주세요..제발🥺"
뉴스테이트 모바일,음 일단 자동차 타는맛이 좋아요. 하지만 총쏠때 타격감이 없고 원래 배그를 하던 사람이면 살짝 지루할것 같네요. 캐릭터 속도도 느려서 선빵필승입니다. 결론 : 뉴스테이트라는 테마로 미래지향적인 자동차를 아무나 탈 수 있는게 좋은점 갔습니다. 하지만 총쏘며 1등하는 겜으로써 이 배그를 평가하면 별로인것 갔습니다.
뉴스테이트 모바일,이제 투핑거로도 시점전환하면서 사격이 가능해졌습니다. 트리거 쓰고 4핑거를 사용하면 굉장히 수월한 게임 플레이가 가능합니다. 단점으로는 너무 큰맵밖에 없어서 템포가 늘어집니다. 작은맵 업데이트가 시급하네요
뉴스테이트 모바일,이건 무엇 인가요? 게임을 1년동안 사전등록 해 노았는데 드디어 됀다해서 갔는데 뭐지 렉엄청걸리고 사전등록하면 보상 준다해서 봤는데 보상 받지는 못하고 뽑기했다가 치킨매달만 날렸네요. 그래서1점 드립니다. 게임 업데이트돼면 다시 하겠습니다. 근데 그때도 이 모양이면 노잼검이리고 알고있겠습니다.
뉴스테이트 모바일,"제가 리뷰를 몇번째 쓰는건지 모르겠네요. 단도입적으로 말하자면 이건 아닌것 같습니다. 목요일, 금요일은 접속을 할수 없었습니다. 시스템 오류였던것 같은데 같은 증상을 호소하는 유저들이 많았고 목요일에는 곧 고쳐질거라고 생각했습니다. 금요일에도 들어가지지 않은건 당황스러웠지만 그래도 사람들이 너무 몰려서 그럴수도 있겠다고 생각했습니다. 오늘 접속이 되더라고요. 게임은 괜찮았습니다. 완성도도 좋았고 렉과 시스템 오류는 분명 큰 흠이였지만 그래도 괜찮다고 생각했습니다. 근데 업데이트를 하고 또 접속이 안됩니다. 이쯤되면 이게 배틀그라운드인지 인내심 키우기인지 헷갈릴 정도네요. 새로운 게임 출시에 큰 기대를 가졌었는데... 이건 아닌것 같네요. 그래픽? 중요하죠. 게임성? 중요하죠. 근데 제일 중요한건 소통이라고 생각합니다. 지금은 전혀 소통이 안된다는 느낌이예요. 리뷰가 지워졌다는 글도 꽤 보이고 게임 접속이나 보상 수령등의 문제부터 시작해서 솔직히 너무 실망스럽네요."
뉴스테이트 모바일,게임 자체는 재미있고 펍지 운영자 분들이 노력하신게 뚜렸이 보입니다. 하지만 원래 배그보다 렉이 많이 걸리고 아이템이 갑자기 안 먹어지고 키세팅도 옴겨지지 않고 다시 다 맟춰야 합니다. 렉이 많이 걸리고 아이템이 안 먹어지는건 제 폰 성능때문일수 있지만 키세팅은 옴길수 있게 해 주시면 정말 재미있게 할수 있을겄 같습니다. 펍지 운영자님들 화이팅!
뉴스테이트 모바일,역시 초기라서 오류가 많았지만 업데이트 이후 점점 게임 플레이가 재밌어집니다. 캐릭터 창도 이쁘고 무엇보다 모션 자체가 부드러워진 것 같아서 좋네요 아쉬운 건 마켓 ? 메달을 모아야만 상자를 깔 수 있는게 조금 어렵네요
뉴스테이트 모바일,"아니 제발 최적화 문제를 고쳐달라니깐요, 이런거 막 내지 마시고, 일단 첫번째 단계부터 고치고 가야 할 것 아닙니까. 근데 지금 배그만 봐도 모바일이든 PC이든 둘 다 프레임 드랍, 최적화 문제 등 제대로 고쳐지는게 없어요. 그런데 이런 상태에서도 뉴스테이트를 낸다고요? 아무리 무료게임이라고 해도 이건 좀 아닌 것 같네요."
뉴스테이트 모바일,"이번에 배틀그라운드 뉴스테이트가 나와서 정말 기쁩니다!! 게임을 들어가보니 그래픽도 좋고, PC배그 같아져서 좋습니다. 이런 게림 만들어주셔서 너무 감사하고 게임보다 건강이 중요하니 건강 잘 챙기시고 열심히 더 나은 게임 만들어주시면 감사하겠습니다!! 앞으로도 열심히 배그 하겠습니다!! 다시한번 감사합니닷!!"
뉴스테이트 모바일,이번에 바뀐 총기 사격 모드 변경빼곤 다 괜찮은거 같구 프레임도 최고 사항으로 최고 프레임으로 올려서 해도 발열이나 렉 없이 너무 편하게 게임 할 수 있습니다 이런게임 만들어 주시느라 수고 많으 셨고 앞으로 자잘한 패치나 버그들에 초심 잃지 말고 계속 잘 처리해주셨음 합니다
뉴스테이트 모바일,"제가 뉴스테이트를 깔았는데 추가 리소스를 다운한대서 했는데 계속 하다가 튕기는데 제가 저의 형,엄마 폰으로 하면 또 됩니다. 그래서 형과 엄마는 저장용량이 많으닌깐 되나 싶어서 저는 제 폰애 있는 게임,앱, 사진 등을 다 지워서 20GB가 있는데 똑같이 튕기는데 저장 용량이 얼마나 필요한건가요? 저장용량이 아니라 폰 문제라면 매우 슬플 듯 히이이이이이잉 문제를 알려주시면 감사 할것 같숩다. 형,엄마 폰으로 해서 재미있어가지고 별4개 드립니다"
뉴스테이트 모바일,"예 뭐 그래픽도 예고하던대로 좋게 잘 나왔고 기존의 배그에서 부족한점을 잘 보완한 것 같습니다. 다만 꽤 오래전부터 대두되는 최적화, 커스텀을 해도 어색한 조작감 문제만 좀 해결 해 주시면 좋을 것 같습니다."
뉴스테이트 모바일,조작감이 좀 그렇네요 키가 너무 많아서 화면을 돌리는 범위가 너무 작구요. 핑은 기본적으로 200이 넘는데다가 핑이 너무 높아서 템을 빨리 먹고 튀어야 되는데 핑때문에 장비가 안먹어죠서 죽고 그럽니다. 신작이라고 하지만 전에 있던 게임이 더 편하세요 이상입니다
뉴스테이트 모바일,저 오늘 깔았는데 출시한지 얼마 안되서 서버가 불안정한지 계속 다시 접속하라고 뜨네요.. 그리고 사전 예약 보상도 안받아지고요.. 이런 점이 불편하긴 했지만 출시한지 얼마 안되서 서버가 터질수도 있으니 이해하겠습니다. 게임 한판 돌려봤는데 나쁘지 않더라고요 ㅎㅎ 앞으로 재밌게 할게요 ^^~
뉴스테이트 모바일,"확실히 원조 회사에서 만든 작품인만큼 전작대비 많이 개선된 건 사실입니다. 하지만 게임소리 (총소리, 발소리 등등)가 좀 작은감이 있습니다. 그리고 맵 특정부분 혹은 가끔 엄청난 노이즈와 함께 소리가 깨지는 점이 발생합니다. 이 점 개선 부탁드립니다."
뉴스테이트 모바일,전에 모바일 배그가 처음 나왔을때 저사양 유저들이 발열 심하다고 난리 쳤습니다. 매우 좋은 게임이었지만 지 폰이 안 좋은것을 겜탓을 해서 결국 인게임의 사양이 낮아졌고 중국 겜처럼 변했죠. 지금이 딱 좋습니다. 근데 아이폰 7+ 픽셀퍼 인치가 노트 20보다 높은데 왜 화질이 깨지고 그래픽 선택 옵션이 없는지 모르겠내요
뉴스테이트 모바일,"뉴스테이트 정말 재밌고 그래픽이나 그런것들을 잘 구현한것같아 재밌게 플레이하고 있습니다. ※혹시나 해서 그런데 아직 신고 시스템이 잘 안되는것같습니다 중국 일본 플레이어들이 고의적으로 팀킬,차량 폭파등으로 저를 죽여서 다이야2에서 다이야3으로 강등됬네요..ㅜ 신고도 하고있는데 뭔가 조치가 안취해지는것같아서 글을 써봅니다. 하지만 게임자체로만 보면 정말 좋은게임인것 같아요 힘네십쇼 크래프톤!"
뉴스테이트 모바일,차량을 이용하여 (차량에 부딪힐때 팀원이 버벅거리며 밀려나다가 낙사?로 죽음) 고의적으로 팀원을 죽이는 유저들이 너무 많습니다.(점점 늘어나는듯 8판중 2판정도 그랬습니다) 제제를 확실하고 명확하게 해주셨으면 좋겠습니다. (퀘스트를 하려는건지 모르겠는데 치고 살리고 치고 살리고함)
뉴스테이트 모바일,안녕하세요! 저는 이번에 새로운 뉴스테이지 배틀그라운드가 우리나라 기업에서 만든 국뽕 게임이라서 바로 깔아서 플레이를 해봤는데... 대박... 저번에 하던 배틀그라운드는 질려서 잘 하지 않았는데 이번 뉴스테이트는 정말 재미있어서 엄청 많이 하고 있어요! 그래픽은 컴퓨터와 비슷한데다 어디에서 교전했는지! 어느 곳에서 누굴 킬했는지 데이터 분석이 더욱이 자세해져서 너무 좋았어요! 다들 뉴스테이트 다운로드하세요!!
뉴스테이트 모바일,재미는 워낙 재밌습니다. 그래도 이런건 고쳐주세요 1.피를 채울때 조금이라도 움직여도 피를 채울수 있게 해주세요 자기장이 밖이고 자기장이 아플때. 구급상자를 쓰는데 조금만 움직여도 회복이 취소됩니다. 그래서 1등할수 있는걸 이상하게 놓쳤습니다. 2.AI를 조금만 이라도 늘려주세요 제가 배그를 잘 못해서 사람만 있는방에서 50등도 못 찍는 사람이라 대부분 다 사람인거는 고쳐주세요. 내리는 곳마다 사람입니다. 3.버린 아이템이 계속 가방에 들어옵니다 설정하면 나을지도 모르겠지만 기존 배그는 설정을 안해도 버리면 알아서 하라는듯이 자동으로 안먹습니다. 근데 그 아이템을 버린 곳에 있으면 계속 먹어집니다. 4.자기장이 너무나 이상하게 걸립니다. 이건 정말 심하네요 자기장이 너무 외곽에 걸려 버리면 끝장납니다. 뉴배를 접고 싶은 이유기도.. 이런건 설정으로 고칠수 있게해라구요!!!
뉴스테이트 모바일,"게임이 나왔을 때 부터 접속을 계속 시도해보았으나,에러 창만 뜨고 접속이 되지 않아요. 문의도 두 번씩 드려 보고, 앱을 지웠다 깔거나 RAM을 리프레쉬?돌리는 등 다양한 시도들 다 해보고 있는데도 항상 에러창만 나옵니다.. 제발 해결해주세요"
뉴스테이트 모바일,"감도, 렉, 서버 불안정, UI 등 여러 문제가 보이지만 출시 초기라 빠른 개선 되길 기대해봅니다. 게임성만 놓고 보면 분명 크게 될 작품인 거 같아요. 여러 버그 픽스로 게임 안정성과 UI편의성 높이면 기존 PUBGM은 생각도 안날 거 같습니다."
뉴스테이트 모바일,게임이 나온지 얼마 안되서 아직 부족한 부분도 있지만 전반적으로 게임을 정말 잘 만들었고 게임을 하면서 세부적인 부분까지 잘 표현되어 있는거 같아 정말 맘에 듭니다. 문제점을 보완하고 앞으로 게임성에 맞는 업데이트가 잘 이루어지면 정말 재밌는 게임이 될거 같네요!
뉴스테이트 모바일,우선 최근에 팀이 차로 저를 쳐서 죽인적이 있는데 차에 치여서 받는 데미지는 없지만 넉백으로 인해 튕겨져서 낙뎀받아 죽는 경우가 있더라구요.그거는 개선을 해주셨으면 좋겠고 두번째 드론템 뺏어먹는 팀에 대해서 드론템이 호출지점으로 도착하면 팀이 뺏으려할때 드론템을 호출한 플레이어만 아이템을 먹을수 있게하고 만약에 드론을 호출한 플레이어가 같이 나눠먹고 싶으면 템 먹는 구석칸에 '팀이랑 공유' 같은 버튼을 둬서 그걸 누르면 같이 먹게? 그런 방식이면 좋을거 같습니다.마지막으로 최근에 솔플 매칭이 잘 안돼는데요 팀플은 잘 잡히더라구요.그것도 좀 불편합니다. 그 외에는 만족스럽고 이런 게임을 만들어주셔서 감사하고 또 감사합니다.
뉴스테이트 모바일,서바이벌 패스 LV.1의 보상인 샘의 프로필 아이콘을 11월 11일 수령한 뒤 렉에 의하여 사용할 수 없습니다. 도움말에 들어가서 문의도 해봤지만 해결되지 않네요.그리고 홈 화면에서 배경이 비정상적으로 표시되는 것도 빠른 해결 부탁드립니다 항상 힘써주셔서 고맙습니다.
뉴스테이트 모바일,그래픽과 게임은 매우 훌륭하지만 감도 부분에서 감도를 높으면 좌우로 너무 심하게 돌아가고 감도를 낮추면 위 아래로 움직일때 너무 둔합니다. 감도부분만 해결되면 좋은 게임이 될거같네요!
뉴스테이트 모바일,"이게임 좀 하다 보니까 갓겜임 이제 팅기지도 않고 컴배처럼 엠포도 안좋고 그래픽도 좋고 근데 싫은점이 있습니다.진짜 컴배처럼k2도 업뎃해주시고 다른 맵 뭐 대충 사녹,미라마,태이고 정도 추가해주시면 더더 갓겜이 돼겠습니다. 이런점만 고쳐주시면 더더욱 많이 관심을 가지는 게임이 될것 같습니다."
뉴스테이트 모바일,"알파 테스트 두번 참여했는데 테스트때보다 렉이 심해졌습니다 또 폰의 성능이 좋지 않아 그래픽을 보통,프레임 매우 높음으로 사용하는데 텍스처 로딩이 안될때도 많고 인게임 나침반이나 낙하할때 뜨는 지역 이름과 멀리있는것을 볼때 계단현상이 심해서 눈이 아파 게임을 오랫동안 하질 못하겠습니다 모배는 저사양 폰도 포용을 해주는데 뉴배는 2~3년지난 폰으로는 계단현상 때문에 하지를 못하겠습니다 한마디로 정리하면 최적화좀 제대로 해주고 폰 성능이 안좋으신 분들은 그냥 모배 합시다 뉴배 못해먹어요"
뉴스테이트 모바일,"이번 업데이트 이후로 갖가지 버그가 더 생겼는데, 이게 맞는건가요? 저번의 서버점검 이후로 계속 튕기고 아이템이 1~2분 후 먹어지고 핑도 너무 심하면서도 움직이면은 벽에 끼는 상황도 계속해서 발생하네요 이게 맞는 운영인가요?? 뉴스테이트 기대했는데 실망입니다 다른리뷰도 보니 거의다 같은 답변이네요ㅋㅋ"
뉴스테이트 모바일,다 좋아요 다 좋은데 한가지때문에 미칠것같아요. 그 이유가 팀 데스 메치를 하는데 처음엔 아무런 문제가 없었어요 중간 부터 잘 하다가 갑자기 제 캐릭터 피가 샷건에 맞은거에요 근데 그 쏜 사람은 어떤 일본인? 중국인?이 였는데 그 사람은 알고 보니 핵사용자 였습니다 너무 억울하게 계속 죽고 그 핵 사용자는 리스폰 되는 곳에서 움직이지도 않고 허공에 총을 쏘는데 그럴때 마다 저의 팀과 저의 캐릭터는 그 총에 맞아 죽었어요. 이런 핵 사용자 막아주시면 좋을것 같습니다... 긴 글 읽어주셔서 감사합니다.
뉴스테이트 모바일,서버 접속되니 다른 문제점 말할게요 만드신분들에게는 죄송합니다 1. 그래픽이 안 좋아요 상대를 저격하고 있는데 상대가 사라져버렸습니다. 2. 건물을 넘어가는데 껴서 자살할수밖에 없었습니다. 더 있지만 이 정도만 할게요 다른 분들도 불만이 많으신것 같으니 빨리 좀 고쳐주세요
