game,review
고철상 팩토리 - 거지 사장 키우기,게임 진행시엔 광고 없어서 편하네요ㅠㅠ매니져 획득할시 무료로 광고 보고 얻을수 있어서 좋은거 같아요! 그렇게 노가다 게임도 아닌지라 손가락이 아프지도 않네요 ㅎㅎ터치 게임중 가장 할만합니당
고철상 팩토리 - 거지 사장 키우기,진짜로 게임하면서 광고 한번도 안나옴 별점5주는이유가 특징:재미있음 부서서 게임하니까 재미있습니다.
고철상 팩토리 - 거지 사장 키우기,오늘깔은유저입니다!처음엔재밌지만단계갈수록재미가없어지네요 ㅜㅜ
고철상 팩토리 - 거지 사장 키우기,광고도 많이 안나오고 재미있어요 ( 이멥 추천 합니다.)
고철상 팩토리 - 거지 사장 키우기,왠지 고철을 부수니깐 스트레스가 풀리는것 같고 제밌도있어요
고철상 팩토리 - 거지 사장 키우기,이거스테이지를빨리깰수있어서좋아요 이거할게임없는사람하면좋으니까꼭해보새요
고철상 팩토리 - 거지 사장 키우기,광고제거가 4만원 오프라인 보상이 2만원? 산좀 쎄게 넘었는데
고철상 팩토리 - 거지 사장 키우기,광고제거가 너무 많이 비싸네요. 1~2만원선이면 쿨하게 결제했을텐데 4만원은 좀.. 광고제거 없으면 매우 불편한 기능인데 없으니 뭐 게임삭제해야죠. 게임성은 괜찮은것 같아요.
고철상 팩토리 - 거지 사장 키우기,"게임에서 메인퀘스트로 광고보기를 지정함, 퀘스트로 주어지기 전에 매니저 업그레이드를 할 경우 결제 없이 퀘스트 공략 못함"
