game,review
미르M,"개인적으론 미르의전설2도 해봤었고 아이템명, 스킬명, 지역이나 미르2의 특징을 그대로 가져온 몬스터들 형상만으로도 이정도면 향수를 불러일으킬만큼 현대적으로 잘살린것같네요. 타 게임들의 시스템이나 컨텐츠를 많이 가져온거 같은데, 제작등과 같은 난이도에 있어서는 과금없이 비교적 짧은 시간으로 성과를 낼 수 있는것 같아 긍정적으로 보입니다. 다만 버그가 꽤 많고 캐릭터간의 밸런스 등 고질적인 문제들만 잘 손본다면.. 원활한 게임이 되지 않을까 싶네요"
미르M,게임 구성/시스템/ 다 만족합니다. 단! 사냥터 효율이 매우 떨어집니다. 6일 플레이 해보면서 파란템(보물)구경도 못해봤고 인첸트 확률(95프로) 파괴 과연 맞는것인지... 슬슬 질려갑니다. 문제는 보물템 확률 올려서 거래소 활성화만 시켜도 번창하실것같습니다. 이런식으로 가면 유저들 질려서 포기할듯합니다
미르M,총체적 난국 ㅎㅎㅎ 게임 개발비를 코인개발 하는데 사용한듯 별에별 버그가 엄청 많지만 다음날 점검하면 사라짐..또 다른 버그가 생길뿐 과금 경쟁요소가 타게임에 비해 높진않지만 필수 과금을 안하면 진행이 어려움 밀어서 잠금해제가 잘안되는건 하드웨어인지 소프트웨어인지...ㅋㅋ 욕나옴
미르M,"저도 알람설정하고 기다렸는데, 그래픽도 옛날 시스템도 옛날 스타일, 느린반응과 퀘스트 안넘어가는 오류투성이. 자동진행안되는데 알수도없어 유저끼리 이건 어떻게하는거냐고 웅성거림. 제일최악은 엔씨가 버려놓은건지 뽑기 합성 ㅎㅎ 린지 w m 그거지겨워서 장타로 할게임 찾았다가 미르m 너도 역시구나 했습니다. 이틀 체험잘하고갑니다. Cbt왜 진행한걸까 의문"
미르M,"타격감은 좋고 괜찮습니다. 그런데 과금을 하지 않으면 퀘스트 진행이 극악입니다. 캐릭터 기본 데미지 올리셔야 될 것 같습니다. 그리고 게임에 대한 설명이 너무 부족합니다. 보스몹 잡기, 파티생성 등 설명이 부족합니다. 그리고 젤 중요한게 서버 관리를 좀 해주시길 바랍니다. 서버에 중국인들이 계속 도배합니다. 미르m 기대하고있습니다. 아직 이틀밖에 안되었지만 빠른 피드백과 난이도 조절 부탁드립니다."
미르M,"너무심각함;;레벨22인데 20달성 업적완료 못해서 칭호도 못받고있음. 파괴확률도 낮은데 계속파괴되고 제작도 거의 반이상이 실패임. 무기 5강 하는것도 힘듦. 그러니 같은 레벨대의 몬스터한테도 잘죽게됨. 보상도 너무 허접하고, 확실히 다른 게임들이랑 다름 보통 점검 들어가면, 뽑기권을 주는데 진짜 안줌. 게임 시작안한사람들은 시작 하지말고 그냥 세븐나이츠 기다리셈."
미르M,완전 리니지 양산형게임에 멍청한 ai 몹 피하려고 이동커서 움직이려하면 캐릭터가 제자리에 멈칫하고 고정되어서 한번 더 움직여야함 완전 예측형으로 해야함 물약도 쓰레기에 주머니형태 아이템은 사용을 몇십번을 눌러도 사용이안되며 가방확장 10만동전으로 산건 어디로 날아갔는지 보이지도않는다 최악 조작감 게임
미르M,버그천지...14일 화신소환권 구매해서 한번에 사용하려고 모아놨었는데 접속해보니 오늘 받은 2개말고 다 없어졌네요 복구해주시던 환불해주시던 조치해주세요. 그 외에도 자동사냥 진행해서 절전모드에서 아이템 습득한거 확인했는데 절전모드 풀면 습득된 아이템 하나도 안들어와있네요. 무슨 이런 경우가 다 있나요. 어찌되었든 현질해서 게임중인데 사용도 못해보고 날아간 화신소환권 빨리 조치해주세요.
미르M,"예전 미르2의 향수를 느낄수 있으면서 그래픽이나 시스템적으로 많이 나아졌네요. 아직 오픈 초기라 조금 불안정한 부분들이 보이긴 하지만 전반적으로 만족합니다. 상점에 싼 상품들도 좀 있었으면 좋겠고, 다양한 이벤트로 아이템 좀 뿌려주시옵소서~~"
미르M,"미르는 이걸로 처음접한건데 렙업수준이 극악이네요 범위스킬도 없는데 몹잡을라면 하루왠종일 걸리고 답답해 즉을거같아서 뽑기 3만원해서 속도가 확체감이 되네요 좋은건 당연히 안떴지만 비교되니 뭐 안하고는 못하게하는 수준 (근데 그것도 없을때보다 나은거지 빠른편은 아님...) 이속도 엄청느리고 퀘스트는 쓸떼없이 마을까지 왔다갔다 시키는데 메인퀘경험치도 창렬급 이속도느린데 왕복 1,000미터넘음 극초반인데... 그래서 순간이동돌같은거 쓰게만드는데 이것도 안쓰곤 못베김 탈것은 또 왜이리 느린지... 현질 1도 안하실분들은 메이플 옛~~~날 수준이라 생각하고 하면될듯 메인퀘 완료안되는 버그도 있었고 하 우선 돈은 조금썼으니 좀 더 하는데 그냥 3만원 여기쓸돈으로 모바일 속시원한 검사나 하면서 피씨로 스팀에서 여름할인받고 1~2만원짜리 즐기는게 정신건강에 좋음"
미르M,겜 진짜 이렇게 대충 만들래요?? 다른 겜에서 이것저것 시스템 갖다붙였으면 자기들 식으로 잘 수정하고 유저들이 차차 적응 해나갈 수 있도록 차차 열거나 가이드를 잘 해놔야지 대충 이런식입니다 튜토리얼 던져두고 재화나 이런건 막대하게 필요하게 해놓고 확률 개방으로 해놓으면 우리 겜 다크소울급(확률)으로 어려우니 알아서 잘해세요 ^^ 이런건가요? 좀 적당적당히 좀 합시다 ㅡㅡ
미르M,2개의 계정 컴터로 게임중. 1번계정에서 구매요청. 컴터에서 결제안됨. 폰으로 들어가서 mpay인가로 결제해야함. 결제함. 2번계정으로 아템구매됨... 이유=폰에 2번계정이 로그인되어있었음. 아무리그래도 시스템이 어이없는게 1번계정 에서 구매요청했는데 2번에서 결제된다는게;; 재빨리 환불요청하려고 1:1 문의씀. 등록하려니 안됨 대표케릭설정해야한다함. 아무리찾아도 대표케릭설정방법없음. 다들 이런문제들로 난리임 4일째 환불 못받고있다하는 사람들있음 문의자체를 못함. 7일이내 청약철회인가인데 못하고있음. 어이없음 어디다 신고해야하나...
미르M,게임전체적인 스토리는 재밌습니다. 하지만 소과금이 넘어가는 장벽이 너무 어렵습니다. 극악에 가까운 난이도때문에 게임을 계속해야될지..의문이 듭니다. 하지만 몇가지만 개선하면 좋은게임이 될 수 있을겁니다. **참고로 유튜브 - 제이(게임스트리머)** 내용 참고 하시면 좋을듯 합니다. 제가 하고싶은 말들 다 잘 담아놨습니다.
미르M,초반은 할 만한데 과금이 너무 심해 키우기가 쉽지 않네요. 게임도 중 카톡 같은 뭔가를 보고 나면 게임이 항상 버벅거려 접속 종료하고 다시 해야 괜찮아지고요. 사냥시 아이템도 떨어지는거 같지 않아 수집 재미도 없고... 이런저런 문제점이 많네요.
미르M,"게임 그래픽은 모바일치고 좋은 편이라고 생각해요. 하지만 게임의 스토리나 퀘스트, 타격감은 지루해서 하고싶은 마음이 들지 않았어요. 후반에 게임이 어떤 컨텐츠가 있는지는 모르겠지만 별로 기대가 되지 않습니다! 게임 초반에 재밋게 할 수 있는 컨텐츠나 후반 플레이에 대한 기대감을 줄 수 있는 초반 컨텐츠가 있으면 좋을 것 같아요..ㅎ"
미르M,레이드하다가 죽어서 부활했는데.. 다른채널에서 부활하는 건 뭔가요? 보상은 보상대로 못 먹고 귀환석에 포션에 쓸거 다썼는데.. 이동방식도 뭐 같아서 보스 스킬 다보이는데 피하지를 못하네.. 바닥을 클릭해서 이동하는거면 클릭만하게 하던지.. 바로 삭제 합니다.
미르M,"온갖 과금bm만 다 가져다 붙여놓고 게임은 미완성 느낌, 각종 버그가 난무하고 대응도 느리다. 살다살다 리니지 보다 뽑기가 다양하고 악랄한게임은 처음이다 ㅋㅋ 오딘뽑기+린w뽑기+아이온생활기술+린w문장+린w도감(미르는 심지어 하나더 뽑아서 도감을 채워야 한다 ㅋㅋ)"
미르M,처음 시작했을때는 와 신발 이딴걸 지금 2022년 게임이라고 만든건가‥ 하는 생각이 들 정도로 너무 어렵고 재미가 없더군요. 특히 사망 패널티 경험치 손실이 너무커서 자동사냥해놔도 불안하고ㅋ 같이 하는 친구가 그래도 이왕 시작했으니까 조금만 더 해보자고해서 25렙까지 키웠더니‥‥ 그 과정에서 게임을 이해하게되고 시스템을 알게되고 고급 화신 받았더니 그때부터가 진짜 미르의 시작이네요ㅎ 물론 무과금의 한계가 있어서 실험삼아 화신에 몇장 넣었는데 녹차선물세트만 30장 나와서 여전히 어렵습니다. 30장이면 보물정도 하나쯤은 줘야되는거 아닌거요 ㅠ.ㅠ 한가지만 좀 개선되었으면하는게(여러가지 있지만 쿨하게 한가지ㅋ) 파티사냥때 파티장 타겟공유 및 파티장중심 활성화 시키고 자사를 돌려도 각각 따로 놀다가 사망하는 경우가 정~~말 많이 발생합니다. 혼자 잡기힘든 몬스터 잡으려고 파티하는데 결국 혼자잡고 있다는‥‥ㅋ 이거 어떻게 개선 안되나요??
미르M,"미르IP를 계승시킨게 아니라 사냥, 길찾기 수준이 1990~2000대로 돌아간 수준. 공격하면 0.7초 뒤 반응, 길찾기누르면 버벅거려서 진행불가. 자동사냥 누르면 한발짝씩 움직이느라 매우허접합니다 이런게임을 만든것도 한심한데 출시되다니 위믹스같은 소리하지말고 기본이나 잘하길..."
미르M,일단 pk시스템 바뀐거에 매우만족합니다 그리고 작업장이 하기에 힘든 구조시스템 좋아요~ 렙업을 해도 타게임은 작업장이 렙빨로 장악하는데 이게임은 작업장이 하긴 힘든 시스템 너무 좋습니다 다만 초반버그만 잘 잡았어도 대박게임인데 아쉽네요 작업장이 없는 게임 번창하시길 ~
미르M,갓존슨님이 광고한 갓게임. 신박한 광고에 호기심이 생겨서 깔 수 밖에 없었습니다. 리세 성공해서 갓존슨 놀리기를 하기위해 노력중입니다. 설명 그대로의 타격과 그래픽!! 디아블로 이모탈 버리고 갈아탑니다. 딱 갓존슨님 게임 옮기는 시점까지 해야할 것 같습니다.(존슨님이 옮기면 이겜도 끝난겁니다) 갓 광고주 만세!!! 갓존슨 만세!!!!!! 라고 쓰라고 했지? 형;;;;
미르M,여러콘텐츠를 제공하는거도 좋지만 버그부터 잡으시죠 케릭창에 갔다접속하면 팅기고 메뉴판 클릭 하면 케릭이동하고 한달이 다되어가도 기본 버그는 언제잡아서 안정화 시깁니까
미르M,"조작감이 매우안좋아요. 반응이 느립니다.s22,5g환경인데도 그냥 조작반응자체가 밀립니다. 잠깐했지만 마나물약 자동사용 기능도 안되네요. 그외 그래픽이나 다른부분은 괜찮네요. 미르와는 다른겜이 되버렸지만 뭔가 느낌이 남아있기도함."
미르M,사냥터 문제나 아이템 문제나 지금은 유저들이 편한 환경을 더 중요시하게 생각합니다 일부유저는 복잡한 환경이라도 감내하겠지만 그외 유저는 간편한것에 익숙해진 상태라 질리거나 지루할수 있을듯 하네요 이전 미르4 한 유저로서는 답답한것이 많습니다
미르M,UI구성자체가 역대급으로 너무 불편하다. 게임 발란스는 잘 맞췄으나 파티플 해도 파티장이 어딨는지 보이지도 않고 지역간 이동도 직관적이지 않고 전부 여러과정을 거쳐야하며 필요한걸 찾을때 찾기 어렵다.
미르M,초반 난이도가 높아요. 하지만 자동사냥과 자동퀘스트 기능이 잘 구현되어있어요. 20레벨 이후가 빡센데 장비 패키지 하나 지르면 많이 편해지네요. 캐릭 키우는 재미로 계속하게 되네요. 쟁 할 때 재미있을 듯ㅋㅋㅋ
미르M,하도 말도 많고 탈도 많은거 같아서 궁금해서 시작했습니다. 개인차는 있겠지만 쿼터뷰도 그렇고 나름 깔끔해서 나름 재미있게 하고 있어요. 자동 돌려놓고 절약(?)모드 넘어가면 경험치 돈 아이템 얼마나 먹었는지 요약해서 나오는건 신박하네요. 소소하게 해볼만 합니다.
미르M,추억은 추억이고 어째 전체적인 게임 진행이 중국에 뒤쳐진듯합니다.. 왜이렇게 빡세나 햇더니 24랩에서 포기하다시피 하다말다인데 모험 업적에 20랩 진정한영웅인가가 18랩에 정지..24랩 올리는동안 흑철캐야 장비제작하던 진행이 됏을텐데 랩은 24올린지가 언젠데 아직도18랩 그래 18..정지 ㅡㅡ 이~십샤 랩 미르2.3에 2.묵청대도 표면에 용무늬 건의..3.몬스터 마을침공 등등 건의도 마이 햇엇는데.. 미르4 나 m이나..이젠 중국보다 더 밝히는 글로벌 돈게임 됏네.. 그래서 흥하겟네..반짝이지 소무과금 분들도 즐겨야 할텐데 지갑을 여는게아니고 입을여네 ...욕하느라ㅡㅡ 추억속 사랑햇던겜이라 별은 다섯개찍고 갑니다.
미르M,"20렙 겨우 넘긴 무과금러임. 초반 설명들이 엄청 부족함. 참고로 탈것들 밥을 줘야하는데 방법을 몰라서 계속 굶김. 설명이 난해하게되어있는게 엄청많음. 버그와 렉.접속불량도 많음. 초반퀘스트가 진짜 중요한데 그딴거 대충해놨음. 그래서 인제서야 첫마을 퀘스트를 시작함. 제작? 하루종일 캐고 잡고했는데 난중에 낚시시작퀘줌.ㅋㅋㅋ 그래놓고 연금좀 하려니깐 이건뭐 총체적난국임. 중급 물약 백개만드는데 삼일은 소요할듯. 지금 일대일 거래하는 방법 찾고 다니고있는데, 관련글없음.ㅡ결론 과금조낸하라고 만든겜. 과금하고도 접을판임. 게시판이 난리인데 답변도 없음. 딴겜하셈.ㅡ"
미르M,평타...겜임상 여러가지 불편하내요. 퀘스트 진행이나 보스 몬스트 언제 나올지도 모르겠내요. 다양한 컨텐츠는 인정입니다. 앞서 자동물약 먹기는 제가 실수로 어떻게 하니 되내요.. 이런 것도 조금 배려가 필요합니다.
미르M,자동사냥 기능 엉망입니다. 지멋대로 멀리 뛰어 갔다 오질 않나 엡데이트후엔 파티장 몹은 잡지도 않네요. 또 자동사냥켜진채로 죽어서 마을로 가지면 자동사냥 그대로 켜져있어 다시 던전으로 돌아가서 또 죽는거 반복 ㅋㅋㅋ
미르M,게임 막 시작하는 유적 입니다. 해봤는데 자동 플레이 자동 퀘스트 플레이 만들어주세요. 수동으로 하면서 좋지만 조금 거의다 힘들어요. 부탁드립니다.
미르M,설정에서 마을 자동귀한할시 도약의패 사용설정으로 두지도 않았는데 마을 자동 수행후에 보유하고있던 도약의패 50개가량이 한번에 없어지네요 미미한 점검 매일같이 하면서 정작 이런건 점검하지도 않고 도약의패 손해본거때문에 주화도 계속 모이지도 않네요 수정을 하시던지 보상을 해주시던지 좀 해주시죠
미르M,"해보면 할만은 함. 근데 과금요소 피로도를 낮춰서 오딘이나 리니지쪽 유저들을 대리고 와야하는데, 과금 피로도가 비슷한거 같다. 이거 bm 세팅한 사람 성과급이랑 기타등등 다 잘랐으면 좋겠다. 대세 흐름을 읽을줄을 모르네"
미르M,캐릭터가 있는데 원래 캐릭터로 접속이 안되네요 왜그런걸까요??? 무슨오류인지 알수가 없네요 전사 캐릭터가 채널 선택할때 9레벨이 나오는데 막상 선택하러 들어가면 1레벨부터 다시 만들라고 나와요 빨리 좀 조치 부탁드립니다
미르M,다음게임들은 업뎃하는 만큼만 용량을 요구하는데 미르는 무슨 게임 업뎃할때마다 게임 총용량보다 2배이상 높은 용량을 요구하는지 업뎃때마다 그러니 스트레스받아서 못해먹겠음
미르M,현금벌이에 미친게임.. 정기적으로 현질해줘야 플레이 가능하고 무과금은 20정도 찍으면 퀘 막히고 진짜 저랩몹 의미없이 사냥하는거 밖에 할게 없다 동랩 몹잡는것도 물약값 계속들고 엔씨겜보다 최악인듯 이렇게 게임을 하드하게 만들고 무과금유저들도 다 떠나게 만들면 망하는건 곧일듯 하다ㅋㅋㅋ
미르M,"최대한 미르 본연에 재미를 찾기위해 노력한 티가 납니다. 하지만, 과금이 심한거에 비해 재미요소는 조금 떨어집니다. 돈을 들이지 않아도 같은시간에 같은 노력을하면 같은 결과가 나올수 있도록 패치해주세요. 유저들이 원하는거는 그거 하납니다. 뽑기도 몇회이상 뽑으면 확정으로 상위단계 지급받을수 있게 해주시고요. 그러지 않으면 오래도록 즐기지 못할꺼 같습니다. 물론 유저와 소통하고 지속적인 업데이트가 이루어진다면 이야기는 다르겠지만요. 추억에 게임을 다시 신선하게 만난 이 기쁨이 쭉 이어졌으면 좋겠습니다."
미르M,게임해본 결과 문제점. 휴대폰 자체 10분후 화면잠금됌. 게임하는데 왜서 화면이 잠겨지 또한 화면 잠기면. 바로 않움직임 몹을 않잡아요 바로 죽음 거지게임이죠 오토못돌리니 오토 기능이 있음 시간없을때 돌리려고 만든거 아님 거지게임
미르M,버그가 심해요. 퀘스트 완료 눌러도 안되고 무공 취득도 안되고 좀 개선할 필요가 있어요. 그리고 발열 심합니다
미르M,미르2를 계승하고 퀄리티만 좀 높였다고 들어서 리니지m처럼 옛날향수를 느낄수 있을줄알았는데 미르2와는 전혀 관계없고 소스만 좀 가져다쓴 전혀다른게임... 미르2생각하고 다운받은 옛날미르2 유저들은 실망할수밖에... 미르2와 별개로 독립적인 전혀다른게임이라고한다면.. 그것도 글쎄요... 여타다른게임과 별반다르지않은 뽑기위주 게임인듯... 추가로 쓰자면 게임회사가 게임계발하고 서비스에 집중해도모자랄판에 코인이나 만들어서 장난질이나하니 서버관리가 개판이죠... 한심합니다.. 서버관리나 똑바로하고 과금유도하세요
미르M,타외파의 소환 패키지 구매시 획득하는 칭호가 구매후에도 활성이 안됩니다.. 시간적 정신적 보상 필요합니다. 그리고 서버에 렉이 전반적으로 너무 많아요
미르M,미안하다... 너무 기대를 많이하고 기다리고.. 했던게임인데... 뭔가 내이름과 똑같은게임이라 어릴때 미르2 부터... 정이 많던 게임인데 이렇게 폭망할꺼라고 생각안했는데.. 미르2 사북쟁탈보다 못만들었냐... 조금 그래픽만 좋아진거잖아ㅏㅏㅏ 너무했다고 생각안하냐.. 미르라는 게임에.. 왜 변신기능이 있는거냐고...
미르M,과금 유도가 너무심함 아이템 맞추기도 힘들고 어느정도 진행하다보면 진행이안됌 결론은 결재를 해야 그나마 어느정도 진행이됌 아이탬 만드는 확률를 좀높이던가 필드에 아이탬드랍를 좀높이던가 해줘야할듯 돈없으면 겜도하지말라는 거같은 느낌이듬 게임자체는 넘좋음
미르M,아니 뭐 마을에서 클릭 몇번만 하면 바로 팅겨ㅡㅡ 주서워서 마을엔 가지도 못하겠네~ 그거말고라도 너무 팅겨요~ 최적화는 밥말아먹었나요ㅠㅠ 하루에 몇번씩 팅겨서 어제도 몇번 접속만하다 말았네요~
미르M,글씨가 작고 화면이 너무 난잡해서 게임진행 불가.. 어지간하면 과금도 하고 재미있게 해보려 했으나 시력이 1.0 이상인데도 글씨를 읽을수가 없어서 삭제합니다
미르M,여자 유저로써 별 기대안하고 이런유형 게임 흥미있지도 않지만 심심해서 이런저런 게임 해본결과 미르m은 본인이 재미느낄만한 직업만 잘 선택한다면 육성할맛남 모바일게임 잘 하지도 않는데 이건 일할때도 자동 사냥 켜놀만큼 뭔가 재미짐 빨리 레벨업 시키고 싶달까.. 호불호 있을만한 게임이지만 게임1도모르는 게알못인 제가 하기엔 재밌음 개인적인 내생각 ㅇㅇ 모바일게임 뭐해볼까 하면 해보고싶은게임 같음
미르M,"게임 참,,,가방 열어서 닫고 옆에 클릭하면 넘어가는 시간만 세월아 네월아 하고 있네,,,다른 게임들은 국가별로 서버 나눠놨던데 이건 한국섭이랑 중국섭이랑 통합인가???한국말보다 한자가 더 많네,,,회사가 중국거라 그런다 쳐도 서버는 나눠놨으면 그나마 나았을껀데 접속한지 30분도 안되서 정떨어졌음다 장사 잘하소"
미르M,지금 소과금으로 하는데 중독성이 강하네요 술사키우는데 너무 재밌어요 자동도 되지만 몰이 사냥하는 쾌감이 짜릿합니다 약간 과금하셔서 하는것도 나름 재밌게 오래 즐길수 있으리라 보내요 그리고 흑철이 렙 26정도되면 체광할수있는데 금방 모여요 이거파시면 장비 맞추는데는 괜찮게 하실거예요 전투에서뵙겠습니다 ~^^
미르M,뭔 쓰레기를 내놓았나? 퀘스트는 완료가 되지 않아 계속 소리만 내며 렉걸리게하고 사냥은 가까운몹이 아니라 혼자 필드를 돌아다니다 치고 돈벌려고 만든게임인게 의도가 보인다... 좋은 게임을 만들면 어련히 돈을 벌게 될것을...
미르M,저처럼 미르m 기다린사람들중에 진짜 예전2D그래픽 미르의전설2 를 모바일로 나온다면 엄청 좋아할텐데.. 참으로 아쉽네요... 플레이 해봤는데 미르4랑 뭐가 다른지...몰르겠네요. 이럴거면 미르m 이라고 왜 이름 지었나요. 진짜 옛날감성 기대했는데 .
미르M,다른건 차차 나아질꺼라봅니다. 하지만 이건 빠른시일내에 고쳐주세요. 파티해서 닥사 자동사냥 돌릴때 마을자동갔다오면 채널이 안맞습니다. 이건 아니지 않나요?
미르M,공식홈피에 말해도 답변조차없네요?? 버그로 인해 각종 피 엠피 버프 물략싸다 사라지고 이동의패 및 각종 마을귀환 주문서 만다라재료 탬들 맥침 등등 싸다 사라졌는데 복구안해주나요?? 그럴꺼면 그냥 지금까지 쓴도 싹다환불해주던가요 아니면 복구할 능력이 없으면 사라진거 다사려면 엽전 몇십만 엽전으로 택도없으니 엽전이라도 100만이상 엽전이라도 보상해주세요 최소한으로 더 바라지도 않아요 지금 버그들 해결도 못하는거 같은데
미르M,할만합니다. 그러나..기본적인 파티챗오류 S울트라22기종 노트인데 화질이 왜깨질까요.. 최적화 업데이트 해주셔야 될것같습니다
미르M,라이트 유저가 10만원 이상 현질해서 화신 뽑았는데...고급등급 이상은 하나도 안나왔습니다... 무협 리니지 그 이상도 이하도 아닙니다 주가 떡락하는 소리와 게임의 만족도는 비례하네요...
미르M,"돼도 않는 갓존슨 광고보고 어이가 없어서 깔아서 해봄 일단 게임은 깔끔하고 옛날 미르감성도 좀 있음. 갤노트10에서 여유있게 돌아감. 근데 리세마라는 좀 문제있큼. 8회동안 진짜 뭐없음ㅋㅋㅋ 시간이나 짧게 걸리면 그러려니 할탠데, 한번에 1시간 넘는듯. 9시간동안 리세만함;; 암튼 리세하다 빡쳐서 겜 접을거 같아서 걍 진행함. 과금요소 생각보다 많음. 진행은 효율구려도 못할정돈 아님. 뭣보다 스펙욕심 안부리고 소소하게 하기엔 린도박보다 선녀임ㅇㅇ 암튼 아직까진 잼씀"
미르M,"온갖버그와 점검을 구경하는게임. 거래소 정산금액이 사라지고 서버가 터지고 불시에 서버가 튕기기도 하는데, 운좋으면 잠깐 사냥도 할수있어요^^"
미르M,역시 돈없으면 게임하지맙시다. 추천사냥터를가도 물약값없어서 진행을못함 참고로 정착패키지등 여러게 샀음 그래도 퀘진행이나 약값이 없음
미르M,베타 안했나? 접속도 잘 안되고 접속할 때마다 반복 다운 받고 퀘 완료도 안되고 캐릭선택 화면 들가지지도 않고. 총체적 엉망인데?
미르M,"아니. 게임 잘하고 있는데, 아무런 이유도 없이 블럭 처리하는 건 무슨 상도덕인가? 무과금은 아예 하지도 말란건가? 갓존슨 리세마라 방송은 광고비까지 주더만... 새로운 전략인가? 같이 게임하던 문파장도 이유없이 블럭 당하고 접더만... 미르M 운영자님들아! 시간 절약하게 해줘서 고맙다."
미르M,게임이 갈수록 너무 재밌습니다. 다만 난이도가 너무 하드하니 약간 조정이 필요해보입니다. 게임초기라 잡버그들이 있지만 금방 수정바랍니다. 재밌게 즐기고있습니다
