game,review
뉴스테이트 모바일,안녕하세요^^뉴배가 출시하자 마자 모배를 접고 뉴배로 갈아탄 유저입니다. 게임 자체는 재미있어요. 그런대 단점은 1.컴퓨터 배그 처럼 대스캠을 못본다는게 아쉬워요.2.가끔 플레이중 바닥이 없어져서 거기에 들어가면 안 움직여져서 플레이어를 만났을때 대처하기가 힘들어요ㅠㅠ2번은 꼭 해결 해줬으면 합니다 하지만 장점도 많아요 1.총이 많다 2.그래픽이 좋다 3.파밍하기가 좋다 4.핵쟁이가 많이 없다 5.스킨이 멋지다 이로서 뉴배는 장점이 훨씬 많습니다. 전 뉴배가 엄청나게 인기있는 게임이었으면 좋겠습니다^^
뉴스테이트 모바일,"일단 11월 11일, 뉴배 출시일부터 꾸준히 플레이해오던 유저로써 단점, 장점 평가 단점 1. '자연'그래픽 조정 필요 2. 알파테스트 때보다 훨씬 저퀄 3. 다수의 핵쟁이 4. 수많은 버그들 5. 서버 문제 6. 신규 맵들을 출시하지 않음 7. 나무 3D, 그림자 랜더링의 좁은 범위 등 많지만 이정도만 나열 / 장점 1. 최적화 그럭저럭 2. 모배에 비해 골고루 잡혀있는 총기 벨런스 3. 칭찬할만한 '건물'의 그래픽 4. 많은 디테일들 5.총기 커스텀마이징 등등 장점들도 이보다 훨씬 많지만, 이정도만 나열 / 개인적으로 좋은 부분 1. 총이 쏘는맛이 있어, 더 재밌음 2. 게임에 거의 영향을 주지않는 콜라보 3. 치킨메달 3개로 뽑을수 있는 상자 4. 플레어건 보급의 총기 개수(1개) 5. 모배보다 현실적인 색감 / 개인적으로 모배 3년 반 동안 하다가 뉴배 출시 하자마자 모배를 깔끔히 버리고 주게임을 뉴배로 바꿀만큼 뉴배에 애정이 깊은 사람이므로 앞으로 뉴배가 더 잘됬으면 좋겠음"
뉴스테이트 모바일,"처음 사전예약부터 하였습니다. 완성도나 디테일은 진짜 좋습니다. 하지만 점점 업데이트를 하면서 안좋아지는 부분이많아지는 것 같아 아쉽습니다. 개인적인 개선사항 입니다. -라이트 그래픽에서 광원키기,끄기 뉴스테이트가 계속 최적화한다고 그래픽 낯추고 하는데 오히려 업데이트를 하면 할수록 렉이 늘어 납니다. -트로이 노을 맵 확률UP -SMG파지속도 원래대로 -훈련장에 정찰드론등 여러가지 훈련추가 -아킨다 이후로도 빠르게 기존맵 추가 입니다."
뉴스테이트 모바일,"6/29 현 뉴배의 심각한 문제들과 장점 1. 뉴배만의 색깔이 점점 옅어짐 - 건물 뉴배만의 장점인 고퀄리티적인 건물구조가 점점 단순화 되어감 ex) 꿀집,작은창문이 달려있는 창문 파쿠르가 안되는 집 - 묵직한 조작감 알파,2차,시즌 초 까지만 했어도 컴배에 가까웠던 묵직했던 조작감이 점점 가벼워 지는듯함 - 차량 디테일 어느 순간부터 차량의 바퀴를 파괴해도 모배처럼 부숴지기만하고 차량이 들썩이지않음 (차체가 파괴될때도 마찬가지) 2. 짜잘짜잘한 버그 3. 신규 콘텐츠 부족 ex) 게임출시 후 몇달째 신맵 출시 × 4. 그래픽 알파테스트,2차테스트때에 비해 최적화 이슈로 그래픽이 현저히 저하됨 장점 1.커스텀 기능 커스텀 기능 덕분에 어느 한 총이 op가 되는일이 적음 2.비교적 잘 잡혀있는 총기 밸런스 3.모배와 달리 인게임에 영향을 안 주는 콜라보 진짜 뉴배 나오자마자 4년동안하던 모배를 미련없이 접고 온 유저로써 뉴배가 잘 됬으면 하는 바람이 크네요 유저들 의견 흘려듣지말길.."
뉴스테이트 모바일,"보안 개선할점이 있음. 1.왼쪽 발사버튼을 안보이기 옵션추가 2.기울리기 기능을 왼쪽에도 선택추가 *3.왼쪽달리기 불편사항: 아템 파밍할때 무분별하게 앞으로 계속달려가서 조작이 힘들다. 모바 배그처럼 달리기 기능을 좀더 위쪽에 버튼을 두게 해야 조작이 쉬울듯. *4.(pc제외 모바일기준) 베그를 가장 선호 하는 유저로볼때, 여러기능과 그래픽이 2편새버전 N스테이트에서 가능합니다. 대신 조작이 쉽지않아요. 더구나 bp상점에서 아템구매시 금액이 높은편이라 1만단위 이상 모아야 상점이용이 가능합니다. 그래서 미션을 추가해 bp를 더 얻으면 좋겠어요. 수준을 베그처럼 조금낮추는것도 어떨까요. 5. 비켄디 에란겔 사막? 3개맵을 좋아하는 유저로서 볼때 8x8 맵을 1~2개이상 추가하면 플레이 참여가 더 많을듯 해요. 건의를 쉽게 할수없는데요 설정에서 건의를 할수있는 옵션추가, 그래서 pc베그가 5점이라면, 모바 베그가 4점, Nstate 는 3점입니다."
뉴스테이트 모바일,뉴배출시일때부터 사용한 유저입니다. 우선 장점은 모바일배그보다 퀄리티도 좋고 컴배에 뒤쳐지지않는 퀄리티입니다. 캐릭터 액션도 다좋습니다. 다만 단점은 나갔다들어오면 네트워크 지연이 뜨면서 아무것도 터치가 안되고 버그들이 다수 존재한다는겁니다. 뭐 이거 말곤 다 좋아서 별점5점드립니다. 그리고 저의 희망사항인데 뉴배에 사녹맵을 넣어주시면 이전보다 훨씬 재밌고 인기가 많은 뉴스테이트 배그가 될것같습니다. 사녹맵 언젠가는 꼭 넣어주시면 감사하겠습니다^^
뉴스테이트 모바일,이게 게임인가 싶다. 1.해상도를 낮추어도 발열과그래픽 문제 2.죄다 외국인(한국 섭을 만들어 줬으면 함 3.실력 차이가 많이 남 (핵 쓰는것 처럼 쏨) 4.감도를 맞추고 저장을 해도 감도가 초기화 되어 있음 5.최적화가 전혀 되있지 않음 업데이트 된후로 발열이 더 심해지고네트워크 지연도 뜸 다 핵 처럼 헤드만 쏨
뉴스테이트 모바일,"모배와 뉴스테이트를 합해서 4000시간을 플레이한 유저의 의견입니다. (뉴스테이트 문제점) 1. 컨텐츠 부족: 컨텐츠가 모배에 비해서 너무 부족합니다 신맵도 이번 업데이트에 나오지 않았구요 그렇다고 스킨이나 이벤트를 모배처럼 하지 않았으면 합니다 따라하게 되면 뉴스테이트만의 특징이나, 장점이 사라질 뿐만 아니라 게임이 판타지가 되버려서 이게 배그인지 구분조차 안갑니다. 2. 최적화: 왜인지는 모르겠지만 버그나 렉이 좀 걸립니다 제가 유튜브를 운영하고 있는데 거기에서도 최적화에 대해 언급을 많이 했습니다. 분명 핑은 정상인데 지연이가 오고 건물에 분명 들어갔는데 뚝하고 끊기더니 다시 밖으로 나와있는등 데스매치에서는 수류탄으로 벽 위에 올라가 농락을 합니다. 이런 심각한 버그는 빨리 고쳐줬으면 하는데 이 버그가 생기고 나서 카페공지에 한달후에 검토해보겠다고 해서 좀 어이가 없었습니다. 3. 그 외: 색감 기본적인맵 출시안함 등 많은 불만이 있지만 모배보다 나으니까 괜찮은것 같습니다"
뉴스테이트 모바일,안녕하세요 재밌는 뉴배를 플레이하는 일반 유저입니다. 제가 뉴배를 플레이 하면서 느낀 아쉬운점 1개가 바로 총기마다 각각 감도를 맞출수 있는 기능입니다. 반동이 센 베릴을 쓰다가 갑자기 반동이 적은 m4를 쓰면 반동잡기가 어렵기 때문에 한번 건의드립니다. 이것말곤 다 좋네요. 실제로 적용이 되는것까진 기대를 안하고 있지만 그래도 한번은 검토해드리면 감사하겠습니다. (게임 자체는 정말 재밌어요!)
뉴스테이트 모바일,"요즘 열심히 뉴스테이트를 업그레이드시켜주시고 있는 개발자분들 여러 총들, 기술들, 맵들이 나와봤자 프레임 드랍이 심하고 네크워크 지연, 게임 튕김 현상이 자자하면 아무 쓸데도 없습니다. 열심히 일하고 계신거 알지만 너무 많은 이러한 게임 방해 요소들은 게임에 대한 흥미를 잃게 만듭니다 이번 4월 업댓이후 한번 이쪽으로 매진해서 업데이트해주시면 감사하겠습니다 +리뷰들 보면 머리만 맞춰서 핵이라고 하시는데 원래 잘하는 사람들은 머리만 쏘도록(헤드라인) 훈련합니다"
뉴스테이트 모바일,"제가 뉴배 하면서 엄청 모배랑 차이가 났습니다. 1. 그래픽이 너무 좋습니다. 2. 프레임이 90FBS까지 할수 있습니다. 3. 모배는 차 운전을 이동 버튼을 눌러야 하니깐 넘 불편하고, 뉴배는 자동 운전을 할수있어서 좋습니다."
뉴스테이트 모바일,"화면 전환할때 가끔씩 덜덜거리는 순간이 있습니다.특히 눈 아이콘을 사용할 땐 덜덜거리지 않는 순간이 없구요. 터치 민감도를 높여봤자입니다. 화면 덜덜거리는 현상을 좀 해결해 주시구요.(아마 손가락 터치면적이 넓어서 그런 것 같습니다.)발열문제좀 plese...아무리 중고가 폰이라지만....(A53 5G)발열이 이렇게 심한건 좀 아니다 싶습니다...게다가 아이폰 13pro max, 삼성 S22+ 같은 프리미엄 폰들도 발열은 어떻게 할 수가 없더군요. 이것 때문에 못해먹겠어요...차라리 같은 서버를 공유하는 뉴스테이트 모바일 라이트를 하나 더 만들어주십쇼!(아마...안되겠지요...돈....)"
뉴스테이트 모바일,"게임 자체는 정말 재밌음. 익스트림모드가 넓은 맵에서 특정구역만 지정해서 게임하기때문에 매번 맵이 달라져서 좋음. 다만 1.고질적인 컨텐츠 부족, 2.핵으로 의심되는 유저(차량에서 이동샷을 헤드샷으로 고정시키는..) 특히 트로이맵에서 심함 3.게임매칭시 너무 수준차이가 나는경우(플래티넘과 마스터가 팀으로 매칭됨) 4.게임내 렉(튕김현상, 음성채팅시 잡음발생 등등), 5.아쉬운수준의 유저 보상(노가다로는 도저히 킬피드를 얻을수가 없음) 게임의 장점으로는 1.원작 모바일배그를 훨씬 상회하는 높은 그래픽퀄리티 2.매 게임마다 변경되는 맵(익스트림모드)으로 패턴이 반복되지않음 3.원작 모바일배그에 없는 적군 영입과 그린플레어 부활 4.굉장한 수준의 총기스킨 게임하나는 진짜 재밌고 잘 만들었음. 운영진도 게임의 방향에 대해 고민하는것이 눈에 보임. (다이니마조끼를 도입해 7.62mm=높은데미지 라는 개성 강화) 힘내라 운영진!!"
뉴스테이트 모바일,장점:퀄리티 좋음 마치 컴베를 하고 있는 듯한 느낌이 듬- 여러가지 커스텀들 덕분에 게임을 더 새롭게 할 수 있음-- 단점: 갑자기 앱 자체가 튕기는 문제가 있음- 신고하고 정지하고 신고하고 정지해도 남아도는 핵쟁이- 비매너 플레이어들- 서버 발적화- 너무 느린 업데이트- 심지어 그 업데이트 내용이 만족스럽지 못함- 맨날 똑같은 맵에 익스트림만 추가하고 클래식 맵은 2개밖에 없음-- 6월 업데이트로 뭔가 나왔어야 했는데...이건 또 뭐냐
뉴스테이트 모바일,"모배에서 넘어와서 그래픽에 놀라며 나름 재밌게 하고 있습니다. 유저로 몇가지 건의 드릴께요. 1. 얼마전부터 비행 이륙이 안되네요? 되더라도 10여m이내에만 머물다 떨어집니다. 2. 모배처럼 에란겔 맵 시즌 변화는 불가능한가요? 3. 지하 벙커 나름 재밌는 장소였는데 막혀있어서 오픈 계획이 있는건지? 4. 자기장 마지막은 항상 야외인데, 건물이나 바다 중간 같은 뜬금없는 곳도 포함된다면 새로운 전략이나 배린이도 치킨이 가능하지 않을까 합니다."
뉴스테이트 모바일,지향사격 범위 너무 좁아서 견착이 의미가 없음 태섭에선 아니었는데레닷 조준 했을때 컴배로 치면 숨참기 버튼이 눌려있는 것 처럼 총기가 짤려서 보임 반동이 너무 약해서 많은 유저가 먼 거리 배율연사를 사용 컴배에 비해 발사되는 총알의 크기가 너무 커서 바위같은 지형에 상대의 헤드가 보이는데도 벽에 박히는 경우가 많음 수정해주셨으면 하는 사항 1. 지향사격 범위 증가 2. 레닷 조준 또는 바이퍼 조준시 총기 몸통보이도록 비율 수정 3. 반동 증가(이거 제발ㅜㅠㅠㅠㅠㅠ) 4. 총알 크기 감소 모배처럼 화려한 무빙과 대부분을 지향사격하는 플레이가 너무 많아 딱히 모배와의 차이를 느끼지 못하겠습니다. 모배는 모배답게 뉴배는 컴배와 유사하게 플레이 할수 있길 원합니다. 모든 리뷰를 반영하시진 못하시겠지만 지향사격 범위와 반동은 조정을 해주시길 정중히 부탁드리겠습니다.
뉴스테이트 모바일,"게임을 오래 하다 보니 재미가 없어졌네요. 제가 보기엔 4×4맵을 출시하는 게 우선이라고 생각하는데 에란겔, 트로이만 맨날 플레이하다보니 재미가 없어지고,곳곳엔 핵,고수들만 있지 이젠 데스메치도 재미 없어졌어요.그러다 보니 4×4맵 6,7월까지 출시 하지 않는다면 저는 이 게임을 접을 생각입니다."
뉴스테이트 모바일,"안녕하세요. 이 게임 자체가 너무 재미있고, 좋은데... 제가 데매를할때 이제 갑작히 재가 단진 수류탄이 저한테 날라올때 이게 버그인가? 십더라고요.. 그리고, 한 번 나갔다 들어온 유저는 계속 나갔다고뜨고, 신고도 안되더라고요... ㅠ 그래도 게임 자체가 너무나더 신선하고 재미있습니다! 운영진들 화이팅!"
뉴스테이트 모바일,복귀 유저입니다! 이게임은 일반모배보다 점수도많이 주고 광탈해도 점수도 별로 안떨어져서 랭킹이 빨리빨리 올라가서 좋아요! 그리고 화면 돌아가는것도 부드러워서 좋아요. 그런데 UI가 좀 복잡하고 불편해요..ㅠ이것좀 개선해주시면 좋겠습니다! 그럼 앞으로도 뉴스테이트 파이팅!
뉴스테이트 모바일,"확실히 모배와 차이점을 두고 만들어진 점은 재미있지만 게임 플레이에 있어 문제점이 많습니다. 중요한 순간에 게임이 자꾸 뚝뚝 끊기는 렉이 걸리고, 노래를 틀면 더이상 게임 사운드가 나지 않는 버그가 존재합니다. 또 게임 한판이 끝난 후에 메인 화면으로 돌아가야 하는데 로딩 화면에서 넘어가지 않습니다. 제발 고쳐주시면 감사합니다."
뉴스테이트 모바일,켄티드사이트가없어요.켄티드사이트를 많이 사랑해주셨으면합니다.다양한각도와거리에서 빠르게 전환하며 교전할때 유용하게 사용되는 켄티드 사이트가필요합니다.펌프의 사거리와 딜량이 보완되어야한다고 생각합니다. 떱배와 DBS는 빠른 발사속도로 딜량이 커버가 되지만 펌프는 너무 애매하다고 생각합니다.
뉴스테이트 모바일,업데이트 하고 게임에 들어가는데 들어가자마자 연결이 안된다고 하네요. 어쩌다 접속하게 되면 연결이 끊겼다고 뜨고 이거 해결하는데 2시간정도 했는데도 불구하고 해결이 안되었습니다. 아무래도 군인이다보니까 폰 받는 시간이 한정적인데 잘 되던 게임이 갑자기 안되다보니 불편함이 너무 커졌습니다.
뉴스테이트 모바일,배그 접고 2년뒤에 배그를 또 했다가 1년만에 뉴스가 새로 나왔길레 해봤는데 기존에 없던것도 있고 게임이 더 재밌어서 추천합니다. 다만 외국에 배그뉴스테이트 핵이 많이 퍼져서 핵 유저가 많습니다. 배그 뉴스테이트에 핵유저와 일반유저를 구분하기 위한 데스캠 기능을 넣어주세요.
뉴스테이트 모바일,뉴배의 장점과 단점 비교대상:모배 장점1.그레픽이.. 쩐다.. 장점2.더욱 다양한 총기와 커스텀마이징 장점3.사실적인 사물디자인 등등 단점1.확실히 출시한지 얼마않되어서 당연하지만 적은 모드들 총평:아직 모드가 적은것 빼고는 모든것이 완벽!
뉴스테이트 모바일,왠만해서는 리뷰 잘 안다는데 뭐 귀찮은것도 있고 해서.. 옛날부터 배그가 용량을 많이 차지해도 재밌게 했거든요? 또 이거 배그뉴스테이트도 새로 나왔(?)길래 용량 많이 차지할것 같지만 그래도 재밌으니까..하고 깔았는데 아레나를 하려고 하면 계속 한쪽팀은 잘하는(티어 높은)사람들로만 구성되어있고 다른 한쪽팀은 못하는(티어 낮은)사람들로만 구성되어있어서 진짜 재미가 없어지고 있고 또 그래서 중간에 나가는 사람도 있거든요.. 가끔씩 그런거라면 모르겠는데 할때마다 매치가 골고루 되어있지 않고 딱 잘하는팀 못하는팀이 나눠져 있는것같아요.. 그리고 와이파이도 연결 잘 되있는데 계속 네트워크 지연인가? 그거 뜨고... 네트워크는 그냥 할수있긴 하니까 천천히 문제점을 찾아주셔도 되는데 진짜 매치만이라도 신경써주세요. 긴 글 읽어주셔서 감사드립니다. 이거 말고는 진짜 다 좋아요!
뉴스테이트 모바일,"안녕하세요. 제가 일단 불편한점이 있습니다. 먼저 팀킬,욕설등등 신고를하면 제일먼저 경고부터 하고 2번째로 산고를 또 하면 정지를 먹이는게 최우선 인것 같습니다. 그리고 좋은점은 거의 pc버전이라해도 속을것같은 퀄리티는 아주 좋습니다 근데 맵이 별로 없다는것이 좀 뭔가 아쉽습니다. 차량도 그렇고 그런데 일반스폰에서 뭐 포터/현대 포니 pc배그처럼 차량이 다양하고 맵도 다양했으면 합니다. 제가 퀸뜨님이랑 플레이 한 적이있는데 제가 '태이고 추가 돼요?' 이렇게 말했는데 퀸뜨님은 '모르겠네요 ㅋㅋㅋ' 라고 한걸보니 추가는 안됄 가능성도 있는거 같더라고요 그런데 지금에 뉴스테이트는 아주 재밌습니다 이걸로도 만족하니 추가 하시는것 안하시는것 상관 없으니 앞으로도 재밌는 게임을 만들어 주실겁니다. 긴 리뷰 들어주셔서 감사합니다."
뉴스테이트 모바일,모바일 게임 중 최애이고 처음으로 플레그쉽 모델로 바꾸고 싶던 가장 큰 이유가 뉴스테이트 하려고 였습니다 중2여서 엄마 한테 말해서 겨우 플립 3를 작년 추석 전에 샀는데 너무 잘되고 너무 재미있습니다 화질을 제 폰으로 할수있는한 최대로 해놓고 하는데도 렉도 없어서 좋은데 로비나 접속 중 한번 다른 앱을 갔다 오면 화면이 깜빡거려서 껐다가 다시 켜야 되는 게 단점이지만 최고
뉴스테이트 모바일,너무나도 재미있는 게임인건 틀림없어요.하지만 렉이 심하다던가 프레임을 높음으로 설정해도 계속낮음으로 변경되기도해요.또 핵이 2~3판에서 1판은 무조건있어요.핵에 대한 조치가 심각하게 필요합니다. (Akm커마하면 총구쪽이 베릴로 변하고 오늘나온 스킨도 총구부분이 베릴로 변해서 않보이네요...버그인지는 모르겠지만 고쳐주세요)
뉴스테이트 모바일,"이겜은 모바일 게임 역사상 최고에 그래픽이라도 해도 아니라는 사람은 별로없을겁니다 아 그리고 렉이 너무 많네요 특히 순간이동 렉이 심하게 심각합니다 순간이동렉 때문에 죽은판이 너무 많아요 그리고 무기,파츠등등 아이템을 주을때 두세번 눌러야지 주어지네요 그건 너무 불편 합니다 이것만 빼면 거의 그래픽도 컴배랑 비슷하고 차도 좋고 그리고 맵을 더 많이 만들어주시면 좋을것 같네요 그리고 총 그래픽도 컴배랑 똑같고요 아! 맞다 그리고 않기 딜레이를 좀 없에주세요 모배에 익숙해서 않기 딜레이있는게 좀 불편하네요 그리고 제일 심각한 문제가 있네요 핵이 너무 많아요 특히 데스매치에서 핵을 너무많이 만나네요 좀 심각하게 많아요 핵을 잡는건 힘든건 알지만 순수하게 게임을 하는 사람들,처음하는 사람들이 피해를 입네요 꼭,꼭 핵은 최대한 빨리 잡아주시면 좋겠네요.."
뉴스테이트 모바일,안녕하세요 뉴스테이트 관리자님 저는 뉴스테이트를 즐기고 있는 한 유저입니다. 다름이 아니라 네트워크 지연이 많이 걸려 리뷰를 해봅니다. 게임은 재미있는데 네트워크 지연이 많이 걸리더군요. 혹시라도 와이파이 문제인가? 해서 와이파이와 가까운 곳에서 게임을 해봤습니다. 다름이 아닐까 제대로 걸려 들어가지지도 않더군요. 그리고 상자깡에 대한 할말이 있습니다. 저는 얼마전까지 무과금 유저였습니다. 룰렛을 돌려도 치킨메달이 잘 안나오길래 약 3만원을 질러보았습니다. 이게 뭡니까? 보라색 1개 빨간색(중복)1개 후회됬습니다. 그리고 제가 아는 지인은 약 15만원을 지르면 좋은게 3개 정도 나올까 말까라고 하더군요. 그리고 요즘 상자깡 스킨이 조금 구립니다. 치킨 크레이드까진 좋았습니다. 이번 업뎃은 조금 별로입니다. 네. 한 연예인이나 캐릭터를 본따서 만드는 것도 괜찮을것같네요. 그리고 치킨메달을 쓰지도 않았는데 사라집니다. 다음 업뎃은 이 버그와 지연현상이 사라지면 좋겠습니다. 이상입니다.
뉴스테이트 모바일,"좀더 느낌이 컴배처럼 조금만더 무거워졌으면 합니다 가볍게해달라는 모배충들의 말 듣지 마시고 좀더 컴배스럽게 가봅시다 화이팅!!(컴배에 있는 아이템과 맵을 하나씩 도입해봅시다 인기 좋을겁니다) 문제점을 제가 볼때는 지연문제,핵문제를 없애지는 못하더라도 최대한 최소화하셨으면 좋겠습니다"
뉴스테이트 모바일,나온지 얼마되지않은데 버그가 완벽하게 없애줘으면좋겠습니다 순간이동 이동하게된면 순간이동 하게되고 그리고 아이템 자동으로 주워야하는데 자동으로 안주워질때 있습니다. 마지막으로 문도 안열리고 순간이동으로 하게되습니다 버그3가지 고쳐줘으면 좋겠습니다.
뉴스테이트 모바일,프리시즌때부터 했지만 핵이 더 많아지고 (심지어 오늘 아침부터 저녁까지 했는데 5~6판 핵 다 만났습니다) 유저는 줄어들고 버그도 많고 지연지속되면 그 판 날아가버리고;;; 그래픽은 확실히 좋긴한데 운영을 참 ㅡㅡ 점점 흥미를 잃어갑니다.
뉴스테이트 모바일,다른건 다 좋은데 자꾸 게임할뗀 유선이어폰 쓰고 블루투스도 꺼두는데 자꾸 매판마다 사용할 수 없는 블루투스 기기 연결이 감지되었다고 뜨고 확인도 안눌리고 재접해도 또 뜨고 해서 게임이 불가능해요ㅠㅠ 저 말고 다른분들도 걸렸다고 하더라구요..얼른 고쳐주시길 바랍니다..!😭
뉴스테이트 모바일,"역대 최악의 서버관리게임. 인디개발사보다 못한수준. 사용자가 많지않음에도 ""서버 연결이 원활하지 않습니다"" 아주 빈번하데 뜸. 게임플레이전 후로 무조건뜸. 초기버전도아니고 출시된지 몇개월됬는데 이정도임. 사람들이 왜떠나는지 알것같음. 쓸데없는 컨텐츠 개발말고 본기능부터 완성했으면 좋겠음."
뉴스테이트 모바일,그래픽 뛰어남 드론 크레딧을 통한 아이템 호출 가능 전사 팀원 부활 가능 방패.드론 등 신규 아이템 추가 커스터마이징이 세밀하지 않음 핵을 잡으려 노력하지만 잡는 것보다 더 많은 핵 엄청나게 빠른 배터리 소모 특정 외모의 경우 수염이 존재하나 색을 커스터마이징 할 수 없음 따라서 수염 색과 똑같은 머리색을 해야하게 만드므로 수염 커마 기능 좀 추가하시길..
뉴스테이트 모바일,트레일러 영상 올려주세요 뉴배 화이팅! 그리고 데스메치할때 우리팀과 상대팀의 밸런스가 너무 맞지 않습니다 뉴배 화이팅 그리고 또 그래픽이 예전에 비해 많이 안좋아진것 같습니다 그래픽을 개선해주세요 그리고 리뷰를 적은 많은 분들과 같이 처음에는 컴배에 가까웠다 이제는 모배와 같아지는것 같습니다 그리고 맵부족이 많이 심각합니다 그리고 데스메치할때 수류탄 판정이 이상합니다 수류탄은 던지는 방향으로 날라가지만 엄폐에 수류탄이 부딪히는 소리와 함께 제쪽애 터집니다 고쳐주세요
뉴스테이트 모바일,와 이게 말이 않되는데요!!!!제가 원래하던 게임과 차원이 다름니다 ㅎㅎ하지만 맵의 양이 적기 때문에 사녹 등등 추가를 해주시면 감사하겠습니다 그리고 그래픽도 점점 모배처럼 변하는데...암튼 뉴배 옛 감성인 뉴배만의 그래픽을 다시 패치해주시면 감사하겠고 제발 사녹좀...그리고 모배 부러워하지 마시고 자신이 만든 뉴배의 자존심을 가지세요그리고 뉴배는 한국 모배는 중국 그니까 중국을 부러워 하지 말았으면 좋겠습니다 뉴배 그래픽 잊지 말아주셨음 좋겠습니다~뉴배 화이팅 아...그리고 최적화가......
