game,review
브롤스타즈,음.. 일단 저는 브롤에 나름 애정이 있어 게임에 실망을 하고 지웠다가도 가끔 생각나면 돌아와 다시 실망하기를 반복했던 유저입니다. 주로 랜큐를 많이 돌리던 유저였는데 상대 플레이어는 무난한 실력을 지녔지만 팀원은 못하는 경우가 부지기수였고 요번에 다시 깔았을 땐 서버가 문제인지 게임이 많이 끊기더라구요. 브롤패스 나왔을 때부턴 보석 획득량에 제한이 걸리며 성장에 어려움을 겪었고 매일 퀘스트를 진행하며 즐기려 게임을 하는 건지 보상을 위해 게임을 하는건지 혼돈이 갈 정도로 숙제와 같은 개념으로 받아집니다. 브롤 초장기에는 정말 즐겁게 게임을 했었지만 점점 정이 떨어지고 현재는 별 기대가 없습니다. 제 생각에는 게임이 캐릭터도 귀엽고 조작도 많이 어렵진 않기에 어린 친구들은 많이 하는 거 같지만 나이가 좀 있다면 하지 않으실 거 같네요. 지금 게임을 까시려는 분이 있다면 갭 차이도 많이 나고하니 추천하지 않고요. 브롤은 유저에 관한 배려가 부족하다란 생각이 드네요. 네... 이상입니다
브롤스타즈,"우선 게임은 정말 재미있습니다. 아이템, 게임모드, 캐릭터들도 다양하고요. 그런데 2가지 문제가 있습니다. 1. 와이파이 끊김이 심합니다. 흔히 말하는 레드 와이파이 가 너무 심해서 어떨때는 화가 솟아나요.. 2.캐릭터 너프&버프 좀.. 애드거는 그냥 좀비입니다. 죽이기만하고 애드거는 절대안져요.. 애드거는 너프가 필요할거같습니다. 크로우와 비는 공격력은 좋은데 피가 너무 약합니다. 브록같은 캐릭터한테 2방컷입니다.. 이 2가지 문제만 해결해주시면 감사하겠습니다^^ 이게임 정말 재미있어요, 추천드립니다~"
브롤스타즈,"현재 3년동안 플레이 하고 있는 유저인데 문제점이 너무나도 많습니다. 상점은 버그가 넘쳐나고 운영진들이 실수를 하여 만들어낸 메가상자 140개를 2500원에 판 사건, 49보석에 메가상자 49개를 판 사건들 이외에도 다른 사건들이 있는데 그것에 대해선 전혀 사과도 없고 무엇보다 총 운영자가 유저를 개돼지 취급하듯 그냥 접으라는 말까지 서슴없이 하고, 그에따라 아무런 대처도 하지않고 보석만 회수하고, 구매하지 못한 유저들에겐 아무것도 주어지지 않은데다가, 이외에도 트로피 구조도 굉장히 올리기 힘들고, 다른 게임들에 비하여 좋다고 볼순 없는데다 캐릭터마다 굉장히 밸런스가 맞지 않습니다. 진이란 캐릭터만 보더라도 대미지,체력, 속도, 애모 차는 속도, 궁극기, 가젯과 스타파워 모두 하나같이 안좋은 반면, 새로나온 캐릭터인 이브는 사거리와, 속도, 판정이외에도 너무나 좋습니다.그리고 유저와의 소통도 잘 이루어지지 않고 모드들도 재밌는것도 없고 무과금은 할 수 없습니다. 깔지않는걸 추천합니다"
브롤스타즈,그래픽 애니메이션은 좋긴한데 레드 와이파이도 좀 걸리고 그러네요 판정도 꽤 이상한걸 발견했고요 몇몇 시스템이 씹히고 버그는 발견되진 않습니다만.. 버그가 안된다고 좋은 게임일리가 없죠 저는 별 1입니다. 참고로 저희집 인터넷이 나간적이 없는곳입니다..
브롤스타즈,"우선 단점은 컴퓨터로 하는데 랙이 좀 걸려요. 그리고 사람들한테 죽고 👎역따봉 받는거 기분 많이 나쁘고 짜증나고 속상해요.😤 장점은 단점 외에, 브롤러도 많고 다양한 온라인 세계의 사람들과 같이 게임을 할수 있는 점이 좋아요. 앞으로도 많은 발전. 기대할게요!"
브롤스타즈,슈퍼셀은 정말화가나는 회사입니다 브롤할때 못하는 사람들만 만나고 잘하는 사람이 상대편만 들어가있는데 그게 게임이입니까? 이건 친한 사람 끼리만 같이 해야됩니다(솔로 쇼다운 빼고)당신이 양심이 있는 이상 잘하는 사람이랑 만나게 해줘야 됩니다!!!!!!!그리고 이 게임은 주의해야 되는 점이 친구랑 많이 싸워야 됩니다! 그리고 혼자할땐 솔로 쇼다운만 하는걸 추천합니다! 처음해본사람은 잘 모르시겠지만 나중에 되면 화나서 지울수도 있어요! 구 못하는 사람 프로필 보면 트로피가 많을거예요 그거 다 슈퍼셀이 AI추가할려고 그러는것 같습니다 화가 많이나는사람들이 이 게임을 깔면 절대 안됩니다!!!!!!!!!!!!!!!!
브롤스타즈,"전 1년동안 플레이한 9000점이고요, 챌린지에 대해서 이야기 하겠습니다. 일단 팀 없이 그냥 랜덤 플레이어들이랑 하는것을 랜덤큐라고 하는데 챌린지에서 렌덤큐로 가면 우리가 그 판에 사용한 브롤러와 점수가 비슷한 점수를 가진 브롤러를 사용하는 분과 만나게 됩니다. 이런경우에는 2가지에 경우가 있습니다. 1. 내가 20랭크 이하이다: 만약 브롤러의 점수가 20랭크(500) 이하이면 물론 배린이도 한 브롤러만 사용하면 그 브롤러에 적용하고 잘 사용 하실것입니다. 그러나 그 배린이의 쉘리(예시)가 450점수고 나의 점수가 440~460이라면 그분과 매칭이 걸리고 그분이 AI처럼 겁나게 못하실수 있습니다. 이런 경우에는 홀릿이나 준님 처럼 전투기록에서 그분의 점수가 500 이라는것을 보고 화나실수 있습니다. 2. 나의 점수가 20랭크 이상이다: 이런 경우에는 배린이나 AI가 따라잡기 어렵지만 적이 잘하실수있습니다. 제발 플레이어의 점수를 비교하세요. 긴 글 읽어주셔서 감사합니다. =^)"
브롤스타즈,"브롤은 현질을 하지 않아도 즐길수 있는 겜이였는데, 어느새부터 브롤퍄스가 도입되면서 현질유도가 심해졌음. 여기까지는 괜찮은데 브롤패스 브롤러(크로마틱)이 언젠가부터 사기가됨 그래도 이브는 물이 많은맵에서만 유리해서 나쁘진 않은데 팽은.... 솔직히 팽은 신발날아가는 거리좀 좁혔으면 좋겠네요. 그리고 레드와이파이가 많이걸리더라고요 폰에 상관없이 참.... 서버문제인지는 모르겠지만 그것좀 고쳐주시면 좋겠고요. 매칭도 솔직히2~3판지면 상대 ai만 걸리게해주면 좋겠는게 팀원이 못해서 지는경우가 대부분이고 거의 지게만든구간이 있더라고요. 참 운영을 어떻게하는지.... 그리고 스킨도 엄청 귀엽고 멋있었는데 어느새부터 징그럽더라고요.(감자 스파이크, 사자불, 파리p 등). 또 무개념 유저들이 많더라고요 나이대가 어려서 그런지는 모르겠지만 이모티콘(핀)기능으로 인성질을 하더라고요 미성년자유저들 채팅막은것도 욕하고, 해서는 안될말을 해서 같은데 그러면 왜 핀기능을 넣은거죠? 진짜 망겜가되가네요."
브롤스타즈,"장점: 1:조작이 간편하다. 조작이 단순해 초보자도 쉽게 할 수 있다. 2:밸런스 패치 브롤의 밸런스 패치는 옆 동네(모마)보다 잘 되는 편이다. 덕분에 영원히 사기인 브롤러가 없다. 단점: 1: 1번장점 덕분에 쉽게 질린다. 왜냐하면 너무 단순하기 때문에 쉽게 질린다. 2:밸런스 붕괴 이브나 팽 같은 경우엔 계속 사기다. 반면에 칼은 계속 쓰레기다. 3:파티 플레이, 티밍 첫 번째로 파티 플레이와 랜큐(랜덤큐)의 밸런스 차이가 엄청 난다. 랜큐는 트롤이 존재하는데, 파티 플레이는 그런 거 없다. 고로 랜큐가 불리한 건 당연하다. 그래서 파티 플레이를 막아버렸으면 한다. 3vs3이나 듀오 쇼다운이 파티 플레이 때문에 혈압오르면, 솔로를 할수도 있는데, 티밍이 더 혈압오른다. 그리고 티밍이 파티 플레이보다 더 짜증나는데 왜냐하면 파티 플레이는 최대 3명이지만, 제대로 됀 티밍은 최소 4명 이상이다. 난 좋은 점도 많아서 4점을 준다."
브롤스타즈,지금 반년? 정도 하고있는 유저 입니다 상자깡을 한다면 좋은 캐릭터가 정말 20%정도? 밖에 좋은 게 많이 안나와요 학률상으론 어쩔수 없지만 그래도 나오는 확률을 좀 더 높여서 그런점을 다시 수정 했으면 좋겠구요 뭐 다양하고 재밌는 여러가지의 맵 들 도 있어서 재밌고 심심할때 해도 좋아요 그런점 만 보수 하면 좋겠네요. (+버그도 같이 보수 해주세요)
브롤스타즈,안녕하세요? 브롤 2달 한 유저 입니다. 이 게임 자체는 정말재미있고 크로마틱 브롤러 들의 확률도 점점 올라가는 것이 정말 좋습니다. 하지만 브롤러나 스킨이 현질로 하는 것이 조금 아쉽습니다. 하지만 처음 시작할때 브롤러도 많이 얻을수 있습니다. 꾸준히 계정을 키워 가는 재미도 쏠쏠합니다. 한번 해보시는 것을 추천합니다. 저의 글을 읽어주셔서 감사합니다!
브롤스타즈,"엄청 나게 재미있습니다 전 3년차 유저인데 업데이트도 많이돼고 지루하지 않습니다 그리고 전 레드와파 별루 안 걸립니다 친구와 같이 할수있고 캐릭터 맵등도 다양하고 매칭도 빨리 걸려서 재미있습니다. 전 다른 슈퍼쉘게임을 한 번씩 하였습니다 브롤 클로 붐비치 클로클 헤이데이 등 정말 최고고 말로 말하게 어려울 정도로 재미있고 아!전 참고로 아군이 잘 못해도 ""내가 잘하면 된다""라는 마인드로 하면 아군이 못해도 괞찬습니다.!!!실력으로 커버 치자구요... 하여튼 그래서 별 5개 줍니다.글 읽어주셔서 감사합니다."
브롤스타즈,게임은 재밌습니다 근데 현질을 안하고 브롤러나 스킨 보석을 쉽게얻을수 있으면 더 좋겠습니다 그래도 한번은 해보는게 좋다고생각합니다 재밌는데 상자깡해서 브롤러도 많이안나오고 거의 모든걸 보석으로 할수있는데 보석도 많이 못얻습니다 그래서 별 4개줍니다 근데현질안해도 할만은합니다 (현질해야만 게임된다는건 아님)
브롤스타즈,"진짜별로네요... 3년차유전데요 최근 사용이 계속 줄고있어요... 아무리 생각해도 이건아니죠. 레파 와이파이상태 아주좋음인데도 계속 랙걸리고,데이터만 3기가 잡아먹고,트로피만 타노스 핑거스넵처럼 사라지고... 또 모티스19보석사건이나4949사건,140매상을 2500원에 파는 상점실수등 단점만 많습니다... 파워리그도 밸런스좀 맞추고,기어좀 하양하든가 삭제해야할 것 같습니다! 저같은 무과금 유저랑 과금유저랑 격차도 많이나고, 맵매이커도 대충만든게 부케만 있어도 되니 망겜이네요... 솔직히 이번11렙 확장은 에바입니다.1점주기도 싫네요"
브롤스타즈,저는 지금 트로피 20000인 유저 입니다. 게임이 정말 재미있어요. 3v3인 게임이 정말 스릴있어요. 특히 브롤볼이 재미있어요. 골을 넣을락 말락 정말 재미있어요 또 쇼다운 같은 경우는 일등하면 트로피도 많이 얻을수 있는거에다 플레이어들이 많아서 좋아요. 그리고 쇼다운+ 는 처치하는 수대로 트로피를 더 받을수 있어서 너무 좋아요. 재미있는 액션형 게임을 만들어주셔서 감사합니다 슈퍼셀 님!
브롤스타즈,휴대폰 사용이 많기도 하고 가끔 퇴근이나 출근길에 즐겨합니다. 하지만 게임의 운영이나 시스템에 대해선 문제가 상당히 많아 보입니다. 1. 레드와이파이 (데이터나 와이파이로 게임을 틀면 자주 서버와의 통신이 끊겨서 플레이에 방해가 됩니다.) 2. 매치 관련 문제 (다른 사용자도 게임 플레이를 하던 도중에 레드와이파이로 나가지는건지 플레이어가 봇처럼 행동 하는 부분이 많습니다.) 3. 이런 문제점을 가장 먼저 해결을 한 뒤 신 캐릭터를 제작하는 것이 현명하다 생각됩니다.
브롤스타즈,"브롤 스타즈 펙트 체그 (리뷰 보시는분들께.) 1.레드와이파이가 심한거 사실이다, 나에게도 경험이 좀 많다. 하지만 3분뒤에 다시 접속하면 정상이 된다.(잠시 유튭보는거 추천☆) 2. 버그로 인해 이득을 본 사람들을 크게 조치하지 않는 것도 사실이다, 허나 버그를 사용했는지, 정말 노력인지 구별하기도 어렵고 데이터를 따로 뒤져서 하더라도 구매자 리스트,구매 가격과 심지어는 상자 1개당 몇 PP를 주는지와 신규 캐릭터 확률도 살펴보며 처리를 해야하고 그렇다고 PP를 없애거나 신규브롤러를 얻었는데 갑자기 사라졌다며 항의 문의가 또 엄청 올거다, 하지만 브롤스타즈 측에서 무과금 유저를 위해 메가상자를 무료로 10개 혹은 그 이상 줘야한다고 생각(개인적인 생각) 3. 신규 브롤러들의 사기성은 정말 벨런스 붕괴만큼 사기적이다. 특히 이브 라는 캐릭터는 업데이트가 되었지만, 그래도 사기다 , 이외에 캐릭터들도 엄청 사기다. 내용은 더 많지만 여백 부족으로 여기까지만 체크하겠다."
브롤스타즈,"안녕하세요 30000점 유저입니다 일단 브롤러가다 게성있고 재밌어요 이 게임 망겜이라고 하는데 완전 꿀 도리도리 잼잼 진짜 한번 깔아보셔도 후회 안해요 대신 게선됬으면 하는 부분이 있어요 1.레드와이파이 좀 고쳐주세요 2.보석을 다시 상자에서 얻을수있게 해주세요 이 두가지 점 만 고쳐주시면 감사하겠습니다 그래도 게임이 너무 재밌고 시스템도 많아서 별4점 주고갑니다 업데이트 자주 해주시고 이렇게 긴글 봐 주셔서 감사합니다~~ 아 그리고 고인물분들께 설명 드립니다! 30000점 이상 가면 트로핑 푸싱이 재미가 뚝 떨어지신 분들 있으실 겁니다 (물론 저도) 그럴때는 이제 일일맵후보로 스트레스 해소를 해보세요 저도 요즘 트로핑 푸싱 안하고 파워리그,클럽리그,일일 맵,우승맵만 플레이합니다 이건 저만의 꿀팁이니 참고만 하셔도 괜찮으실 것 같습니다!"
브롤스타즈,브롤은 경쟁게임이며 친구와 할수있고 캐릭터도 다양하고 맵도다양하고 재밌습니다 1번이라도 하는걸 추천드리며 안하면 후회하실수도있고 아주 갓겜입니다 근데 가끔 쪼금씩의 버그가 있습니다 예를 들자면 레드와이파이 순간이동버그 잠시 겜이 멈추거나 그런 버그등이 있습니다 한줄평:재밌고 캐릭터도 다양 맵도다양 갓겜이며 추천함(팽은 너무사기니깐 너프좀)
브롤스타즈,"슈퍼셀ID 버튼 누르면 게임이 팅깁니다. 예전에는 잘되서 ID연동도 해놨는데 요즘들어 생긴현상입니다. 업데이트, 지웠다 다시깔기 등등 다해봤는데도 여전히 팅깁니다. 저같은 현상이 다른분들한테도 많이 생겼다는것을 네이버 공식카페를 보고 알았습니다. 아무래도 게임 업데이트 과정에서 생긴버그 같은데 제발 빠른 해결좀 부탁드립니다."
브롤스타즈,"1점도 아까워요.. 재미있게 하고 있었는데 요즘엔 매칭도 너무 기가막히게 밸런스차이 많이 나고 AI도 많아지고 트로피도 주는 것도 없는데 너무 많이 깎여요 .. AI나 매칭 좀 제발 고쳐주세요 와이파이도 다 괜찮은데 자꾸 데이터 재시도 뜨면 또 끊기고 끊기고 하다가 져서 트로피 깎이고, 아쉬운 점이 많네요... 업데이트 할 때 좀 잘 보완해주세요"
브롤스타즈,매칭하고 팀 운 수준 진짜 너무 더러워요.진짜 뭔 짓을 해도 잼그랩이든 브롤볼이든 팀들이 거의 자살하는 수준이예요.요즘 너무 자주 이런 현상이 생기는덧 같아요.차라리 게임을 계속 지면 게임 진사람들끼리 몇판 하면서 실력 키우는 시스템이라도 넣어주면 훨씬 좋을것 같네요.. 고의성 트롤들때문에 요즘 게임할 맛이 나지가 않아요.물론 저도 실력이 아주 좋다는 아니지만 팀운이 나쁜건 몇판을 돌려도 거의 동일합니다.그러니 진사람들끼리 게임하는시스템 넣어서 유저 실력도 키우고 기분도 좋게하며 게임도 더 발전할것 같습니다.
브롤스타즈,정말 좋고 재밌으면서 질리지 않은 게임입니다. 하지만 불편한 점이 많이 있습니다. 처음으로 매칭시스템 입니다. 파워리그 같은 전투에서는 같은 트로피때의 유저들이 아닌 점수가 현저히 낮거나 상대편과 트로피차가 심하게 날 때가 있습니다. 두번째로 레드와이파이입니다. 레드와이파이는 예전부터 있었던 문제이긴 합니다. 최근에 고쳐진 것 같기도 하지만 간혹가다 와이파이가 정상일때도 레드와이파이가 뜰 때가 있습니다. 마지막으로는 뽑기 시스템입니다. 말 할것도 없습니다. 그냥 무과금에게 신캐는 보석을 쓰지 않고는 절대 못뽑습니다. 확률이 더 높아졌으면 좋겠다는 개인적인 바램입니다. 긴글 읽어주셔서 감사합니다
브롤스타즈,"전체적으로 괜찮습니다. 하지만 현질이 꽤 필요하고 상점 오류땜에 손해를 보는 경우가 있습니다. 그리고 브롤러가 너무 잘 안 나옵니다. 생일을 제외하곤 현질을 하지않아 상자가 적게 모이고 브롤러가 잘 아나옵니다. 그래서 몇번을 뽑을때 마다 확정적으로 브롤러를 준다거나 쪽지같은걸 만들어 퀘스트, 챌린지, 현질로 획득해 쪽지에 브롤러 이름을 써서 그 브롤러의 획득률을 0.몇몇 프로 높이면 좋을 것 같습니다"
브롤스타즈,이 게임을 2년정도 한사람으로서 말하는데 재밌습니다. 브롤러 확률이 낮다는 사람들도 있는데 하다보면 다 나와요. 저도 무과금으로 이브 뽑았어요. 열심히 하고 전투하는 맛도 있습니다. 그리고 모티스나 다이너 같은건 손맛이 있어서 더욱 재밌습니다. 여러분들도 열심히 하고 브롤러도 키워보세요 👍 전 그래서 만점 줍니다. 한가지 아쉬운점은 레벨차이 이것만 살짝 수정해 줬으면 합니다(안해줘도 상관 없고요).
브롤스타즈,"일단 저는 트로피20000점 찍어본 입장에서(그만큼 많이 해봤다는 거죠) 게임자체는 정말 재밌고요 맵도 다양하고 많은 유저분들이 만드신 맵도 플래이 할 수 있어서 좋습니다. 또 요즘 AI들이 예전보다는 발전해서 친선에서 할때도 조금 재밌다는 생각이 듭니다. 근데 게임 매치 기준이 rank로 되어 있는거 같아서 조금 플래이하는게 어렵다고 해야 할 까요? 보통 레벨 높은 사람이 이기더라고요, 그래서 결론은 매치 기준을 rank가 아닌 레벨로 바꿔주시면 좋을것 같다는 말씀 들이는거구요(슈퍼셀에게..)그리고 매번 업데이트 할때마다 새로운 캐릭터도 나오는데 현질 못하는 사람은 얻기가 매우 힘들고 현질하시는 분들과 너무 차이가 나서(물론 회사에서도 돈을 버셔야 겠지만;;)가끔 게임이 하기 싫다고 해야할까요?(물론 제 입장이에요)계속 당하니까 존버가 답인거같기도 하고요, 제데로 못 싸워봐서 트로피만 우수수 떨어지고 점점 이 게임에 대한 흥미도 떨어지네요ㅜ"
브롤스타즈,"브롤스타즈는 개인적으로 봤을때 잘만든게임인데 플레이어 레벨이나 프로필에 관련된것들은 쓸때없는것 같아요. 개선하였으면 하는것: 프로필은 트로피 20000획득, 30000획득할때마다 프로필을 제공하고,레벨은 1레벨이나 3레벨씩 오를때마다 브롤상자나 대형상자 획득한다면 140메가상자 사건을 어느정도는 복구 가능할듯 합니다. 물론 (이만큼이라도 한다면 유저들은 이 게임을 생각해주지 않을가요?) 그리고 칭호 갔은거 있으면 쓸데는 없지만 자랑가능할듯"
브롤스타즈,저는 이게임을 하는 유저 인데요 다른것은 다 괜찮습니다 하지만 레드 와이파이 데문에 30분 동안 나갔다 들어 왔다를 반복 하고 있습니다 이 레드 와이파이만 없으면 다 괜찮을것 같습니다 레드 와이파이 만 없으면 다 괜찮아서 3점 드렸습니다. (레드 와이파이 떼문에 2점 뺐습니다.)긴글읽어 주셔서 감사합니다.
브롤스타즈,"내가 해본 게임 중 제일 최악의 게임이라고 해도 될정도임. 왜냐면 1. 나랑 내 팀원의 트로피 차가 너무나도 심하다. 그래서 팀원이 트로피가 너무 낮아서 실력이 진짜 노답임. 2. 랜덤큐하면 진짜 스트레스다. 챌린지, 쇼다운, 브롤볼 등등 랜덤큐로 하면 매 판 진다고 봐야함. 3. 캐릭터 나올 확률도 적은데 캐릭터들의 밸런스는 엉망임. 4. 트롤들이 너무 많음. 쇼다운에서 독가스로 간다던가, 잠수를 탄다거나, 고의로 상대에게 죽거나 등 수도없이 많음. 신고 시스템이 없어서 인지, 연령층이 낮아서 그런지는 모르지만 되게 많음. 5. 레드와이파이가 시도때도없이 뜸. 와이파이가 5칸인데도. +높은 구간에서는 사람들이 다 존버만 함. 무슨 상대방 찾아 죽이기 게임인 줄 앎.. 부쉬 좀만 없앴으면 좋겠음. 이 게임 하실 분들은 조금 많은 걸 감수하고 하세요.. 진짜 스트레스 많이 받아요."
브롤스타즈,제가 이 게임을 한지 1 년인데요 다양한 캐릭터와 재밌는 모드와 맵이 많아서 좋습니다 근데 단점은 트로피를 너무 조금씩 줍니다 이부분 수정해 주시면 좋을껏 같습니다 그리고 상자에서 캐릭터 나올 확률이 너무 낮습니다 이점 빼곤 다 괜찮더라고요 제 긴글 읽어 주셔서 감사하고 제가 말한점 제발 이루어 주시길 부탁드릴게요
브롤스타즈,"브롤이 장점도 있지만 지금 고쳐야 할 점이 너무 많습니다. (저는 로사가 신규 브롤러로 출시했던 때부터 플레이 하던 사람입니다) 1. 네트워크 문제 (렉) : 옛날부터 문제였습니다 와이파이 쓰면서 렉걸리는건 뭐 이해는 한다고 쳐도 성능좋게 하고, 데이터까지 써도 렉 걸리는 건 서버가 문제 아닌가요? 렉이 심각합니다 2. 신규 브롤러 문제 & 밸런스 문제 : 이게 가장 심각합니다 로사 때부터 거의 모든 브롤러 (레온, 로사, 스프라우트, 앰버, 스튜, 롤라 등) 가 사기로 출시되었습니다. 물론 이후에 너프가 되긴 하지만 굉장히 스트레스 받습니다 그리고 밸런스 붕괴가 심합니다. 어느 하나 가젯이나 스타파워, 능력치가 버프&너프 되는 것 하나로 상성, 심하면 브롤러 픽률을 완전히 바꿔 버릴 정도로 매번 이런 식으로 밸런스를 맞추니까 점점 질려버리고, 하기 싫어집니다 3.신고 기능 부재 : 트롤들을 막을 수 있는 기능으로 딱 좋은데... 아직도 없습니다 제발 이것만 해결되었으면"
브롤스타즈,"예전부터 꾸준히는 아니여도 계속해서 브롤스타즈를 즐겨왔었던 유저입니다. 일단 예전에비해 밸런스패치등은 그럭저럭 맞춰지고는 있는것같아요. 아주더디기는하지만.. 그런데 한가지 말씀드릴건 원래 슈퍼셀 게임이 이렇게 현질위주였나요? 솔직히 즐겜이긴하지만 스타파워 및 기어나 가젯 유무가 너무 차이가 큽니다.. 차라리 상자에서 나오는 확률을 높이던가 새것이 안뜨면 게임특성상 너무 질립니다. 클로는 트로피전만 안하면돼서 2대2나 이벤트를 즐길수있었는데 브롤은 파워리그는 레벨빨이 너무 심하고 유저맵도 결국 유저가만드니까 탈도많고 빨리 진부해집니다. 사실 저는 이 게임에 현질할 생각이 아예 없습니다. 그래도 즐겜하며 오래할수있을거라 생각했는데 요새는 너무 레벨에따른 차이가 심하네요.. 그 외에도 레드와이파이,랜덤큐 등 아직 해결되지못한 문제가 너무 많습니다. 어떤 신규 브롤러,맵을 만들까, 어떻게 돈을 더 벌까 라는 아이디어 짜기 전에 이런 문제부터 해결해주세요. 게임이 이제는 너무 지쳐갑니다."
브롤스타즈,저는 1년 동안 재밌게 즐겨 왔던 유저 입니다 이게임에 좋은점과 안젛은덤을 말해주겠습니다 먼저 안좋은점 부터 말하겠습니다 1.와이파이가 끊키면 와이파이같은게 뜨면서 캐릭터가 앞으로 갈수가 없습니다 2.프랭크에 망치로 캐릭터를칠때 느려서 캐릭터가 도망갈수 있는데 그 뒤에있는 딴사람이 파밍 하고 있는데 잘못걸려 죽는 경우도 있죠 그때얼마나 억울 했는지 젛은점 말하겠습니다 1.일단 쉘리는 처음했슬때 나오는 캐릭터 입니다. 쉘리는공격력이 쎕니다 그래서 캐릭터 잡기가 쉽워요~ 그래서 좋구요 이상 저의 이야기를 다 들어주셔서 감사합니다
