game,review
쿠키런: 킹덤,개인적으로 굉장히 잘 플레이 하고 있는 무과금러 입니다. 무과금러들이 하기 힘들다는 글이 많던데 저는 딱히 그렇지도 않더라고요. 그냥 천천히 키우면서 하기 괜찮은 것 같아요. 단점이 있다면 업데이트를 할 때 마다 핸드폰 전원을 아예 껐다 키지 않으면 업데이트를 못하는 거에요. 그거 말고는 딱히 없네요.
쿠키런: 킹덤,"정말 재밌고 심심할때 들어가서 여러가지 컨텐츠들을 즐길 수 있는게 좋은데 다만, 이번 업뎃은 조금 맘에 안들었던 것 같아요. 또, 제 폰만 그런건지 모르겠지만 가끔 터치가 안돼는 버그와 로딩화면에서 멈추는 현상이 발생합니다. 그리고 스토리 업뎃을 자주 해주셨으면 좋겠습니다.암튼 정말 재밌고 좋은 게임이니 5점 남깁니다^^"
쿠키런: 킹덤,"소통 없는 운영이나 느린 업데이트 등 단점이 명확한 게임이지만, 이만큼 재미있는 모바일 알피지 게임을 찾아볼 수 없는 것 역시 사실입니다. 출시되는 쿠키들은 하나같이 캐디가 뛰어나고 캐릭터성이 명확해서 모으는 재미가 있고, 메인 스토리와 이벤트 스토리 등의 퀄리티가 뛰어나 세계관에 몰입할 수 있고 등장인물들 역시 입체적으로 느껴져요. 거기에 아기자기한 그래픽과 직접 왕국을 꾸밀 수 있는 디자인 요소가 게임에 애정을 가지게 합니다. 요즈음에는 뛰어난 그래픽을 내세우는 알피지 게임도 많지만, 쿠킹덤은 그런 게임들만큼이나 보는 즐거움을 충족시켜 주는 것 같습니다. 과금 유도 부분도 나쁘지 않다고 생각해요. 저는 기본적으로 시즌마다 킹덤패스를 구매하고, 이벤트성으로 출시되는 효율 좋은 저가 패키지들만 구매하는 소과금러인데, 게임을 플레이하며 답답했던 부분은 없었습니다. 어디까지나 소과금 라이트 유저의 의견이지만, 바쁜 일상 속에서 잠깐씩 힐링하고 싶은 분들에게 추천드리고 싶은 게임이에요."
쿠키런: 킹덤,이게임을즐기고있는유저입니다.제가이게임을플레이해봤은때손색이없습니다.하지만제가생각한아이디어가있습니다.바로스킬파우더교환입니다.예를들어침투형파우더를넣으면마법형파우더를준다입니다갯수는내가있는걸2개주면자기가없는걸하나선택해서2개주면1개를얻는시스템입니다.읽는것만으로도감사합니다
쿠키런: 킹덤,"안녕하세요! 킹덤을 아주재밌게하고있는 유저입니다 하지만 정말 아쉬운점이 있습니다, 바로 섬마을을 겨울느낌으로 꾸미고 나면 마음에드는데 만약 봄이와서 또꾸미고 계속 반복하는데 힘들다는거입니다 저는 섬마을을 저장을 하고 바꾸고 그걸로 원상복구 할수있는 버튼? 같은게 있었스면 좋겠어요! 해주시면 정말 감사드리겠습니다 좋은게임 만들어주셔서 감사합니다!"
쿠키런: 킹덤,"별 4개만 준 이유는 길드 가입하면 건물을 살 수 있는데 그 건물은 자기의 왕국의서는 사용이 불가하더라구요 그래서 다음 업데이트에는 '길드 가입해서 건물을 자신의 왕국의서 사용하게하겠습니다' 이런걸 넣어주시길 바랍니다. (흑우 당했는 100000만원자리1개 1400얼마 이상 도 몇 개있고,타일 1000원 2개있는데ㅜㅜㅜ 흑우당했네 흑우당했어ㅜㅜ)"
쿠키런: 킹덤,"안녕하세요? 2달정도 한 무과금 유저입니다. 이 게임의 장점은 질리지 않고 계속 할수있고 크리스탈도 월드탐험 밀거나,아레나를 하면 금방모을수있습니다. 그런데도 별4점을 드린이유는 폰으로 플레이를 하는데 왕국으로 돌아갈려고 가기를 누르면 하루에 1~2번은 화면이 아예 멈추고 탭을 누르면 노래가 계속나와서 탭에서 잠깐 지우고 다시 접속해야합니다. 제 폰이 문제인지 아님 게임의 문제인지 잘 모르겠습니다."
쿠키런: 킹덤,"성우진도 스토리도 탄탄하고 재밌어요. 다만 새로운 컨텐츠일수록 시간은 많이 들고 즐길 요소가 없다고 느껴집니다. 에스프레소 출시때부터 했는데 점점 시간만 많이 들고 진행은 멈춰있어서 손이 잘 안가네요. 최근에는 에이션트, 스토리 업데이트때만 반짝하고 있습니다."
쿠키런: 킹덤,"장단점 둘 다 설명할게요. 장점은 쿠키들이 각자 개성이 있어서 너무 재밌고, 성우 캐스팅까지 합니다. 쿠키런 최초로 성우 캐스팅을 하는거죠. 거기다 조작 난이도도 오븐브레이크는 어려운 반면 킹덤은 클릭만 해도 됩니다! 단점은 생산품이 너무 비효율적입니다. 만드는데 몇 시간이나 걸려요;;; 챕터 6부터 난이도가 올라가고 챕터 7은 7-25 땜에 너무 힘듭니다. 그리고 버그도 너무 많습니다. 게임 많이 튕깁니다.(하지만 이건 1~2시간 있으면 고쳐지는 경우도 있습니다) 그리고 점검은 계속 연장이 됩니다. 보통 1~2시간 연장되고요... 제일 심각한건 현질유도가 너무 심합니다."
쿠키런: 킹덤,작년 1월부터 한 유저입니다. 다른 콘텐츠엔 불만이 없지만 새로 변화된 길드 콘텐츠에 대해서는 불만이 좀 많습니다. 길드 채팅방을 일부러 클릭해야 나올 수 있는 곳에 숨겨 두시면 의견이 길드장에게 닿지 않을 확률이 많습니다. 또한 길드장이 오랜시간 안 들어왔을 때 길드장이 바뀌었는데 길드에 대한 관여도가 매우 낮은 분에게 돌아가 책임감이 결여됩니다. 실제로 일을 하고 계시지 않아 길드 콘텐츠인 건물 세우기도 즐기지 못하고 길드원 물갈이도 제대로 안 됩니다.(들어오지 않으신지 90일이 넘은 길드원도 있습니다.) 채팅방에 건의를 드려도 피드백이 없고 인삿말로도 남겨봤지만 소용이 없었습니다. 자동으로 아무에게나 길드장이 돌아가면 이러한 문제가 생깁니다. 이러한 관계로 채팅방에 대한 변화와 길드장 임명에 대한 수정을 건의드립니다.
쿠키런: 킹덤,"처음 쿠킹덤이 나왔을때부터 항상 재밌게 플레이 하고 있는 쿠킹덤 유저입니다. 일단 게임 너무 재밌습니다. 지금까지 하던중 버그는 없었구요. 무과금분들도 충분히 즐기실수있는 게임입니다. 제 생각에는 무과금분들이 가장 쿠킹덤 할때 어려운것이 오로라 재료 모으는 것 같습니다. 저도 무과금 유저이기 때문에 영토확장,생산시설 레벨업 등등 굉장히 필요한곳은 많지만 그걸 다 모으지 못해 성장이 느리다는게 현실입니다. 그래서 무과금유저분들도 레벨업 조금이라도 편하게 하실수있게 오로라 재료를 받을수있는 이벤트를 많이 만들어주시면 합니다.두번째로는 킹덤아레나입니다.이건 제 경험담이지만 킹덤아레나에서 티어로 전투 상대를 새로고침하여 고를수있는데 초콜릿 1티어여도 과금러분들은 전투력 십만정도 하시는 분들도 있습니다.그래서 크리스탈1티어정도 되면 전투상대를 새로고침해도 1명 나올까 말까입니다.그러니 티어별로 말고 전투력 비슷한사람들끼리 붙게 해주시면 정말 즐거운 쿠킹덤 할것같습니다.감사합니다!"
쿠키런: 킹덤,"오류가 가끔 발생하긴 하지만 최고의 게임이에요!!! 광고도 없고, 현질 유도도 많이 없어서 최고에요! 조용한걸 원하시는 분들은 왕국만 꾸며도 돼고, 싸우는 걸 좋아하시는 분들은 걍 월드탐험이나 트로피컬 소다제도, 혼돈의 케이크타워, 기타등등 싸우면 돼요!!!!!!"
쿠키런: 킹덤,"이제 막 쿠킹덤을 한 지 반년? 즈음 되는 유저입니다. 동생이 깊콘을 사다줘서 사용한 5000원 정도만 이 게임에 결제했었구요. 5000원을 쓰지 않았었더라도 즐겁게 게임을 할 수 있을 뿐더러, 과금을 할 이유 없이 스토리를 진행하거나 여러 에피소드를 보기만 해도 꽤 높은 곳 까지 갈 수 있어서 너무 마음에 들어요! 버그나 렉과 같은 기본적으로 모든 게임에서 수용해야 하는 부분이 있다는 점을 감안하지 않더라도 렉이 걸린다거나, 하는 그런 불편한 점 없이 플레이 하고 있습니다. oO(패치 쪽으로 문제가 간혹 있을 때가 있지만...) 이대로 과금을 하지 않더라도 즐겁게 게임할 수 있는... 이런 포지션? 만큼은 쭈욱, 밀고 나가주셨으면 좋겠습니다!!!"
쿠키런: 킹덤,무난하게 플레이하기 좋으나 주이벤트성 게임의 경우 참여조건이 일정레벨 이상 등 저렙에게는 조금 불리한 경향이 있음. 또 일반맵에서 요구되는 공격치가 실제와 달리 더 높아서 더 어려운 경우가 더러 있어 재미를 반감하는 요소가 자주 보임. 가끔씩 튕기거나 멈추는 사례 역시 반감요소임
쿠키런: 킹덤,전 게임자체는 재미있다고 생각됩니다. {단점} 1. 뽑기 확률이 너무 낮다 ~조금만 올려주시면 좋겠어요 2. 할게 없다 ~ 수호의 성전은 너무 시간이 길고. 아레나는 1위나 10위나 보상이 같아서 열심히 할 필요가 없고. 솔직히 더 많은 할거?를 원하는데 다른것만 업데이트를 하고. 3. 과금유저와 무과금유저와 차이가 없다 ~처음에 300만원 정도하면 엄청 차이나는데 뒤로부턴 거의 비슷해요 요것만 고쳐지면 더 완벽한 게임이 될것같아요 앞으로 될 업데이트에서는 이 점들이 꼭 고쳐지면 좋겠네요. 긴 글을 읽어주셔서 감사해요^^
쿠키런: 킹덤,먼저 자극적이지 않고 재미있음. 쿠키 그림들도 귀엽게 생기고 잔인하거나 선정적이지도 않아서 어린이들이 하기 좋음. 그런데 부분유료라 그런지 현질 유도를 많이 함. 오븐 브레이크를 오랫동안 해본 사람으로서 새로운 게임 방식과 낯이 익은 쿠키들이 나와 전투를 하는 것이 이 게임의 포인트라고 생각함. 데브시스터즈의 새로운 도전이라고 깔아봤는데 앞선 쿠키 워즈와 퍼즐보다 재미있는 것 같음.(개인적인 주관) 중독성도 있고 그래픽 시설 등도 꽤 잘 돼있음.
쿠키런: 킹덤,4별인 이유는 하나입니다. 소통이 부족하고 너무 서포터에 편애하는 경향 때문에 파우더가 남아나질 않고요...또 왕국 저장기능 없는거(이건 진짜 셉니다) 정도입니다. 그래도 스킨 수집러가 아닌 이상은 무소과금들도 충분히 즐길만한 게임이여서 나머진 다 좋습니다.
쿠키런: 킹덤,"어렸을 때 하던 쿠키런을 새로운 게임 방식과 모습으로 더 재미있게 즐기고 있어요! 최근 업데이트 이후 재밌게 즐기고 있지만 뽑기 확률을 좀 개선하면 좋을 것 같아요..마스터 티어에서 놀고 있는데 총 결제 금액 대비 쿠키 성능이 막 좋은 것도 아니고, 그렇다고 확률이 합리적인 것도 아니고, 그렇다고 쿠키들의 밸런스가 좋은 편도 아니어서 개선이 필요하다고 생각됩니다."
쿠키런: 킹덤,"퓨바때부터 시작한 유저입니다!! 쿠킹덤의 장점부터 얘기해보도록 할게요. 우선 디자인이 너무 세세하고 예쁩니다. 꾸미기겜으로도 할 수 있을 정도로 생산 건물, 꾸미기 건물 퀄리티가 장난 아니라는 점이 있구요. 두번째는 크탈 얻기가 쉽다는 점!! 전 현재 무과금으로 킹덤을 플레이하고 있는데도 쿠키들도 모두 다 있고 스토리도 쭉쭉 올라간 상태입니다. 노력으로 충분히 게임진행이 가능하다는 점이 가장 좋은 것 같아요 이제 단점을 한 번 말해보자면 첫번째는 아레나 시스템이에요. 시즌 시작한지 얼마 안되었을 때부터 하위티어에 전투력 50~60만이 되시는 분들이 종종 계셔서 아레나가 잘 막히더라고요. 전부터 많은 유저분들이 말씀하셨던 만큼 최대한 전투력이 비슷한 분들과 아레나를 매칭해주셨으면 합니다. 그래도 이 정도면 갓겜 아닐까 싶어요. 데브분들이 항상 고생하시는 만큼 저도 게임을 정말 즐겁게 하고 있기 때문에 다음부터는 점검할 때 연장 좀 많이 해서 크리스탈 좀....^^ 부탁합니다"
쿠키런: 킹덤,"게임 정말 재밌습니다!! 쿠키들도 너무 귀엽고 게임 난이도도 적당하면서 재화 모으는것도 어렵지 않습니다. 다만 한가지 부탁드리고 싶은것이 있습니다. 월드 탐험, 아레나, 혼돈의 케이크 타워 등 즐길 수 있는 컨텐츠는 많지만 케이크 타워 입장에 필요한 열쇠의 충전 시간이 너무 길다고 플레이 할 때 마다 느끼고 있습니다...ㅠㅠ 혹시 가능하시다면 조금만 줄여주시길 부탁드리겠습니다. 앞으로도 좋은 게임 운영 부탁드립니다!!"
쿠키런: 킹덤,"이게임은 못해도 2~3년안에 섭종할겁니다, 일단 콘텐츠 부족, 아레나 밸런스 문제, 개발사인 데브시스터즈가 유저들한테 대하는 무책임한 태도, 게임내 스냅드래곤 최적화 문제(쿠키런 킹덤이 엑시노스 최적화라서 제 핸드폰이 노트20인데도 조금 버벅입니다.), 각종 버그, 지난 업데이트때 큰거 온다해놓고 실제로는 그렇지 않은 자동사냥 콘텐츠인 수호의 성전과 그냥 변경된 길드 시스템뿐인것등 여러가지 문제점들이 많습니다 안그래도 게임이 재미가 없는데 운영도 이래서 답이 없습니다 이제 4월달까지만 하고 그 이후엔 접습니다. 안녕히계세요, 데브시스터즈."
쿠키런: 킹덤,"사전예약해서 지금까지 쭉 해온 유저입니다 무과금도 재밌게할수 있어서 좋은거같아요, 근데 생산품을 만드는 곰젤리나 각설탕 같은 기본재료들이 나오긴 한다지만 생산품 만들기엔 조금 빡쎈거같아요 뽑기 확률이... 그래도 뭐 나오긴 나옵니다 ㅎㅎ...전 컨텐츠도 많고 전 개인적으로 재밌게 플레이 했습니다 추천합니다"
쿠키런: 킹덤,"메타 변화가 조금 과격하게 느껴질 정도로 변화가 강하기도 하고 신쿠키에 의존하는 감이 있긴 해도 꾸준히 새로운 빌드, 새로운 컨셉의 덱을 만드는 건 정말 잘하고 있다고 봄. 컨텐츠는 앞으로도 계속 이렇게 해주면 좋겠고 운영이나 유저 대하는 것도 나름 열심히 하고 있다고 생각하지만 다른 게임사들이 운영 말아먹고 순식간에 망하는 거 보면 데브도 그런 꼴 안 나게 계속 노력해줬으면 함. +)이제 운영에 신경을 쓸 때가 됐다 데브야.. 예전처럼 사과보상을 펑펑 뿌리든 불만에 째깍째깍 반응하든 하나는 해야지"
쿠키런: 킹덤,"1점짜리 글들 보다 속 터져서 씁니다 1.크리스탈 n개를 모았는데 에이션트,레전더리가 안 나와요:아니 그건 님 운이 나쁜겁니다.2.스테이지가 너무 어려운데 난이도를 내리던가 쿠키 배치를 n개만 더 추가해주세요:그건 님이 약한거임 3.티어가 높아지니까 트로피 손상이 너무 커요.당연하죠 티어가 높으면 높을 수록 경쟁자도 많고 난이도도 올라가니까. 4.무과금으로 하다 벽이 느껴졌어요:저도 무과금인데 이벤트 다 하면서 쿠폰도 쓰고 토벌,현상,아레나,스토리 등 여러가지를 골고루 하면 충분히 무과금도 됩니다.5.버그가 너무 많고 서버점검을 너무 자주해요:이건 저도 느끼기는 하는데 출시된지 이제 1년입니다 아직 많을 수 있습니다.6.레전더리와 에이션트를 왜 3개 제한으로 했나요? 그거땜에 계속 지고 못 깨는데:그건 밸런스를 맞추려고 그런거겠죠 생각을 해봐요 어떤 사람 와서 5쿠키 다 레전,에션이면 바로 컷 당하고 레전,에션이 없는 사람은 그런 덱 들은 거의 못이길테니 3개 제한으로 했겠죠?"
쿠키런: 킹덤,"초반에는 정말 재미있게 플레이 했었고, 과금도 하며 하루종일 이게임만 했는데 갈수록 스테이지가 어려워지고 보상도 적게 주고 할것도 없어요.걍 생산시스템 돌리고 출석보상 받고 끝이에요 할게 정말 없어요.이젠 그때 무슨 재미로 했는지 기억도 안나요. 전투모드 말고 다른 부류의 게임 모드를 만드는것도 나쁘지 않을것 같네요."
쿠키런: 킹덤,진짜 이거 해봐서 재밌긴해요. 뽑기도 재밌고 다 재밌는데 제가 컴퓨터에서도 할려고 깔았는데 계속 다른 기기에 설치가 뜨네여? 꺼보기도 하고 로그아웃 하면서 무슨 짓을 다 해봐도 계속 다른기기에설치만 뜹니다... 게임 재밌게 하고 있고 뽑기 운좀 올려주시면 감사하겠고요 어느정도 성장을 했는데 에이전트 레전더리가 한개도 없고 에픽 반도 없습니다... 뽑기를 해도 영혼석만 나오고... 쨌든 수고하세여!
쿠키런: 킹덤,"진짜로 쿠키런 오븐브레이크 하면서 쿠키런 신작 하나만 나와줘라...ㅠㅠ 이랬는데 이런 갓겜이 나오니 정말 좋아요! 근데 단점은 초반에 급하게하다보면 버그가 있어서 그건좀 고쳐주시면 더 좋은게임이 될것같아요! ^^ 그리고 로딩시작화면 좀 처음에나온 마들렌,호밀,용쿠 있는걸로 바꿔주시면 좋을것같아요! 이유는 갈수록 업데이트되면 로딩화면이 우울해지는것같아요."
쿠키런: 킹덤,쿠키들이 귀엽고 왕꾸가 재밌어서 꾸준히 하고 있습니다. 스토리도 좋고 이벤트도 바뀌면서 보상을 꾸준히 주시려 하는 것 같아 이것저것 모으는 재미로 하는 중입니다. 그런데 요즘따라 새로운 쿠키들에게 능력치가 몰아지면서 뉴비들과 유저들에게 벨붕이 일어나고 있더라구요..? 좋아하는 게임이 망겜 루트로 가는 것 같다는 이야기를 볼 때마다 안타깝습니다.. 그리고 업데이트 할 때마다 서버에 신경써주셨으면 좋겠어요. 오류가 심하게 나서 아레나를 3번 이상을 못가거나 레이드 도중에 멈춰서 쿠키 체력만 줄어들어 망하거나 이런 루트가 반복되다보니 게임에 오랜 시간을 투자하기 어렵습니다
쿠키런: 킹덤,"여러가지 꾸미기 기능도 업데이트 되고 무과금으로도 충분히 즐길수 있어 좋습니다 다만 테마별 왕국 저장기능과 영역확장좀 해주세요... 땅이 부족해요ㅠ 그리고 풍요의분수나 기차역, 현상수배,소원나무도 함께 테마적용 할수 있다면 더 좋을것같습니다"
쿠키런: 킹덤,"별 3개 준 이유:게임자체는 재밌습니다. 이중에 몇가지 불편한게 있는데요 1.운이 크게 작용합니다 막 1년했는데 퓨바,바요,서리여왕,홀리배리 등 없는 분들이 많더라고요 뽑기할때는 재밌는데 1년됐을때 에픽이상에 등급 없는 분들한테 드리는 이벤트 형식같은걸 추가하면 좋을거같아요. 2.업데이트를 너무 많이합니다 이것만 좀 어떻게 해주세요 3.고수들이 초보양학(레벨에 알맞은 사람들을 매칭시켜주시길 바랍니다.전투력 십만이하만 매칭한다던가"
쿠키런: 킹덤,"정말 좋은 게임이지만 그만큼 단점이 많은 것 같아요. 1. 힐하는 보물인 눈 먼 치료사의 힐링 스태프 는 한 쿠키의 피를 올려주는 보물인데, 설명엔 분명 ""현재 체력이 가장 낮은 아군의 ••• 회복시킨다"" 는 설명이 있는데 쿠키 5마리중 4마리가 풀피, 1마리가 딸피일때 풀피를 회복시키고 그걸로 딸피는 금방 죽어버리고 어쩔 수 없이 다른 보물을 사용해야한다는 것이 정말.. 2. 킹덤 아레나 에서 1:1 전투를 하는데 목화가 스킬을 썼더니 양이 저 멀리에서 문워크를 합니다. 때문에 목화가 죽었고요. 문워크 고쳐주세요. 3. 수호의 성전 은 다른 전투와 다르게 게임 시간이 늘어나면서 점점 할수록 재미가 없어지는 것 같습니다 이미 나왔지만 전투 시간이 길게는 10분이 넘어가니 자동전투를 안하게 한다면 직접 게임하는 느낌이 들어서 재미가 있을 것 같지만 10분 넘게 게임을 하고 그냥 지켜보는 것이 재미가 없는 것 같습니다. 그래도 정말좋은 게임 입니다 강추!"
쿠키런: 킹덤,일단 너무 재미있어요! 별은 5개 입니당 단점과 장점은 장점/1.다양한 쿠키 2.다양한 성을 꾸밀수있는것들 3.별사탕 4.(월드탐험) 많이깨면 크리스탈 주는것 더 많지만 저는 여기까지 단점/ 1.크리스탈 무과금은 모으기가 힘들어요 2.너무 많이 점검을 해요 ㅠㅠ 이상 끝입니다
쿠키런: 킹덤,아래나를 할때 가장 화가 많이나고 짜증이 납니다.어떨땐 갑자기 트로피 1~3개가 없어집니다 그리고 트로피를 얻는것보다 잃는게 더 많은것 같습니다 예를 들면 이기면 트로피 3~4개를 주고 지면11~13개를 가져가요ㅠㅠ .또 스테이깰때 분명 궈장전투력이 (예)10이라고 써있는데 전투력이 20 은 되야 될것같아요 ㅠㅠ
쿠키런: 킹덤,"이 게임의 장점 1. 다른게임 보다는 레전더리 또는 고대 쿠키가 잘나온다 2. 나의 왕국을 키운다는 느낌이 들고, 성장한 나의 왕국을 보고 뿌듯한 느낌이 들때가 있다 3.크리스탈수급이 그래도 단게임 보단 잘나온다, 쿠키 스킬 레벨업 재료도 현상수배를 통해 얻을수 있어 수급이 괜찮다 이게임에 단점이 있다면 1. 숙제 느낌이 들고 잠깐 생산시설을 돌리지 않으면 재고가 부족해 버리는 느낌이 들어 노가다를 해야할때가 있다 2.별사탕 수급도 쿠키하우스, 소다제도, 등등 얻을곳이 있지만 레벨업 할때 들어가는 별사탕에 비해 현저히 부족하다 쿠킹덤은 숙제느끼을 덜 느끼게 해주고 별사탕 수급옵션 추가만 해주시면 더 좋은 게임이 될거같다"
쿠키런: 킹덤,1.업데이트 주기가 원래도 늦었으나 요즘들어 더 늦어짐 -에클레어 출시 이후 덱 다양화가 되긴 하였으나 보통은 덱 고착화가 되어 아레나(PVP) 재미가 떨어짐 2.높은 진입장벽 -게임난이도가 쉽다고 할수도 있지만 토핑(장비) 시스템이 뉴비 유저에게 쉬운 요소는 아님 -레전더리 등급의 바다요정 쿠키가 없다면 진행이 매우 어려움(상위 랭킹이나 스토리 진행) 3.소통 없음 -공식 유튜브 채널이 있긴 하나 업데이트 정보만 딱 나오고 소통이 아얘 없음. -유저들이 초반부터 요구하던건 이뤄지지 않고 매 업데이트마다 실속없이 신캐와 재탕 컨텐츠만 낸다고 생각함 -설문조사까지 하였으나 반영된것은 없었음 4.과금 -게임사도 장사를 해야되니 과금요소가 있는건 당연함.근데 일부 패키지는 효율이 아주 별로거나 업데이트도 안하면서 패키지는 꼬박꼬박 내는중
쿠키런: 킹덤,"이 게임 정말 재미있습니다! 쿠키들도 귀엽고 왕국 꾸미는것도 재미있어요! 그런데 조금 아쉬운 점은 초반에 쓸 레어,커먼 쿠키들이 많이 없다는 것입니다 업뎃 할때마다 에픽이나 에이션트,레전더리 쿠키들만 출시를 해서 시작한지 얼마 안된 뉴비유저들이 쓸 레어들도 많이 없고 아레나에는 레전더리 에이션트로만 가득 차있어서 레어들도 좀 추가해줬으면 좋을것 같습니다 그외 다른것들은 큰 문제는 없습니다! 좋은 게임 만들어주셔서 감사합니다! 이 겜 강추드려요☆☆"
쿠키런: 킹덤,일단 쿠키런 킹덤 게임은 보상 재미 그리고 무과금도 충분히 즐길수 있는 게임입니다. 게임 스테이지 난이도가 대부분 적당한거 같습니다. 하지만 몇몇 스테이지는 너무 어렵습니다. 제가 일반 11-27을 공약을 보고 또 보고 해봐도 1달정도간 못 깨고 있습니다. 예전처럼 라즈베리가 소환수 말고 소환물에게 데미지가 들어가게 다시 패치해줬으면 합니다. 진짜 너무 어려워서 게임을 하기 싫을 정도였습니다. 그래도 전체적인면을 보면 이 게임은 아주 훌륭합니다. 제가 전달하고 싶은것은 난이도가 저는 조금더 낮춰지면 좋을것 같습니다.그리고 마지막으로 저는 11-27에서 라즈베리맛 쿠키가 소환수말고 소환물에게 스킬 데미지가 들어갔으면 합니다. 패치 부탁드립니다.
