game,review
브롤스타즈,"저 댓글 좀 길어요 이 게임은 멀티,개플이 둘다 되서 재미있고 채팅도 되서 재미있고 팀원이 잘하면 친추가능하고 싫으면 안해도 됨니다 그리고 여러가지 캐릭터가 있어서 재미있고 또 상자에서 뽑는 재미도 있어서 재미있고 가젯,스타파워,기어까지있어서 좋아요 이겜 강추!!"
브롤스타즈,좀 단점이 있고 장점도 있는 애매한 게임입니다 장점은 여자브롤러는 예쁘고 남자브롤러는 멋지며 맵이 다양합니다. 단점은 현질유도가 심하고 상점 물건은 보석이나 코인 돈으로 질러야 하며 너무 브롤러가 안나오고 아이콘이 안 바뀝니다 그리고 듀얼좀 다시 추가해 주세요 제발... 기다리고 있겠습니다.
브롤스타즈,일단 게임성은 좋습니다. 캐릭터도 다양하고 모드도 많습니다. 하지만 문제가 이만저만이 아닙니다. 레드 와이파이가 더 심해졌습니다. 데이터 켜고 해도 레드 와이파이가 걸리는데 애초에 트로피가 맞지도 않는 사람끼리 매칭이 되는 말도 안되는 사태가 있습니다. 주로 챌린지에 그러죠 나는 6000 트로피 인데 상대는 19000 인 말도 안되는 사태죠 그렇게 되면 실력도 차이가 심합니다. 그러면 이길수도 없죠 정말 문제점이 이만저만이 아닙니다.
브롤스타즈,"이거 정말 재밌습니다 장점,단점 장점은 모드가 특기하고 재밌고 각종 캐릭터들! 단점,단점은 와이파이,그리고 제가 트로피가 18900인데 1000때점 만나는거를 고쳐주셔으면 좋겠습니다 그리고 마직막은 애매한 맵 메이커입니다 왜냐하면 누가 파일을 뜯어서 만든 맵이 있는데 그걸 없애지 못하니까 그런 특기하고 안부서지는 장애물을 추가해주면 좋겠습니다 긴글 읽어 주셔서 감사합니다 안녕히 계세요"
브롤스타즈,"다른건 다 좋은데 브롤러를 새로 얻으면 트로피 올리기가 쉬워졌다 하는데 3ㄷ3 할땐 팀원들이 참 뭣같은 얘들만 걸리네요 매칭 개선한거 맞습니까? 그리고 한가지 더 신고 기능좀 넣어주시기 바랍니다. 요즘 팀원들에게 해를 끼치는(특히 브롤볼 자살골, 잠수등등) 사람들이 너무 많아져 겜을 하기가 싫어지네요. 이부분 참고 바랍니다."
브롤스타즈,브롤스타즈 팀들과 채팅만 할 수 있게만 하면 완전 재밌는 게임~^^ 지금까지 채팅이 없어서 팀들과 하고 싶은 말도 못 했어요 ㅠㅠ 나중에 업데이트 할때쯤에 채팅 할 수 있게 업데이트를 해주세요~^^ 그리고 적이 없었는데 갑자기 생겨서 갑자기 죽이는 맵이 걸리는데 그런점만 없으면 굉장히 좋을것 같아요~^^ 그런점 좀 없애 주세요 그런점과 채팅할수 있게 해주면 최고의 게임~ ♡♡
브롤스타즈,서버안정화좀시켜라 !!!! 다이긴게임 5g도 문제없는데 네트워크 오류 겁나 뜨네 게임 하다가 개빡침 한두번도 아니고 그리고 죽었다가 다시 살아날때 5초 15초 카운팅 끝나면 바로 살려라!!! 카운팅 끝났는데 캐릭터 나오는데까지도 몇초 더 걸리노!!! 그럴꺼면 카운팅 시간을 늘려!!!
브롤스타즈,브롤스타즈는 엉청 재미있더라고요.그리고 친구와 함께할 수 도있어서 좋아요.그리고 크로마틱이 뭔지 모른다면 전설입니다.그리고 친구가 마지막으로 접속한것도볼 수 있어요.클럽도 있고 상자를 깨면 브롤러가 나올 수 도있기때문에 좋습니다ㅎㅎ 이 글을 보신다면 브롤스타즈를 까는 것이 좋습니다! 그럼 긴 글읽어주셔서 감사합니다!
브롤스타즈,"이 게임을 4년째 하고있는 유저예요. 연동도 되고 친추도 되며 친구와도 즐겁게 플레이할 수 있다는것과 클럽 가입,브롤 메시지 등 여러가지 플레이하는 모드들도 있어요. 저는 이게임이 완벽한 게임이라고 생각해요. 지우기에는 너무 아까운 게임이예요. 많이 플레이 해주세요. 진짜 재밌어요. 위 모든점이 장점이고요, 단점이..... 별로 있지는 않는데... 한가지만 탁 골라서 뽑으라고 한다면 그 상자 깔때 쾌감도 아주아주아주 많이 느껴지긴 하지만 브롤러가 진짜 가끔씩 밖에 안나오는것 같아요. 저만 그런가요? 쨌든 전 이게임이 완벽한 게임이라고 생각해요😃"
브롤스타즈,게임은 엄청 재밌지만 레드 와이파이 때문에 짜증 날 때가 좀 있습니다. 그리고 새로운 캐릭터가 나올 때마다 밸런스가 안 맞습니다.지금은 보통 새로운 캐릭터가 나올 때마다 다 크로마틱으로 나옵니다.새로운 캐릭터가 크로마틱이 아니었으면 좋겄습니다.
브롤스타즈,안녕하세요 저는 브롤5년차인 사람인데요. 옛날부터 브롤스타즈를 해오면서 느낀점 또는 장점과단점을 이야기 해볼여고 합니다. 일단 장점은 보상을 시원하게 뿌리고 재밌는 맵과 신기한 브롤러가 있어서 재밌고 단점은 무과금과 과금러의 차이점이 심각합니다. 브롤패스 시즌10에 나온 팽이 지금 과금러들이 브롤패스를 사서 무과금러를 죽이고 게임을 접게 만듭니다. 그러니 무과금한테 보석을 주시던 아님 무과금과 과금러의 차이점을 줄이시면 좋게습니다! 이상 브롤 경력5차가 글을 마치겠습니다. 여기까지 일어주셔서 감사합니다.
브롤스타즈,"너무좋아용>< 브롤패스라고 보석으로 살 수있는뎅 1년정도만 모으면 현질 안하고도 하실수있음 나이거 지금 몇년 함 나 지금12살 업데이트도 자주해서 좋음 꼭 다운로드ㄱㄱ 그리고 10000이 20000을 이길수도 있구요,레드 와이파이는 장소가 않좋아서 그렇구요,저는 지금16000넘었는데 현질 안해도 올릴수 있는거고요,10000에서 9000점으로 떨어질뻔한 거는요 브롤러를 잘못선택해서 그래요,저도 이 게임을 몇년 했잖아요,근데 브롤러 사기는 '이브'입니다. 30티어만 가면 브롤상자에서도 깔수있는 건데 엠버도 그렇게 사기는 아니에요,제가 스프라우트 있어서 아는데 사기도 아니고 딱 좋아요,롤라는 나온지가 별로안되서 아직 패치가 잘안됬을 가능성도 있어요,이거 보고 부정적 평가에 이런 내용이 몇개 있는데,이거 보고 마음 바뀌셨으면 해요!😁"
브롤스타즈,"일단은 잼민이 게임으로 찍혀 있는 브롤. 12세또는 12세보다 많은 경우 잘하지 않는다거나 게임을 많이 하지 않는 사람에게는 정말 비추하는 게임이다. 잼민이들은 아 그렇구나 하고 넘어가지만, 12세부터는 정말 게임을 할때 빡치기 때문이다. 그 이유는 일단 브롤러가 더럽게 나오지 않고, 설령 업데이트를 한다고 해도 밸런스를 정말 터트려 놓을 정도로 이상한 브롤러를 내놓기 때문이다. 또, 잘하는 3부터 4만 점 때 유저들은 대놓고 낮은 유저들을 깔보고, 채팅에는 갖가지 욕이 나온다. 잼민이 유저가 아닌 사람들이 욕을 쓰는 것이다. 그리고 여러가지 불편한게 많지만, 긴 이야기는 하지 않고 걍 삭제 시키겠다."
브롤스타즈,안녕하세요 초4유저입니다 이 게임은 정말 재미있습니다 캐릭터들도 확실히 많아지고 업데이트도 많이돼요 하지만 제일 짜증나는건 레드와이파이 입니다 왜냐하면 레드와이파이가 너무 심하면 공격도 거의 못하고 죽습니다 개다가 움직이는것도 잘 안됩니다 하지만 재미있어서 까는것을 추천합니다.
브롤스타즈,브롤스타즈 독학으로 트로피 4만 찍은 무과금 골수 유저입니다. 여느때와같이 새로운 브롤러가 나온다길래 오늘도 어떤 사기캐를 내놓을라나라는 심정으로 업뎃 다운을 받고 게임에 들어가다가 로딩화면때 콘텐츠 다운로드에서 잠깐 멈추다가 로딩이 완료되더니 게임의 화면이 매우 작아지고 반이 잘려있는상태에서 터치 하는곳은 그대로인 기이한 현상을 목격했습니다. 리뷰를 보니 저만 그런것이 아닌거같아요 업뎃을 해서 그런건지 제 문제인건지는 모르겠지만 빠른시일내에 고쳐주시길 바랍니다. 고쳤었는데 ^^바 또이러네여
브롤스타즈,엄청 재미있는 게임입니다.하지만 단점이 있습니다.랭크가 많이 올라가면 떨어지는게 엄청 많아지고 이겨도 얻는 트로피가 줄어듭니다.이것 때문에 힘들게 올려놓은 트로피가 줄어들어 짜증납니다.이것만 고쳐주시면 좋겠습니다.
브롤스타즈,"아주 좋아요 게임 플레이, 밸런스 패치, 브롤러 등 장점이 많은 게임입니다 하지만 높은 등급의 브롤러 확률이 저번패치로 아주 낮아졌어요 무과금도 거의 안나올텐데 말이죠 또 이번업뎃에 이브가 너프되었는데 솔직히 아직도 사기 아닌가요 차라리 해피서프라이즈 스타파워를 딜레이 스킬로 바꿔줬음 좋겠네요 아무튼 이것만 빼고 다 좋아요 슈퍼쉘 화이팅!🤩🤩🤩🤩"
브롤스타즈,"문제점:파워리그, 클럽리그 문제 1. 사람들이 들어오고 중퇴한다 2. 1렙을 선택,쌉트롤 해결방안:트로피 제한을 3000이상으로 한다. 문제점 2:인성질 1. 1등을 하면 인성질을 한다 해결방안:인성질을 하는 이모티콘을 없엔다. 문제점 3:상자깡 1.브롤러가 진짜진짜 안 나온다 2.8이 떠서 기대했더니 스파,가젯이 나온다. 해결방안:브롤러가 나오는 확률을 높이고, 브롤러가 나올땐 다른 색깔로 반짝인다. 문제점4:브롤러가 너무 많다(이렇면 무과금 유저들이 힘들어진다) 해결방안:브롤패스에는 브롤러대신 울트라 메가 상자이런거 만들면 좋겠다. 문제점이 너무 많아서 할 말이 많지만 더 안 하겠습니다. 이랬으면 좋은 점:스타포인트를 코인으로 바꿀 수 있게 만들기,티밍 하는 사람들은 5분간 접속 불가 제발 고쳐주세요. 이거 고치면 별 5점 드릴게요."
브롤스타즈,초반에는 재밌으나 할수록 과금러와의 차이가 심해지는게 느껴지고 브롤러 하나하나가 다 자기만의 장점이 있어야하는데 사기 브롤러(이브나 바이런)가 나타나면서 특정 브롤러의 완벽한 상위호환이 되버렸습니다. 그런걸 좀 알아두시고 레벨시스템 없애시는거 추천합니다 돈 벌려면 있어야된다구요? 이미 돈에 미치셔서 아무리 벌어도 만족하지 못하실겁니다. 티밍에 트롤에 핵까지 참 지칠때로 지쳤습니다 사후세계에는 이보다 좋은 게임이 많길 바라면서 수고하십쇼^^
브롤스타즈,저는 트로피 2000때 버즈라는 크로마틱 브롤러를 었엇습니다 지금 트로피는 9000입니다. 이 게임 않깔면 후회 합니다. 단점도물론 있습니다 무엏이냐면 브롤패스를 살 때 보석이 필요한데 보석이149개 브롤스타즈 티어 5개는 249개 입니다 그래도 엄청 재미있고 브롤러 도 많아서 할 것도 더 많습니다 꼭 깔으시는 것을 추천 합니다👍
브롤스타즈,일단 제가 오래 해본 결과 이제 이게임의 슈펄셀이 돈퍼셀로 변한다는 것을 확실히 알수가 있습니다.또한 이제 점점 고인물들만 남게되어 더이상 초보들은 보기 드물어졌습니다. 그리고 142개 매가 상자 사건 또 다른 일이 문제가 있었는데 조치가 없는 슈퍼셀의 실망이 큼니다. 하지만 그래도 얼른 사과하고 좀더 나은 게임으로 성장하겠습니다.정신차려 슈퍼셀!!!
브롤스타즈,"재미는 많은데 신고버튼이없고 단점이너무 많아요1.티밍이많다2.트롤이많다3.이해할수없는일을한다(예를들어자책골,숨어있는데내쪽으로적을끌고오더라등등)뿐만아니라게일의2번째가제가운데에공있는데우리는못잡고상대만잡을수있는어이없는상황도있죠.이점고쳐주세요.그리고신고버튼좀추가해주세요."
브롤스타즈,3년정도 브롤을 플레이한 30k 유저입니다. 요즘에는 트로피 푸슁보다는 재미로 브롤을 하는 정도입니다. 다른 분들이 브롤은 레드와이파이 잘 걸린다고 들었는데 와이파이가 잘 잡히면 레드와이파이는 정말 안뜹니다. 아니면 폰이 안좋은거겠죠? 상자에서 브롤러 나올 확률도 지금이 적당한것 같습니다. 브롤러도 이브 빼고는 다 있습니다. 하지만 가끔씩 게임을 던지는 유저나 자신이 못했는데 남탓하는 유저들이 있습니다. 그래서 신고 기능좀 만들어주셨으면 감사하겠습니다. 그런것만 아니면 게임 자체는 정말 잘 만든것 같습니다. 마지막으로 부탁드릴게 있다면 클럽리그를 매일 할 수 있도록 해주시면 좋겠습니다. 개인 스케쥴 때문에 클업리그를 하지 못하여 순위가 올라가지 않는 경우도 많기 때문입니다. 게임은 재미있게 플레이하고 있습니다. 감사합니다.
브롤스타즈,솔직히 챔피언리그인가? 그거하는 유저분들이 트로피가 저에 비해서 트로피가 너무 적습니다. 적어도 10000트로피 이상만 챔피언리그를 할 수 있도록 해주시면 좋겠습니다. 꼭 10000트로피가 아니어도 5000트로피여도 괜찮습니다. 제발 부탁드립니다. 그래도 재미있어서 별점 5개 드립니다. 더 드릴 수도 있긴했지만요.
브롤스타즈,"안녕하세요.저는 4년차 브롤유저입니다.맨처은엔 아주 재미있게 게임을하면서 보석이 적어도 긍정적이게 받아드렸습니다.근데 몇주전부터 맵이 너무 많아져서 저는 안하게 되더라구요..ㅡㅡ 하지만 맵이 재미있는것도있고 재미가 없는것도 있지만 그래도 좋습니다.그런데 보석이 얻기가 너무 어렵습니다.보석을 많이 얻을려면 현질을 해야합니다.저는 현질을 안하는데,정말 그런부분이 화가나고,보석을 좀 많이 주면 평점을 올려드리겠습니다."
브롤스타즈,"안녕하세요. 저는 브롤스타즈를 거의 2년가량 즐긴 플레이어입니다. 우선 장점은 첫 째, 할수 있는 거리가 많습니다. 잼그렙, 쇼다운, 바운티, 하이스트 등등이 있습니다. 그런데 이 모드들은 각자의 개성이 독특해서 좋습니다. 둘 째, 브롤러들이 개성있어서 좋습니다. 브롤러들은 각자의 개성이 많아서 뭘 골라도 ㅋㅈ입니다. (킹정) 셋 째, 업데이트가 많이 됩니다. 업데이트가 많아서 즐길 거리가 많습니다."
브롤스타즈,"저는 브롤 3년차 유저입니다 일단 장점은 매칭이 쉽게 잡혀 게임을 빠르게 했던 것, 캐릭터 마다 능력이 달라서 다른 캐릭터를 쓰면서 즐기는 것이 있습니다. 하지만 단점은 레드와파가 심하고 버그 를 악용하는 사람이 많아 제대로 플레이를 할 수가 없습니다. 버그를 고치고 레드와파도 천천히 줄여가면서 레드와파를 없애는 것을 하면 정말 재밌게 할 거 같습니다"
브롤스타즈,"전 게임을 슈퍼셀의 다른게임인 클래시로얄 에서 알게되었습니다. 일단 이 게임은 장단점이 크게 존재합니다 장점)온라인의 실제 플레이어와 함께 즐길수 있다, 자주 지속적인 업데이트로 지루함이 거의 없음 정도라고 생각됩니다 단점)현질을 유도하는 느낌이 존재합니다 전 무과금 이였는데 확실히 과금과 무과금은 차이가 천지차이 입니다 솔직히 하루나 이틀정도씩 상자를 준다던가 등 대책이 절실해 보입니다 이로인하여 밸런스도 맞지 않습니다 요정도만 반영해주시면 완벽한 게임이 되지 않을까 생각됩니다."
브롤스타즈,모드도 다양하고 재밌고 유튜버 크리에이터가 자주 이용하는게임일 정도로 인기가 많아서 5점을 드리고 싶지만 3점을 드리는 이유가 2가지있습니다 1.캐릭터가 상자에서 나올 확률이 너무낮다 제가 트로피가 적당히해서 20000정도 되는데 현질을 제가 좀해서 개릭터가 전설 크로우 샌디 빼고 전설만 얻으면 다얻은건데 전설 확률이 0.1이 말이 됨니까? 0.1%란 게임에선 0.000000000001입니다 전 그래서 상자를 까고까고 까서 트로피 10000일때 샌디를 얻고 크로우는 어쩔수없이 현질 했습니다15000쯤일때 그러니 확률이 너무적으니 좀 올려주시면 더 좋은 게임이 될것 같습니다 2. 과금과 무과금의 차이가 좀 남니다 과금을 하면 막 레벨이 11까지 열려서 기어 2개 스파 가젯 까지 쓰지만 무과금인 분들은 솔직히 되게 힘듬니다 제가 무과금이엿다가 이게임은 솔직히 현질을 해야 되겠다 싶은 게임입니다 예를 들면 프랭크로 치면 무과금은 막 HP가 8000이라 치면 과금은 11000막 이런식?
브롤스타즈,슈퍼셀님 저는 브롤스타즈 진짜 열심히 하는 12살 유저입니다! 제가 이렇게 리뷰를 달게된 이유는 바로 이게임의 장단점 입니다. 바로 말씀드리겠습니다. 장점:다양한 모드를 재밌게 즐길수 있다.저는 주로 브롤볼을 많이해요.그리고 맵매이크 기능도 좋은것 같아요! 유저들의 창의력도 늘어나고 재밌어요.그리고 광고가 안나오는게 큰 장점 인 것 같아요 하지만 단점도 있어요. 단점:레드와이파이가 심함 자꾸 레드와이파이로 인하여 게임이 튕기게 되고 팀원들은 민폐가 끼쳐요.현질 유도가 너무나도 심함. 슈퍼셀님의 좋은 게임때문에 심심하지 않고도 즐겁게 해줄 수 있어서 감사합니다! 그럼 안녕히게세요!!
브롤스타즈,"잼민이 게임 이라고 인식이 박혀있는 게임이지만, 생각보다 중독성이 있었습니다. 노래도 좋고, 중간광고도 없으며, 각 캐릭터마다 다른 능력이 있어 캐릭터 모으는 재미도 쏠쏠합니다. 다만, 현질유도가 약간 있는 편입니다. 그리고 렉도 조금 걸리는 것 같습니다. 일명 '레드 와이파이' 가 분명 인터넷이 잘 터지는데도 불구하고 나오는 경우가 꽤 있습니다. 추천도: 7/10"
브롤스타즈,"운영 하나가 게임을 방칠 수 있다는걸 보여주는 게임, 메가 상자 사태를 제대로 수습하지 않는 아니 오히려 그냥 떠나는게 낫다고 말하는 운영진, 해당 사태로 너무나도 많이 벌어진 격차, 아무리 브롤스타즈를 즐기던 과금 유저들도 손절각을 볼 수 밖에 없다고 봅니다. 게임 자체는 재미있습니다. 하지만, 운영이 이러면 누가 좋다고 할까요"
브롤스타즈,"이 게임은 다 괜찮은 데 매칭 시스템이 문제입니다. 예를 들어, 하이스트를 한 다면 공격을 나가야 하는 캐릭터(발리, 다이너마이크 등)이 함께 매칭 되고, 수비를 해야 되는 캐릭터(불과 같은 근접 캐릭터 등) 캐릭터마다 특성이 있고 포지션이 있는데 공격 수비의 맞는 캐릭터들을 섞어주지 못하고, 한 쪽에 쏠려서 매칭을 해줍니다. 이 점만 개선한다면, 훌륭한 게임이 될 수 있을 것 같습니다."
브롤스타즈,"업데이트 해주면 좋겠는걸 안 될것 같지만 적어봅니다 1.화면에 카메라 모양이 있어서 눌르면 화면이 캡쳐돼서 클럽이나 팀 채팅끼리 공유할수있으면 좋을것같습니다. 2.더 다양한 모드가 생기면 좋을것 같습니다 제가 원하는 모드는 술래잡기나 숨바꼭질 모드가 있으면 좋겠습니다. 그리고 브롤스타즈에 좋은점,재밌는점은 팀을 만들어서 게임을 할수있는게 좋고 또 여러가지 핀(이모티콘)들이 있어서 좋고 그리고 친선전투도 있어서 좋습니다. 재밌는 점은 서로 싸우는게 재밌고 트로피 올리는게 재밌습니다.아 그리고 레드와이파이 때문에 전투에 딥중이 안돼요!"
브롤스타즈,초반에는 정말 재밌게 했는데 몇가지 아쉬운 점이 있어서 리뷰를 씁니다 먼저 캐릭터 업그레이드가 너무 힘듭니다. 6~7렙이 넘어가면 필요경험치와 골드가 게임 내에서 충당하기 힘들정도에요. 저랭크에는 업그레이드가 크게 중요하지 않지만 고랭크 올라갈수록 체감이 많이들더군요 두번째로 맵이 조금만 더 다양했으면 좋겠어요. 부쉬나 벽 위치만 바꾸지말고 새로운 지형이나 새로운 모드가 꾸준히 업데이트가 되면 정말 좋을 것 같습니다 마지막으로 이게 가장 큰 문제인데 티밍이 심각합니다. 팀원에 상관없이 내가 잘하면 이기는 게 편해서 솔로 쇼다운을 주로 했는데 고랭크에 가면 몇몆 유저끼리 팀을 맺습니다. 다이너마이크나 발리가 2~3명에서 많게는 5명까지 서로 팀을 맺고 중앙에 있으면 다른 브롤러들은 정말 아무것도 할 수가 없어요. 이게 중앙부쉬가 많은 맵이 아닐경우에는 10판당 7~8판이 그런 것 같습니다 잘 만들어진 게임이라 이런 몇가지 사례가 더 아쉽게 느껴지는 것 같습니다
브롤스타즈,"다 좋은데 딱 2가지가 아쉽다. 대부분의 유저들이 느낄텐데, 첫번째는 이유없는 와이파이 렉이다. 유튜*에서 이 게임을 플레이하는 고수들의 화면에도 가끔씩 나오기도하고 와이파이가 4칸이고 잘 터지는 집에서 플레이를해도 와이파이가 잘 안된다며 빨간색 와이파이가 뜬다. 두번째는 친구추가이다. 닉네임 등으로 추가가아닌 직접 초대링크를 보내주거나 추천목록에서 내려가며 찾아야한다. 솔직히 너무 불편하다. 와이파이 오류와 친구추가 시스템만 바뀌어도 충분히 더 많은사람들이 즐길 수 있을것 같다. (매칭시스템은 그나마 나아진듯.. 그래도 아직 사소한 문제들이 남아있는듯 함)"
브롤스타즈,"게임자체는 아주 좋습니다... 하지만 에너지 물약 모드, 로봇이 소환(?) 되는 쇼다운 모드에서는 벨런스가 맞지않습니다.. 그래도 그 정도까지는 이해 할수 있는데 와이파이.... 정말 데이터를 켰는데도 와파가 안된답니다. 그 부분으로 인해서 진 적이 한두번이 아니니 빨리 고쳐 주시면 감사하겠습니다..."
브롤스타즈,"브롤을 1년동안 함께한 유저입니다. 현제 17000점이고 앰버,루,콜레트,바이런 빼고는 다있습니다. 브롤의 장점부터 말하자면 손쉽고 간편하게 할수 있다는 겁니다. 언제 어디서든 3분이라는 시간만 있으면 어떤 모드든 상관없이 플레이 할수 있습니다. 두번째는 퀄리티 입니다. 브롤러들이 하나같이 독특하고 능력또한 다양해서 질릴틈이 없습니다. 장점이 있으면 단점도 있는법. 단점은 인터넷연결 불안정이 제일 큰것 같습니다. 아직까지 고치지 못한것을 보면 해결하기 어려운 문제겠지요. 두번째 단점은 밸런스 문제입니다. 최근에 나온 애드거,앰버가 심각하게 오버밸런스라고 생각합니다. 이럴거면 너프를 많이 먹은 레온을 버프하고 크로우와 스파이크 또한 버프하지 않는 이상 애드거와 앰버를 너프시키는게 맞다고 봅니다. 앞으로도 재밌고 소통이 잘되는 브롤스타즈가 되길 바랍니다."
브롤스타즈,"브롤스타즈에는 문제점이 많습니다 1째,전략게임이 아닌 운 게임입니다 왜냐하면 쇼다운에서 상자가 많이 나오는 곳 과 많이 않 나오는 곳이 있고,캐릭터 문제도 있습니다 상자를 열어서 나온 캐릭터는 지형에 알맞게 사용해야하는데 그 캐릭터가 없을때는 속수무책으로 당할 수 박게 없습니다 또 스타파워도 마찬가지 입니다. 2째,끝나고 나오는 화면에 나가기 번튼은 트로피가 얼마나 떨어졌는지 본 다음에 누룰 수 있어서 더 짜증 납니다. 3째,팀원과 소통이 안 되어 답답합니다. 그래서 제가 해결방안을 만들었 습니다. 1째,캐릭터를 특정시간 동안 빌려준다.(일주일에 한 번씩) 2째,끝나고 나오는 화면은 모두 동시에 나오게한다. 3째,팀원과 소통할 수 있게한다.(혹시 욕,비속어 등이 걱정되면 신고할 수 있는 시설을 만들면 됩니다) 이 부분을 빨리 수정해주시면 감사하겠습니다. 그리고 저의 개인적인 의견으로 비비:공격력,체력 크게 감소 로사:공격범위 감소 보:체력증가 이 부분이 패치 부탁합니다"
브롤스타즈,"- 서버안정화 필요 - 악의적 플레이에 대한 제제 필요 - 점수(랭크)에 맞는 팀배치필요 - 길드,개인,랭크,각 게임모드 의 매칭시스템 개선필요 - 업데이트해도 클라에선 계속 업데이트 유도하는부분 개선 필요. 최근 버전에서도 전혀 개선되지 않음. (무조건 삭제하고 다시 깔아야하는데 그마저도 원활하지않음.)"
