game,review
쿠키런: 킹덤,"게임은 재미있습니다. 하지만 게임을 플레이하다가 잡초제거 혹은 자원 만들기, 심지어 건물 짓기 등 오류로 인해서 처리가 되지 않아서 계속해서 게임을 끄고 다시 접속하기를 반복해야했습니다. 심지어 게임에 접속을 위한 화면에사 조차도 이러한 문제가 발생하더군요. 이라한 오류를 바로 잡아주셨으면 합니다."
쿠키런: 킹덤,재밌게 플레이 하고 있습니다:) 몇 가지 기능이 추가되면 좋을 것 같습니다. 1. 꾸미기 페이지 스크롤 넘기기에서 페이지 넘기는 방식 추가. -꾸미기 페이지가 스크롤이라 스크롤이 긴 경우 계속 넘겨서 설치해야하는 것이 너무 불편합니다. 페이지 버튼을 만들어서 버튼으로 페이지 넘기는 방식이 생겼으면 좋겠습니다. 2. 왕국 꾸미기 저장 및 불러오기 기능 추가. -1~3개 정도 왕국 꾸미기를 저장하고 불러올 수 있는 기능이 추가되었으면 좋겠습니다. 땅이 좁은 편이라 다양한 꾸미기를 못하는 유저분들이 많습니다. 이를 개선하기 위해 슬롯에 현 왕국의 꾸미기를 저장하고 불러올 수 있는 슬롯이 추가되었으면 좋겠습니다. 3. 꾸미기 일정 아이템 수거 및 꾸미기 아이템 전체 수거 기능 -왕국을 꾸밀 때 하나씩 수거 해야하는 번거로움이 매우 큽니다. 일정 아이템을 일괄 수거하는 기능과 생산시설을 제외한 왕국의 모든 꾸미기 아이템을 수거할 수 있는 기능이 추가되었으면 좋겠습니다.
쿠키런: 킹덤,"꾸밀 테마도 많고 정말 예쁩니다. 주기적으로 업데이트되는 콘텐츠들도 재미있고 조금 불편했던 것들도 개선되어서 잘 하고 있어요. 근데 몇가지만 더 업데이트 되면 정말 좋을 것 같습니다... 1.생산시설끼리 합치는 기능을 만들어주세요. 생산시설종류가 적지 않다보니 공간차지가 꽤 큽니다. 영토 확장을 거의 다 한 상태인데도 제대로 꾸미려면 생산시설을 한 개씩만 간신히 꺼내놓을 수 있을 정도에요. 한 개씩만 꺼내놓으면 무역선, 소원나무, 곰돌이 열차의 수급을 제대로 할 수 없고요. 두개씩있는 똑같은 디자인의 생산시설을 여러 대 꺼내놓으면 흡사 공장지대 같기도 해서 예쁘게 배치하는 것이 굉장히 어렵습니다... 2. 왼쪽으로도 확장해주세요. 성 레벨 최고치를 15로 확장했을 때 영토도 확장되긴 했지만 오른쪽으로만 비대한 모양새라 굉장히 불균형적으로 보여서 조금 신경쓰입니다ㅠ 테마 간의 연결감을 지켜서 꾸미는 편이라 더 불편하게 느껴지는 것도 있고요..."
쿠키런: 킹덤,정말 재밌게 하고 있었는데 오로라 나침반 재화가 창고에서 사라졌네요... 열차에서 3개 점검보상으로 1개 받아서 총 4개 있어야하는데 사용하지않았음에도 통째로 없어졌습니다. 로딩이 안돼서 표시가 안뜨나 싶어서 게임을 두어번 나갔다가 들어왔는데도 복구가 안되네요. 치명적인 오류는 아니나 게임 내에서 수급이 어렵고 상당히 중요한 희귀 재화가 사라진 건 타격이 커서 평점으로라도 문의해봅니다.
쿠키런: 킹덤,"너무 재밌음 그래픽과 성우진, 스토리 가 완벽 그 자체 출시된지 얼마 안 됐지만 의외로 할 게 많아서 시간 가는 줄 모를만큼 몰입도가 장난아님 단점을 굳이 뽑자면 왕국 꾸밀 때 건물 배치할 때마다 올라오는 보관함 탭 (바닥/건물보관)이 계속 올라오는 점? 그것만 고쳐준다면 꾸밀 때 어려움이 없을 것 같음 암튼 꾸준히 열심히 할 것 같음 진심존잼"
쿠키런: 킹덤,"트로피컬 소다 제도에서 특정 두 개의 섬만 계속 점령당하고 있습니다. 그런데 하필 그 두 곳이 가장 센 적들이라서 깨는 데 애를 먹고 있습니다. 물론 이건 제 덱의 전투력 문제이기도 하겠지만, 궁금한 건 원래 재점령이 그런 시스템으로 이뤄지는지 여부입니다. 버그라면 최대한 빨리 수정해주시기 바랍니다."
쿠키런: 킹덤,리뷰 다시합니다. 초창기라서 컨텐츠요소가 정말정말 많이 없습니다. 흔한 반복전투도 아직 구비되어있지않습니다. 스토리를 다시볼 수 있다던가 성장을 위한 별사탕 보급도 편의성 부분에선 한참 부족합니다. 전체적인 면에서 아직 갈 길이 멀다 느껴집니다.. 마을이 성장하고 레벨 오를수록 자원을 버는 수단이 많아져야하는데 열차 한대 추가말고는 사실상 없습니다. 레벨이 오를수록 아이템을 만드는게 힘든데도 불구하고요. 사람들이 공략으로 괜히 업그레이드하지말라는게 이거때문입니다. 성장할수록 오히려 손해가 무지막지합니다. 리스크가 큰만큼 그만큼의 이득을 봐야하는데 그게 없습니다..
쿠키런: 킹덤,게임인 이상 과금의 요소는 필요하다고 생각합니다. 그러나 무과금으로도 충분히 즐길 수 있는 게임이라고 생각합니다 쿠키들도 귀엽고 많은 시간을 투자하지 않아도 되서 매우 만족중이지만 전투나 결투장 때 스킵 버튼이 있었으면 합니다 (스테이지의 경우 깼을 때) 막혀서 스테이지 뺑뺑이를 돌릴 때 너무 괴롭습니다. 앞으로도 재미있게 하겠습니다 ㅎㅎ
쿠키런: 킹덤,"재미있어요! 친숙한 콘텐츠를 쿠키라는 소재로 재미있게 꾸며서 즐겁게 플레이하고 있습니다. 길드 콘텐츠가 생기면 더 재미있겠네요!! 수확할 때 하나씩 눌러서 해야 하는 점이 아쉬운데, 한 번에 수확하고 한 번에 작업하게 하는 기능이 있으면 더 좋을 것 같아요. 그리고 스테이지에서 반복 전투가 가능했으면 좋겠습니다!! 아기자기한 기능이 많고 성향에 맞는 플레이가 가능해서 좋아요. 오랫동안 좋은 운영 해주세요! 화이팅!!"
쿠키런: 킹덤,쿠키런 오븐브레이크를 통해 킹덤을 알게되어 해봤는데 넘 재밌어요!!! 근데 한가지 아쉬운 점은 건물 건설할 때 방향이 두가지 방향만 된다는 거예요.. 그리구 서버가 다르면 친구추가를 못한다는 거? 그리고 서버를 합치지 못한다면 서버가달라도 친구추가는 할수 있게 해주셨음 해요! 또한 품질...? 이 좋은만큼 용량이 너무 큰 것 같네요 ㅠㆍㅠ 이 외에 다른거는 괜찮고 너무너무 재밌습니다!! 감사해요! ♥
쿠키런: 킹덤,"정말 재미있다. 7~8년전 쿠키런 오리지날을 처음 즐기고 오랜만에 쿠키런 시리즈를 접하는데 캐릭터 게임성은 여전히 마음에 든다. 업데이트할 때 게임파일을 다시 받는 것 같은데, 최적화가 덜 되어서 매번 삭제 후 재설치해야 해 아쉽다. (낮은 사양 저용량의 폰으로 게임하는 데 불편함이 있다.) 앱 설정에서 내장 메모리ㆍ외장 메모리로 파일을 옮길 수 있는 기능이 있었음 좋겠다. 아직 정식발표된 지 얼마 되지 않은 게임이라 어쩔 수 없겠지만 앞으로도 쭉 기대해보겠다."
쿠키런: 킹덤,"1. 더더욱 높아지는 진입장벽 2. 고인물들을 위한 컨텐츠 부족 3. 계속해서 반복되는 재미없는 이벤트 4. 가끔씩 생기는 자잘한 튕김현상 5. 캐릭터 키워서 인연작업 하기도 어려운데 스킨출시와 함께 스킨인연이라는 말도안되는 시스템 출시 6. 저같이 서버오픈날부터 시작한 스타터 유저분들을 잡지못함 (컨텐츠 부족등) 서버 오픈때부터 계속 노가다하여 마스터2에 머물렀지만 결국엔 할건없고, 이벤트는 똑같은게 일정주기로 반복되서 재미없고.. 언젠가 개선이 되겠지만 처음의 운영에비해 피드백도 느려지는거 같고 변했네요"
쿠키런: 킹덤,재밌게 플레이 하고 있지만 업뎃하라고 알림 뜰 때마다 스토어를 들어가보면 업데이트 버튼은 없고 플레이 버튼만 계속 뜹니다;; 껐다가 켜도 똑같은 화면입니다..그래서 저는 지웠다가 다시 깔아서 업뎃을 하는데요. 언제까지 업뎃할 날마다 지웠다 깔았다를 반복해야 되는 지 모르겠습니다ㅠㅠ 이걸 고칠 수 있는 방법은 없을까요...
쿠키런: 킹덤,왕국에 있는 시스템과 전투쪽에 시스템이 서로 굴레가 잘 돌아가서 재미가 있습니다. 어느 것 하나 버리는 컨텐츠가 없다는 점에서 만족하고 인게임내에 쿠키런 요소가 있는 점이 기존 쿠키런을 즐기던 분들에게 플러스 되는 요소라고 생각합니다. 다만 에픽 외에 캐릭터들이 너무 성능이 좋지 않아서 사용하기 애매하다는 점이 매우 아쉽고 캐릭터 간의 밸런스도 차이가 좀 많이 나지 않나 싶습니다. 무엇보다 마음에 드는 점이나 씁쓸한 점은 오랜 시간 동안 이 게임을 안(못)해도 된다는 점입니다. 스테미너가 많이 부족한 현상이 나서 찰때까지 폰을 잡고 집중을 안해도 된다는 점이 피로감 조절에 있어서 좋기는 하나 아쉽기도 합니다.
쿠키런: 킹덤,캐릭터도 귀엽고 스토리도 탄탄하고 오랜만에 마음에 드는 게임이었는데 너무 자주 튕깁니다.. 게임 진행에 지장이 갈 정도로 튕기고 오류도 자주 발생해요. 특히 쿠키를 뽑을 때 튕기면 다시 접속했을땐 다이아는 사라져있는데 무슨 쿠키를 뽑았는지 확인할 수가 없어서 뽑기가 된건지 아니면 다이아가 씹힌건지 알 수가 없어요... 폰으로 하다가 너무 튕겨서 패드로 진행 중인데 여전히 오류 발생 빈도가 너무 높습니다..
쿠키런: 킹덤,일단 게임이 너무 재미있어요. 전체적으로 게임이 지루하지 않아요. 근데 몇가지 원하는게 있는데 다들 아시다시피 렉이 심하다는건데 처음엔 진짜 심했거든요. 게임을 하면 처음보단 심하지 않지만 그래도 있긴 해요. 그렇다고 너무 없는건 아니지만 눈에 보일 정도의 렉이 있다는 거구요. 그리고 코인 얻는 방법이 더 있었으면 좋겠어요. 게임을 하다보면 코인을 쓸 일이 많아지는데 제가 현질은 안 하는 편이어서 현질 하지 않고 코인을 얻는데 어려움이 많습니다. 또 건물 이동을 할 때 두 방향으로만 바꿀 수 있고 건물 뒤편을 못 보는게 아쉽고 화면으로 왕국을 볼 때 정해진 각에서만 보는게 조금 답답해요. 이해 못 하실 수 도 있는데 아까와 같이 건물을 이동 할 때 360도 어디에서나 볼 때 전체적으로 만족스러운 위치에 이동하고 싶지만 360도로 화면을 보지 못한다는 거예요. 마지막으로 많은 유저분들이 게임 많이 튕긴다고 하시는데 저 13레벨 정도 인데 아직까진 튕기진 않았어요.
쿠키런: 킹덤,"재미있는 게임입니다 하지만 문제점이 있습니다. 1.로딩시간이 너무길어 힘듭니다 쿠오븐처럼 빠른로딩이 있으면 좋겠습니다 2.현질유도가 꽤 있습니다. 에픽을뽑았을때 00획득 패키지,승급하였을때 승급패키지등등 유도가 꽤 심합니다 이상입니다 아직 출시된지 별로 안됐기 때문에 패치가 이루어질거라고 믿습니다 할거없으신 분들은 이게임 꼭 해보시기 바랍니다"
쿠키런: 킹덤,"우선 쿠키런 특유의 아기자기한 캐릭터 디자인과 섬세한 스토리텔링에 매우 만족하며 플레이 중인 유저입니다 :) 다만 잦은 튕김 현상은 꼭 고쳐주셨으면 해서 말씀드려요ㅜ 특정 상황시에만 발생한다고 볼 수 없을 정도로 이곳저곳 랜덤으로 튕겨서 지칠 정도입니다.. 제가 자주 겪은 부분은 아레나 로비 입장, 아레나 배틀 시작, 메인 스테이지 맵 입장, 메인스테이지 배틀 시작, 생산건물 클릭 등이 있었습니다. 또한 처음 로딩시간이 너무 긴듯 합니다.. 고칠 수 있는 부분인지 없는 부분인지는 모르겠지만 좀 더 나은 플레이 환경을 위해 노력해주셨으면 해요 88"
쿠키런: 킹덤,게임은 엄청 재밌어요!! 쿠키들마다 특성있는 성격이랑 외형도 매력있고요. 그런데 왕국 꾸미기 할 때 조금 불편한 점들이 있습니다.. 왕국 확대/축소를 좀 더 많이 할 수 있었으면 좋겠어요. 특히 왕국 전체를 한 눈에 볼 수 있을 정도로 축소가 되었으면 좋겠습니다. 그리고 도로 깔 때도 두 손가락으로 움직이면 도로를 까는 게 아니라 이동할 수 있었으면 좋겠어요! 두 손가락으로 만지면 움직이고 한 손가락으로 만지면 도로가 깔리도록 업데이트 해주었으면 하는 바람이 있습니다~!
쿠키런: 킹덤,"지금 아레나 두번이나 먹통으로 정상종료가 안돼서 강제종료했네요. 한번은 나가기해서 패배먹고 두번째는 나가기도 안돼서 앱을 껐고 재접속도 아예 안됩니다. 동영상도 찍어놨구요. 게임이용에 여러가지 불만은 많은데 오류사항은 아니니 그러려니한다지만 지금 겪은 이런 오류는 안 생겨야죠. (갤노10, 최신버전, 5g접속)"
쿠키런: 킹덤,"사전예약부터 했던 유저입니다. 게임에 과금을 거의 하지 않는데요, 에이션트 등급이 나오면서 무과금/소과금과 헤비한 과금러들 사이의 격차가 더욱 커진것 같습니다. 거의 2,3백번 뽑기를 했는데도 조각하나 얻지 못할 정도니.. 그리고 매일 반복해야 하는 것들이 처음엔 재미였지만 점차 숙제처럼 느껴지면서 흥미가 급격히 떨어지더군요. 정말 오래 플레이 했지만 이제는 더 즐기지 못할것 같아 삭제합니다."
쿠키런: 킹덤,"쿠키런 킹덤을 즐기고 있는 사람입니다. 평소에는 그냥 그럭저럭하게 게임을 하고 있다가 업데이트를 했는데 흰 화면만 나오고 튕기네요. 평점을 보니까 저만 지금 이런일이 일어나는 것 같진 않은데, 그래서 다시 깔아봤더니 이번엔 상호작용(젤리 생산같은 거)를 할 때 소리가 지지직 거리면서 게임 내내 그럽니다. 이 버그좀 고쳐주시길 바랍니다. 이런 버그만 고쳐지면 재밌게 플레이할것 같네요."
쿠키런: 킹덤,"내가 요즘 찾던 종류의 게임이다. 처음 플레이스토어에서랑 광고만 봤을 때는 별로 깔고싶지 않았다. 오븐브레이크에서 간접체험 하고 난 후 바로 깔게 되었는데 전투 방식도 쉬워서 만족한다. 무엇보다 쿠키가 정말 귀엽고 세계관이 매력적이다. 불편한 점은, 마을을 보려고 화면을 드래그 할 때 자꾸 건물들이 움직여서 번거롭다. 길게 누르면 건물이 이동하는걸 이동하지 못하게 잠금 할 수 있는 기능이 있었으면 좋겠다."
쿠키런: 킹덤,이번에 RPG 게임으로 나와서 색다르고 재밌어요 전에는 계속 달리기만 해서 금방 질렸는데 이번에는 여러가지 기능이 추가되면서 완전 재밌어졌어요. 기다려야 하는게 많아서 지루할때도 있지만 그때 성을 꾸미면 시간가는줄도 몰라요. 크리스탈과 코인도 금방 모을 수 있어서 지루하지도 않아요. 다운로드 강추강추!!!
쿠키런: 킹덤,평소에 정말 재밌게 하던 유저입니다 이번에 업데이트를 하고 나니까 데브시스터즈 화면에서 넘어가지를 않네요.. 계속 기다려봐도 실행되지는 않고 튕겨버립니다..저번 업데이트 후에도 무슨 보안폴더 오류같은게 떴었는데 업데이트때마다 오류가 생기니 보상도 못받고 너무 불편하네요..확인해보고 고쳐주시면 정말로 감사하겠습니다 게임자체는 중독성있고 재밌는것같아요!
쿠키런: 킹덤,무과금으로 9스테이지까지간 유저입니다 확실히 보상을 넉넉하게주긴하는데 어느날 갑자기버그가걸려 다시 들어갔고 다시 처음부터 시작되는 버그가걸렸습니다. 이버그는 대체무엇인가요..... 그래도 무과금으로 할만한게임같으니 미리 만들어둔 부계정으로 하겠지만 앞으로 이런버그들을 좀 수정하셨으면좋겠습니다
쿠키런: 킹덤,"게임 자체는 괜찮은데 몇몇 문제가 보이네요. 저는 이걸 노트10이랑 갤탭s7+ 로 하고 있는데, 노트로 하면 렉은 없는데 발열이 좀 심하고, 갤탭으로 하면 발열은 없는데 전투할 때 첫 스킬을 쓸 때마다 렉이 걸리고 뚝뚝 끊겨요. 어려운 스테이지에서 수동으로 전투를 돌리기 어려울 정도입니다. 쿠키런 하기에 사양이 딸릴만한 기기도 아닌데 왜 이런 문제가 발생하는지 모르겠네요. 고쳐주시면 좋겠습니다"
쿠키런: 킹덤,"시즌 1부터하고 시즌 3까지 현금결재를 하지 않은 유저입니다. 현금결제를 하지 않아도 충분히 즐길 수 있는 게임입니다. 많은 사고가 있었지만 충분한 보상으로 유저들을 만족을 시켜주었습니다. 그렇지만, 매 시즌마다 상위 유저만의 시즌 아이콘이 존재합니다. 이는 그걸을 얻기 위해 많은 투자를 하겠지만 얻지 못한 사람은 회색으로 영원히 남게 됩니다. 그러면 기존에 하다가 실수로 얻지 못하면 그대로 흥미가 사라져 게임을 접게되며 신규 유저들도 이전 시즌 아이콘을 획득하지못해 박탈감이나 상실감을 줄 수 있다고 생각합니다. 이러한 시스템은 단기적으로는 수익을 얻을 수 있지만 장기적인 모델은 아니라고 생각합니다."
쿠키런: 킹덤,"음 단점만 좀 없었더라면 5점 쌉가능이구 4점을 준 이유가 있겠죠? 현재 업데이트가 되어 '소다 제도의 무법자들' 스토리? 같은게 오픈 되었습니다. 긴급 점검이 되어 오픈 된 스토리입니다. 많은 사람들이 기대한 만큼 퀄도 엄청나고요. 하지만 게임을 하다 '해당 문제를 해결 할 수 없습니다' 같은 클릭을 해도 안 들어가지는 그런 문제가 발생 해 다시 긴급 점검 상태가 되었습니다. 그렇다고 점검 시간이 긴 편도 아닙니다. 그래도 이런 문제가 자주 발생하지 않으면 좋겠습니다. 그리고 무과금,소과금들이 보석,코인 등을 잘 못 모으는게 좀 그런 것 같습니다. 무과금,소과금들도 어찌어찌 잘 발전할 수 있게 해주셨음 좋겠습니다. 사실상 단점이 그렇게 어마무시하게 많은것은 아닙니다. 장점도 엄청 있구요. 제가 손이 아파서 못 쓴거지 장점이 엄청 많습니다... 쓰려고 하다가 손 나갈 뻔 했습니다..... 그럼 쿠킹덤 만관부!!!!"
쿠키런: 킹덤,출시때부터 했지만 최근 일주일 넘게 접속이 안 되어서 업뎃으로 고쳐지면 들어가야겠다하고 미뤘다가 업데이트 뜨고나서 업뎃 후에도 접속 시도하는데 그래도 접속이 안 되네요.. 앱 누르면 흰 화면 3초 떴다가 튕겨집니다. 폰 기종은 노트10+이며 용량 문제로 튕긴 것은 아닙니다. 해당 폰 용량이 512기가라서 남아도는게 용량인 상태라서요... 아 그리고 현재 안드 폰 버전은 10 입니다. 얼른 개선되어 다시 접속해서 열심히 겜 하고 싶네요..😢😢
쿠키런: 킹덤,게임은 재미있으나 새로운 컨탠츠가 시급함. 이번 패치로 컨탠츠가 늘어난거같긴하나. 재일중요한건 투기장 개선이라고 생각함. 앞으로도 계속 에이션트와 래전드리가 나올텐데 그렇게되면 투기장에서 무과금이 설자리가 하나도 없음. 투기장 개선을통해서 래전드리 에이션트 3이상 금지등의 룰을 추가하던지. 아니면 그런룰을 가진 투기장과 프리룰 투기장을 나누던지 해야한다고 생각
쿠키런: 킹덤,"게임은 굉장히 재밌게 즐기고 있습니다. 주제도 좋고, 무과금도 어느정도는 할 수 있도록 잘 만들어진 것 같아요. 다만, 월드 탐험 스테이지의 난이도가 권장 전투력보다 더 높게 느껴지는 경우가 있습니다. 저번에 추가된 11-27 스테이지 같은 경우도, 라즈베리가 너무 세서 전투력이 50만이 넘도록 못깨다가 이번에 겨우 깼습니다. 11-27 깨고 나니 12스테이지 클리어하는건 일도 아니더군요. 이런 부분에서는 난이도 조정이 필요해보입니다."
쿠키런: 킹덤,게임성이나 연출이나 다 너무 재밌고 만족하는 유저입니다. 그런데 딱 하나 개선해주셨으면 하는 부분이 있다면 게임 로딩시 자꾸 오류가 뜨거나 팅기는 부분을 개선해주셨으면 좋겠습니다. 그전에는 오류 메시지만 뜨고 한 두어번 다시 들어가면 접속이 되서 상관없었는데 업데이트 이후로 계속 팅기고 잘 안들어가집니다 ㅜㅜ
쿠키런: 킹덤,솔직히 게임자체는 확실히 재밌습니다만 토핑얻기나 경험치 얻기가 어렵습니다. 스테이지 하면 되는데 너무 한판한판하는게 불편하고 시간 아깝습니다. 연속전투 옵션이 생기면 좋겠습니다. 깬스테이지는 연속으로 계속 깨서 플레이어 가 원하는 만큼 돌릴수 있으면 좋겠습니다. 이상입니다!
쿠키런: 킹덤,"게임 자체는 그럭 저럭 할만함. 얼마나 대단한 폰에 맞춰서 개발을 한건진 모르겠지만 발열, 렉 등 심한편. 처음 깔고 실행했을 때 로딩화면에서 한번 오늘 업데이트 하고 또 로딩화면에서 한번 두번이나 폰이 재부팅 됨. (완전한 재부팅도 아니고 OS만 재부팅 된 느낌..) 어떻게 만든걸까..."
쿠키런: 킹덤,스테이지를 깨거나 결투장에서 이겼을 때 (이미 끝난 경기인데) 항상 네트워크가불안정하다면서 재접속이 안됩니다. 다른 터치도 다 안 먹어서 창을 지우고 다시 들어가는 방법밖에 없는데 가면 항상 졌다는 결과가 떠요. 대부분 경기가 그렇고 결투장같은 경우는 이미 이겼는데 결과가 정산되기 전에 무한로딩이 걸려서 튕기고 매번 졌다고 뜨니까 점수 손실이 엄청납니다. 저보다 티어 낮은 유저분과 싸우면 8점씩 떨어지고 그래요. 그런식으로 잃은 메달?이나 스테미너 젤리 등이 엄청나요. 네트워크는 문제 없는데 쿠킹덤만 그럽니다. 부디 고쳐주시길 바랍니다.
쿠키런: 킹덤,"재밌습니다. 다만 아레나, 떨어지는 트로피는 많은데 그것의 비해 아레나를 많이 돌릴 수가 없습니다. 그래서 다이아 부터는 올리기가 정말 힘들어요. 또 별사탕 수급입니다. 신캐가 나오는건 좋은데 신캐가 나오면서 기존의 쓰던덱으로는 아레나에서 동전투력이더라도 차이가 확실히 나요. 그래서 덱을 바꿀려 해도 과금유저가 아닌이상 풍요의 분수, 별사탕 집만으로는 신캐 레밸을 기존 덱만큼 올리기가 어렵습니다. 그래서 자신의 캐릭터 레밸을 다운시킬 수 있게 해주시면 좋겠습니다. 다운 시키는 과정에서 썻던 별사탕을 일부 돌려주는 식으로요. 이런 식으로 몇몇 재화가 부족합니다. 재밌는 있지만 이런 재화 수급하는 과정에서 이게 게임인지 노가다인지 햇갈릴때가 있습니다. 이 과정에서 게임의 몰입도가 떨어지고요. 퍼주라는 소리는 아닙니다. 다만 수급 방식을 조금 늘려주시거나 수급하는 양을 늘려주시면 좋겠습니다. 데브 화이팅!"
쿠키런: 킹덤,"일단 건물이 두방향 밖에 안돼서 아쉬워요 ! 그리고 좋은 폰이 아니면 게임시작만 누르면 팅겨서 보상을 못 받을 때가 많아요 ! 그리고 점검을 너무 많이하고 아레나 경우에는 실력 차이가 너무 극과 극 차이로 떠요 !! 심져 아레나에서 자꾸 팅겨서 트로피랑 메달, 그리고 티켓 버릴때가 많아서 티어가 잘 안 올라가요 ㅠㅠ 그런데 이런점 빼고는 아주 좋은 게임이네요 ^_^"
쿠키런: 킹덤,진짜 무과금도 재밌게 할 수 있는 게임이라고 생각해요. 크리스탈도 스테이지를 깰 때마다 100씩 주고 점검이나 이벤트 쿠폰 등으로 크리스탈도 많이 받을 수 있어서 좋아요! 아쉬운 부분은 뽑기 할 때 좋은 쿠키들이 잘 안 나와서 힘 빠질 때가 있어요.. 또한 새로 열린 소다제도는 처음은 너무 좋은데 가면 갈수록 스테이지 깨는 것이 쉽지 않고 새로운 스테이지를 깰 때 필요한 재료를 얻기도 좀 힘들어요..
