game,review
쿠키런: 킹덤,게임성은 정말 좋습니다. 하지만 개인적으로 볼 때에는 스토리가 다 끝난뒤 할것이 없어진다면 게임은 망할 것 같습니다. 이 게임도 멱살잡고 지옥에서 새로운 컨텐츠를 들고와 즐기게 하고 그게 끝나면 이제 사람이 할 것이 없어집니다. 그리고 트로피컬 소다제도가 너무 빨리 다시 점령된다는 점입니다. 한 1-2만 안해도 하나는 점령되어있는 듯 해보입니다. 버그 또는 렉 그런 것들 싹다 없에고 보면은 정말 좋은 게임입니다.
쿠키런: 킹덤,"너무 좋고 쿠키도 귀여운데 몇가지 아쉬운 점을 뽑자면 1.길드 영토관리자 여러명 설정 가능하게 해주면 좋을 것 같습니다. 2.보물 등급 조정이 필요해보입니다. 시계,뿔 등의 사기 보물이 커먼인가 하면 점액, 지팡이 등의 별로 안좋은 보물이 에픽입니다. 등급을 아예 없에버리는 것도 좋은 방법 같습니다. 3.레어 쿠키들의 활용 가치를 만들어주세요. 예를들어 레어쿠키만 쓸 수 있는 아레나라던지... 4.아레나 에인션트,레전더리 쿠키를 최대 2개로 줄여주세요. 그러면 더 다양한 덱이 연구될 수 있을 것 같습니다. 5.인게임에 성우 정보 표시해주면 좋을 것 같습니다. 긴 글 읽어주셔서 감사합니다!"
쿠키런: 킹덤,"무과금인데 쉽게 왕국을 키울 수 있고,재미도 있고,성우분들도 잘 녹음해주시고,스토리 보는 재미도 있고,왕국도 멋지게 잘 꾸여져 아주 재미있습니다. 한 번해보시는 것을 추천드립니다."
쿠키런: 킹덤,너무너무 재미있구요. 재미있게 잘 진행하고 있습니다. 쿠키들의 다양한 스킬들과 스킨도 있어서 좋더라구요. 또 인테리어도 가능 등등... 너무 많아서 말하기 힘드네요. 쨌든 엄청 재미있습니다.
쿠키런: 킹덤,안녕하세요 저는 쿠키런을 많이즐기는 한유저입니다 재미있어요!네 재미있는데 현질이랑 크리스탈이 많이부족하더라구요..그..점검 보상이 넉넉해서좋지만 조오금 더주시길.. 그리고 제그런건지 모르겠지만 아이폰을 사용하거든요 ! 하지만 그폰이 오래됀거라.. 자주 튕기고 많이 뜨거워져서.. 용양만 쪼오금 줄이면 딱 돼겠네요 ! 그건빼고 다른건 없습니다 그럼 이만
쿠키런: 킹덤,챕터 2-웨이브7 구간에서 버그가 생겼어요. 무한 체력으로 죽지도 앞으로 나아가지도 않고 무한 결투를 벌이네요~~ 어젯밤만 그러는 줄 알았는데 지금도 그러네요~~ 수정 요합니다~~~ 수고하세요~~~~
쿠키런: 킹덤,"아레나의 방어기록에서 복수하기를 할때 한 상대를 확인하고 나면 원래 계속 그 창 위치에 머물러 있었는데 업데이트 이후 상대를 확인하고 복수를 하지 않는 이상 상대 덱만 확인하고 나오면 대전하기 창으로 자동으로 넘어가지고 방어기록 창으로 다시 넘어가도 위치도 제가 보던 곳이 아닌 이상한 곳에 있더군요. 유저분들 중에 전략적으로 방어덱을 공격덱보다 약하게 설정해놓아 복수하기에서 트로피를 얻으시는 분들이 많던데 이런식이면 나를 공격한 상대가 많을때, 일일이 확인하기가 힘든것 같습니다.다시 원래대로 해주시면 감사하겠습니다"
쿠키런: 킹덤,"서비스 오픈 후부터 하루도 안빠지고 하고있습니다. 조급하게만 안하면 쿠키도 결국 다 얻고, 마일리지로도 쿠키 5성도 만들 수 있어요. 쿠키 개수가 많아지면서, 활용 안되는 쿠키 최소화하려고 다양한 컨텐츠도 추가하고. 3개월 이상 모바일게임 해본적 없는데, 1년넘게 하고있네요 ㅋㅋ 뉴비들도 금방 적응할수있어요! 강추합니다 :)"
쿠키런: 킹덤,"게임 자체는 쿠키도 귀엽고 좋다고 봐 만점을 받아고 좋다고 봅니다. 그런데 좀 문제가 생긴 것 같더라규요. 몇 번이고 재설치를 하고 했는데도 아레나, 소다 제도, 케이크 타워, 길드전 등, 들어거기만 하면 앱이 종료돼요. 다른 앱처럼 예기치 않게 종료되었습니다가 뜨는 것도 아니라 그냥 게임은 꺼지고 핸드폰 화면으로 돌아와 있어요. 몇 번이고 재설치 했는데.... 해결 부탁드립니다."
쿠키런: 킹덤,괜찮긴 해요 근데 단점이 있으면 너무 현질 패키지가 많습니다. 장점은 쿠키들이 다 멋지고 귀여워요 새로운 쿠키 나올때도 엄청 멋진거 같아요 그리고 쿠키들 성우 캐스팅도 완벽해요 근데 쿠키 에픽 확률을 높여주시면 별점 5 해도 괜찮을거 같긴 해요 그리고 현질패키지 좀 줄여주시면 좋겠습니다!!
쿠키런: 킹덤,쿠키런은 게임이 정말재밌습니다. 제가 추천드리는 게임이고 심심할때나 하고싶을때가 있는데 그럴때하면 너무 재밌습니다 할것도 많고 개인적으로 추천드리는 게임입니다 컨텐츠도 계속 나오고 다만 렉이 조금 걸린다는거 빼고는 제 게임중 탑2 입니다 데브시스터즈 화이팅
쿠키런: 킹덤,"갤럭시 s8유저입니다. 쿠키런킹덤 너무 재밌습니다. 다만 폰 성능이 안좋은 것인지 게임을 켤때나 어플 내에서 화면이 전환될때 몇분동안 동작이 느려지거나 화면이 멈추고 튕기는 현상이 있습니다ㅠㅠ 백그라운드에서 타어플과 함께 작동시킬시 (ex)유튜브, 음악, 플레이스토어 다운로드 등) 둘중 하나가 종료되는 현상이 있습니다.ㅠ 이런 현상때문인지는 몰라도 배터리도 많이 사용되는것 같네요ㅠㅡㅠ 이러한 불편함에도 쿠킹덤을 끊지 못한다니ㅠㅠ 너무 재밌네요 폰을 좋은 걸로 살까봐요ㅠ"
쿠키런: 킹덤,"쿠키런 오븐브레이크하면서 같이하게 된 유저입니다. 귀여워서 키울맛 나는 쿠키캐릭터들을 보며 꾸밀맛 나는 마을까지 환상적인 게임입니다. 다만 한참 게임에 몰입해서 진행하면 화면 전환될때마다 튕기는건 스트레스받네요.. ㅠ 사용자가 몰려서 그럴 수 있지만 심각한 수준입니다. 현재 사툥하고있는 기종은 S20인데.. 기종과 상관없다면 빠르게 수정하여 업데이트 부탁드립니다.. 빨리 마을 꾸며야해요.. :( 뽑기중간, 아레나 전투시작, 탐험시작, 열기구탐사시작..등등 화면이 전환될때마다 자꾸 튕기는 바람에 아쉽지만 화질도 낮추고 효과도 껐는데.. 어제까는 그래도 중간에 튕겨서 진행이 더디긴해도 게임 진행은 됬었는데 아까부터 접속 화면에서 오류가 뜨는거 보면 현기증도 나는것 같습니다. 제발..빠르게 수정 부탁드립니다. 감사합니다."
쿠키런: 킹덤,"갤럭시 s20+ 사용자 입니다. 일단 게임은 재미있게 즐기고 있습니다.^^ 다만, 게임플레이를 하는데 있어 제 폰의 버전이 문제가 있는건지는 잘 모르겠지만. 젤리든 머니든 다른 유저들은 부족하다라는 말이 많은데... 그건 개개인의 플레이에 따라 차등 적용 부분인것 같고요. 게임 플레이 도중 음향이 깨지는 부분이 있는데 굉장히 거스리는 음향으로 깨져 들려 불편한 부분과 그리고 어플 들어갈 때 한번에 들어가지는게 아니라 한두번 튕기고 나서 들어가지는 부분만이라도 일단 개선이 신속하게 필요한것 같습니다. 두가지 개선 해야할 부분은 다를 유저들도 동감되리라 봅니다. 빠른 개선 부탁 드립니다."
쿠키런: 킹덤,2~3개의 스킬을 사용할 때나 건물들의 생산품들이 전부 생산 완료 됐을 때 화면이 계속 끊기고 렉도 너무 많이 걸려요.. 그리고 꾸밀 때 밑에 수로와 타일이 뜨는 부분을 내려놔도 하나의 건물을 옮기면 계속 다시 뜨는게 불편해요.. 건물이랑 다른 기타 물품들로 함께 꾸며놨는데 한꺼번에 선택해서 옮길 수 없으니까 꾸미고 수정하는 부분이 조금 어려운 것 같아요! 이런 부분은 다음 업데이트 때 고려해주셨으면 좋겠어요!! 집에 있는 시간이 많아지면서 재밌게 할 수 있는 게임을 찾은 것 같아서 너무 좋네요ㅎㅎ 한국판 동물의 숲 같은 느낌이라 너무 재밌게 하고있습니다! 쿠키들도 정말 귀여워요♡
쿠키런: 킹덤,최적화가 너무 안 되어 있습니다 노트10+사용자인데 게임을 조금만 돌려도 발열이 너무 심합니다. 이 부분 개선부탁드립니다. 또한 보스방 난이도가 충분히 뽑기를 돌리지 않은 스펙으로는 깨기 힘든 난이도로 되어있습니다. 특히 도굴꾼대장 잡을때 화염지대가 너무 아픕니다. 권장전투력을 2000이상 차이내고 들어가도 덱이 녹습니다. 개선 부탁드립니다. 나머지는 뭐 좋습니다!
쿠키런: 킹덤,개발진 중에 스마트폰 기반 타이쿤 게임 해보신 분이 없으실까 의심이 가는 수준의 타이쿤게임성을 가졌습니다. 1.터치드래그로 화면을 이동해야하는데. 건물 편집모드가 따로 있음에도 굳이 오브젝트들을 오래 터치하고 있으면 개별로 편집모드가 뜹니다. 화면 이동을 위해 굳이 건물이 없는 곳을 집어서 터치드래그를 해야합니다. 아니면 개별건물편집일 하나하나 끄던가요. 삼성폰도 홈화면 잠금기능이 있는데. 맵편집모드도 이미 있으니 '맵터치 잠금 옵션'같은 것을 추가해주셨으면 좋겠습니다. 2. 길이나 수로를 설치하는것에서도 화면 이동시 터치드래그를 한다는 것을 잊었는지 화면 이동을 하려고 터치드래그를 하는 것인데 길이 줄줄 흘러내립니다. 다른 타이쿤 게임 좀 해보십쇼. 누가 길을 이렇게 깔리게 합니까? 3. 오브젝트들의 우선순위가 엉망입니다. 타이쿤 게임은 맵 예쁘게 꾸미는 재미인데. 0.5칸씩 이동도 되면서 건물부지 맵핑이 보도블럭 맵핑 위에 올라가있는 것 좀 어떻게 해보십쇼. 글자가 부족함
쿠키런: 킹덤,"너무나 흔한 수집형 RPG를 쿠키런, 그리고 자신만의 왕국 꾸미기라는 시스템으로 재미있게 탈바꿈시킨 게임. 초반이라 버그도 있고 난이도도 좀 높은 편이라 생각하지만 더빙, 그래픽, 최적화 모두 만족스럽습니다. 그동안 쿠키런은 오븐브레이크 이후 후속작들은 실패가 많았지만 이 게임은 그렇게 되지 않길 바라며... 앞으로도 재미있는 게임으로 있어주세요..! 이상 7챕터 3에서 막혀서 렙업중인 '더빌런' 입니다. 화이팅 😊"
쿠키런: 킹덤,"일단 게임 자체는 옛날 생산형 도시 건설형 게임, 요즘 유행하는 턴제같은 게임 특징등을 자연스럽게 잘 어우러져서 자연스럽게 하나의 칸텐츠로 만들었다는 점은 매우 만족스럽습니다. 게임 자체가 재미있고 화려한 액션으로 눈도 즐거웠습니다. 하지만 아쉬운 점이 있다면 최적화 관련된 문제입니다. iphone 12를 쓰는 유저의 플레이는 부드럽고 UI적 버그도 없는데 안드로이드는 기본적으로 긴 로딩과 버벅거리는 액션, 간헐적으로 생기는 UI 버그가 기종에 따라 조금에서 플레이 하기 어려울 정도로 불편하게 만듦니다. 핸드폰 자체 발열과 배터리 소모도 상당히 큰편이고 한마디로 안드로이드 os의 최적화가 상당히 불안정 하다고 보입니다. 이런 최적화만 잘 진행해준다면 만족스러운 게임이 될 것 같습니다. 뽑기형 게임에서 극악적인 확률은 평범하다고 생각되고 고티어를 노리지 않는 이상 굳이 현질을 할 필요까지는 생각 되지 않습니다. 유료 재화만을 사용한 가챠가 나오지 않는다는 조건이지만요."
쿠키런: 킹덤,장점 스토리 완성도 높음. 성우가 퀄리티 높음. 개성적인 캐릭터와 높은 퀄리티의 움직임. 좋은 그래픽 단점 끔찍한 수준의 최적화. 쿠키간 밸런스 나쁨. 하우징 기능의 완성도가 많이 부족함. 결국 전체적으로 낮은 게임성과 완성도. 마무리 게임성과 최적화만 부족하고 나머지는 훌륭함 근데 이게 부족하면 왜 해?...
쿠키런: 킹덤,많이 신경써서 만들었다는 느낌이나요! 더빙도 어색하지않고 캐릭터성을 잘 살린거 같아요 다이아도 모으기 쉽고 화질이 버벅거리는듯한 현상이 일어나시는 분은 설정에 들어가 프레임을 줄이면 좋아지실거에요 다만 퀘스트 완료나 아이템을 얻었을때 효과(?)같은게 화려해서 화면이 넘어가는게 느려서 간략화할 수 있는 설정이 있었으면 좋겠어요 골드도 이런저런 쓸모가 많은데 모으기가 힘든거 같은 기분이 들어요~
쿠키런: 킹덤,정말 좋은 게임입니다 1.무과금 유저에게도 크리스탈을 많이 퍼줌 2.모험하면서 나오는 스토리 3.중간중간 귀엽고 짜잘짜잘한 것들 4.과금유도 별로 없음 5.폭력성 없음 6.좋은 그래픽과 음악 7.디자인 좋음 8.재밌는 컨텐츠들 등등 엄청 많은데 이것들만 좀 고쳐주시면 완벽한 게임이 될 것 같습니다 1.중간에 있는 버그들(코드같은게 너무 많다보니 렉이 살짝 걸림) 2.메인게임에서 전투 끝나고 나가기 버튼과 다시하기 버튼의 위치 바꾸기(자꾸 잘못 눌러서 다시하기 버튼을 누르게 됩니다) 3.비효율적인것을 없애주기 ex)생산시설에서 나오는 롤케익 9개가 3개보다 더 시간이 오래걸림(비슷하게 해주세요) 게임 정말 재밌고 앞으로도 다양한 컨텐츠와 변함없이 지금 느낌으로 쭉 밀고 나가주시면 오래갈 게임입니다. 데브시스터즈팀 화이팅입니다!
쿠키런: 킹덤,"캐릭터들도 디자인적으로 매력적이고 재밌어서 잘 하고 있습니다. 다만 게임 내에서 '쿠키성' 레벨 상승을 위한 '환경점수'를 올리려고 건물들을 지으려 했는데,더 이상 건물들을 지을수 없다고 합니다. 공간도 충분하고 부족한건 쿠키성 레벨 뿐인데,이럴땐 어떻게 환경점수를 올릴수 있는지 궁금합니다!"
쿠키런: 킹덤,게임은 너무나 재밌습니다^^ (한 번하고나니 새벽 2시에 잠들었다는;;) 아무튼 너무나도 재밌는 게임이지만 더욱 성장하기에 필요한 요소들을 감히 조언 해드립니다. 1. 원근법 어..일단 게임 내에 건물을 설치할 수 가있는데요. 이때 직사각형이 완벽한 직사각형이 아닌 이상한 도형으로 보입니다. 또한 보면 어색한 부분들이 꽤나 있습니다. 따라서 이 문제 고쳐주셨으면 하네요. 2. 뽑기 확률 뽑기 확률이 낮아요.. 이건 전체 확률 업등을 통해서 매워주시면 감사하겠습니다. 물론 에픽등은 캐릭터 확률이 낮아야 하는건 알겠지만 체감상 너무 안나오면 유저들의 게임 흥미를 떨어뜨립니다. 그리고 원하는 캐릭터들이 안 나오니 게임의 흥미는 당연히 떨어지며 또한 좋은 성능캐릭터들이 없으면 스토리를 깨는데 있어서 등등 어려움이 생기게 됩니다. 3. 스토리 난이도 기본 권장량의 전투력보다 높음에도 불구하고 못 깨는 스테이지가 많습니다. 따라서 이 문제점들을 보충해주시면 감사하겠슴다!!
쿠키런: 킹덤,"게임 자체는 상당히 잘만들었다고 생각합니다. 그런데 정작 기타 편의적인 부분은 좀 신경쓰지 않은게 눈에 들어오네요. 우선 기본 설정부터 보면 그래픽이나 기타 옵션이 없습니다. 쿠키를 집어올릴때 울리는 진동을 끄는 기능조차 없어요. 그리고 60프레임이나 30프레임이나 차이가 별로 없을정도로 최적화가 부실하다고 생각해요. 분명 60프레임인데도 버벅거린다는 느낌이 드는데, 이걸 해결하기위한 그래픽 옵션도 없네요. 생산품 관리를 위해 월드맵과 왕국을 계속 왔다갔다 해야하는데, 그때마다 버벅거림을 느끼고, 화면을 움직이려 했는데 손을 댄 부분에 쿠키가 있으면 게임이 끊기며 화면이 움직이는 대신 쿠키가 잡혀서 옮겨지는등 기본 편의성 부분에 문제가 있어보여요. 또 양파맛 쿠키의 스킬은 심히 애매한게 스킬 발동후 약간의 텀 후에 공격판정이 들어가는데 이때 스턴이 걸리면 모션은 나오는데 스킬은 발동을 안하고, 스택은 그대론데 쿨타임은 돌아가는 기묘한 현상이 있네요. 이건 저지불가라도 있어야할듯"
쿠키런: 킹덤,수정됐으면 하는 부분이 많습니다. 확대 축소가 너무 한정적이고 건물 바닥 재질이 정해져있으니 어디에 놓아도 이질감 듭니다.. 바닥 타일을 깔 때 화면을 이동을 못해서 불편합니다! 그리고 다른 게임처럼 더이상 키우지 않는 캐릭터에 쓴 별사탕을 리셋하는 기능도 생기면 진짜 너무 좋을 것 같습니다. 후반에 가니 정말 별사탕 모으기 힘들어져서 그냥 귀찮아지고 하기 싫은 마음이 커서요!
쿠키런: 킹덤,"큰 버그가 몇 개 있습니다. 업데이트 전까진 이렇지 않았는데.. 1. 들어가면 가장자리 버튼들이 모두 안 보이는 버그 (다른 것으로 버그가 풀리는지는 확인하지 못했지만, 풍요의 분수를 터치하고 다시 되돌아가는 일시적으로 버그가 풀리는 것을 확인했습니다.) 2. 출석체크를 제외한 모든 퀘스트, 이벤트 보상이 받아지지 않는 버그 3. 길드 토벌전에서 게임오버가 됐을 때 게임이 끝나지 않고 나가지지도 않는 버그 4. 스토리 7-30단계에서 '보스 출현' 문구가 뜬 후 쿠키들이 앞으로 나아가지 못해서 보스를 때리지 못하는 버그 저의 폰 기종은 S8+이고, 보안폴더로 플레이하고 있습니다. 이런 버그 때문에 게임을 진행하기가 어렵습니다. 업데이트 전까지 게임을 너무 잘 즐기고 있던 유저기에 더욱 빨리 버그가 고쳐지길 기다리고 있습니다. 긴 글 읽어주시면 감사하겠습니다."
쿠키런: 킹덤,"그래픽도 좋고 음질, 성우도 좋으나 최적화 문제가 해결되지 않은 듯 합니다. 전작 쿠키워즈 때보다 렉이 더 심하며, 쿠키 전투력이 높아도 1~2 챕터에서 별 2개만 달성이 되버립니다. 이에 따른 패치를 부탁드립니다. 그러나 스테이지에서 자동전투로 지루함을 덜기위해 쿠키런도 포함시킨건 정말 흥미롭습니다."
쿠키런: 킹덤,"이 게임을 플레이 하고 있는 유저 입니다! 저는 정말 다 좋은것 같아요 많은 분들이 렉이나 재화 문제 하시는데 재화는 그렇게 얻기 어려운 편도 아니고, 생산품 생산 시간도 적절한것 같은데...렉은 접속자가 많아서 그렇다고 생각합니다 아니면 와이파이 문제거나.... 그리고 왕국 영토를 넓혀서 꾸밀수 있다는 점이 너무 좋아요!!!!! 근데 꾸미기 물건이 더 여러방향으로 돌릴수 있으면 좋겠습니다!"
쿠키런: 킹덤,"용량이 너무 큽니다 한 번 업뎃 할때마다 저장공간이 뭐이리 필요한지... 하루에 한 번 씩 들어가는데도 들어갈때 마다 리소스를 다운하고, 화면이 넘어갈때(?) 텀이 너무 길어요 발열이나 배터리는 왠만한 겜 다 엇비슷하니까 얘기 안할게요 위에서 말했던 것 빼고는 괜찮아요.. 캐릭도 귀엽고 목소리 듣는 재미도있고.."
쿠키런: 킹덤,"재밌다하여 실행해봤는데... 하하... 벌써 3번을 튕겼네요... 그것도 튜토리얼에서. 튜토리얼만 3번 하고있네요ㅠㅠ 그래픽 너무 이쁘지만, 영상이 계속 끊기네요... 제 휴대폰 문제인걸까요...? 그래도 그래픽이랑 성우진 분들은 진짜 잘 뽑으신 것 같아요...! 문제 사항 한번씩 봐주시면 감사하겠습니다!"
쿠키런: 킹덤,"게임도 정말 재밌고 캐릭터들도 귀엽고, 성장해가는 재미가 좋습니다. 하지만 최적화에 문제있어 로딩시간이 비정상적으로 길고, 게임시 그래픽옵션이 없어 저사양 기기로 플레이하는데 문제가 있습니다. 고사양 Pc로 즐길때도 로딩이 긴 문제가 있지만 아주 잘만든 게임임에 틀림 없다고 생각됩니다."
쿠키런: 킹덤,"재밌어요! 제작사에서 엄청난 공을 들인게 확연히 보일맘큼 스토리도 섬세하고 전체적으로, 세부적으로도 잘 갖춰져있습니다. 다만 개인적으로 아쉬운 점은 접속 시 100% 튕긴다는 겁니다. 최신 디바이스와 와이파이 다섯 칸에서도 이건..계속 이러니 꽤 불편하네요. 개선될거라 믿겠습니다:)"
쿠키런: 킹덤,"왕국 꾸미기 요소들은 계속 추가되는데 꾸미기에 유용한 기능들(배치 슬롯, 건물 일시적 회수, 꾸미기 아이템 찾기의 편의성, 건물 아래 잔디 변경 등)이 없어서 너무 아쉽네요. 이러한 기능들이 추가되어서 왕꾸가 조금 더 편해졌으면 하는 바람입니다. 항상 재밌게 플레이하고 있어요. 감사합니다~"
쿠키런: 킹덤,"게임은 확실히 잘만들었단 생각이 듭니다. 쿠키런 캐릭터들이라 낯설지 않구요. 하지만 새 게임이라 아직 최적화가 덜 된건 같네요.... 휴대폰으로 돌리는데 계속 튜토리얼에서 튕겨서 컴퓨터로 게임을 돌리는데도 스킬을 쓸때마다 멈춤 현상이 있네요.. 하루빨리 갓적화해서 갓겜으로 등급합시다!! 지금 평점 낮은 리뷰들을 보면 버그, 렉등의 문제가 많으니 빠른 최적화가 1순위인것 같네요! 쿠키런 화이팅~"
쿠키런: 킹덤,다이아나 코인 모으는 방법이 쉽고 다양해서 좋아요. 자동 전투 기능이랑 전투 배속 기능도 있어서 편하고 무과금으로 예쁘게 꾸밀 수 있기도 해서 좋은데 꾸미기를 할 때 타일을 깔고 그 위에 건축물을 놓으면 건축물의 잔디 부분이 타일을 가려서 그 부분이 아쉽네요. 그래도 다른 점은 다 좋아서 별점 5점 드렸습니다!!
쿠키런: 킹덤,편집에 편의 기능을 추가 해줬으면 좋겠는 바람입니다. 편집이 너어무 불편합니다. 매우 엄청 완전이요. 여러가지의 꾸미기건물들을 한 번에 깔거나 지울 수 있는 일괄 선택이나 일괄 해제 또는 일괄 판매 같은 기능이 있었으면 좋겠습니다. 그리고 꾸미기 건물들이 붙어있으면 일일이 하나하나 클릭해서 편집 하는 것이 아니라 첫 번째 건물을 보관함에 넣으면 두 번째 건물도 버튼이 활성화가 되게 만들어주셨으면 좋겠습니다. 마을 꾸미는 것도 하나의 재미요소인데 편집이 너무 불편합니다. 진짜 너무 불편해서 짜증이 날 정도입니다. 개선이 있었으면 좋겠습니다.
쿠키런: 킹덤,"솔직하게 재밌습니다 재미있어서 벌써 10만원 정도 현질을 했을 정도입니다 하지만 불편한 점이 있어 이렇게 리뷰를 남깁니다. 성을 코디할때 불편한 점이 있습니다. 첫번째로 건물방향이 오직 아래쪽과 왼쪽만 향하도록 설정이 되어서 성을 꾸밀때 많은 불편함이 있습니다. 4방향 모두 향하였으면 좋겠습니다. 두번째로는 건물로 시아가 가려지는 곳 등에 장식품(나무,의자,꽃 등등)을 배치하고 싶으나 투명도가 설정되어 있지 않아 배치할때 굉장히 불편합니다. 이런 이유로 평점 4점을 드립니다. 근데 게임은 기대 이상으로 재미있어서 감동했습니다😊"
쿠키런: 킹덤,"안녕하세요.쿠키런 킹덤을 사용하고 있는 플레이어입니다.일단은 모든게 다 좋고 처음 앱을 깔고 시작할때 부터 애니메이션 같은게 상영(?)되어서 매우 좋았고요.그리고 많은 장점도 있지만 단점도 조금 있습니다. 1.건물을 건설할때 동서남북으로 자유자재 만들고 싶습니다.근데 정면과 옆으로만 건설할수 있더라구욤..그러면 영토를 확장해도 건물은 되게 불편하게 배치가 되서 그 점이 가장 아쉽습니다.2.전투준비할때 인원 수가 5명 밖에 안 되는지 궁금하구요!전투를 하기 전에 캐릭터들을 배치하는게 있는데,배치를 할때도 굉장히 불편합니다.손으로 끌어서 캐릭터를 배치 하면 좋은데 버튼(?)같은걸 눌러서 배치하더라구요.그 점에서 그렇게 고쳐주시면 좋겠습니다.3.전투를 할때 적이 한 명인데 공격을 하는 수가 있죠.하지만 공격을 하죠?죽었죠?그래도 캐릭터는 공격하더라구요.적이 아무도 없는데 공격을 하는게..오히려. ..더 불편합니다.;;...이상 마치겠습니다."
