game,review
퍼펙트 아레나,평점 4.6이라는게 이상할 만큼 최악의 게임. 평점 조작이나 보상으로 평점 유도 했을터... 일반 양산형 대전 게임인데 그래픽은 10년전 보다 못하고 페이지 넘어갈때 마다 잦은 로딩 버벅거림에 조잡한 인터페이스로 인해 게임 몰입도가 아예 없는 수준. 게임 진행이 굉장히 느리며 빠른 스킵 가속 배틀이 없어 굉장한 답답함을 유발 시키며 스킬 타격감 모두 최악인 말 그대로 게이머를 호구로 보고 돈만 뽑아 먹을 생각으로 출시한 게임인듯. 단점은 많으나 장점은 1도 없는 양산형중에서도 최악의 게임 30분 해보고 바로 삭제 합니다.
퍼펙트 아레나,쉽고.빠르고.재미지다. 재미난게임 퍼펙트아레나~~ 감사합니다. 컨텐츠가 많아 몰입도가 상당하네요. 열심히 하고 있습니다. 근데 요거 PC에서도 가능하네요. 어라~~ 멍미? 하믄서도 플레이 하고 있습니다. 사무실서 휴대폰 돌리믄 좀 눈치라. 컴터로 살짝쿵 플레이 하고 있습니다. 물론 플레이 안해도 성장하지만 보는 재미가 있어서요.ㅋ 계정 두개 돌려가믄서 해도 되겠네요. 즐거운 컨텐츠 듬뿍 만들어 주시길.. 뽜이팅입니다.
퍼펙트 아레나,튜토리얼 하는데 전투는 너무 심각하게 느려서 답답할 정도고 계속 몇초 멈췄다가 공격하고 인내심 테스트네요.. 참고 해볼려했는데 도저히 지루해서 못하겠어요 게임 스킬 임펙트도 없고 타격감도 없고 겜 전장 그래픽도 살짝 떨어지네요 전투 속도 향상 시키면 그때 다시 한번 해볼게요.
퍼펙트 아레나,컨텐츠가 다양해서 즐길거리가 많아요 좀 할게 많기는 하지만 투력이 되면 빠르게 넘어갈수있도록 된 부분도 있어서 편했습니다 다만 과금요소를 조금만 줄여도 충분할텐데하는 아쉬움은 존재하구요 게임을 오래하는 분들도 혜택을 받을수있는 출석보상을 조금만 더 강화해주셔도 좋을듯 합니다
퍼펙트 아레나,제작사가 중국인지 대만인지 모르겠지맛 나름 괜찮습니다. 무과금으로 하기에는 진행상 끊기는 부분 많긴 합니다. 무과금으로 꾹 참고 하실분 하시면 됩니다. 일단 아무생각없이 그냥 깐 타 게임에 비해 2주째 하고 있습니다. 여타 게임이 그렇듯 갈수록 장벽이 심해지긴 합니다. 무과금으로 3주째 삭제할듯.
퍼펙트 아레나,"리뷰처음남기는데 진짜 오랜만에 재밌는 게임 찾아서 즐겁게 하고있어요, 초반에 많이 퍼주고 이벤트도 많아서 어느정도 덱 맞추고 현재 컨텐츠 즐기고 영웅 키우면서 하고있어요. 재밌는 요소가 곳곳에 있어 시간가는줄도 모르고 하고있네요. 다들 초기인 지금 주는거 많이 받으시고 게임해보세요. 갓겜!"
퍼펙트 아레나,전투가 느린데 배속 옵션이 없길래 뭐지 이 구시대적인 게임은? 이라고 생각했지만 거기서 나가도 실시간으로 전투가 이어지는 걸 알고는 한 번에 여러 컨텐츠를 할 수 있어서 숙제가 지루해질 틈조차 없게 만든 이 발상이 기발하다고 느꼈다. 겜 출시한지 얼마나 됐다고 벌써 전투력이 수백만인 사람들이 많이 보이는 걸 봐선 과금 효율이 괜찮은 모양인데 무과금으로도 꽤 할만 하다. 다만 밸런스는 좀 별로인게 몇몇 광역 딜러는 너무 약해서 단일 딜러에비해 장점이 없다고 느껴진다. 그리고 업글하는데 드는 재료 개수가 상당해서 무소과금은 어느순간부터 스팩업을 못해서 급브레이크가 걸리고 마는데 이건 뭐 AFK아레나류 게임에선 정도의 차이가 있을 뿐 어디서나 있는 문제점이라 이것이 터닝 포인트가 돼서 과금을 유도하는 시스템이니 이해는 된다. 한가지 확실한건 천천히 할만한 게임이라는 것
퍼펙트 아레나,아직 초반이라 그런지는 모르겠지만 전반적으로 게임이 루즈하지않고 빠르게 진행됩니다. 원하는 영웅 장비도 쉽게 얻을 수 있어서 무과로 진행하는데 큰 무리없습니다. 간만에 재미있는 게임하는것 같네요.
퍼펙트 아레나,"20년전 웹게임 수준에도 한참 미달인 게임입니다. 현 게이머들 눈높이에 못 맞출 것이란 건 그 누구도 쉽게 예상 할 수 있음에도 오픈을 했다는 건 이 게임의 오픈 목적이 다른 곳에 있다는 걸 의미 합니다. 첫째로 게스트 계정을 지원하지 않습니다. 구글 계정 외 로그인이 불가능합니다. 두 번째로 게임 탈퇴(회원 탈퇴)를 지원하지 않습니다. 셋 째 ""중국"" 위 세 가지만 봐도 개인 정보 수집이 목적이란 걸 알 수 있습니다. 시작도 하지 마시길."
퍼펙트 아레나,게임을 보통보면 현질유도한게임도 많구 이벤트도 부실합니다 하지만 이게임은 현질러만큼은 따라갈순없겟지만 시간만 투자하면 될정도로 이벤트도 받고 보상도푸짐합니다 정말퍼주는 느낌이랄까요^^ 지금투력이 5천만이넘엇네요 무과금으루요 이정두만되두 충분히즐깁니다 지금여기서 시간을더투자하면 더오를테구요 정말 시간가는줄모르고 즐기는게임 퍼펙트아레나 강추합니다
퍼펙트 아레나,"확실히 재밌음. 최근 겜 중 가장 할만 하다고 생각함. 무소과금도 즐길만하고 랭킹도 나름 들만함. 다만 아직 인터페이스가 확실히 안눌려서 뭐를 누르면 스크린이 내려감. 중국겜이라 앞으로 운영이 걱정되는데, 그 부분만 신경 써주면 좋겠음"
퍼펙트 아레나,리세마라가 재미있으면 이거 한번 잡숴봐! 많이 퍼주고 단계별로 뽑기 기회가 진짜 많아요. 저는 여러 서버를 거치면서 많은 캐릭과 덱을 경험해봤습니다. 리세마라가 즐거운 컨텐츠라고 생각한다면 이겜 잘맞으실거에요.
퍼펙트 아레나,친구따라했다가 그래픽이아닌 게임성으로 한번 손대면 멈출수없음. PC에서 크롬같은 인터넷 브라우져로 하는게 더 클릭도 쉽고 좋으네요
퍼펙트 아레나,퍼펙트 아레나 컨텐츠도 많고 이벤트도 다양하며 되게 의외로 재밌고 영웅들 모으는 취미 있으신 분들이라면 강추 !! 저는 완전 재밌게 하고있슴당~
퍼펙트 아레나,쉽고 재밌는거 같습니다 무엇보다 현재 이벤트 진행중이어서 그런지 무소과금이어도 챙길 수 있는건 챙겨갈 수 있는게 정말 좋은거 같습니다~
퍼펙트 아레나,라퓨타 신섭 하고있습니다 근데 충전을 햇는데 결제만 완료되구 왜 물품은 안주고 다시 충전해야되는건지요? 빠르게 활성 부탁드립니다
퍼펙트 아레나,로딩...로딩...로딩때문 접겠음. 지금것 하던것 때문 그나마 2별....통신환경이라는 답정너 회피식 매크로 답변 줄바에는 그냥 답변 주지 마세요.
퍼펙트 아레나,소과금으로 하고 있지만 무과금으로도 충분히 즐길수 있네요~ 오랜만에 재미난 게임 만나서 좋아요
퍼펙트 아레나,무심코 하게되었는데 직접 플레이 해보니 너무 재밋고 방치중에도 계속들여보게되는 마성이 있습니다요~~!!
퍼펙트 아레나,"게임은 괜찮은거같은데, 보스도전 할때 1초에 한번씩 때리는게 아니라 끊기면서 시간초는 안지나나고 잠깐 5~10초 멈췃다가 싸우고 그러는데 동시접속 많아서 그런가요? 확인 조치 빠르게부탁드려요^^"
퍼펙트 아레나,여러 방치겜 해봤는데 이것저것 많고 재밋어요 다른 겜이랑 달리 투력때문에 진도가 막히는게 아니라 작위때문에 진도가 막히는건 조금 불편하긴해요
퍼펙트 아레나,"첨에 오픈하고 했었는데 버벅거림이 넘심해서 바로삭제했었는데 요즘할게마땅히 없어서 다시해보니 많이 개선되었네요.. 영웅,다야 수급도잘되고..시간때우기좋아요"
퍼펙트 아레나,화면 자동 잠금화면으로 꺼지는거 절전모드를 만드시는게 많이불편해요 그리고 터치 버튼 진짜누르기힘들어요 선택 터치버튼 몇번눌러야 한번 되고.... 문제점 보강좀 해주세요
퍼펙트 아레나,서버 점검 공지도 없시 하는곳은 오랜만에 봄 현금 쓴사람들 대우도 못 받고 언제 접속되나 기다려야 하실듯
퍼펙트 아레나,재밌습니다. 과금없이 플레이하는데 조금 부족하긴해도 점점 강해지는 맛이 있네요. 신역전장 기회를 많이 늘려주면 좋겠어요 새로운 영웅 쓰는 맛이 있거든요
퍼펙트 아레나,"부담없이 플레이하기 좋아요. 조작도 편하고 시스템도 복잡하지않고, 폰이 구형인데 폰에 부담도 가지않는지 발열도 적어요. 게임 재밌고 캐릭도 이쁨!!!"
퍼펙트 아레나,이런종류의 게임류을 많이 해봤는데.이만한 게임이 없는것같습니다.쿠폰도 적당히 주고 과금을 안해도 느긋하게 즐기면서 하면 왠만한건 다할수 있네요
퍼펙트 아레나,퍼펙트아레나 완전 혜자 겜입니다. 어플도 가벼워서 쉽게 돌아가요~ 강추합니다
퍼펙트 아레나,터치가 좀 잘 안먹히고 종료하고싶어서 뒤로가기누르는데 종료문구도 안떠서 홈버튼 눌러서 나가야하는 번거로움이 있음 그것말고는 겜자체에 만족하는중입니다 과금요소가 많긴하지만 무과금도 적당히 재미볼수있을정도로 많이퍼줌
퍼펙트 아레나,생각보다 재밌어요! 자동사냥이긴이어서 그냥 멍하니 보긴 하는데 캐릭터 수집하는 것도 재미있고 보상도 딴 겜보다 너무 잘줘서 좋아요!
퍼펙트 아레나,그래픽은 물론 움직임도 이상함 게임하면 렉과함께 끊김은 옵션임.. 이런 게임이 왜 4.7점인지 이해가 안가는 게임.... 평점 좋게쓰라고 알바라도 푸셨나..ㅋㅋ
퍼펙트 아레나,"푸짐한 이벤트, 빠른 속도감, 다양한케릭, 빠져들만하네요 이제갓시작햇지만 앞으로계속하게될것같습니다 좋은운영부탁드려요"
퍼펙트 아레나,"게임을 이어 나가기가 어렵다. 캐릭 렙업도,장비 업글도, 콘텐츠도 개운치 않다.좀 더 신경 써 주셨으면 좋겠습니다."
퍼펙트 아레나,재화 많이줌 과금효율 좋음 그래픽과 시스템 양산형 뽑기확률 ss급은 잘 나옴 afk아레나 보다 먼저 나오거나 나오자마자 2 3번째로 나왔다면 혜자 갓겜으로 불릴뻔 했으나 시기를 많이 놓침 스킬도 비슷비슷한게 많고 전장이 걍 뒷배경 느낌이라 캐릭터가 그 위로 겹칠 때가 있음 vip3까진 의무적으로 올려야 되는 게임 초반에 뽕뽑고 빤스런이 우려됨 서비스 1년에서 길어봐야 2년 봄
퍼펙트 아레나,최근 나온 방치형게임 중에서 단연 쵝오예요~!! 현질만 유도하는 방식이 아니라 좋고요~ 수집형RPG의 기본이 잘 갖춰져 있어요!
퍼펙트 아레나,초반진행하고 있는데 생각보다 재미있습니다. 찍먹해볼려구 게임설치하고 5분만 해봐야지 맘먹고 설치했는데 시간가는줄 모르고 쭈욱 게임 하고 있네요. 할까 말까 망설이신분들 일단 5분만 해보세요 생각보다 재미있습니다. ^0^
퍼펙트 아레나,방치게임중에 제일 괜찮은듯 싶네요 우선 캐릭터들이 스킬쓰는 재미때문에 더 할만합니다 컨텐츠도 다양하고 보상도 빵빵하게 주네요 이게임은 꾸준히 할거 같네요
퍼펙트 아레나,아직 처음이라 많이 알수 없어요 혼자 가능한한 게임? 현 유도 조금 있지만 초반이라 잘 모르겠네요 재미라고 하기는 뭐하고 카드게임에서 진화했다 정도 조금더 해보고 평하고 싶었는데..
퍼펙트 아레나,최근 이런 게임들 많이 해봤지만~~퍼펙트아레나가 최고네요. 초반 몰입감이 최고입니다. 인터페이스도 아주 깔끔하게 잘되있고...우선 너무 게임이 너무 잼나요^^ 번창하시고~~업데이트 잘부탁드립니다
퍼펙트 아레나,보상이 엄청 후해서 과금을 안해도 충분히 할만하다 그래픽이나 이펙트 같은건 떨어지지만 뽑기확률도 좋아서 이것만 빼면 나쁜점을 찾을수가 없다 만족함
퍼펙트 아레나,"일단, 영웅이 확실히 차등 되있어서 좋흡니다 캐주얼 겜이라 부담도 없고 어렵지도 않고 무엇보다 빠른 진행이 좋습니다"
퍼펙트 아레나,방치형게임이고 다양한 캐릭터와 깔끔한 인터페이스로 초반 흥미를 갖게 해주셨네요 일단 재밌습니다 추천드려요~
퍼펙트 아레나,광고랑 다르다. 제우스 를 주지만 꼴랑 3일용이다. 특이한건 중국 게임 인지 신들 보다 중국 장수가 티어가 높다. 일단 할만 하다
퍼펙트 아레나,방치형게임도 요새 너무많은데 크게 다를건없지만 뭔가 묘하게 중독성이 있네요. 꼭 휴대폰으로 안해도 웹에서도 되니까 이것도 너무 좋구요. 한번은 해볼만한 게임입니다.
퍼펙트 아레나,퍼팩트아레나 정말 재밌어요 rpg게임을 좋아하는데 이건정말 언제해도 재밌고 쉽게 플레이할수있어서 너무좋은거같아요
퍼펙트 아레나,오랜만에 할만한 게임 찾았네요. 무과금으로도 다이아 수급이랑 영웅수급이 쉬워서 할만함!!
퍼펙트 아레나,뽑기권겁나많이줌 진행이 수월함 But 필요없는 케릭이 대부분임.. 케릭 밸런스 수정이 필요할듯합니다
퍼펙트 아레나,평점 조작질 심하게했네 2022년게임이 아니라 2012년 게임 그래픽 타격 ui 전부 최악 들어가자마자 패키지만 수십개 정붙이기 전에 게임수준과 과금상품들에 없던 정도 떨어짐
퍼펙트 아레나,수집형 모바일게이을 찾는중에 이게임을 접하게됬는데 처음 시작하고 지금까지 하고있습니다 과금없이 보상도 많이주고 게임도 재미있어요
퍼펙트 아레나,VIP 등급이 꽤나 많은 과금을 필요로 하긴하나 무소과금으로도 충분히 즐거움을 가질수 있는 소재가 많네요 모험은 좀 더 세분화해서 여유롭게 즐길수 있으면 좋겠고 배속은 있었으면 좋겠어요 😀
퍼펙트 아레나,게임구성도나 컨텐츠는 좋은거 같습니다. 자동사냥 기능은 무과금으로도 할수 있게 해주셧으면 더 좋았을거 같습니다.
퍼펙트 아레나,시작한지는 몇일안됐지만 방치형이란게 마음에 들어 하고있습니다 하다보니까 보상도 그렇고 꾸준히 해야할것들이 있더라구요 아직은 좀더 해봐야알겠지만 현재까진 만족하면서 즐기고 있네요~'~'
퍼펙트 아레나,흠 잡을때 없이 퍼펙트한 퍼펙트 아레나!!개 재밌다 ㄹㅇ 그리고 무과금도 충분히 즐길수 있을 정도로 이벤트가 많은편임
퍼펙트 아레나,소통 없는 게임이니 안하는 걸 추천한다 문의해도 아무런 답변을 받을 수 없고 버그도 못 고치는게 확실하다 개발 능력이 없다
퍼펙트 아레나,심심풀이용으로 좋으며 과금요소는 많으나 무과금으로 즐기기에도 충분합니다.
퍼펙트 아레나,쉽고 재밋게 할수 있는 게임이네요~좋은 영웅 많이 얻을수 있게 이벤트도 많이 부탁드립니다 화이팅~~!!
퍼펙트 아레나,재미있습니다. 다 비슷한 게임일 수 있지만! 최적화가 잘되어있고 유저들의 말을 귀담아듣고 정말 CBT때 건의한 필요한부분들 패치해줍니다.
퍼펙트 아레나,게임할때 항상켜기가 안되나요 15초되면 꺼지네요 게임할때 항상켜질수있게 추가해주세요 부탁드립니다 그리고 재미는있네요
퍼펙트 아레나,천천히 수집해서 성급 올리는 재미로 하고 있습니다! 아직 늅늅이라 닫혀있는 콘텐츠 기다리는 중~
퍼펙트 아레나,난렉걸린적도 느린적도 없는데.. dc월드하고 퍼펙아레나 두개 하는데 힘들어서 뭐지울지생각하다 스킵많고 보상많은 퍼펙아레나를 남기기로했음. 딱하나 단점 ... 화면클릭이 잘안되서 혈압오름.
퍼펙트 아레나,"인간적으로 하루에서버몇개를만들어요 서버당 사람없어서 재미가없는데 10개식 통합이라도해주시던가 한섭에 사람 고작30,40명 해도해도넘한거아니요"
퍼펙트 아레나,3일짜리 게임. 이벤트로 제우스3일짜리 주는데 사라지면 무과금은 모든컨탠츠가 막힘 ㅅㄱ. 단 뽑기에 자신있는 금손들은 무과금도 충분히 할만한듯
퍼펙트 아레나,할게 없어서 다운받고 겜해보니 갓겜!! 나같이 뽑기 좋아하고 좋은거 뽑을 때마다 광대승천하는 분들께는 강추드립니다! 퍼펙트아레나 정~말 퍼펙트합니다
퍼펙트 아레나,"ㅎ ㅏㅇ ㅏ........왜 세로게임? 좀 할만한 게임 인가 하면 세로게임 이네...삭제를 해야할지,,,게임진행도 슬로우 비디오 인줄 버벅버벅,,서버도 읍고 그냥 개인컴터를 서버로 쓰는거 아닌가,,그 므시냐 프리섭 같은 식으로,,,답답하다"
퍼펙트 아레나,야....이게임....중국게임같기는한거같은데...ㅋㅋ 히*로즈테일즈게임이랑은 다르게 엄청퍼주고 이순신 UR도주네...ㅋㅋ 이순신 영어로 쿠폰치면 주는거 좋고 ssr확율도좋아서 지금해도좋은게임 (리뷰조작아님 자꼬 그러는 사람이 있어서)암튼 시간 때우기에는 좋은(앞부분에서는 스토리노가다해서 쿠폰치고서 깨는게 좋아여)게임
퍼펙트 아레나,아주~ 시간가는줄 모르게 재밋게 하고있어요 초보자도 쉽게 할수있어서 좋아요~
퍼펙트 아레나,이주아주 재미있어요 그리고 게임이 친절함 ㅎㅎ운영자도 친절함 홈페이지에 보석 수급처 정리도 해놓으심 ㅋㅋㅋ
퍼펙트 아레나,1위에는 리뷰가 있는 듯 합니다 무과금 과금러 상관없이 각자 즐겁게 즐길 수 있고 중독성도 강합니다 강추합니다!
퍼펙트 아레나,디자인도 깔끔하고 컨텐츠도 많은거같고 신규보상도 많습니다 재밌게 하고있어요~
퍼펙트 아레나,현충일 매일쿠폰 동일유형 상한이라고 적용안됨 난 원래 한번만 되는줄 알았는데 나머진 다 받아지네??? 빨리 해결해주소 적용못한 기간까지 다 풀어주고
퍼펙트 아레나,근래 찾아보기 힘든 착한 게임이에요 무과금도 충분히 즐길수 있게 잘 만들어졌네요
퍼펙트 아레나,케릭 키우는 재미와 다야한 컨텐츠 즐기는 재미가 있습니다. 천천히 키울만 합니다.
퍼펙트 아레나,주는 영웅뽑기가 많아서 좋네요. 초반에 3일사용가능한 제우스를 사용해보니 제우스가 좋네요.
퍼펙트 아레나,리뷰 잘 안남기는데 오랜만에 할만한 게임을 찾은거 같아요 시작할라면 지금시작하는게 맞는듯 즐겜하러 갑니다.
퍼펙트 아레나,시간가는줄 말고 재미있습니다. 보상도 많고 전개도빠릅니다
퍼펙트 아레나,기본 툴은 방치형 게임이나 컨텐츠가 많아서 지루하지 않네요. 좋아요
퍼펙트 아레나,아직 초반인데 영웅들도 많이주고 컨텐츠가 많아서 즐기기 좋아요~
퍼펙트 아레나,진짜 무과금으로도 충분히즐길수 있는게임입니다 하루종일 시간가는줄 모르고하고있어요! 완전강추합니다
퍼펙트 아레나,뽑기권도 많이주고 초반에 키우는게 너무 재미있네요~ 오랜만에 할만한 게임인듯^^/
퍼펙트 아레나,재미있네요 다양하게 캐릭터를 키울수 있고 제우스를 무료로 지급해줘서 빠르게 플레이가 가능하네요
퍼펙트 아레나,뽑기권 많이주고 뽑을때마다 ss가 나와서 좋습니다 역시 이런겜은 뽑기가 재밌어
퍼펙트 아레나,방금 설치했는데 화면 터치하면시작한다더니 먹통~ㅎㅎ 겜 하지말란가봅니다.삭제
퍼펙트 아레나,너무 재밌게 잘하고있습니다. 소과금으로도 충분히 만족할만한 덱을 짤수있네요. 뽑기 확률도 높고요.
퍼펙트 아레나,진짜.. 인생 게임을 만난 것 같음 할 때마다 시간 순삭되는 마법을 볼 수 있음 진짜 띵작!!
퍼펙트 아레나,최근에 한 게임 중에서 제일 재미있어요! 시간을 두고 천천히 할만한 겜 같아요
퍼펙트 아레나,초반에 각종 보상이 어마어마해서 무과금으로도 충분히 즐길수있고 하고있으면 시간가는줄 몰라요!!! 갓겜
퍼펙트 아레나,퍼펙트아레나 정말 기대안했는데.. 혜자스럽고 하면할수록 컨텐츠도 넘쳐나고 재밌는거같애요 ^^ 갓겜 흥하세여 ~ ♡
퍼펙트 아레나,단순하면서 재밌고 영웅이랑 이벤ㅇㅣ 진짜 혜자에요 무과금도 충분히 즐길게임!!
퍼펙트 아레나,직장인이라서 자주 확인이 안되는데 바쁜 하루속에 소소한 재미입니다^^ 너무너무 재밋게 하고있습니다
퍼펙트 아레나,부담없이 하기에 좋습니다. 각종 이벤트들도 많이 하고 재미있습니다.
퍼펙트 아레나,빠르고 재미있습니다 무과금도ㅠ할만한거 같고 오래 하고싶은 게임이네요
퍼펙트 아레나,폰에서하다가 PC에서도하다가~ 요즘 할게임없어서 방황했는데 구글 1위길래 다운받았다가 재밌게하고있어요
퍼펙트 아레나,"ㅋ ㅋㅋㅋ이 게임깔지마요 재미도없고 그리고 광고좀 줄여요 끝나지도않았는데 4,연속"
퍼펙트 아레나,뽑기를 원없이 할수 있어서 좋습니다 방치형중에 제일 할만한것 같아요 재밌습니다
퍼펙트 아레나,렉은 조금있는데 재화 많이퍼줘서 좋아요. 갠적으로 이런 rpg많이해봤는데 아직까진 할만함
퍼펙트 아레나,터치가 잘 안되는 부분이 가장 신경쓰이는 부분이지만 전체적으로 무난~~~
퍼펙트 아레나,간만에 잼있는 게임발견~ 시간많이 투자안해도 즐길수 있는 게임
퍼펙트 아레나,"간편한 조작과 여러가지 컨텐츠, 무과금도 쉽게 할수있는 갓겜"
퍼펙트 아레나,퍼펙트 아레나 방치형 게임이라서 너무 좋아요 가끔 팅기거나 다시 연결중 뜨지만 왜 그런지 모르겠네요
퍼펙트 아레나,출시 축하 합니다~ 많이 기대한 만큼 게임도 잼있고 이벤트도 다양하고 보상도 많이 주네요^^
퍼펙트 아레나,정말 재밌게 하고 있어요~ 부담없이 소소하게 즐기기 좋은거 같아요!
퍼펙트 아레나,캐릭터 디자인은 마음에 드네요...다만 서버랙좀 빨리 고쳐주세요~
퍼펙트 아레나,간만에 오래할 만한 게임 만났습니다. 진입 장벽 낮습니다.
퍼펙트 아레나,무과금도 할수 있는 멋진게임입니다. 차곡차곡 캐릭모아가는 재미가잇네요. 쿠폰도 좋습니다^^
퍼펙트 아레나,방치형 게임은 이벤트가 중요한데 퍼주니깐 너무 좋네요 대 만족입니다.
퍼펙트 아레나,심심풀이용으로 좋으며 과금요소는 많으나 무과금으로 즐기기에도 충분합니다.
퍼펙트 아레나,가볍게 즐길 수 있고 컨텐츠가 많아서 재밌게 즐기고 있어요
퍼펙트 아레나,가볍게 즐길 수 있어서 좋네요! 오래 할 수 있는 게임이었으면 좋겠습니다.
퍼펙트 아레나,한번 시작하면 시간가는 줄 모르고 하게 됩니다. 그만큼 재밌고 쉬워요!
퍼펙트 아레나,화면이 왜어둡나요 자체가 너무어두워서 게임을할수가없는데 어떻게해야되나요 답답해서못하겟네여
퍼펙트 아레나,지금 까지 해본 방치형 RPG 중 최고봉 굿 굿 별점 10개도 아깝지 않네요
퍼펙트 아레나,근래 해본 게임 중 제일 재밌게 한거 같네요. 계속 흥했으면 좋겠네요.
퍼펙트 아레나,게임방식이나 스킨은 좀 구리지만 게임방식자체나 이펙트는 화려하고 좋네요
퍼펙트 아레나,와 근데 확률은 보기좋은 겜이지만 그 로딩 자꾸 뜨는게 아쉽네요 쪼큼
퍼펙트 아레나,첫화면에서 화면을 터치하라는데 터치해도 화면이 안 넘어간다.
퍼펙트 아레나,직접 플레이 해봤습니다. 평점이 높은 이유가 있습니다. 직접 해보세요^^ 저는 개인적으로 밀스 정말 좋습니다!
퍼펙트 아레나,생각보다 재밌어요; 그냥 무지성 재화 한바가지 받기 무한뽑기 이런거 해보고싶은 심심한분들 한번 깔아보세요 ㄱㄱ 캐릭터도 이쁨
퍼펙트 아레나,즐겁게 플레이하고 있습니다. 장수 게임으로 남도록 좋은 관리 부탁드립니다~
퍼펙트 아레나,점점갈수록 고급 뽑기에선 SSS캐릭터를 못보고 SSS조각으로 뽑았는데 가서보니 없고 이게 뭐죠?
퍼펙트 아레나,S5. 영원의아이언 / 조금 오래된 게임이지만 생각보다 재미있습니다. 쿠폰 좀 많이 뿌려 주세요. 번청하세요.
퍼펙트 아레나,무과금도 쉽게 즐기수 있는 게임 입니다. 퍼팩트 합니다.
퍼펙트 아레나,생각보다 잘만들어진 게임입니다. 기본에 충실한 방치형 게임
