game,review
퍼펙트 아레나,적당 수준에서 즐기려고 하면 소과금으로도 충분히 즐길 수 있는 것 같아 괜찮은것 같네요.
퍼펙트 아레나,돈빨아쳐먹을 생각하지말고 렉이나 잡아라 모바일 게임에서 공격안하고 멍하니 서있는거 처음본다
퍼펙트 아레나,원소공명상태해제방법좀요 레베이100에서 못넘어가요 원소공명때문에 답답
퍼펙트 아레나,심심하면 그냥 생각 안하고 할수있는 겜인듯. 현질없어도 잘 즐길수 있고 지루하지 않은 게임
퍼펙트 아레나,대박 ! 재미있네요. 너무 재미있어서 시간가는 줄 모르고 하는중입니다. 항상 번창하세요! 정말 최고임!
퍼펙트 아레나,눈과 손을 떼기 정말 어렵네요ㅋㅋ 간단한데다 궁극기도 화려해서 재미있네요
퍼펙트 아레나,오픈한지 얼마 안되어서 그런지 몰라도 이벤트가 풍성함.. 갓겜이될듯 👍👍👍
퍼펙트 아레나,관문진행 가끔 막힐때 한번씩 모아둔 재화쓰면 쭉쭉 뚫리는게 재미있네요
퍼펙트 아레나,게임자체도 정말 잘 만들어졌고 진행할수록 강해지는 캐릭터를 보면 정말 할 맛이 납니다
퍼펙트 아레나,간단하면서도 빠질수밖에 없는 게임 강추합니다 저렴하게 하거나 무과금 가능
퍼펙트 아레나,지인 따라 시작했는데 게임이 간단하고 경쟁하기 좋은 컨텐츠로 잘만들어진것 같아요.
퍼펙트 아레나,지인 따라 시작했는데 게임이 간단하고 경쟁하기 좋은 컨텐츠로 잘만들어진것 같아요.
퍼펙트 아레나,심심풀이용으로 좋으며 과금요소는 많으나 무과금으로 즐기기에도 충분합니다.
퍼펙트 아레나,저는 이 게임을 아주 잼있게 즐기고 있습니다. 보상도 좋고 성장하는 것도 재미있고 좋습니다.
퍼펙트 아레나,관문 진행해서 컨텐츠 열릴때마다 지루한거보단 점점 더 재미있어지네요
퍼펙트 아레나,클베때 영웅뽑기가 재미있어서 정식서비스때도 찾아오게 됬네요 좋은 운영으로 오래할수있게해주세요~
퍼펙트 아레나,게임자체도 정말 잘 만들어졌고 진행할수록 강해지는 캐릭터를 보면 정말 할 맛이 납니다
퍼펙트 아레나,하다보면 광고가 뛰쳐나오는 딴 게임들은 그때마다 흐름끊겨서 기분안좋아지는데 퍼펙트아레나는 그런게 없어서 너무 좋네요~~
퍼펙트 아레나,방치형 게임 탑클래스! 보상이 정말 좋아서 무소과금도 부담없이 즐길수있는게 좋아요~
퍼펙트 아레나,기대감없이 광고보고 깔았는데 엄청 재미있네요ㅎㅎ 번창하세요~~~💛
퍼펙트 아레나,부담없이 게임을 즐길 수 있다는 점에서 만족도가 좋네요. 스킬효과나 타격감도 좋구요
퍼펙트 아레나,방치게임중에 제일 괜찮은듯 싶네요 우선 캐릭터들이 스킬쓰는 재미때문에 더 할만합니다
퍼펙트 아레나,현질안해도 관문 진행은 잘된다는 친구말에 속는셈치고 해보는데 이거 완전 물건이네요
퍼펙트 아레나,오픈날부터 한 유저입니다 지금도 잼있게 하고있어요 근데 폰 사양이 딸려서..pc버전으로 해볼려고 합니다.
퍼펙트 아레나,이런 RPG에는 평소에 잘안하는편인데 이겜은 그런거 상관없이 재미있게 잘하고 있습니다.
퍼펙트 아레나,재미있어요!! 퀄리티도 되게 좋고 필살기도 화려하고 좋아요!! 열심히 키우고 있어요!!
퍼펙트 아레나,재화를 여기저기서 많이 얻을 수 있어서 투력도 잘 올라서 키우는 맛이 있어요
퍼펙트 아레나,게임도 재미있고 영자들도 친절해서 계속 하게되네요~ 초심잃지말고 오래 가세요
퍼펙트 아레나,케릭 자주 멈추고 그냥 못만든 게임. 댓글 평점 알바 100퍼
퍼펙트 아레나,나름 피드백도 잘받아주는거 같고 겜하는데 불편한걸 따로 못느껴서 계속 해봅니다~
퍼펙트 아레나,재밋음 현질유도 없음 무과금도 충분히 즐길수있고 꾸준히 하믄 랭커들어갈수잇음 혜자게임이라 생각함
퍼펙트 아레나,게임할 시간이 엄청 많지는 않아서 하루종일 보고있기 힘든데 퍼펙트아레나는 엄청 편하게 게임할 수 있네요
퍼펙트 아레나,영웅들이 각양각색의 매력이 있고 다양한 조합으로 꾸릴 수 있어서 좋아요!
퍼펙트 아레나,간단하면서도 빠질수밖에 없는 게임 강추합니다 저렴하게 하거나 무과금 가능
퍼펙트 아레나,소통도 잘하고 문의답변도 나름 빠른거 같아서 만족도가 높습니다
퍼펙트 아레나,손이 많이 가는 방치형 게임이 아니라서 좋아요 방치해두다가 하고 싶을때 쭉 해도 충분~
퍼펙트 아레나,이벤트 구성들이 다양하고 컨텐츠 또한 다양하여 할 게 많네요 좋아요~
퍼펙트 아레나,문의남기면 답변도 빠른편이고 친절해서 느낌좋네요~!!!!!
퍼펙트 아레나,소통도 엄청 잘해주고 문의 남기면 빨리빨리 처리해줘서 그 점이 참 좋아요(^0^)
퍼펙트 아레나,캐릭터 다양성도 좋고 밸런스도 좋은거같아서 오래할맛날거같네요
퍼펙트 아레나,관문 뚫다가 한번 막히는데 조합맞춰서 한번에 쭈욱 미는 쾌감이 엄청 좋네요 ㅎㅎ
퍼펙트 아레나,캐릭터도 멋지고 플레이하는데 재미있네요. 그래픽도 만족스럽습니다.
퍼펙트 아레나,PC버전으로 하면 그래픽도 매우 좋네요 굿굿!! 전 지금 재밌게 즐기고 있습니다
퍼펙트 아레나,얼른 플레이 할 수 있으면 좋겠습니다! 게임 플레이 하먼서도 저희 유저들과의 소통 많이 해주시길 바래요!
퍼펙트 아레나,한 컨텐츠를 끝까지 볼 필요없이 뒤로가서 다른 컨텐츠도 하는게 제일 마음에 들어요
퍼펙트 아레나,전투 스킬도 참신하게 잘되어있고 특색있어서 조합짜는게 재미있네요
퍼펙트 아레나,재미있어요!! 퀄리티도 되게 좋고 필살기도 화려하고 좋아요!!! 열심히 키우고 있어요!!
퍼펙트 아레나,일단 과금 없이 이벤트 같은걸로 충분히 즐길수있고 모~~바일인데 이정도면 괜춘한 퀄임
퍼펙트 아레나,라이트하게 즐기는데도 보상이 넉넉해서 정말 재미있게 잘하고 있습니다.
퍼펙트 아레나,너무 너무 재밌게 하고있습니다.. 홍보 많이 해서 유저들 많아졌으면 좋겠습니다.ㅎㅎ
퍼펙트 아레나,아직 뉴비지만 게임이 정말 재미있네요ㅎ 그래픽도 취향에 맞아서 가볍게 하기좋은거같아요
퍼펙트 아레나,이 게임 재밌네요. 퍼펙트 아레나 으따 퍼펙트 하다잉 !
퍼펙트 아레나,"너무 느리지도 않고, 적당적당을 좋아하시면서 심심하지 않네요"
퍼펙트 아레나,그래픽 보고 마음에 들어 시작했는데 컨텐츠도 다양하고 너무 재밌어요ㅎㅎ
퍼펙트 아레나,그래픽은일단 이뻐요~~아직 시작한지 얼마안되서 좀더 봐야할꺼같아요
퍼펙트 아레나,그다지 제 취향에는 별로같았는데 막상 해보니까 게임 매력에 계속 빠져들게 되네요
퍼펙트 아레나,오랜만에 재미있는 게임 찾은거같아서 기부니가 좋아요~~ 오래 서비스해주세용~~
퍼펙트 아레나,흔한 양...산형 감성게임인줄 알았는데 게임 특색도 있고 장르에 맞게 잘 녹여낸거같아요
퍼펙트 아레나,컨텐츠도 다양하고 보상도 빵빵하게 주네요 이게임은 꾸준히 할거 같네요
퍼펙트 아레나,천천히 느긋이 진행하면서 하나하나 다 즐겨보고 있는데 다 재미있어요
퍼펙트 아레나,광고떠서 한번 다운해봤는데 게임 접근성도 좋고 게임 내용물도 알차네요
퍼펙트 아레나,일단 과금 없이 이벤트 같은걸로 충분히 즐길수있고 모바일인데 이정도면 괜춘한 퀄임
퍼펙트 아레나,방금 막 시작했는데 속도고 빠르고 생각보다 5성이 잘나와서 좋아용!
퍼펙트 아레나,AFK류 원탑...게임 편의성과 보상 모두가 빵빵함 두고두고 오래즐길수 있을것같습니다
퍼펙트 아레나,한 컨텐츠를 끝까지 볼 필요없이 뒤로가서 다른 컨텐츠도 하는게 제일 마음에 들어요
퍼펙트 아레나,크게 과금안하고도 즐겁게 겜할수 있습니다.정말 재미있습니다!!!!!!~
퍼펙트 아레나,퍼펙트아레나 정말 기대안했는데.. 혜자스럽고 하면할수록 컨텐츠도 넘쳐나고 재밌는거같애요 ^^ 갓겜 흥하세여 ~ 💙💙
퍼펙트 아레나,치밀하고 꼼꼼하게 게임을 잘 만들어둬서 재미있게 잘하고있습니다
퍼펙트 아레나,과금요소가 있긴하지만 무과금도 적당히 재미볼수있을정도로 많이퍼줌
퍼펙트 아레나,1차 업데이트도 알차게 잘된거같아요 오래오래 업데이트 부탁드려요~
퍼펙트 아레나,처음부터 무과금으로 즐기고 있는데 아무 문제없이 고렙까지 플레이 가능합니다
퍼펙트 아레나,게임스토리나 설정도 탄탄해서 읽어보는 맛이나 몰입도가 좋네요
퍼펙트 아레나,게임 재미있게 잘하고 있습니다. 영웅뽑아서 승성할때 쾌감이 좋아요
퍼펙트 아레나,광고가 안나오는게 엄청 좋음 요즘 겜 뭐만하면 광고 떠서 별로였는데…
퍼펙트 아레나,과금할게 없음. 과금안해도 아직까진 충분히 할만한듯. 게임 자체는 재밌다!!!
퍼펙트 아레나,손쉽게 영웅키우고 손쉽게 영웅수집하는 맛이 좋습니다)))
퍼펙트 아레나,AFK아레나 최고라고 생각했는데 아니였네요 퍼펙트 아레나가 최고입니당👍
퍼펙트 아레나,조합한번 싹 맞춰봤는데 기가막히네요ㅋㅋㅋㅋ 이제 저만의 조합을 찾아봐야겠어요
퍼펙트 아레나,조금씩 진행하면서 컨텐츠 하나씩 다 해보는중인데 진짜 재미있네요
퍼펙트 아레나,킬링타임으로 좋다는 리뷰가 종종 보이던데 그말이 정말 맞는거같아요. 컨텐츠 이거저거 하다보면 시간이 훅훅 가네요
퍼펙트 아레나,자동사냥 정말 편하네요 재화쌓여있는거 수확하는맛이 있달까…
퍼펙트 아레나,게임방식이나 스킨은 좀 구리지만 게임방식자체나 이펙트는 화려하고 좋네요
퍼펙트 아레나,오잉🧐 방치형을 이렇게 재미잇게 만들어주셔서감사 문의메일 대처도 빠르시고 맘에듭니다
퍼펙트 아레나,이거 솔직히말해서 광고보고 바로깔았는데 진짜기대한만큼 재밌네요!
퍼펙트 아레나,게임 설계 정말 마음에 드네용 관문 뚫는 맛도 있고 오래 할만할듯??
퍼펙트 아레나,캐릭터가 개성이 넘쳐서 여러가지 조합해서 키우기 재미잇어요
퍼펙트 아레나,편의성이나 완성도가 좋아서 불편한것도 못느끼고 직관성도 좋아요
퍼펙트 아레나,보상이나 재화들을 많이 얻을 수 있어서 무과금이 접근하기 좋음
퍼펙트 아레나,크게 과금안하고도 즐겁게 겜할수 있습니다.정말 재미있습니다
퍼펙트 아레나,언제나 재미있는 짱짱 퍼펙트 아레나 ~~!!! S1.이건아니지
퍼펙트 아레나,요즘 할만한 게임이 없는데 퍼펙트 아레나 게임은 퍼펙트 합니다..나름 잼나게 즐기고 있습니다.
퍼펙트 아레나,무엇보다 진입장벽이 엄청 낮은게 좋네요 초반에 캐릭터도 많이 주고요
퍼펙트 아레나,현질안하고도 할수있다기에 시작했는데 시작한지얼마안됐지만 흥미롭네요~ 계속 해봐야겠어요
퍼펙트 아레나,수집형 모바일게임을 찾는중에 이게임을 접하게됬는데 처음 시작하고 지금까지 하고있습니다~
퍼펙트 아레나,현질안하고도 할수있다기에 시작했는데 시작한지얼마안됐지만 흥미롭네요~ 계속 해봐야겠어요
퍼펙트 아레나,캐릭터 뽑는맛이 꽤 좋네요 기회도 많아서 여유도 가지게되고
퍼펙트 아레나,요즘 재미없고 자극적인 광고로 빡치게하는 게임보다 훨씬 재밌어요!!
퍼펙트 아레나,게임에 지속적으로 업데이트가 생겨서 점차 할맛도 다양해져서 좋아요
퍼펙트 아레나,왜 이게임이 상위 랭크되고 댓글 평가가 좋을까 해보면 안다 중국형 ㅆㄹㄱ 양산게임에 풀린 알바들이라는 걸
퍼펙트 아레나,오랜만에 잼있는겜 만났어요..더 해봐야겠지만 과금 없이도 가능할듯요 ㅎ
퍼펙트 아레나,재미있습니다 그래픽도 좋고 보상 제공도도 준수한 편입니다
퍼펙트 아레나,느긋이 맘 내려놓고 하기에 좋은 게임 시간만 어느정도 투자하면 못할건없어보임
퍼펙트 아레나,오잉 방치형을 이렇게 재미잇게 만들어주셔서감사 문의메일 대처도 빠르시고 맘에듭니다
퍼펙트 아레나,스토리 완성도가 꽤 좋네용 다음 캐릭터들도 더 나오겠죠? 기대가 됩니다ㅎㅎ
퍼펙트 아레나,"무과금도 왠만한건 다 할 수 있음, 특정 부분만 빼면 무과금도 무난히 육성이 가능"
퍼펙트 아레나,무과금도 충분히 플레이하는 맛을 느낄수있는게 정말 큰 장점입니다!
퍼펙트 아레나,퍼펙트아레나 처음엔 비빔밥게임인줄알았는데 중독성있네여 ㅎㅎㅎㅎㅎ
퍼펙트 아레나,오랜만에 재밌는 게임하고 있습니다 모으는 재미가 있어서 좋아요
퍼펙트 아레나,궁극기뿐만아니라 스킬도 몇가지있어서 이거 고려해서 조합짜는 것도 하나의 재미네요
퍼펙트 아레나,지금 까지 해본 방치형 RPG 중 최고봉 굿 굿 별점 10개도 아깝지 않네요
퍼펙트 아레나,^----------^ 컨텐츠가재화수급이 잘되서 여러가지 해보는 맛이 좋아요
퍼펙트 아레나,완전매우매우강추!! 타격감도 착착 감기고 플레이하면서 내내 즐거웠네요
퍼펙트 아레나,친구가 재미있게 하길래 기대좀 하고 깔았는데 재미있어할만하네요ㅋㅋ
퍼펙트 아레나,관문 뚫다가 한번 막히는데 조합맞춰서 한번에 쭈욱 미는 쾌감이 엄청 좋네요
퍼펙트 아레나,"무과금도 왠만한건 다 할 수 있음, 특정 부분만 빼면 무과금도 무난히 육성이 가능"
퍼펙트 아레나,최근에 한 게임 중에서 제일 재미있어요! 시간을 두고 천천히 할만한 겜 같아요
퍼펙트 아레나,난 되게 재미있게하고있음 굳이 머리아프게할필욘없구 편히 재미있게할만함
퍼펙트 아레나,방치형 무기도 어느정도 나오구 적당하게 크는것같고 할게많음 재미있어요.
퍼펙트 아레나,이 게임해보세요 무과금으로도 노력만 하면 꽤 높은 위치까지는 올라갈 수 있어요
퍼펙트 아레나,무과금으로도 노력만 하면 꽤 높은 위치까지는 올라갈 수 있어요
퍼펙트 아레나,게임 재밋네요. 홈페이지 이벤트로 보상도 많이 받을 수 있어서 좋아요
퍼펙트 아레나,탑클래스 수집형RPG 진짜 너무 재미있게 잘하고있습니다.
퍼펙트 아레나,"이벤트 앞으로도 많이 열어주시고, 소통하는 모습 보여주셨으면 좋겠어요~"
퍼펙트 아레나,너무 재미 있습니다. 무소과금도 충분히 즐기실 수 있어요~
퍼펙트 아레나,평이 좋길래 설치해서 플레이해봤는데 힘들게 뽑기권을 모으지 않아도 좋네요
퍼펙트 아레나,쾌적한 환경에서 재밌는 플레이를 할 수 있어 좋습니다!!!..
퍼펙트 아레나,라이트 유저인데 재화 수급처가 꽤 많아서 넉넉히 할만하네요
퍼펙트 아레나,문의 글에 대한 빠른조치 감사합니다. 게임 재미있게 하고 있어요.^ㅇ^
퍼펙트 아레나,정체구간이 있긴한데 그때마다 전투력올릴만한 컨텐츠 조금 하다보면 또 뚫리고 그러네요
퍼펙트 아레나,게임 넘 재밌어요!!! 여러가지 영웅들이 많아 재미가 더하네요
퍼펙트 아레나,난 되게 재미있게하고있음 굳이 머리아프게할필욘없구 편히 재미있게할만함
퍼펙트 아레나,아니 이거 별점 잘 준 사람한테만 답햐주나요? 비추. 하지마세요.
