games,reviews
페어리테일:위대한여정,페어리테일 솔직하다 실망 스럽다 컷신 스토리 나가다 방식 나쁘다 심하다 간략 팬심 사전예약 컷신 캐릭 전개식 캐릭터 더빙 일러스트 퀄리티 밋밋하다 킬링타임 수작 흔하다 빠지다 전체 부분 밋밋하다 강하다 질리다 쉽다 쉽다 이벤트 뽑기 미션 달성 공짜 미션 힘들다 케릭 율도 낮다 가챠 시작 린쥐 잇다 확윻 조작 가능성 다분하다 검색 확율 조작 회사 참고 가챠확율 낮다 현금 쓰다 말다 팬심 시작 밋밋하다 기분 들다 원작 가져오다 신형식 맘에들엇어 컷신 연출 내용 엄청 멀뚱하다 쳐다보다 기분 크게 잔략 구성 뽑기 웃기 임무 깨다 야금야금 중간 캐릭 뽑다 시나리오 깨다 끽해야 뽑다 세번 만들다 실행 건지다 배너 당당하다 어이없다 어케 이해 뽑다 강조 미션 달성 난이도 높다 쉬다 쓰다 첨부 뽑기 무료 공짜 케릭 장창 진심 노잼 만들다 재밋는 용다 친구 재밋 다야 간직 경험치 그거 말다 불만 코인 킹덤 다야 줄다 친구 도말 개재 밋엉 태권도 또래 또래 이거재밋데 발전 도방 전략 서재 강요 도하 말다 캐릭터 나다 복잡하다 복잡하다 평범 일본어 자주 멈추다 노트 울트라 사용 자본 뽑기 전설 뽑기 무조건 캐쉬 유도 심하다 뽑기 다이아 뽑다 다이아 개망 페어리테일 최고 스토리 요약 버리다 달다 전반 늘다 보이스 부분 성우 한국 성우 여야 편하다 성우 한국 바꾸다 그거 애니 좋아하다 방치 더욱 마음 듭니 수집 욕구 자극 일러스트 워낙 애니메이션 일본어 사용 신의한수 만화 귀엽다 케릭 보여주다 오랫동안 기다리다 즐겁다 아직 한지 일부 수정 사항 스토리 페어리테일 좋아하다 퀄리티 캐릭터 뽀쨕 만족스럽다 기대하다 좀더 화려하다 액션 기대하다 잇다 답답하다 잇다 넘어가다 하트 지나다 모으다 다이아 쓰다 하트 얻다 다이아 쓰다 과금 입장 곤란하다 굳이 지나다 얻다 다이아 써다 사전예약 들어오다 왠만하다 튜토리얼 끝나다 사전예약 여기다 안주 사전예약 의미 사라지다 컷신 불편하다 일일이 게속 클릭 하니 다르다 나쁘다 넘다 복잡하다 머리아픈데 단순하다 들어가다 팅기다 마자 깔다 자동 전투 뽑기 확률 과금 캐릭터 뽑다 확률 엉망 뽑다 다이아 수도 들다 이건 원작 살리다 원작 페어리테일 애니 원래 다이아 벌리다 티켓 뽑기 벌리다 오래 가즈 페어리테일 어리다 기억 추억 페어리테일 솔직하다 궁금하다 해보다 해보다 만족스럽다 페어리테일 거만 달리 화질 좋아지다 애니 옛날 추억 나다 다이아 뿌리다 질문 변경 새롭다 키우다 효율 사전예약 사전예약 들다 오다 빠르다 사전예약 아직 들다 오다 빠르다 조치 부탁
"좋은 피자, 위대한 피자",계속 질리 피자 도우 토핑 정원 퀄리티 퀘스트 스토리 깨다 이벤트 기간 짧다 보석 모으다 힘드다 기간 짧다 사고 사서 안타깝다 파이어 퍼스트 일차 마지막 피자 수정 연속 실패 시행착오 페퍼로니 성공하다 알아내다 실수 건지다 의도 건지다 라면 보석 낭비하다 고생 생기지 빨리 수정 상어 마스코트 아이템 정상 적용 오류 재다 어플 여전하다 밉다 상태 결제 이루어지다 아이템 적용 메일 전달 빠르다 중복 취소 바라다 요리 높다 스토리 이벤트 피자 만들기 다양하다 콘텐츠 쉬다 질리다 타입 질리 오븐 수리 비용 살충제 재료 비싸다 실감 면도 수익 비다 줄이다 새롭다 아이템 상어 마스코트 아이템 아이템 적용 가격표 누르다 방법 나타나다 유도 또는 아이템 적용 해결 바라다 업적 사라지다 데이터 불다 오기 건가 데이터 삭제 기능 불다 기능 오랫동안 허무하다 남기다 열리다 속상하다 귀엽다 따뜻하다 그림 흔하다 짜이다 스토리 시기 맞다 에피소드 들어가다 요리 찾아보다 새롭다 지루하다 이기다 새롭다 에피소드 자주 이외 만족하다 그림 스토리 형식 레벨 반정 이따 이전 투자 해달라다 달러 가져가다 들어가다 달라 기록 안남다 들어가다 기록 안남다 불편하다 업그레이드 피자 만들다 배경음 들다 기다리다 손님 뉴스 내용 반복 흥미 살짝 떨어지다 막상 만들다 엄청 부족하다 찾다 얘기 개인 틈틈하다 깔다 원래 데이터 옮기다 방법 할아버지 데이터 연동 방법 알다 바라다 해보다 노력 다사 라지 달다 불다 찾아보다 지우다 기록 미션 미션 완료 기록 복구 오류 사항 갤럭시 노트 주문 들어오다 피자 만들다 박스 열리다 오류 반복 발생 하루 끝나다 랜덤 발생 까맣다 뜨다 오류 이름 제안 사항 가게 꾸미다 아이템 다양하다 초반 토핑 모으다 기도 반복 목표 없어지다 쉽다 아이템 살다 계속 세부 미션 오류 사항 말씀드리다 먼저 전반 힐링 마음 편하다 피자 만들다 모션 귀엽다 더빙 효과음 아기자기하다 개성 일러스트 마음 듭니 가끔 랜덤 스킵 융통성 전체 컨트롤 편리 부여 바람 들다 피자 여러 오븐 피자 판이 절반 넘어가다 나머지 피자 만들다 오븐 여러 재료 커서 피자 만들다 오른 재료 사용 넘기다 재료 터치 하므다 동선 낭비 크다 여태 타이쿤 다르다 신선하다 유머러스하다 개발자 덕분 즐겁다 폐업 나서다 뜨다 패드 퀘스트 수행 들다 개업 나서다 이상하다 어두워지다 전원 크다 발생 이상하다 글씨 떠돌다 계속 발생 뉴스 시작 발생 차이 미미하다 구별 쉬다 살짝 계속 개발 힘쓰다 개발 즐겁다 비다 시청 강요 띄다 타임 늘다 갈다 손님 재치 주문 차차 능숙하다 생각나다 간간히 딱하다 질리 오래간만 당황 겪다 할로윈 이벤트 빠지다 튕겨 버리다 반복 더불다 이벤트 날로 미루다 아예 스킵 할로윈 이벤트 별개 아예 불가능하다 이벤트 종료 해당 계속 반복 단순하다 기기 문제 일어나다 헷갈리다 다르다 간혹 짜다 문제 대부분 하루 차갑다 지나다 뜨다 곤란하다 스킵 나가다 들어오다 하루 초기 속상하다 해보다 해결 방안 빠르다 해결 방법 부탁 넘다 스킵 받다 선택 흥미 때우다 미니게임 퀘스트 이제껏 미션 계속 쌓이다 피자 뉴스 라거 주문 식상하다 부분 좋아지다 개발자 토핑 보조 터치 만하 자동 토핑 올려주다 토핑 가지 정석 예쁘다 토핑 토핑 종류 방향 치우치다 이상하다 예쁘다 해보다 수정 커팅할 괜히 신경 쓰이다 간혹 표시 뜨다 수가 뜨다 곤란하다 들다 찾기 지도 배너 뜨다 정보 찾기 뜨다 표시 가기 누르다 꺼지다 종료 해당 회차 지워지다 만족스럽다 재치 넘치다 손님 주문 가지각색 특별하다 손님 간단하다 조작 다양하다 피자 빠르다 만들다 손님 깐깐하다 주문 반복 오다 외우다 갈다 수록 크게 반감 중후 부로 갈다 수록 난이도 손님 말로 정답 알다 실패하다 알다 오다 피자 소스 토핑 업그레이드 소스 이름 업그레이드 부적합하다 쉬다 만들다 크게 반감 해당 업그레이드 삭제 업그레이드 기능 연장 업그레이드 하루 영업 길어지다 쉬다 타임 길어지다 정지 기능 사용 어플 시작 마감 직전 하루 시작 주문 받다 중간 어플 시작 영업 바라다 간단 해보다 집중 만들다 매력 만들다 멈추다 발전 오래 끝내다 상태 업그레이드 장식품 가지 빼다 완료 상태 지루함 최근 입구 프레임 받다 전혀 변화 착각 업뎃 마음 들다 심하다 한가지 받다 보석 갯수 올라가다 장사 도중 끄다 보석 갯수 끝나다 원래 받다 보석 갯수 작다 요정 식물 요정 식물 버섯 노리다 건지다 미리 이미지 다르다 말씀드리다 요정 원래 이벤트 끝나다 그만 맞다 이벤트 끝나다 계속 아무래도 남기다 자동 토핑 기능 업그레이드 터치 토핑들 한쪽 알다 깔리다 깔리다 맞다 깔리다 토핑 깔리다 토핑 삐뚤어지다 어긋나게 깔리다 토핑 종류 망치다 얘기 토핑 종류 무관 무작위 페퍼로니 덜하다 업뎃 오래 지루하다 업뎃 열리다 슈퍼 끝나다 미션 청지기 스페셜 데이 없어지다 지루하다 새롭다 미션 채다 린지 업뎃 계획 가요 아기자기하다 개성 캐릭터 따뜻하다 색감 손님 피자 완성 나가다 심심하다 집중 높이다 공개 토핑 수가 치즈 가루 뿌리다 핫소스 치다 음료 적일 조리 넓어지다 오븐 달다 빠지다 이건 절제 잃다 요새 크리스마스 하루 물건 이벤트 중이 매장 예쁘다 꾸미다 가지 퀘스트 다양하다 모으다 검볼 기계 티비 주크박스 사고 진도 나가다 질리다 예전 삭제 오다 사라지다 기본 세팅 검볼 비싸다 업적 다녀가다 스타 사라지다 설정 예전 데이터 불다 기도 빠르다 데이터 원상 복귀 바라다 문제 예전 손맛 클라우드 최소한 데이터 복원 넘다 계속 해보다 높다 점수 러시 곤란하다 빨리 짜다 피자 도우 시절 돌아가다 신선하다 질리다 노가다 개임 착각 컨탠츠 부족하다 지루하다 노래 계속 뉴스 아무튼 컨텐츠 가져오다 바라다 원작 베타 암튼 영어 알다 한글패치 인기 엄청 많아지다 번역 센스 된거 꾸준하다 빠르다 욕심 자꾸 삭제 달다 는걸 반복 계시다 아쉬움 남기다 빼다 문제 끄다 이미 하루 심각하다 없애다 내주다 살다
궁수의 전설,와이파이 계속 착하다 쓰다 아이템 없어지다 와이파이 일시 보이다 버근가 넘어가다 와이파이 지역 켜다 아이템 보이다 와이파이 장착 아이템 장착 헤제 수정 데이터 동기화 뜨다 클릭 자꾸 골뱅이 게속 돌아가다 전원 끄다 십분 지켜보다 게속 데이터 동기화 뜨다 시작 지우다 깔다 초기 레벨 높다 실망 평점 해보다 킬링타임 제격 가끔 조금씩 성장하다 조금씩 강하다 부가 기능 더하다 순간 지우다 스릴 감다 성장 반대 신비하다 상인 상점 고급 계몽 보석 사다 스테이지 끝나다 콜렉션 해보다 계몽 보이지 문의 안보 이면 증거 스크린샷 영상 보이다 달라 오다 아이템 얻다 스크린샷 찍다 놓다 하나요 제품 사용 시작 방치 회피 한판 한판 끝나다 저번 돌파 돌파 기억 어쨌든 쉬다 한판 끝나다 고용 장점 알다 장점 방치 회피 한판 빨리 끝내다 멀티 신청 어가 늦다 들어오다 채팅 악마 치다 장점 장점 에픽 무기 완벽하다 에픽 전설 재료 전설 상자 얻다 평가 고요 찍다 한계 마인크래프트 커맨드 명령어 마스터 고도 불리다 프로 넘다 인물 넘다 썩다 궁수 전설 제일 쉬다 설명 평가 쓰레기 넘다 도중 버퍼링 생기다 죽다 반사 원정 다니다 스킬 제공 아예 차례 인하다 무책임 난이도 밸런스 천차만별 스테이지 별로 타파 불가능하다 수도 유도 몬스터 가속 번개 들어오다 심하다 한판 아이템 잘나오다 희다 합성 리기 겁나다 힘드다 과금 가능 라운드 깨다 노가다 레벨 랩빨 올라가다 보석 모으다 아이템 뽑다 팟탬 희다 잘나오다 노가다 아직 흰녹팟템임 보라 구경 거품 빼다 솔직하다 작성 조작 단순하다 스킬 조합 킬링타임 불편하다 체력 보이다 적의 사체 제외 오브젝트 투명 도르다 조절 기능 아군 서로 사체 분간 알다 에너지 회복 속도 상향 스테이지 난이도 지나치다 상승 체력 하향 강화 효율 증가 투명 조절 기능 도입 난이도 낮추다 채다 난이도 급상승 장비 업글 깨다 번개 제한 차다 속도 내리다 무기 특성 장비 상자 열쇠 빈도 자주 등급 가지 중간 에픽 등급 아이템 얻다 힘드다 적어도 레어 장비 쉬다 패치 부족하다 강화 되돌리기 초보자 맞다 아이템 기전 강화하다 손해 밀치다 공격 막히다 들다 가짐 지연 발사체 사용 발사체 자리 남고 들다 다가 들어가다 에너지 한판 소비 마는 들어서다 아쉬움 스테이지 시작 돌리다 룰렛 크롤 포함 크롤 늦어지다 깨다 느리다 스크롤 룰렛 스테이지 무시 장비 판매 장비 필요없다 종류 장비 가지 판매 골드 수급 수월하다 재밋는듯 아이작 구속 로그라이크 그대 박아 환경 적절하다 반영 인상 깊다 대부분 에너지 부족하다 들다 무료 다운 부분 부분 추후 픽스 다양하다 보스 빌리다 새롭다 요소 던지다 다양하다 지속 이루어지다 잇다 재밋 그날 궁수 전설 플레이어 성능 문제 컨트롤 문제 아직 스테이지 벗어나다 뉴비 보이다 작성 먼저 위아래 움직 캐릭터 방향 수직 근접 상태 발사 속도 멀리 공격 이해 근접하다 상태 문제 타켓팅 문제 기본 근접하다 몬스터 위로 보이다 몬스터 위로 어려움 줍다 화나다 피격 판정 범위 넓다 캐릭터 모습 피격 판정 범위 도트 바깥 판정 범위 보이다 마지막 에너지 수급 빠르다 되게 로그라이크 자동 조준 자동사 격방 어울리다 컨트롤 방식 거기 공격 리스크 조절 아직 키우다 도움 언락 얻다 컨트롤 어리다 난이도 성장 극복 나쁘다 에너지 리미트 흐름 끊다 특수 효과 소리 단순하다 모노 감안 부분 채다 단계 후기 중독 불편하다 사항 들다 어빌리티 하나요 개중 뽑다 쓰다 능력 써다 대놓고 크리티컬 능력 방법 도감 밑쪽 이동 스틱 캐릭터 움직이다 위로 올라가다 스틱 탄알 이건 보완 필수 상자 끄다 보석 모으다 보석 수급 최상급 최소 보석 미지수 난이도 급상승 과금 쉽다 과금 상자 끄다 얻다 감다 오다 난이도 조절 개인 개인 끊어지다 스테이지 클리어 입장 재화 소모 수복 속도 느리다 재능 해금 레벨 클리어 만들다 스테이지 클리어 막히다 부분 존재 입장 재화 소모 끊어지다 재화 회복 오래 퀘스트 형태 입장 재화 챙기다 회복 들다 줄이다 마지막 몇몇 통과 사체 넘다 공격 플레이어 쏘다 화살 뚫다 지나가다 벽돌 사이 지나가다 하니 의도 디자인 수정 줄다 기본 좌우 스테이지 짜증 유발 스테이지 레벨 마다 습득 스킬 랜덤 슬롯 선택 기인 업그레이드 종류 늘어나다 슬롯 여전하다 결과 수록 원하다 스킬 확률 급격하다 떨어지다 스킬 강하다 강화 렌덤 공격 테오 도움 스킬 위주 초반 감각 거리 멀다 운빨 의존 향후 스킬 습득 부분 손대다 대감 시작 한판 빠져들다 적절하다 난이도 격감 스킬 레벨 마다 얻다 새롭다 만들다 전혀 질리다 별로 조합 오기 생기다 부분 만족감 에너지 에너지 원하다 가끔 짜증 나다 에너지 얻다 소모 계속 만들다 주시 보장 스테이지 난이도 스테이지 어려워지다 시작 올라가다 스테이지 마다 난이도 상승량 보이다 두번째 무기 진화 사용 게임머니 무기 진화 등급 무기 드랍률 낮다 난이도 높다 캐릭터 스텟 늘리다 요구 재화량 증가 치가 높다 무기 강화도 마찬가지 트리 거가 작동 스테이지 개인 능력 시작 스킬 선택 넘어가다 레벨 사라지다 몬스터 죽이다 레벨 가끔 중간 보스 체력 보이다 스테이지 스테이지 특히 거미 보스 체력 보이지 스테이지 인공 지능 최소 방향 막다 근처 유인 반대편 넘어가다 자리 수정 제안 기준 쉬다 만들다 이면 스테이지 용의 공격 범위 줄이다 아깝다 언급 인공 지능 상향 만들다 상위 에너지 모으다 방법 별로 에너지 쓰다 분임 던전 에너지 던전 한판 돌리다 최소 이건 절반 줄어들다 사막 스테이지 간공 머리 내미다 지형 넘어가다 모션 머릴 위로 내미다 이해 모션 머리 내미다 요약 에너지 얻다 방법 일부 몬스터 모션 무기 설명 공격 쎄다 대신 느리다 공격 대신 빠르다 실제 무기 스텟 공격 공격 속도 표시 부분 한국어 번역 어색하다 부분 대신 에너지 수급 극악 에너지 에너지 최대 고작 충전 기다 몰입 기도 에너지 쓰다 오래 최대 에너지 갯수 늘리다 충전 단축 방법 에너지 대치 충전 단축 재능 강화 도입 거지 기술 무기 캐릭터 기적 이벤트 무기 장비 이전 장비 무기 뽑다 과금 유도 기적 이벤트 솔직하다 똑같다 수집 교환 과금 유도 패키지 패스 심해 보이다 수도 커버 커버 끄다 후반 부로 갈수록 과금 유도 생기다 무소 과금 차별 생기다 시작 채다 진행중 채다 클리어 히어로 노멀 난이도 올라가다 유리하다 아이템 드랍률 올려주다 드럽다 아이템 쓰레기 자꾸 실패 성공 상관 가버리다 밸런스 빼다 제법 다양하다 스테이지 무기 장비 능력 캐릭터 육성 단계 가보다 공감 좁다 터지다 몬스터 더럽다 소환 몬스터 이동속도 공격 범위 상치 세로 최고 시점 시야 제법 좁다 스테이지 난이도 막무가내 짜다 충만 양산 수준 밸런스 요소 구기다 아무튼 방식 수준 말씀드리다 몬스터 판정 조정 넓다 디자인 손대다 게임상 역대 대작 아쉬움 크다 채다 채다 도저히 엄두 나다 난이도 성장 작다 쌔졌다 보통 성장 몇몇 스테이지 호쾌 넘어가다 컨트롤 중심 맞다 건지다 의문 들다 괜히 지르다 듭니 페이 양해 입장 장비 궁금하다 꾸준하다 참을성 분만 성장 길다 개구리 냄비 천천히 온도 뜨겁다 물이 궁수 전설 육성 측면 박하다 장점 실력 반영 스테이지 몬스터 랜덤 등장 질리 가능 번개 소모 극심 한판 번개 충전 번개 난이도 올라가다 실력 아이템 의존 마리 잡다 얻어맞다 죽음 조작 간단하다 꿀잼 가지 패치 쓰다 장비 분해 재료 수급 재료 모으다 빡셉니 에너지 파다 모되 에너지 줄이다 레벨 최대 보유 에너지 늘어나다 깎다 짜다 줄이다 기다 마지막 장비 종류 늘어나다 날다 서로 장비 합성 에너지 차서 한판 마다 마다 차다 거나 파다 들다 에너지 줄이다 보임 나다 받다 플레이어 레벨 경험치 던전 가면 올라가다 난이도 어려워지다 받다 양은 똑같다 어려워지다 채다 올라가다 받다 경험치 늘리다 채다 중간 보스 틀리다 공격 세다 반면 플레이어 레벨 레벨 제한 스테이지 이전 찍다 남다 스테이지 레벨 채우다 스킬 선택 클리어 힘들다 레벨 제한 없애다 제한 높다 잡다 야하다 장비 강화 증가 공격 시작 선택 스킬 뜨다 심해 하자 자유분방하다 돌아다니다 정밀 캐릭터 조준 비다 캐릭터 움직임 공간 부족 불편하다 조이스틱 이동 초반 스테이지 만들다 체력 높다 유도 고려 돌아오다 사운드 이펙트 빼다 박다 멈추다 공격 고유 공격캔슬 다반사 렙업 능력 공격 속도 자주 컨트롤 요소 플레이어 따라가다 구조 이루어지다 현재 쓰레기 무방 받다 써다
