game,review
블루 아카이브,가챠겜인데다 몇몇 OP캐들 덕분에 전술전 같은 경우는 메타가 정해져서 조합이 고착화 된 상태고 그 대부분의 사기캐들이 3성에 몰려있다보니 유저간 차이가 큰건 별 수 없는듯. 하지만 무과금도 무난하게 즐길 수 있을 정도로 보상도 괜찮은 편이라 딱히 불만은 없음. 이런 류 게임 좋아하면 추천드림.
블루 아카이브,너무 재미있게 플레이하고 있어요. 캐릭터마다 매력도 있고 총력전이라는 마지막 컨텐츠에서 전략을 짜서 하는 것도 캐릭터마다 스토리도 정말 좋고 메모리얼도 정말 이뻐서 자꾸 플레이하게 되는 게임같아요.
블루 아카이브,자동 전투 AI를 이해할 수 없음. 피가 거의 꽉차도 굳이 힐쓰고 적다고 힐쓰지도 않음. 스킬 코스트 차도 굳이 안쓰고 모아놨다가 방어력 강화만 계속 쓰다가 죽음. 안 쓴 스킬 우선도 아니고 피회복 우선도 아니고 적 방어 고려해서 공격 스킬쓰는 것도 아니던데 대체 어떤 기준으로 이딴 전투를 하는지 이해할 수 없음.
블루 아카이브,"게임이 기본적으로 문제가 좀 잇어요. 일단 스킬, 장비 육성 재화가 심각하게 치우쳐져 있습니다. 물론 너도 나도 다 비슷한 상황이니 경쟁의 관점에선 심각한 문제가 아닐수 있는대 계획을 세우고 게임을 꾸준히 진행하는 입자에선 한쪽으론 넘쳐나지만 활용을 안하는 재화가 있고 다른 한편으론 매일 꼬박 꼬박 수집해도 항상 부족한 재화가 있는걸 보면 더욱더 답답함을 불러 옵니다. 그런대 대고 케릭터의 구성도 이상해요. 케릭터의 행동 패턴, 장비 구성이 이상한 케릭터들이 다수 존재 하여 실질적으로 육성을 해 활용할 만한 케릭터가 한정 됩니다. 언젠가는 육성해 쓴다고 하지만. 결국 되돌아 보면 그걸 써야만 하는 컨탠츠를 만든거지. 그 케릭터의 활용도가 올라서 쓰는게 아니에요. 만약에 같은 케릭터를 반복적으로 활용 가능햇더라면 절대 다른 케릭터를 안썻을거라 생각될정도로 케릭터간 밸런스가 안맞습니다. 이렇게 재화의 불균형. 케릭터간 불균형을 안고 가는거야 이런 유형의 게임에서 종종 보는 현상이니 어쩔수 없다 생각할수도 있지만. 정작 그런 불균형에 대한 운영사의 입장이 너무 가볍습니다. 자기들이 불균형을 만들었으면 최소 그런 컨탠츠에 관해서 패치를 할때 유저들이 납득할 이유를 제시 해줘야 할법 한대 그런게 없이 그냥 '개발 의도와 달랐다' 한마디로 패치를 진행 합니다. 가장 조심스러워야 할 운영쪽에서 너무나도 무 성의한 시각을 비추다 보니 더욱더 이 게임의 운영에 의문을 품게 됩니다."
블루 아카이브,"캐릭터 수집겜으로서의 퀄리티는 훌륭하지만 게임성은 높은 점수를 주기 어려움. 으레 대부분의 가챠겜이 그러하듯, 상위 티어 캐릭터만 쓰이는건 이 게임도 매한가지였고, 분재겜으로서도 상당히 부족한 컨텐츠량이 아닌가 싶음."
블루 아카이브,"오픈초기 퍼블리셔와 게임사의 성의없는 운영과 대처로 많은 실망을 했습니다. 세계관과 캐릭터가 정말 매력적이었던만큼 실망감이 더욱 크게 다가왔습니다. 그럼에도 5점을 줬습니다. 그만큼 게임의 스토리와 음악, 그리고 게임 그 자체의 분위기가 좋아 더욱 오래 플레이하고 싶기 때문입니다. 넥슨과 넷게임즈가 이 매력적인 게임을 유저들과 함께 잘 이끌고 나가길 바랍니다."
블루 아카이브,자동전투 돌리면 화면 꺼지고 게임도 일시정지 됩니다. 뭔게임이 화면이 꺼진다고 게임이 멈추나요? 기기는 갤럭시 노트 10+입니다. 그리고 전투 빼면 너무 노잼이에요. 스토리 안보는 유저도 할 만한 거 넣어주세요. 대부분 전투가 너무 길고 말만 많아요.
블루 아카이브,"가챠 확률이 진짜 지옥급인게 문제긴한데, 그건 게임사가 꼬우면 하지말라고 선택권을 준거니 그러려니 할만합니다. 근데 로비 캐릭터 이미지가 애니메이션도 아닌 이미진데 해상도 조절안된 파일이라 블러가 들어가는거나 ai들이 진짜 무뇌급이라 pvp나 자동전투가 의미없는거, 스토리 텍스트 읽는거 말곤 컨텐츠랄게 전혀 없는건 이게임을 몇달 하면 오래했다고 하게 만들만한 부족한 요소인듯 싶네요."
블루 아카이브,확실히 재미있는 게임 하지만 스토리 연출 이 아쉬운 게임 프리코네 처럼 풀 애니메이션 은 돈 도 많이 들고 많은 인력이 필요 한건 알고있지만 종이 인형 놀이 마냥 위아래 양옆 으로 와리가리 하는게 전부 인건 많이 아쉬워요 상황에 맞는 컷신 좀 추가되면 좋겠습니다 모든 상황에 총 은 항상 들고있고 표정만 바뀌는게 안타깝네요 나중에 추가 좀 해주세요 항상 재밌게 하고 있습니다 좋은 게임 만들어주셔서 감사합니다
블루 아카이브,3성 갓캐 나오는거 아니면 개빡셈. 그렇다고 3성이 잘나오는가? 나오긴 나옴 근데 개잡캐만 나옴. 그러면 가챠 할 수 있는 청휘석 수급이 잘되는가? 스테이지 쭉쭉밀면 150번 가챠는 가능할듯. 근데 이 150번에 1티어 3성 못먹으면 계속 고생함. 같은 3성인데 스킬 격차가 오지게큼. 개똥망겜 찍먹하고 삭제했다
블루 아카이브,"무과금 중에 괘나 열심히 한다고 자부하고있는데 전술대회에서 AI 스킬쓰는 꼬라지가 진짜...차라리 실시간으로 하고있는 유저중 비슷한 레벨, 또는 비슷한 스테이지를 밀고있는 유저중 매칭을 잡아 직접 수동으로 스킬사용이 가능하게 해주셨으면 좋겠습니다. 진짜 AI가 상대는 내가 원하는대로 쓰고 내 AI는 무슨 1:1인데 도발스킬쓰고 상대는 히비키 스킬을 쓰네요 참..."
블루 아카이브,진짜 재밌습니다. 캐릭터들도 이쁘고 스토리도 너무 재밌고 3성도 진짜 잘 나와요. 아쉬운 점은 자동전투하면 스킬을 허공에다 날린다거나 캐릭터들이 이상한곳으로 움직여요. 그리고 로딩속도가 지나치게 느립니다.
블루 아카이브,"기기 호환이 잘 안되서 그런지 메모리 누수가 발생해서 그런지 잘 모르겠는데 게임을 해보려고 하면 튕김. 게임에 버그도 많고 핵도 많음. 그에 대한 대응도 느리고 그로 인해 피해받은 사람들에게 실질적인 보상은 없음. 과금도 좀 했지만, 저는 이 게임을 추천하지 않습니디. 라고 적음"
블루 아카이브,"언제 다시 평가를 바꿀지는 모르지만 유저들 의견 많이 반영된 것 같아 기대해보기로 했습니다. 다만 앞으로는 소통 창구를 조금만 더 적극적으로 활용해주셨으면 합니다. 조금만 빨리, 미리미리 말했더라면 미연에 방지할 수 있었던 운영상의 마찰이 많지 않았나 합니다. 리뷰니까 언급하자면 게임은 진짜 좋아요. 캐릭터 수집형 게임으로서는 훌륭합니다. 애들이 진짜 매력넘쳐요."
블루 아카이브,"게임성 노래 그래픽 다 좋아서 5점을 주고 싶지만 딱 하나 아쉽다면 아쉬운게 과금컨텐츠. 게임이 너무 내 취향에 재밌어서 과금을 할 수 있지만 청휘석 구매가 아닌 패키지로 따졌을 때 사람들이 더 많이 찾고 가격 합리화를 하며 현질을 하기 마련이지만, 이게임은 그냥 청휘석 구매가 패키지 보다 훨 아니 패키지를 사면 비슷한 가격대에 구입을 하는게 호구 짓이다 라는 생각을 들게 할 정도로 패키지의 구성은 실망스럽다.."
블루 아카이브,"드뎌 플레이를 해보았습니다! 일러, 테마, 음악, 등등이 귀를 사로잡고, 파릇파릇하고 밝은 모던한 테마는 청량감을 줍니다. 그리고 귀여운 미소녀 일러로 눈힐링! 전체적으로 스토리도 잘 짜여져있고 한마디로 평을 하자면 '찐 덕후가 만든 찐 덕후게임'입니다 ㅋㅋ 나쁜쪽으로 하는 말이 아니라 그만큼 유저들의 니즈를 잘 파악한 게임이라는 것이죠 ㅎㅎ 이렇게 잘 나온만큼 운영만 잘하면 정말로 히트칠 게임입니다! 런칭해주셔서 감사합니다!"
블루 아카이브,"게임에 검수를 위한 로딩현상이 매우 긴 것에 비해, 정말로 검수를 하고 있는 것인지 모르겠습니다. 게임의 생태계를 파괴하는 불법프로그램이 버젓이 활개를 치고있고, 조용히만 있으면 안잡는데, 그럴꺼면 대체 그 엄청긴 검수시간은 무엇을 위해 있는 것입니까? 불법 프로그램 체크하는거 아닙니까?"
블루 아카이브,"뽑기는 솔직히 확률표가 나와도 안믿는것은 회사의 이미지때문에 어쩔수없는 자신의 업보라고 보지만 복권100개긁어도 1등안나오는 놈이 있고 1개만에 1등 나오는 놈이 있듯이 게임의 가챠를 제외하고 평가한다면 상당한 수작이다 소탕이 처음에 게임 수명을 많이 잡아먹겠다 생각했지만 그만큼 다음스테이지로 가면 겁나 강해져있는 상대를 만나기에 수명은 짧지 않겠지만 레벨디자인이 아직까지 별로없는 스테이지를 못 뚫게 하기위해 너무 높게 진입장벽을 친게 아쉽다 라는 생각을 제외하면 스토리,일러스트,게임성,특유의 스킬 컷씬 등 다 나쁘지않고 랭커가 목적이 아니라면 하루하루 소탕하며 렙업하다 다음스테이지 공략가능하면 넘어가는 식으로 라이트하게 하기 나쁘지 않다."
블루 아카이브,"게임 최적화가 제대로 이루어진 것인지 심히 의심스럽습니다. 무엇보다 게임이 할게 없어요. 오픈 이벤트가 노노미 획득 말고는 없습니다. 이건 뭐.. 이벤트 던전이나 빙고도 없고 서클은 그냥 활동력 10 얻는거 말고는 의미도 없습니다. 뽑기는 친구 우정뽑기 기능도 없고, 무조건 현금재화 사용해서 뽑게 되어있는데 3일 1회 무료뽑기 기능도 없습니다."
블루 아카이브,양심적으로 긴급점검하고 오픈시간 미정인데 보상은 잘주십시오. 그래도 블루아카이브 명작 게임입니다. 부족한 점이 있지만 개선의 의지가 있고 모바일 게임중에서 제일 재밌습니다. 특히 전투부분이 배틀그라운드도 기립박수 칠 정도 입니다. 글읽어주셔서 감사합니다. -영오너
블루 아카이브,페이트윈이 아니라는 의견도있지만 저는 개인적으로 몇년전까지 월급 다꼴아박으며 게임했던입장으로써 그냥 그래픽쪼가리입니다... 요즘은 오프라인게임하다보니 이런게임은 상점둘러보는데 패키지보니 확율도 낮은데 10연뽑 4회정도가 10만원돈인거보고 기겁했습니다. 물론 재밋으면 지르겟지만 확율이 낮더군요... 그리고 재미면도 컨트롤보단 지켜보다가 스킬쓰는게 일방적이라 컨트롤보단 이거누를시간에 영화보겟습니다..그돈이더싸고 매번새롭고 재밋을껍니다.. 첫시도는 신선할지몰라도 그행위가10~20번이 반복되면 질리는겁니다.
블루 아카이브,와 이게임 뽑기 완전 헬이네. 픽업케릭뽑 할때마다 모집포인트라는게 쌓이는데 쉽게 말해서 천장임. 그천장을 200뽑을해야 되는데 총 24000다이아. 근데 문제가 픽업이 끝나면 모집포인트 초기화됌. 처음부터 다시 해야됌. 어이없는 시스템임.
블루 아카이브,"게임 재밌고 애들 귀여운데 천장 칠 때까지 3성이 죽어도 안 나온다. 그런데 인연 랭크 올리는 카페에는 내가 없는 애들만 계속 초대되고 있어서 메모리얼과 청휘석 손실을 동시에 겪고 있다. 3성확률 2.5%라는데 체감으로도 그렇고 계산을 해봐도 천장 칠 때까지 나오지 않을 확률이 아닌데, 뭔가 문제가 있는 듯하다."
블루 아카이브,다운로드 실패 하여 앱을 종료 합니다(80099) 가 계속 뜹니다 접속도 못해보고 다운로드 화면만 봅니다.... 겔럭시s10 5g 입니다 폰업뎃도 다했습니다... 그래도 다운로드 실패됩니다 ㅠㅠ 재설치해도 똑같아요 다운로드 실패 화면만 1시간 반동안 봐서 슬슬 지치내요 기대했는데 아쉽습니다 접속조차 못해서
블루 아카이브,이런 게임들 특성상 인권캐라는 것은 존재하기 나름임. 인권캐가 없으면 꼬운 건 확실하나 없어도 크게 게임플레이에 지장은 되지 않음. 무과금이 하기 힘들다 라고 말들 많이 하는데 게임회사도 돈 벌어야하는데 무과금만 생각하고 게임을 하면 무슨 수로 돈을 버냐. 다만 무과금이 할 만한 환경은 주고 과금유도를 하면 상관없지. 이 게임은 무과금이 해도 별 지장 안 가게 즐길 건 다 즐길 수 있는 게임임. 뭐 무과금이라서 힘드니 이런 건 핑계고 그냥 노력 안 한게 문제지. 게임에 제대로 접근조차 안 해본 티가 남. 무과금이어도 초반엔 청휘석 수급처가 널리고 널렸다. 내가 현재까지 무과금으로 하고 있는데 있을만한 3성은 다 얻었고 과금러도 pvp로 만나면 털 수 있을 정도로 강해짐. 그냥 무과금이라서 힘들다는 건 말이 안 되는거임. 노력을 하셈
블루 아카이브,"다 좋아요 진짜. 게임 재밌고 , 스토리 전달 좋고 전체적으로 굉장히 깔끔하고 잘만든 게임이라고 할수있습니다. 단점 딱 2가지 ※헬가차 ※친추없음 제가 이런 가차게임을 플레이할때 자주 과금을 하곤합니다. 하지만 블루 아카아이브 가차에서 50번을 뽑았는데 3성 한명이 나온걸 보고 ""무서워서"" 과금을 못하겠어요. ""어...이만큼 질렀는데 안나오면 어쩌지..."" 라는 생각이 머리속을 지배해서 도저히 현질을 할 용기가 나질 않습니다...ㅠ 확률을 올리라곤 말안할테니 다이야 가격만 어떻게 해주시면 괜찮을꺼 같습니다. 물론 확률을 올리는게 베스트긴 하죠. 그리고 제가 친구 추천으로 이 게임을 시작했는데, 같이 할수있다는 생각에 시작을 했더니 친구추가 기능이...없네요... 간단한 친구와의 채팅/프로필 보기/서포터 혹은 스트라이커 빌리기/ 와 같은 기능들이 하나도 없으니 게임을 하면서 좀 외롭다...는 느낌을 많이 받았어요. 서클도 대부분 보상만 받으려고 하는 사람들이 많더라구요."
블루 아카이브,"캐릭터, 세계관, 스토리 탄탄한 것 같고 밝고 가볍고 좀 톡톡 튀는? 유머가 있음. 예상과 다른 캐릭터들의 개성 강한 반응에 피식거리는 느낌? 개그만화 느낌? 앞으로가 기대됨. 세계관의 중심의 딥한 이야기는 가려져있는 것 같은데 어떨지는? 요즘 웰메이드 스토리 게임이 좀 부족한데 블루아카 괜찮은 느낌. IP를 계속 발전했으면 함. 잘되서 일본에서 애니화되면 좋을 듯. 여러 분재 게임 중 하나로 해도 부담없음. 분재 게임의 편의성 매우 좋음. 총력전은 도전심리 자극함. 몇몇 스킬은 터치 조작, 타이밍 보는게 나름 재미있음. 대신 몰아서 플레이하고 싶은 사람에게는 아쉬움이 좀 남음. 하루에 여러 번 접속+플레이 추천. 그리고 뽑기는 좀 맵다. 픽뚫 비율 많은 것 같다. 유저분들 스킬 업글하는 재화 얻기 힘드니 효율적으로 잘 챙겨요!(캐릭터 잘 골라서). 아 깜빡했는데 좋은 bgm을 좋아하는 사람들에게 추천!!게임 bgm 트렌디하고 느낌있음. 오랜만에 좋은 bgm의 게임이 나왔다!"
블루 아카이브,나름 할만하고 일러 및 게임성은 좋구 적당히 소과금으로도 즐길수 있으나 한계가 많음. 빡겜으로 즐기자면 과금은 헬게이트가 열림. 3성 가챠 확률이 너무 낮아 보임. 230연차 해도 노3성...50만 질러도 가챠 만족감이 없구 허무함. 리세로 필수급 안뽑고 시작하면 노답. 캐릭 육성 재화 수급이 힘들어서 다양한 캐릭 키우기가 힘듬. 그런데 게임은 여러 부대와 여러 상성의 캐릭이 필요함. 걍 맘 비우고 적당히 즐겜 하는게 정신건강에 좋음.
블루 아카이브,친척 동생이 허락없이 결제해서 환불 요청드립니다. 안녕하세요. 어제 12일에 제 사촌동생이 허락없이 블루 아카이브라는 게임에 7차례나 결제를 하였습니다. 저는 이를 12일 저녁에 확인 하였고 바로 구글 환불 센터에 환불요청을 드렸지만 처음있는일이라 이유를 잘못해서 실수로 구매함이라는 이유로 환불을 요청한다는 실수를 했습니다 당황해서 다시 제3자가 마음대로 구매함이라는 이유로 신청했지만 오늘(13일) 아침에 구글에서는 환불이 안된다는 연락이와서 이렇게 메일을 드립니다. 이번 7차례의 결제는 정말 저는 모르는 일이였고 제가 플레이 하지 않는 게임이라 만약 환불을 해주신다면 계정을 삭제 할 마음도 있습니다. 제발 신속히 해결을 도와주세요. 저는 7번의 결제를 전액 환불을 요청드립니다. 감사합니다.
블루 아카이브,블루 아카이브는 진짜 갓작입니다.오프닝과 메모리얼 브금과 화려한 스킬연출 솔직히 사전예약을 하지못해서 아쉽고 후회돼지만 지금이겜을 하고 있다는게 자랑스럽네요. 진짜 처음으로 이겜을 할때 신기한 느낌을 얻게 됐네요.또한 메인 스토리도 생각보다 재밌고 몰입감이 있더라고요 대책위윈회가 2장에서 끝나서 아쉽지만 3장과 스토리 음성까지 기대하고 있겠습니다. 블루 아카이브 파이팅!!! 항상 있는그대로 부탁드립니다.몇년동안 하고싶고 모바일로는 이겜이 저한테는 최고니깐 오래오래 유지해주세요~! 이게임 오래갈거죠?
블루 아카이브,재밌게 즐기고 있지만 아쉬운 점이 있어서 적어봅니다. 처음 로딩 시 걸리는 시간이 꽤 길어서 최적화를 해줬으면 합니다. 자동을 돌렸을 때 AI 성능도 개선을 했으면 합니다.
블루 아카이브,게임 일러와 성우들이 너무 매력적이고 스토리에 신경을 많이 써줘서 재미있게 즐기고 있어요. 다만 한정적인 이벤트와 어느정도 게임을 진행하면 할 수 있는 컨텐츠가 부족한거 같아서 좀 더 이벤트를 해주면 좋을꺼 같고 스토리 업데이트를 많이 해주면 좋겠다고 봅니다.
블루 아카이브,너무 좋은데여 근데 청휘석 모으는 게 너무 힘들어요ㅠㅠ전체적으로 아주 재밌고 상당히 고퀄리티 이기도 하고 사양이 낮은 폰에서도 그럭저럭 잘 돌아가요.청휘석이랑 로딩 화면 긴 거 빼면 진짜 재밌고 간단하고 좋은 게임 전체적으로 매우매우 좋아요^^
블루 아카이브,일단 스토리가 매우 훌륭함 짧고 간단하게 쓰여있으면서도 몰입감과 짜임새가 있고 탄탄함 또한 여러 학생들이 개성이 있고 세밀한 부분까지 신경 쓴 점이 보임 지형과 속성을 이용하여 다양한 학생들을 꾸릴 수 있게 했고 꾸준히 업데이트가 되고 있음
블루 아카이브,유일하게 하는 모바일겜. 안드로이드 버전 이미지 계단현상 생기는거 해결해주세요 탭이나 노트 같은 대화면에서 찌부러지는데 상당히 거슬립니다.
블루 아카이브,"저번에 리뷰단 사람인데 잔짜 버그인가보다 왜 픽업모집에 픽업캐가아니라 다른게 뜨는것인가 진짜 픽업캐 확률을 올리던지 천장을 낮추던지 사료좀 퍼주던지 좀 아무거나 좀 해주면 좋겠음 진짜 돈없으면 못하는게임임 현질한다해도 그 가치가 매우 낮음 이때문에 다른 뉴비현질러는 15지도 기본인데 71렙인 난 13지에서부터 막히고 총력전도 익스트링 한번이라도 깨본적이없음 이게임 그냥 스토리보는용으로 방치하셈 진짜 나중에 후회하지말고, 물론 게임 내 문제점을 비판한거뿐이지 무작정으로 비판하거나 비난한게 아니기에 무과금러들도 충분히 즐길수있음 다만 과금러와는 180도로 불편하지만"
블루 아카이브,다ㅠ좋지만 무엇보다스토리를 다시볼수있는점이 가장 좋은데 총력전에서 나오는 스토리는 못보는게 아쉬워요 가능하면 총력전에서 나오는 스토리돞다시보기에서 볼수있게 해주시면감사하겠습니다
블루 아카이브,게임성과 캐릭터 스토리 면에서 다 높은 점수를 주고 싶습니다 바라는 점이 있다면 인게임 내에 보이스 자막기능과 보이스 모아듣는 페이지가 있었으면 합니다
블루 아카이브,리듬게임 눈 아파서 못 하겠음 도대체 왜 버튼이 옆으로 오는거임? 그리고 양쪽으로 하는거 잘 안됨 내가 못 누르는게 아니라 진짜 인식이 안됨 리듬겜 형식을 좀 바꿔야됨 그리고 판정이 이상함 왜 +버튼이 있는곳에서 좀 더 뒤로 가서 눌러야 크리티컬이지? 그리고 또 왜 miss나면 타일 전체가 사라지는거임? 어이가 없어서
블루 아카이브,블루아카 나오기 전부터 기대한 겜인데 반주년이 지난 지금도 만족중ㅎㅎ 그 넥슨답게 캐릭터들 매력이 좋고 그 전 플레이가 재밌어요. 오타쿠의 소소한 일상게임? 퀄 좋은 가챠겜. 겜이 쉽고 어려운 부분도 부분 넣어 몇차례 시도하면 깨지는 바람직한 겜입니다.
블루 아카이브,"스킵 버그 막은거 때문에 플레이타임 늘어났지만, 체감상 피로도가 배로 늘어났음... 어짜피 들어가서 스킵 돌리고 나올뿐인데 너무 시간이 오래걸림.. 이게 유저 적대적 패치..? 게임 개악..?"
블루 아카이브,"약간의 노가다요소가 들어있긴 하나,이건 나름대로 할 만한 노가다인듯. 그리고 가챠 확률은 그럭저럭 괜찮은 편. 좋은 평가 받을 만함 스토리 라인도 좋고 중간에 틀어지거나 그런거 없고."
블루 아카이브,너무 매운맛 게임을 하다와서 그런지 학생들이 하나하나 다 개성있음 전투도 이정도면 만족하지만 일섭과는 좀 차이를 뒀으면.. 일섭에서 일어났던 문제점들이 한섭도 그대로 일어나버리면 어떡해양 ㅠ
블루 아카이브,캐릭터 모델도 귀엽고 정말 재밌습니다. 과금 안해도 즐길수 있고 할게 많아서 좋네요. 첨으로 스토리를 읽어보는 모바일 게임 이었습니다.
블루 아카이브,10회 뽑기를 40번이나 했는데 픽업캐릭터가 단 한번도 안뜨는 확률조작급 게임입니다 3성이 뜨기는 해도 그게 픽업캐릭터가 아니라 어이가 없네요 뽑기로 모두가 떠나가는 게임이라는 말을 증명하는 경험이었고 도박 이벤트를 시작하더니 확률도 타짜급으로 바뀐건가요? 확률이 너무 이상합니다
블루 아카이브,게임은 좋은데...전술 대회 때문에 너무 답답함. 하고싶은데 계속 서버가 요청을 처리하지 못했다면서 하지를 못하게 함. 덕분에 훨씬 오를 순위도 떨어지고 맨처음 로딩 화면으로 보내서 시간도 다 날림. 그래서 진짜 너무 답답해 죽겠음.
블루 아카이브,이런류의 다른 게임이랑 비교했을때 상대적으로 나쁘지 않음. 오래 운영하다보면 떠나는 사람이 생기긴 하겠지만 그래도 캐릭터 일러등이 괜찮아서 애정충들은 많이 남을것 같은 느낌.
블루 아카이브,게임 자체는 그냥 재밌다! 근데 pvp ai 할 말 많지만 거의 안 해서 그냥 그러려니 하고 마는데... 가챠 확률도 매우 맵고; 경쟁 안 할 꺼면 굳이 현질 안 해도 상관은 없는데 할 꺼면 현질을 좀 해야 하는게...ㅎㅋㅋ 크레딧이 남아돈다는 분은 혹시 캐릭 다 키우셨나? 스킬렙작만 해도 훅 까여서 오히려 부족하던데 ㅋ 어떤 식으로 버시는지 궁금하네
블루 아카이브,픽업기간이 좀더 늘어났으면 좋겠습니다 청휘석을 모으는데 시간이 오래걸려서 캐릭터를 뽑을때 천장을 쳐야될때 정작 청휘석은 없어서 그때동안 쓴 청휘석을 일정량이라도 돌려주면 그래도 압박이 들해질거같습니다 이렇게 업데이트를 해주면 감사하지만 안된다면 청휘석을 많이 주셨으면 합니다
블루 아카이브,진짜 너무 재밌게 하고 있는 게임. 캐릭터들도 매력적이고 스토리도 재밌어서 가챠 겜 류에서는 인생 겜.
블루 아카이브,"갓겜입니다! 매력적인 캐릭터와 일러스트, 가슴이 웅장해지는 브금, 웬만한 소설책 뺨치는 스토리까지... 가챠 확률 조금 더 높이고 인게임 컨텐츠를 늘리고 개선만 한다면 완벽하다."
블루 아카이브,스토리가 재밌있고 캐릭터도 잘 뽑았다. 좀 아쉬운건 캐릭터 목소리를 거의 들을 수 없다. 메인 스토리라도 풀더빙해주세요.
