game,review
블루 아카이브,리세 과정이 일섭 대비 쉬워졌다고는 하지만 너무 오래 걸림. 스토리 부분 제외하고는 스킵이 불가능해서 체감적으로 더 심하게 느껴짐. 게다가 재시작할 때마다 파일 체크하는 기능 때문에 사람 기운빠지게 만듦. 일섭이 이미 진행된 만큼 사람들이 어느정도 필수캐를 뽑고 시작하려 할게 당연한데 뽑기 횟수도 너무 부족하게 주는데다가 확률도 매우 낮음. 게다가 확률 조작이 의심될 정도로 3성 중에 필수캐는 잘 안 뜨고 이즈미 같은 쓸모없는 캐릭만 자꾸 나옴. 백수 아닌 이상 리세마라를 수십번하는 것도 쉬운 일이 아닌데 청휘석 갯수를 줄이고 3성 선택권을 주는게 더 좋은 시작이었을 법함.
블루 아카이브,겜자체는 아기자기하고 좋은데 가챠가 좀 너무해요 진짜 ㅋㅋㅋㅋ;; 재화를 많이 주기는 하는데 그거에 관계없이 3성이 안나올뿐더러 나와도 다 픽뚫임.. 심지어 지금은 확률조작 의심까지 들어요..ㅠㅠ 매 픽업마다 이러니 진짜 가챠할때마다 지쳐가고 힘들어짐.. 힐링이 아니라 열딱지나서 수명이 짧아지는 느낌 ㅋㅋ... 공식 커뮤니티는 온갖 비틱질이 넘쳐나서 정보를 보기도 힘들어요.. 곧 우마무스메로 가겠습니다 >< 여전히 남아계실 선생님들 화이팅입니다!!
블루 아카이브,케릭터가 매력적임 케릭터성 겹치거나 호불호 갈릴만한 케릭이 거의 없음 강도 게임중독 허당 등등 신선한 케릭이 많음 스토리에 보이스 없는건 아쉽지만 대신 메모리얼이 더욱 임팩트가 남음 스토리가 완성도가 높음 진짜 뽕이 차오름 게임도 나음 재미있음 내가 직접 덱 짜고 빌드 만드는 재미도 상당함 물론 리트가 문제임 몇십분동안 내내 해야하기도 함 정공전 ai 답답한 문제도 있음 슌이 엄폐물 뺐기면 돌격하고 적 바로 앞에서 포복하고 맞고 죽거나 초반 덱이 뭣같이 떠서 지거나 등등 그리고 케릭터가 게밀트에 쏠려있어서 게밀트 육성 재화가 너무 부족한 문제도 있고 그래도 아주 매력적인 게임인거 같음
블루 아카이브,"막 깔았는데 팅기는 부분이 있군요. 이래서는 플레이 해보려는 유저를 막는 것으로 밖에 안 보이는데.. 이거 언제 고쳐집니까? 다운로드 하다가 팅기는게 한두번이 아니네요. 한번에 다 다운로드 하고 게임 할 방법이 없는겁니까? 추가) 요 얼마전에도 패치하는데 같은 상황이 나오더군요. 당황스러운건 용량이 충분해도 이런다는거고, 오류로 종료 되어도 다시 접속하면 마저 나머지 부분을 받는다는거죠. 웃긴 상황이에요. 다 받고나선 게임은 잘 돌아간다는거죠. 정말 당황스러운 상태긴 합니다."
블루 아카이브,캐릭터들의 인연랭크를 올릴때 한번에 다 볼수 있게 한 점은 좋았으나 한번에 다 보려고 할때 인연 스토리 버그 때문인지는 몰라도 인연랭크 보상을 못받았으나 인연랭크는 올라갔다고 뜨더라구요...해결부탁드립니다...그리고 게임 잘하고 있습니다~악성 리뷰들도 있지만 힘내셔서 열심히 일해주시길 바랍니다~
블루 아카이브,+일러이쁨 +SD캐릭터 싸우는거 커여움 +이해하기쉬움(비슷한류의게임이 차고넘쳐서 그런거도있고) +손컨이 재밋음! -성장이 고됨(갈수록 키워줘야할애가 많아지는데 성장재화가못받쳐줘서 좀 빡셈. 그마저도 사기캐몇몇이 없다면 허접한2성을키워서 똥꼬쇼해야됨) -캐릭터풀이 적음(차차 캐릭터가많아지면 나아지겠지만 아직은 없으면꼬울정도로 다른유저와 차이가벌어짐..) -보이스가좀 아쉬움..(서브스토리도 보이스좀 들어있었으면했는데.. 밋밋해서 몰입이안됨) 아직은 재밋음! 딱 가챠운 거지같아서 나홀로 꼬와죽을거같은거빼면 다 맘에듦!
블루 아카이브,"캐릭터 수집형 게임이지만 수집 난이도는 보통, 육성은 약간 어려움(성급 올리기). 장비는 재료모아 업글하는 식이고 재료 수급 난이도도 낮은 편이라 부담이 적음. 캐릭터 성급이 있지만 1성→5성이냐 2성→5성 차이라 시간과 노력으로 커버 가능. 캐릭터을 빨리 키워서 자랑하고 싶다면 과금, 느긋하게 즐기고 싶다면 무과금으로. 개인적인 생각이지만 미소녀들이 무기를 들고 싸우는 컨셉의 게임 중에서 매우 밝고 유쾌한 게임이라 생각함."
블루 아카이브,"UI, 캐릭터, BGM같은 게임성 외적인 요소는 정말 너무 맘에들어요. 겜 자체도 모바일 게임인거 감안하면 걍 할만 하구요. 전술대회같은 pvp는 그냥 내려놓으니까 편하네요. 다만 매번 화면 넘어갈때마다 있는 약간의 잔렉, 지나치게 픽률이 낮은 학생들에 대한 개선이 없을거 같은 느낌이라 그 부분은 약간 아쉬워요. 특히 스페셜쪽 애들. 흔히들 말하는 4대장만큼 올려달라고는 안하지만, 어짜피 캐릭터 수집하는 게임에서 사용할 수 있는 캐릭터가 늘어나면 더 재밌을거 같은데... 그리고 3성 확률 자체는 무난한 편이지만 픽업확률이 지옥인점, 그리고 이겜에서 재밌는 컨텐츠가 총력전 뿐이라 이부분도 좀 앞으로 늘어나면 좋을거 같아요"
블루 아카이브,"독특한 세계관과 귀여운 일러스트, 명품 성우진, 각 캐릭터들의 개성들이 좋습니다. 하지만 분재겜 치곤 사료가 적으며 과금효율도 좋진 않습니다.또한 데이터 상태나 휴대폰의 성능, 인권캐의 유무에 따라 승패가 결정됩니다. 다른 리뷰처럼 잦은 팅김은 체감 되진 않지만 타사게임보단 긴 로딩속도는 불편하긴 합니다."
블루 아카이브,"게임자체는 여태해본 분재겜중 가장 재미있었습니다. 우선 가차확률과 리세 부분에서는 체감상 3성 캐릭 확률이 낮다고 느꼈지만, 24000다이아 당 천장이 존재해서 2주간의 신캐 픽업 마다 확정으로 얻을수 있다는 점이 좋았고, 두번째로 전투 시스템의 경우 아기자기한 3d sd캐릭터의 은엄폐 및 상호작용, 스킬 애니메이션 모두 이 게임만의 개성적인 면모가 보여 질리지않았습니다. 세번째로 호감도 상승에 의한 메모리얼 개방의 경우 충분히 매력적으로 다가왔으며, 마지막으로 메인, 서브 ,호감도 스토리모두 입체적이여서 좋았다. 현재 나온 총력전의 경우 엔드컨텐츠 로서 다양한 캐릭의 육성의 맛을 느끼게 해준다."
블루 아카이브,"프리코네와 거의 대부분의 시스템이 비슷하지만, 전투 시스템이 보다 더 전략적인 것이 장점. 하지만, 아직 프리코네에 준하지 못하는 편의성 패치가 필요하다는 것이 흠인 작품. 게임성 이외에도 각종 일러스트나 BGM의 우수성이 게임을 더 빛난다고 생각."
블루 아카이브,장점1. 스토리가 너무 재미있어요. 솔직히 소설로 내도 될 정도라고 생각합니다.(메인 스토리는 좀 무겁게 다루고 서브 스토리는 즐거운 느낌으로 다뤄서 완벽한 밸런스를 유지하고 있습니다.) 장점2. 캐릭터가 개성있게 잘 뽑혔어요. 하나같이 정말 좋아요. 장점3. 청휘석을 많이 퍼줍니다. 리세 잘하고 최대한 아끼면 무과금도 어느정도 할만합니다. 단점1. 이건 개인차가 있을 수 있는데 총력전 할 때 빼고는 할게 없네요.(저는 괜찮다고 생각함) 단점2. 대항전AI가 너무 심각합니다. 이건 재밌게 플레이하는 유저들도 느끼는 최대의 단점입니다. 스킬발동 순서를 미리 설정할 수 있으면 좋겠습니다.
블루 아카이브,"리뷰 없어져서 3번째 다시 씀. 게임이 전체적으로 답답함. 게임 실행 후 짧으면 20초 길면 30초 이상 로딩, 플레이 중간중간에도 5초 정도 로딩 걸리고 잡렉도 있음. 정식오픈 게임이 아니라 오픈베타 게임 같음. 뽑기는 조작 의심될 정도로 많이 매움. 오픈 사료만으로 47뽑이나 가능해서 리세 좀 해봤는데 첫 무료 10뽑에서 3성 확정인거 빼면 3성 진짜 안나오는 편. 3성 뽑더라도 나오는 캐릭터만 나오고 특정 캐릭터들은 절대 안나옴."
블루 아카이브,재밌는데 룸메랑 사용하는 kt 개인공유기랑은 연결하면 튕기고 건물 전체에서 쓰는 공용공유기랑 연결하면 잘 되는데 이거 왜 이런 건가요? 개인공유기는 다른 거 다 잘 되고 공용공유기는 다른거하면 엄청나게 버벅거리는데 이게임만 엄청 잘 돌아가갖고; 맨날 바꾸기 귀찮아서 별 하나 뺐습니다
블루 아카이브,장점은 캐릭터 하나하나가 다 매력적입니다. 개성이 있고요 전투부분에선 재미있었습니다. 단점은 스토리랑 호감도 부분에서 보이스가 없습니다. 호감도 스토리에서라도 보이스 있었으면 좋았을텐데 아쉽습니다 메인화면에서 라이브 2D가 없는점은 아쉬운데 메인화면으로 들어갈때 대사있어서 좋았습니다.
블루 아카이브,장점 1. 캐릭터들이 귀엽다. 2. 발열이 없다. 단점 1. 게임 접속 로딩 시간이 상당히 길다. 2. 게임 중간중간 로딩도 타게임들의 비해 길다. 3. 배터리 소모 상당하다. 4. 그래픽 최상이여도 많이 깔끔하지는 않지만 최상이 아니면 전투 화면 캐릭터들 어색하다. 5. 게임을 살짝만 창 내려도 재접해야한다. 6. 단점이 너무 많다.
블루 아카이브,일단 재밌음.광고 때문에 사전등록 했는데 킬링타임용으로 해보니까 은근 재밌다.캐릭터들도 그리는사람이 다 달라서 각자 매력이 있고 전투 때는 sd로 나오는데 처음엔 별로였는데 볼수록 귀엽다.가챠겜이라서 3성 뽑을때 쾌감도 있고 뿌듯함도 있다.넥슨이 투자를 많이해서 그런지 운영만 잘하면 갓겜될 듯하다. 그리고 청회석 좀 많이주셔야 될듯 가챠겜이라 3성이 없으면 임무깰때마다 힘들어지는데 과금안하면 3성 얻기가 힘들어서 유저들 격차를 줄여야 될듯함. 요약하자면 운영막 잘하면 갓겜.
블루 아카이브,각종 버그가 속출하고 있고 게임 서비스가 엉망입니다. 120청휘석 주말쿠폰 무한 중복 사용 버그. 노노미 캐릭터 신명문자 클릭한 만큼 중복해서 얻는 버그. 레벨1짜리가 40레벨 캐릭터보다 강해서 그걸 이용해서 지역이랑 현상수배 다 뚫어버릴 수 있는 버그. 심각한 수준입니다.
블루 아카이브,일단 기본적으로 넥슨게임이라는 편견은 버려주고 시작해주셨으면 합니다. 저도 넥슨 좋은 시선으로 절대 안 보고있고 다른 게임도 잘 안했지만 과거의 듀랑고를 정말 재미있게 플레이 했던 기억이 떠오를 만큼 정말 재미있게 플레이 하고있습니다. 듀랑고는 안타깝게 되었지만 블아는 그렇게 되지않고 자신만의 길을 갈 수 있길 빕니다. 이제 블아가 다른 수집형 RPG들과 다른 점들을 몇가지 보면 크게 전략성과 형평성이라고 생각하는데요. 전략성으로는 일단 전투에서 고려할 요소가 엄청나게 많고 후반으로 갈수록 다양한 조합을 구성해야되며 흔히들 말하는 1티어 덱이라는게 매 지역마다 바뀌기 때문에 다양한 캐릭을 키워야합니다. 그리고 형평성으로는 다양한 캐릭을 키워야 하는 만큼 1~2성캐릭들도 3성캐릭터들 못지 않게 좋거나 특정 상황에는 무조건 데려가야 되기도 합니다. 아무리 좋은 1티어 캐릭이라도 히비키를 제외하면 대체불가능한 캐릭은 없기때문에 리세를 하신다면 히비키만 데려가십시오 글자수가 적어서 여기까지
블루 아카이브,솔직히 말해서 기대 이하다 이런류의 게임이 한 두개도 아니고 여렀있다. 그리고 무엇보다 엄패라는 시스템은 좋았으나 모션이 너무길고 숨는 알고리즘이 너무 멍청하여 초반에는 숨다가 아무런 딜을 못하고 끝나는 경우가 태반이다. 숨는 알고리즘은 최대 사거리에서 가장 가까운 적에게 닿는 곳 인거 같던데 이게 문제다. 이게 이상한 곳에서 숨고 딜을 못하게 한다. 게임 플레이만 보면 1점을 주고 싶지만 다른 컨텐츠는 즐길만 하다. 다시 말하지만 게임 플레이가 재미없다
블루 아카이브,"읽기 가볍고 재밌는 스토리. 각자마다 매력을 가진 캐릭터. 중독성 있는 bgm 이라는 세가지 요소는 게임이 재미있다고 느끼게 해주었다. 다만 유독 맵게 느껴지는 뽑기 확률. 스토리의 더빙 부재. 일부 성의없는 번역은 게임을 아쉽게 만든다. 확률 자체는 다른 게임과 크게 다를게 없으나, 그 확률로 뽑을 캐릭터 하나하나가 쓰임새가 있어 뽑기를 자극하고 이를 계속 뽑다보니 다른 게임에 비해 맵게 느껴지는 것 같기도 하다. 더빙도 은행 털자. 갓겜입니다 같이 재미있는 씬을 딱딱한 텍스트로 때우다 보니 심심함이 느껴지며 아쉬움이 남는 듯 하다. 번역은 콘비니(편의점) 같이 일본식 발음을 그대로 싣거나 레일건/자주포처럼 원문은 레일건이라는 같은 단어임에도 다르게 번역한 건 성의가 없게 느껴질 수 밖에 없다. 그리고 무엇보다 아쉬운 건 개발사가 각종 인터뷰에서 바쁘다는 밑밥을 뿌리고 있어 이대로 쭈욱 갈것 같다는 점이다."
블루 아카이브,"일단 자동모드로 하면 적이 맞지도 않고 죽으면 쏘고 너무 안 좋아서 수동으로 해야 해서 엄청 피곤하네요. 그리고 뽑기 확률이 너무 낮습니다. 맨날 2성만 나와서 진행을 할 수가 없네요. 중복으로 나와도 1성은 조각 1개, 2성은 10개만 주니까 2성이나 3성으로 올리기도 힘들고요. 무과금은 하지 말라는 것 같네요."
블루 아카이브,"전체적으로 로딩이 너무 김. 특히 게임 들어갈 때 마다 로딩만 30초 이상 씩 걸림. 전투도 개인적으론 아쉬운게 sd캐릭으로는 잘 만들었지만 전투 시작부터 끝날 때 까지 캐릭터들은 뒤통수만 보임. 캐릭터가 잘 보이게 관전 시점 바꿀 수도 있었으면 좋겠음. 처음 시작할 때 튜토리얼 스토리에는 텍스트에 맞게 보이스가 나왔었는데 막상 게임 진행 해보니까 메인 스토리, 서브 스토리에 보이스 하나 없이 텍스트만 나옴. 20년 전에 있었을 법한 미연시 게임 같아서 스토리 올 스킵함. 이렇게 보니까 보이스 비는 곳을 찾을 수가 없는 프리코네가 얼마나 디테일하고 투자를 많이 한 게임인지 알겠음. 그래도 솔직히 운영 자체는 좋음. 일섭은 300천장 시작이였는데 한섭은 시작부터 200천장 조기도입으로 시작하고 오픈 사료도 적은 양은 아니였음."
블루 아카이브,"단점만 적겠음. 1. 심각한 개발능력 및 발적화 최대 해상도가 4:3 쯤으로 고정이라 갤럭시폴드에선 레터박스가 남음. 게다가 안드로이드는 최적화실패로 인하여 HD급 화질을 어거지로 늘려놓인 것으로 보임. 덕분에 그래픽이 자글자글함. 충격적인건 이렇게 해놓고도 인게임에서 렉걸릴 때가 있음.. 2019년 출시한 걸카페건도 이렇진 않음. 일단 레터박스도 인 게임 내에선 안남고, 해상도도 매우 훌륭하게 출력됨. 발적화로 인해 매력적인 일러스트들을 저해상도의 자글자글한 화면으로 봐야하는게 너무나 아쉬운 점임. 프로그래밍 실패로인하여 아트팀 결과물을 망쳐놓은 느낌임. 최적화는 이 게임이 오래가려면 반드시 해결해야하는 문제임. 하지만 이 외에 AP가 가득찼다고 잘못오는 알림, 네트워크연결실패 알림등을 아직도 못 고치는걸 보면.... 이 게임의 미래는 어둡다. 능력없는 프로그래머들 전부 리소스지원실로 보내고 시니어 급으로 새로 뽑아야할듯하다. 적을게 많은데 500자 제한. 안타깝다"
블루 아카이브,"다른 사람들이 좋은 점에 대해 입이 닳도록 말해주시니 저는 사람들이 좋지 않게 평하는 점을 논해보도록 하겠습니다 1. 가챠 많이들 얘기하십니다. 저는 이정도면 천장 시스템도 무난하고 확률도 요즘 가챠겜에 비해서나 단독으로 보나, 괜찮다고 봅니다. 리세는 가챠겜 특성상 좋고 안좋은 캐릭터가 나뉘니 어쩔수 없습니다. 다만 픽업 3성 확률이 조금 아쉽다고 볼수는 있겠습니다. 2. 최적화 이거는 확실히 좀 부족하다고 봅니다. 그래픽이 월등히 엄청난 게임이 아님에도 불구하고 렉등이 좀 있는거 같습니다. (앱플레이어, 폰 동일) 최적화가 문제가 좀 있기에 어떤 핸드폰, PC를 가져와도 렉이 좀 걸립니다. 나머지는 만족하고 있습니다. 지금은 운영이 괜찮은데, 나중에는 또 넥슨이라 어떨지. 지켜봅니다 중구난방한 글 읽어주신거 감사드립니다."
블루 아카이브,굉장히 재밌지만 똑같은 것만 반복하는 것이 아쉽네요. 그리고 자주 그러는데 자꾸 튕겨서 시간을 여태 30분은 버린 것 같아요. 이것들만 수정해주신다면 감사하겠습니다. 그래도 정말 재미있네요 유튜브에서 재밌다고 했거든요. 캐릭터도 너무 귀여워서 3점 줄여다가 5점 드립니다. 튕기는거랑 똑같은 컨텐츠를 반복 하는 짓만 수정해주시면 감사하겠습니다.
블루 아카이브,이런 질문 드려서 죄송합니다만 꼭 답변 부탁드립니다. 블루 아카이브를 설치 후 플레이하다 저와 잘 맞지 않는 것 같아 삭제하게 되었는데 핸드폰에서 블루 아카이브 아이콘이 지워지질 않습니다. 아무래도 제 폰의 문제인가 싶어서 다시 설치 후 지워도 보고 휴대폰 전원도 꺼보고 했는데 요지부동입니다. 혹시 개발사측에서 해결할만한 방법을 알고 계신다면 아무쪼록 답변 부탁드립니다. ㅠㅠ
블루 아카이브,"캐릭터 디자인,bgm 등 아트웍이 캐리했다 생각해요 게임성은 캐릭터간 밸런싱 면에서 좀 아쉽지만 그래도 이만하면 공략할 요소가 죽은 수준은 아니여서 할만합니다 다만, 이 게임은 엄연히 '분재 게임' 류의 라이트한 게임인데 그에 반해 로딩이 너무 길다고 생각해요 로딩창에 짤막한 컷만화로 보완을 시도한것 같은데 한두번이지 컨텐츠,우편함,미션함 왔다갔다 하는데만 스트레스를 유발합니다 이게임 오래 하기위해서 언젠간 손을 봐줬음 싶은 부분입니다"
블루 아카이브,"게임 자체는 재미있음.. 가볍게 하기 좋네요. 다만 어설픈 역 로컬라이징(?) 대신 그냥 일본 배경 그대로 쓰는 건 그럴 수 있는데.. 미션 지명 ㅇㅇ정목 이라든지 이건 느낌을 살린게 아니라 그냥 번역을 ""안"" 한거임... 차라리 ㅇㅇ쵸메 라고 하던지.. 교토를 경도라고 넣은 거나 마찬가지죠. 곳곳에 나타나는 한국식 한자 읽기는 오히려 몰입을 깨트리는 수준의 번역이라 아쉽네요."
블루 아카이브,1. 갸챠가 매우 매운 맛. 2. 스토리 보이스x (메모리얼은 매우 제한적) 3. 최적화가 덜되어있고 캐릭터나 게임 컨텐츠가 아직 덜 완성됨 - 스토리랑 캐릭터는 괜찮은 편이므로 무과금 찍먹정도는 추천턱걸이로 가능.
블루 아카이브,"하면 할수록 재미없는 게임, 일반적인 진행에서의 하자는 탱커가 아닌데 총 사거리가 짧으면 탱커랑 같은라인으로 가서 맞아죽고 본인기준 부채꼴범위의 스킬을 가진 캐릭터가 너무 후위에 있어서 범위가 무색하게 딜을 못넣을때가 있는게, 전술대회에서 특정캐릭터가 없으면 처맞는게, 총력전에서 무한 딜찍누 랭킹이 당연한, 전형적인 pay to win분재 게임. 고딩(으로 추정되는)치고 훌륭한 혹은 초라한 몸뚱아리에 흥분하라고 만든 씹덕게임이지만 게임성이 해도해도 너무하다 싶을정도로 엉망이다 총력전에서 보스의 스킬 범위를 보여준다한들 이동하는 스킬을 가지고 있지 않으면 그냥 맞고 힐 해줘야하는데 이동스킬을 가지지못한 캐릭터가 더 많은데 왜 보여주는건지 의문스러울정도다. 쓰고싶은 타이밍에 스킬을 마음대로 쓰지못해서 많이 답답하고 지루하다. 과거 다른게임과 비교해도 더욱 덜떨어진 게임이라고 생각하며, 3배속 오토랑 본인이 할 때의 차이는 스킬 타이밍 뿐이라는걸 인지하고 시작하자."
블루 아카이브,게임은 저의 취향이고 재밌습니다만 ap나 카페의 생산량이 다차지도 않았는데 ap나 카페의 생산량이 다찼다고 알람이 오는 버그가 있습니다. 가끔씩 한두개쯤 오는거면 그렇게 신경은 쓰지 않을텐데 그렇게 길지않은 텀으로 10~30개 정도의 알람이 옵니다. 저는 개인적으로 알람을 중요시하는 편이라서 이런 알람이 오면 곤란하네요. 이러한 버그들을 고치고 점점 성장하는 블루 아카이브가 되기를 바라며 글을 마치겠습니다.
블루 아카이브,"저는 블루 아카이브의 캐릭터와 스토리, 그리고 BGM을 통해 다른 미소녀 수집형 게임보다 더욱 강렬한 생기발랄함과 친밀감을 느꼈습니다. 또한 그것이 이 게임의 장래에 대해 희망을 갖게 해주는 원동력이라고 믿습니다. 비록 서비스 초반에 갖은 버그가 발견되고 있지만 개발 및 운영 팀에서 문제를 해결하려는 의지를 보았고, 따라서 이 역시 곧 극복할 수 있을 것입니다."
블루 아카이브,"핵을 잘 잡지도 못하고 캐릭터 오류 보상, 스테이지 오류 때문에 공평하게 겜도 안돌아가는데 여기에 결제를 한 것이 아깝습니다. 무엇이 문제인지 무엇을 해결해야 하는지 시급히 해결하지 못하는 모습을 보여왔고 절대 좋은 태도라고 보이지 못했는데 유저를 위한 게임 운영 보여주세요 개선을 하는 모습 보여주길 기대합니다."
블루 아카이브,전체적으로 로딩시간이 너무길다.시작화면부터 긴로딩시간.중간중간 화면 넘어갈때도 늘어지고 편의성 개선도 할게 많은데 일단 소탕을 누르면 스킵버튼이 왜있어야 되는지 모르겠다 소탕이면 빠르게 넘겨 줘야지 거기에 스킵 선택버튼 만들고 재확인 버튼도 눌러야되고 로딩도 긴데 저런 불편한건 왜 넣은건지 참. 빠른개선 요함
블루 아카이브,"정말 애매한 게임이라고 할 수 있다 내가 느낀 장단점을 적어보겠다. 일단 스토리, 스토리가 잘 짜여져 있다고 생각한다 또한 일러스트가 퀄이 좋다 별 3점은 스토리와 일러스트에서 전부다 왔다고 보면 된다. 문제는 일러스트와 인게임의 퀄리티 차이이다 우선 캐릭터 3D디자인이 정말 구리다 또한 화질 자체도 그렇게 좋지 못하다. 이 게임은 인게임 캐릭터 디자인, 화질만 개선해도 정말 괜찮은 게임이 될것이라고 생각한다 물론 큰 문제점은 없지만 기대했었던만큼 개인적인 만족감 문재로 별3개를 주는 것 같다"
블루 아카이브,"스토리, 플레이 스타일, 가챠 등 다 좋은데 전술 대회에서 오토 AI가 너무 안 좋다고 생각이 많이 든다. 상대가 방어를 할 때 직접 조종을 못 한다는 점에서 공격도 오토로 만든 것은 굉장히 좋았다. 하지만 분명 공격을 해야 하는 타이밍 때 전혀 효과도 없는 힐, 죽기 직전인데 스킬을 쓰고 스킬이 나가기도 전에 죽어버려 코스트를 날려버리는 사태가 빈번하다. 시작하자마자 다른 공격 스킬이 있어도 힐캐 스킬이 있으면 먼저 쓰는 경우도 대다수다. 오토가 스킬을 그냥 나온 것들 중에 랜덤으로 골라주는지는 잘 모르겠지만, 캐릭터가 같은 상황에서 레벨차이가 나는데도 스킬을 잘 못 골라서 레벨이 높은 쪽이 지는 경우도 꽤 많이 있었다. 그 덕에 레벨이 더 낮은 사람이 이기면 나보다 레벨이 높은 사람을 이겼다고 기뻐하는 사람들이 있겠지만, 레벨이 더 높은데도 져서 억울한 유저도 많을 것이다. 이에 대비해 사용 우선 스킬 지정 같은 것을 만들면 전술대회도 오토때문에 불만 없이 즐길 수 있을것 같다."
