game,review
Goose Goose Duck,업데이트를 했는데 업데이트를 하라고 뜨고 안들어가집니다 껏다 껴봐도 그대로고 지웠다 깔아도 업데이트를 하라고 합니다. 이 현상으로 인해 게임을 못하고 있습니다 빠른 조치 부탁드립니다
Goose Goose Duck,모바일도 편하게 게임을 즐길 수 있도록 조작이 쉬워서 더 재밌고 직업도 밸런스가 잘 맞춰서 있는것 같네요! 게임 번창하시길!
Goose Goose Duck,너무 재밓고.. 지금 거의 중독 상태인데 친구가 없어서 자주 못하고 있어요.. 재밌어요..
Goose Goose Duck,제작자님 업데이트100% 됐는데 왜 플레이가 안돼죠?(참고로 와이파이 아주 잘 잡임)
Goose Goose Duck,"전 이게임을 아주 잘 플레이하고 있는 유접니다. 이 글을 쓰는 이유는 신규 모드와 신규 직업을 제안하기 위해서 입니다. 첫번째, 경도 모드, 경도모드는 오리는 경찰이 되고 도둑은 거위가 돼서 진행하는 게임입니다. 경찰은 제한시간 안에 도둑을 다 잡아야 하고 도둑은 경찰을 피해서 제한시간동안 살아남으면 됩니다. 이제 신규 직업을 말하겠습니다. 첫번짼 심령술사고 두번째는 불사조입니다. 심령술사는 거위이며 암살자처럼 투표당한번씩 유령들과 대화할수 있습니다. 두번째는 불사조인데 불사조는 죽으면 다시 부활할수 있으면서 만약 미션을 다하면 오리가 누군지 알아낼수 있는 직업입니다 이게 추가된다면 재밌을것 같아 제작자님께 요청함니다"
Goose Goose Duck,어몽보다 100배는 더 재밌고 어몽은 로그인 해야 되는데 이건 음성에다 채팅까지 되니까 겁나 재밌고요 한 20개의 직업은 있어서 재밌고 어몽은 맵이 적은데 이건 많아요 꿀 잼
Goose Goose Duck,구스덕 개발자는 들어라!!! 라운지 닫혀있는 방에 새로운 유저 들어왔을때 벽뚫리는 버그 고쳐라!!
Goose Goose Duck,개발자님들도 친절하게 대답해주고 인게임에서도 재밌습니다.업데이트도 자주해주고 투표 버그가 있긴 한데 그것만 고쳐주시면 5점 드리겠습니다.그리고 게임 엄청 제밌내요.
Goose Goose Duck,게임은 너무 재미있고 좋은데 패드립퍼랑 욕하는 사람이 너무 많아요. 그런데 신고할수도 없고 ...그래서 좀 개인적 생각인데 밴을하거나 신고를 할수있으면 좋겠어요.
Goose Goose Duck,직업도많고 어몽보다 꿀잼이네요ㅋㅋㅋ 나중에 모드생겼으면 더욱더 꿀잼일듯하네요 다운많이해주세요
Goose Goose Duck,너무 재미있어요! 근데 게속 게임에서 제 목소리가 안들리고(마이크 켰는데) 게속 튕겨가지고 다시 들어가야 하네요! 빨리 고쳐졌으면 합니다
Goose Goose Duck,친구들끼리 하면 재미있는데 pc에 비해 모바일이 성능을 잘 못따라오네요. 마이크랑 헤드셋 오류가 많고 돌아다는 조이스틱도 pc에 비해 느리고 조작이 까다롭습니다.
Goose Goose Duck,게임은재밌어요 하지만 욕설은 차단이나신고를해도안되요.. 그래도 아주재밌고 게임이 창의적(?)입니당!
Goose Goose Duck,저는 라운지를 하는 유저입니다. 라운지에있는 문 기능좀 없애주세요. 진짜 그거 필요없어요.
Goose Goose Duck,컨트롤이 많이불편합니다 조이스틱으로있으면 좋을텐데 조이스틱이 아니네요 제가 모르는거일수도 있지만 많이 불편하네요!
Goose Goose Duck,아니 뭔 나중에 들어가면 무한로딩걸리고 로딩도 오래걸리고 재미는있지만 로딩문제로3점드립니다.
Goose Goose Duck,광고 전혀 않나오고 정말 재미있어요!! 어몽어스 뒤를 이은 덕몽어스 다른 분들께 추천 드려요. 아 그리고 금 동전도 많이 부탁 드려요. 제발요 ㅠㅠ 제작자님 부탁 드려요. 저도 오류가 있다면서 플레이 스토어에 계속 들어오게해요. 어떻하죠 방법을 알려주세요. 지금 너무하고 싶은데 오류 때문에 못하고 있어요.ㅠㅠ 🥺😭🥺😭🥺😭🥺😭🥺😭🥺😭🥺😭🥺😭🥺😭🥺😭🥺😭🥺😭🥺😭🥺😭🥺😭🥺😭🥺😭🥺😭 아이 속상해 부탁드려요. 삭제를 해봤더니 이번에는 업데이트가 나오네요.ㅠㅠ
Goose Goose Duck,"진짜 최고의겜, 어몽보다 더 많은직업과 모드도 있고 음성채팅까지, 이정도면 마피아게임중에 극락이다."
Goose Goose Duck,정말 재미있어요 어몽어스 패러디 인가 하고 해봤는데 직업도 다양하고 맵 코스튭 다 다양해서 재밌고 좋은것 같아요 그리고 제일 좋은건 마이크가 있어서 편해요!
Goose Goose Duck,넘 잼나용. 근데 회의창에서 오리이름이 살색바탕에 하얀색이라 잘 안보이고 글씨가 너무 작습니다. 대빵컷으면 좋겠고 오리도 커지면 좋을것 같아요.
Goose Goose Duck,진짜 너무 강추합니다. 재미있고 스릴있는 게임입니다. 무조건 한번 해보세요!
Goose Goose Duck,진짜 최고의 게임입니다 엄청 재밌음 이게임이 버그가 많다 들어가지지 않는다라고 평점이 낮은데 그건 폰 문제에요 이게임 진짜 매일 매일 하고있어요 이게임 추천합니다 진짜 찐으로 엄청 재밌음 직업도 엄청많고 사람들이랑 음성채팅도 가능하고 그냥 갓겜임 꼭 깔아보셈 개재밌음ㅋㅋ
Goose Goose Duck,너무재미있네요.한가지안좋은점이있다면.....엄..없어요! 그냥짱짱짱 재미있어요 !
Goose Goose Duck,재미있습니다. 하지만 사람들이 게임을 하는 동안 나가는 경우가 많습니다. 나갔을시 코인을 없애는 방법으로 벌을 주는것이 좋을것입니다. -구스구스덕을 좋아하는 평범한 한국인 유저-
Goose Goose Duck,모든게 재미있고 좋습니다 다만 한가지 문제점은 게임을 플레이 하는 유저가 횡포를 부린다는 것 입니다. 제보를하여 제보가 누적되면 특정 기간동안 플레이를 막는 기능을 만들 생각이 없습니까?
Goose Goose Duck,별로구 버그가 많이 생기고 회원가입 해야되요. 너무 복잡하구 또 무슨 업데이트인가 그걸 하라고 하네욥 그거 감안 하실 분만 추천 드릴게요.
Goose Goose Duck,친구들과 하기 좋아요! 컨트롤은 모바일보다 컴퓨터가 하기 좋아요! 역할도 많고 마이크로 말도 할 수 있어서 정말 재미있습니다!! 친구들과 즐기기 정말 좋아요
Goose Goose Duck,친구들과도 할수있고 일반+모드를 하면은 여러가지 직업을 할수있어 좋아요
Goose Goose Duck,이거 재밌는 게임 같은데 튜토리얼중에 움직이다보면 그 자리에서 안움직이더라고요? 그래서 게임도 못해보고 만약 어떻게 해야 풀리는지 아시는 분은 알려주시기 바랍니다 ㅠㅠ 이 폰이 이상한진 모르겠어요 ㅠㅠ
Goose Goose Duck,마피아게임비슷한 게임 인데 직업이 다양하고 마이크 채팅 둘다가능 하고 성인들 많아서 매너도 좋고 재밌어요 업적이 있어요 보상도있고 스킨및 이모티콘도 살수있어요 매우 재밌어요 친구들끼리도 할수있어 친구들에게 알려주고 싶어요 다른분들도 꼭 깔아보세요!!
Goose Goose Duck,"어몽어스보다 더 재미있는 것 같아요!ㅎ 직업도 있고,사보미션이 있어서 그걸로 임포로 몰려서 직업을 발키는 데 암살자가 죽였어요. 그래도 어몽어스 보단 재미있어요!"
Goose Goose Duck,아 친구들이랑 하는데 너무 재밌어요ㅜ👍 미션에도 스토리가 숨겨져 있는 거 같고 특히 오리들이 너무 하찮게 생겨서 너무 귀여워요ㅜ직업도 많아서 색다른 느낌인 게임 이예요ㅜ❤❤
Goose Goose Duck,접속 안되는 건 삭제 했다가 다시 깔면 해결 되었다. 그런데 게임을 할때 컨트롤 키가 없는 것이 아쉽다.
Goose Goose Duck,마이크가 되는 게임 이여서 조쿠여 덕몽어스에 잼민이가 너무 많아 시끄러웠 습니다. 너무 시끄러운 사람은 자동강퇴라는 것을 만들어 주시면 감사하겠습니당. 또 직업이 다양해 게임이 재미있습니다
Goose Goose Duck,충분히 재밌는데 조금 더 기능이 추가되었으면 좋겠다( 예 : 미션 시스템: 오리 직업일때 5마리 이상 죽이면 추가로 돈 얻음 등
Goose Goose Duck,재밌어요 아쉬운건 비공방에서만 게임시 마이크가 된다는 건데 그렇게 한 이유가 있나요? 그리고 방에서 나가게 되면 메인으로 안 가고 방 목록이 보이면 좋겠어요
Goose Goose Duck,여태껏 게임하면서 너무 만족스러웠는데.. 2분전에 게임을 들어갔더니 로딩만 되고 게임이 안들어가집니다
Goose Goose Duck,많은 사람들과 대화하고 재밌고 좋은데 문제점은 이게 자주 연결이 끊기고 욕하는 사람들이 많습니다ㅜㅜ 욕하는 사람은 삐처리 시켜주시는 기능 넣어주시면 감사드리겠습니당!!!!!!
Goose Goose Duck,정말 재밌어 보였는데 제가 이메일을 잘 몰라서 로그인도 못했네요 이메일 말고 다른 로그인 방법이나 로그인 하지 않아도 게임 할 수 있으면 좋겠습니다.
Goose Goose Duck,노래부르는방도있고 겜하시는분들이 넘 친절하세요! 전이겜 강추합니다!!
Goose Goose Duck,이거는역할이많아서밸런스가잘맞아요그리고저는오리걸릴때밸런스가맞지만제일안맞는게변장술사가제일안맞다고생각합니다변장술사 너프좀ㅠㅜ추리불가능(걸릴땐좋음ㅋㅋ)
Goose Goose Duck,친구는 정말 좋지만 가끔 친구추가를 누르면 상대에게 전송이 안될때가 있습니다. 버그인지 확인해주세요.
Goose Goose Duck,아니 게임 방이 꽉찾으면 다시 새로고침 해주묜 되는데 왜 게임방에 꽉찾다고만30분이나 걸려 로딩이 하.... 망겜각이넼ㅋㅋㅋㅋ
Goose Goose Duck,다 좋은 데 렉이 너무 많아요 그리고 업데이트도 잘 안돼요
Goose Goose Duck,게임 팀원들과 같이 덕몽을 즐기던 중 어느날부터 방에 들어가지지 않는다거나 들어간다해도 튕기는 현상이 매일 발생하네요 게임 자체는 재밌습니다
Goose Goose Duck,아 처음 시작한 유저 입니다 일단 너무 꿀잼 이네요! ! 하지만 버그가 있어요 그레서 좀 불편하지만 버그 빼고 다 괜찮아요 버그 때문에 4별버그 고쳐 주면 감사합니다 그럼 안녕히계세요
Goose Goose Duck,재미있는데 모바일로 하면 많이 불편하네요 그래도 강추!!
Goose Goose Duck,"재밌습니다.미션도 다양하고, 사보타지, 직업등이 많아서 너무 좋고, 가까이 가면 마이크가 자동으로 연결되서 좋네요.친구들이랑 하기 좋아요. 마이크가 안 되면 설정->마이크->눌러서 말하기 로 바꾸면 됩니다"
Goose Goose Duck,"재밌는데 낙시 부분에서 시간이 너무 오래걸려요. 미션을 해야하는데 계속 밀당만 하니까 다른 미션도 못 하는 상황이나, 나만 미션을 완료하면 되는 상황인데 미션을 못 깨서 완료가 안 되어 욕 먹는 상황이 계속 되구요 낙시때문에 재미없어져요"
Goose Goose Duck,이거 문제도 생기고 마이크가 안돼서 별 한개만 주기 아깝네여..
Goose Goose Duck,광고도 없고 목소리도 들리고 더 재밌어짐 어몽어스랑 완전 비슷한 게임! 추천드림☆☆
Goose Goose Duck,안녕하세요 저는 구스구스덕을 재미있게하고있는 사람입니다. 그런데 말할것이있습니다. 그건 바로 방장은 추방을 못해 나 죽이면 너 추방 이라고 해서 제대로 게임할수없을때가 있습니다. 저가 잼민이만님한테 추방을 당해 억울해서 적습니다. 추방을 과반수가 동의하면 방장이 나가게 하는거는 어떨까요? 10명11명12명 7명이상동의 13명14명 과반수이상 15명16명 10명이상으로 해주세요
Goose Goose Duck,와 진짜 재밌습니다.이거 이상하지않고 완전히 좋아요.더 좋은 게임이 되기를 응원합니다!!!화이팅!!!
Goose Goose Duck,아니지금차별를하는방이많이있는데뭐하시는거에요그거때문에초등학생이많이접어가고있어요빨리해결해주새요
Goose Goose Duck,엄청 재밌어요! 제가 이걸 하면서 제일 좋은 점은 말을 하면서 더 좋은 의사소통? 같은 것을 할 수 있기 때문입니다. 그리고 직업 하나하나 알려주는 모든 구스 구스 덕 관리자님들! 항상 파이팅 하시고 좋은 하루 보내세요~! 재밌는 게임 만들어주셔서 감사합니다!
Goose Goose Duck,재밌어요 👍👍👍 조이스틱은 설정 가면 바꿀수 있고 색은 스킨꾸미는곳에서 바꿀수 있어요 아무튼 정말 재밌습니다!
Goose Goose Duck,회원가입을했는데 계속 로딩로딩..겜 하라는거에요 하지마라는거에요;;
Goose Goose Duck,들어갔던 방은 다시 들어갈수 있었으면 좋겠네요 게임에서 오하나 라는 친구를 만났는데 제가 잘못클릭하여 나가버려서 다신 만날수 없게 되었어요..
Goose Goose Duck,너무 재밌어요!! 어몽어스에서는 직업하려면 돈내야된다던데 여기서는 돈도 안내고 많은 직업을 할수 있어요!!(물론 어몽어스에서도 돈내라는 말은 없었지만)뭐 아무튼 너무너무 재밌습니다
Goose Goose Duck,일단 여러가지 직업이 있어서 너무 좋아요.단 게임중의 오류만 빼고요. 업데이트도 잘 돼요.좋은 게임 만들어 주셔서 감사합니다.
Goose Goose Duck,캐릭터도 귀엽고 재미있어요! 근데 옷이나 악세서리가 넘 비싸요ㅠㅠ. 장식만 좀 싸게해주시면 강추!
Goose Goose Duck,3점을 준 이유는 첫번째 음성채팅을 하게합니다. 두번째 맵이 많습니다. 세번째 새롭게 돈으로 옷을 살 수 있습니다. 네번째 음성 채팅 목소리가 작게 들립니다. 다섯번째 업데이트가 없는데 하라고 하고 있습니다.
Goose Goose Duck,재미는 있는데.... 방 나가고 다른 방 들어가려면 무조건 튕겨서 종료하고 아예 다시 껐다가 들어가는게 킹받음... 번거로워요 고쳐쥬세요
Goose Goose Duck,이거 너무 재미있어요! 다른 마피아 게임보다 직업도 많고 오리도 거위도 아닌 직업도 있고 어몽어스는 직업이 적어서 아쉬웠는데 구스구스덕은 그 아쉬운 부분이 어몽하고는 다르게 잘 되 있어서 좋네요 ㅎㅎㅎ
Goose Goose Duck,마이크가 계속 잘되다가 지지직 거린다고 하는데 핸드폰문제도 이어폰문제도 아닌데 개선좀 부탁드립니다.
Goose Goose Duck,저는 유튜브에서 핫하다고 해서 들어갔는데 로딩만 계속되고 아무것도 안되고 계정도 있는데 안들어가집니다 그래도 만약 제가 플레이를 한다면 잘 할것 같아서 이 평점 드립니다
Goose Goose Duck,움직이는게 너무 어려워요... 그래서 게임을 잘 못하겠다는 ㅠㅠ 이것만 수정해주시면 게임 재밌게 할 수 있을것같아용 ~
Goose Goose Duck,"LTE는 무한로딩, 접속이 안되요 WIPI는 접속이 너무 자주 끊겨서 게임을 할수가 없어요"
Goose Goose Duck,일단 재밌고 렉이 약간씩 걸리기도해요 예를들면 오리성당맵인 방에 들어왔을땐 비소리가 조금씩 끊겨요 이런점말고는 없는것같아요 제 설명을 읽어주셨다면 이런점 고쳐주세요 장점은 직업이 많아서 더 재밌기도 하고 맵도 여러개여서 더 재밌는것 같아요 리뷰는 여기까집니당 방금 수정했어요
Goose Goose Duck,이거 뭐죠? 아니 게임 들어갈때 무슨 영어로 적혀있는 창이 뜨는데 계속하기 버튼 누르면 스토어에 들어가게 돼더라고요. 업데이트를 하라는 건진 잘 모르겠지만 답변 해주시면 감사하겠습니다
Goose Goose Duck,이거 목소리도 낼수있고 추리하고 능력이 많아서좋아요 사람이 별로안들어 올때가 만치만요.. 그래도 재미있어여! 다들 해보셔유
Goose Goose Duck,실수로 로그아웃했는데 다 없어짐 아 내가 턱시도도 받고 그랬는데 다 없어짐 처음부터 다시 해야됨 로그인을 잘못 해서 그런지 아니면 걍 초기화된건지 돌려주세요 계속시도 해도 안됨
Goose Goose Duck,"마이크는 안하고 싶어서 찾아봤는데 안할수도 있어서 너무좋아요, 근데 게임방 찾을때 로딩 시간이 너무 오래걸려서 좀 힘드네요, 이것만 고치면 좋을거 같아요"
Goose Goose Duck,"게임에 들어가면 메인메뉴 화면에 게임시작.컬렉션 인런게안뜹니다. 언어선택,광고보기 이런건뜨는데"
Goose Goose Duck,이어폰을 껴야 마이크가 되길래 이어폰을 끼는데 로비에만 들어가면 그때부터 모든 소리가 안들리네요 안그런 경우도 있는데 그런 경우가 훨씬 많고 그럼 그때마다 재접해야돼요
Goose Goose Duck,계속 게임이 튕기네요.. 와이파이도 풀로 되어있는데 인터넷 문제로 게임이 튕겨서 시작을 못하네.. 삼성 버즈로 소통하는것도 문제가 있는것 같더라고요.
Goose Goose Duck,어몽어스는 영어로 되어 있어서 잘모르겠던데 덕몽어스는 한국어로 되어있어서 편하고 게임도 너무 재미있더라구요ᆢ
Goose Goose Duck,너무 재밌는데 모바일로 갤럭시 버즈 프로 연결해서 하면 마이크 잘 안돼요... 잠깐 나갓다오면 다른사람 음성이랑 게임소리 안들리고 너무 불편함... 스피커로 했을땐 잘 되는데
Goose Goose Duck,제작자님 이 컨트롤 움직이는게 너무 어려워요 제가 앞으로 가면 아래로 가고...오른쭉으로 가도...그래요...이 점만 고쳐주세요♡♡
Goose Goose Duck,일단 맵이점점 많아져서 원하는맵이 하기힘들고 직업들도 설명이없는것도있고 너무쓸모없는능력이 많음 채팅누르거나 신고할때 아니면 방들어갈때 렉이너무심함 그리고 투표할때 투표안누르고 나가면 거기있던전부 시간이끌날때까지 기다려야함
Goose Goose Duck,어몽보다 직업도 많고 이야기 할때 좀 편리하네요 딱 하나에 단점이 있다면 방에 들어 갈때 좀 오래 걸려요 하지만 어몽보다 5배는 더 재밌음
Goose Goose Duck,"재미있어요! 저는 삼성을 사용 중인데, 음성도 잘 들리고 좋습니다! 직업도 다양해서, 질리지 않고 재밌어요!"
Goose Goose Duck,제가 로그인 처음으로 했는데 로딩중이라며 기다렸는데 계~~~~~~~~~속 로딩중이라 하고 결국엔 못했어요.게임해보고 평가하는데 처음부터 안좋아서 3점드릴게요.
Goose Goose Duck,게임 접속하면 업데이트 하라고 하는데 막상 업데이트하려고 플레이스토어 접속하면 업뎃 버튼이 없네요..
Goose Goose Duck,재밌는데 서버 끊김이 심해요 인터넷 연결되있는데 인터넷 연결을 확인하라고 뜨네요? 서버만 잘 관리하면 완벽한 게임이 될것같아요
Goose Goose Duck,네 됬어요. 근데 모바일로 패키지 구매는 되는데 골드코인 구매 누를 때 마다 로딩이 너무 오래걸려요. 결제가 안되요
Goose Goose Duck,"버즈 사용시 음성 인식이 안됨, 조이스틱과 능력 버튼 위치가 불편함, 하지만 게임은 재밌음"
Goose Goose Duck,오늘 처음깔았는데 오리 튜토리얼 다하고 거위 튜토리얼을 할려고 들어갔는데 지도를 들어가니까 거위가 못움직이더라구요 조이스틱은 잘만 움직여지는데 거위가 안움직여져요..
Goose Goose Duck,너무재밌고 다 좋은데 인터넷이 너무 자주 끊겨요 너무심해요.. 도중에 게임 자꾸 강종됨 겜을 할수가없음.... 제발 개선해주세요
Goose Goose Duck,아주 재밌는 게임입니다 그리고 직업이 많아서 좋아요 그리고 장의사와 한탕주의자는 그냥 무직업이랑 비슷하다고 셍각해요 장의사는 그냥 시체 조사하다가 의심을 받을수있으니까요
Goose Goose Duck,정말 재미있는 게임인데 이번에 생긴 친추 시스탬에서 친구를 초대하는것만이 아닌 친구가 있는 방에 들어갈수 있는 기능이 생겼으면 좋겠네요
Goose Goose Duck,이어폰끼고 할 때 소리좀 제대로 났으면 좋겠어요 ㅠㅠ 진짜 게임하다가 멈춘적이 한 두번이 아님.. 다 좋은데 그거 하나만 좀 고쳐주세요 제발 ㅠ
Goose Goose Duck,"직업 추천:이름이 마음에 들지 않는다면 바꿔서 지어도 됩니다. 1.구세주/영매사처럼 죽은 사람을 확인할 수 있고, 게임당 한번 한 명을 부활시킬 수 있습니다. 단,부활한 사람은 채팅 및 음성채팅이 불가해집니다. 2.방어자/마피아들이 불을 질렀을 경우, 한 판당 한번 바로 불을 소화할 수 있습니다. 3.힌트발동자/미션을 일정량동안 수행하면, 마피아들의 옷의 일부분을 보여줍니다. 4.스펙터/벤트에 있는 사람을 볼 수 있습니다. 5.프리즈너/한 명을 꽁꽁 얼려붙게 해서 움직이지 못하게 합니다. 스킬 발동자만 이펙트를 볼 수 있습니다. 6.페이커/만일 사망하면 자신의 미션을 모두 수행한 것으로 처리됩니다. 7.스피더/남아있는 사람이 4명이하라면, 자신과 팀원들의 이동속도를 20%증가시킵니다. 8.스틸러/근처에 있는 사람들의 직업을 훔칠 수 있습니다. 하지만 조심하세요, 마피아의 직업을 훔칠려고 하면 돌이킬 수 없는 일이 생길 수도 있으니까요! 9.의심/sus(?)"
Goose Goose Duck,"뭔가 어몽어스와는 확실히 차별화 된 게임인게, 일단 캐릭터들도 너무 귀엽고 직업도 다양해서 개인적으로는 되게 재밌다고 생각합니다"
Goose Goose Duck,"무한로딩 실행 안됨 라우터 변경, 삭제후재설치 여러번해도 같은현상이 일어남"
Goose Goose Duck,재밌는데 너무 렉이많아요. 자꾸 게임 도중에 튕겨서 나가고 렉걸려서 방도 안들어가지고. 너무 짜증나네요. 이게 몇번째인지
Goose Goose Duck,제작장 님이 말씀드린 대로 해봤는데 진짜로 되더군요 해 봤는데 정말 재밌고 직업도 많아서 엄청 좋습니다. 저야말로 불편을 드려서 죄송합니다.
Goose Goose Duck,PE 버전으로 경험을 쌓아서 PC 버전으로 하기 편했습니다! 게임 자체도 너무 재밌어요 감사합니다!
Goose Goose Duck,"친구들과 놀기가 좋습니다!별10개는 주고싶네요,다만 ..,소리가 조금 작습니다.그것 빼곤 너무 재밌습니다 강추드려요!"
Goose Goose Duck,회원가입 안돼서 재밌는지 게임을 할 수도 없어요 기다리는 텀이 너무길어요 버그도 많아요 한 4번째 회원가입 안돼서 계속 기다리자 하는데 날이 지나도 안되는데 이거 왜이래요
Goose Goose Duck,아..진짜 게임을 끝내본적이 없고 계속 인터넷 연결이 불안정하다고만 떠서..그래도 재밌으니까 3점 드릴게요..
Goose Goose Duck,갤럭시탭에 블루투스키보드 연결해서 쓰는데 화면에 키보드 뭐 눌러야되는지가 안보이네요(키보드 키는 pc랑 똑같이 적용됨) 아마 모바일버전이라 그런거같은데 pc버전처럼 모바일버전에도 키보드 뭐 눌러야하는지 적어주세요
Goose Goose Duck,로그인할라면 이름쓸때이름쓰고뛰고로그인하샘 예시:이름 근대개임이너무재미가있어요 마이크를안할수도있고할수도있고너무좋아요
Goose Goose Duck,업데이트도했고 캐시도 삭제해보고 제거후 제설치도 해보았지만 업데이트 하라는 문구만뜨고 실행이 안돼요 어찌해야 실행되나요?
Goose Goose Duck,"한국어 번역이 많이 아쉽고, 게임을 플레이 하기까지의 대기 시간이 많이 길었습니다. 용의자들 게임에서 넘어왔는데 전반적으로 雑。"
Goose Goose Duck,모바일로 음성을 사용하면 기계음이 많이 들리고 하울링이 들리네요..덕분에 게임을 못합니다
Goose Goose Duck,안녕하세요 저는 최근에깐 유저입니다. 이게임을 했는데 재미있는데 조종이 힘들어요 조종하는거만 고쳐주시면 별을 5점들일 수 있을것 같아요.
Goose Goose Duck,디자인이랑 다른 종류에 직업이 있어서 좋고 대신 아쉬운점이 있어요. 음성성질이 좀 안좋드라고여
Goose Goose Duck,재밌습니다 선물 흭득을 위한 코드입력을 게임 내에서 추가해주신다면 더 편의성이 개선될 것 같습니다.
Goose Goose Duck,"어몽어스와 비슷한데 역할까지 넣다니,이분 천재 아니에요?심지어 맵도 개성있고 모드도 다양하다니,강추!!!^^"
Goose Goose Duck,"데이터로는 메인화면까지만 뜨고 다른 유튜버들 보니까 시작이랑 튜토리얼 등이 있더라구요 근데 저는 시작, 튜토리얼같은 버튼도 보이지 않습니다 그래서 시작도 못하고 리뷰 남겨요"
Goose Goose Duck,어몽어스도 재미있죠~하지만 덕몽어스는 미션도 있지!보안관 거의 등등 다 있다구요 많은참여부탁드려요 참고로 덕몽어스는 가입
Goose Goose Duck,정말제밌어요근데단점이있어요1.사람들이욕을많이쓴다2.심하면페드립까지한다.이정도를제외하면정말최고의게임인것같습니다
