game,review
Goose Goose Duck,다른 방에 들어 가면 계속 튜토리얼만 떠가지고 못하고 있습니다 튜토리얼 하려고 하는데 계속 가다가 멈춰요 왜 이러죠?
Goose Goose Duck,아니 씹더 겜 한판하려면 지루하게 관전해야하는거 뭐냐고 진짜 기다리는게 몇분인데 처음에 모르고 들어갔다가 40분동안 겜 못함 옛날이 더 좋았음
Goose Goose Duck,저만 마이크 안돼는거 빼고 다 굿굿! 직업도 많아서 좋고 어몽어스처럼 핵쟁이나 역많이하는 분들 없어서 되게 좋습미다 추천드려요
Goose Goose Duck,이겜 처음하는데 자꾸 멈추는 버그가걸리고 사람들이 욕설을 많이합니다 그래도장점은 많습니다 개발자님이 버그만 고쳐주시면 5점을드릴수도 있는데 기분이 안좋습니다 직업이 너무많긴해요 그래서 너무재밌네요 버그 고쳐주시면 감사하겠습니다 개발자님 힘내세요!
Goose Goose Duck,직업도 어몽어스보다 다양하고 조그에 버그빼곤 정말 재미있게 플래이 하고있습니다!
Goose Goose Duck,정말 좋은 게임입니다.. 하지만 모바일로 방을 생성하고 오리수와 중립수를 바꿀때 제 손이 이상한건진 모르겠지만 터치가 잘 안됩니다.. 그것만 좀 고쳐주시면 아주 좋은게임이 될것같습니다!!ㅠㅠ
Goose Goose Duck,이거 넘모 좋네요! 여러가지 모드가 있고 게다가 여러 직업이 있어서 좋은 것 같아요:) 또 마이크가 있어서 편리하고 조절도 가능해요 근데 로딩 속도가 좀 느리네요.. 이거 고쳐 주심 감사합니다
Goose Goose Duck,"이거 튜토리얼에서 안되는게 너무 많아요. 저는 거위(어몽에선 크루원)로 튜토리얼을 진행했는데, 미션해라 한 다음에 제 캐릭이 안 움직여요 제 인터넷 문제는 아닌게 자른 게임들은 정상적으로 잘 작동이 되서,이건 시스템에 문제가 있다고 보거든요? 그리고 오리!! 봇을 죽인 후에 미션을 하라는데 대체 어떻게 하는거죠..? 이 2개 이후에도 더 있을법하긴 한데, 우선 이것들 패치좀 부탁드립니다. 제가 다른 리뷰 답변둘도 봐보니 더럽게 성의없으시네, 제 답변읽고 화나서 지웠습니다. 지침을 읽긴 개뿔이ㅋㅋ"
Goose Goose Duck,다 좋은데 조금씩 버그가 있습니다 예를 들면 킬 버튼을 눌렀는데 돌진만 하고 죽지는 않아서 2 대 2상황을 못 만들고 투표로 죽었습니다 수정해 주시면 감사하겠습니다
Goose Goose Duck,게임중 갑자기 오디오와 마이크가 꺼지고 다시는 연결 되지 않는 심각한 버그가 있습니다. 덕분에 할 때마다 한창 재밌을 때 게임을 나갔다가 돌아와서 관전하고 담판을 기다려야하는 수고가 생깁니다.
Goose Goose Duck,"업데이트 이후 갤럭시 버즈를 착용하고 게임을 하면 게임 소리 및,음성이 들리지 않으며 종료후에도 버즈를 착용하고 있음에도 아무 소리가 들리지 않으며 오히려 이전 버전 보다 더 안 좋아졌습니다 빠른 시일내로 해결 부탁드립니다"
Goose Goose Duck,이 게임 재미는 있는데 정확히 따져본다면 이어폰이 문제가 아니라 삼성폰 문제인거 같은데요 지금 쓰는 이어폰이 삼성꺼도 아닌데 안되거든요? 아니면 안드폰이 문제인지 모르겠는데 좀 해결할거면 최대한 빨리 해결해주셔야 다른유저들도 편하게 마이크키고 할 수 있지 않을까요?? 알아보겠습니다만 답변하지 마시고 상세하게 알아보시고 빠른해결 부탁드립니다 +아니 삼성 이어폰자체가 문제아니고 삼성폰이 문제라고 봐도 되지않을까요? 이 게임 말고 다른회사 게임은 이어폰 암거나 써도 잘만 들리고 마이크도 잘 된다고요ㅡㅡ 제작자님 한번 더 댓글 봐주시고 답변바랍니다
Goose Goose Duck,갤럭시 노트20+ 사용하는데 마이크 인식이 안됩니다. 설정에도 Default input만 뜨네요. 스마트폰 설정에서 마이크 허용도했습니다... 고치는 방법이 있나요?
Goose Goose Duck,"다 좋습니다 직업이 많은것도 수시로 업뎃하는것도 소통도 다 좋은데 대신 금화를 얻는 경로가 상당히 한정적이라서 이런방식으로 금화를 얻으면 좋겠습니다 1.게임이 끝나고 일정확률로 금화 획득 2.한탕주의자 최대 보너스,청부업자/보디가드의 보너스를 1금화로 변경 3.도전과제를 납치됐오리 l,납치됐오리 ll,납치됐오리 lll같이 도전과제 세분화 또는 도전과제에서 얻는 금화량 증가 4.은화ㅡ>금화 변환 100은화ㅡ>1금화 5.퀘스트같은 서브컨텐츠를 추가하여 은화/금화 수급처 증가"
Goose Goose Duck,"꼭 읽어주세요. 모바일 플레이 중 마이크 입력값이 현저히 떨어지는 현상이 있습니다. 이건 게임이 통화 음량을 조절하지 않고, 미디어 음량을 조절하기 때문입니다. 마이크 음성 입력을 높이면 정상적으로 해결이 됩니다. 말하는 도중에 올리면 되요."
Goose Goose Duck,처음 시작하려고 거위 튜토리얼을 하려고 하는데 조이스틱이나 터치로 하는 이동 방식이 안 됩니다. 쉽게 말해 움직이지 않습니다. 단순한 버그 인가요?
Goose Goose Duck,"어몽같은거보다 재밌습니다.여러가지 많은 맵,많은 모드가 있어서 재밌게 할 수 있는거 같아요.단점 하나가 있는데 방 들어갈 때 로딩이 너무 길어요..."
Goose Goose Duck,1. 게임중 튕김이 심각함. 접속끊기는 현상이 거의 1시간에 한번꼴. 2. 게임떠나기(메인화면)가 안되는 경우가 많음. 게임 중 뿐 아니라 게임대기장(로비)에서도 나가기가 안되어서 강제종료 해야하는 경우 다수 발생함
Goose Goose Duck,재미는 있는데 악성 유저가 너무 많습니다. 1.가만히 있는 유저 2.채팅으로 도배하거나 마이크로 시끄럽게 하는 유저 3.핵 등등 문제점이 많아요 일단 벤 기능만 추가해주심 괜찮을거 같아요
Goose Goose Duck,핸드폰 블루투스 이어폰과의 호환문제가 있음. 핸드폰 스피커를 사용할때는 음성채팅에 문제가 없음. 블루투스 이어폰으로 노 마이크 모드일때는 잘 진행되지만 마이크모드를 키고 인게임 음성이 들리는 순간 게임 내 모든 소리가 아예 안들림
Goose Goose Duck,거위들도 직업이 있어서 재밌었어요. 또 음성채팅도 가능해서 좋았어요. 근데 아쉬운게 송골매 자투하라고 하면 다 들키던데 송골매 리메이크 좀요. 또 영매사도 너무 쓸모가 없어요. 능력이 살짝만 바뀌면 재밌을듯 암튼 그래도 잘 만든듯해요.
Goose Goose Duck,구스구스덕을 재미있게 즐기고 있는 유저입니다. 친구추가 기능이 있어 다른 상대를 초대할 수 있어 좋지만 친구추가가 된 다른 상대가 있는 방에 참가할 수 있는 기능이 없어 친구추가를 해도 같이 못노는 경우가 많아 불편합니다. 이 기능을 만들어 주시면 감사하겠습니다.
Goose Goose Duck,처음에는 조금만 기다리면 방에 들어가지는데 거기서 한번 튕겼다?그러면 제대로 로그인 되지도 않고 방 한번 들어가기 더럽게 힘든데 만약 방에 들어가면 10초있다가 또 다시 튕김 비추 완전 비추 이거 할 빠엔 어몽어스한다
Goose Goose Duck,직업군이 아주 많아서 재밌습니다. 별을 5개 준 이유는 직업군이 많고 다른 게임 모드도 있고 맵들도 다 개성이 있어서 아주 좋습니다. 직업군을 더 많이 추가해주세요!
Goose Goose Duck,재밌네요 단점과 장점으로 나눈다면 장점은 게임 플레이가 재밌고 퀄리티도 좋네요 그리고 회의를 할때 얘기를 할수있다는것이 아주 좋아요 단점은 비매너 사람울 킥할수 있는 것을 추거 해주시면 좋겠습니다 게임 재밌고 꼭 한번 깔아보세요
Goose Goose Duck,너무 재밌어보여서 다운로드 했는데 게임이 바탕화면이랑 파일 그어디에도 안보여서 구글에서 문제 해결방법도 여러번 검색했는데 안뜨더라구요(그 경우의 문제 해결방법이) 그래서 별점 2개 드립니당 이유가 한가지 더 있어요 바로 재밌어보여서 입니다 그럼 이만 여기까지 읽어주신 분들 모두 감사합니다^^
Goose Goose Duck,재미있는데요 진짜 버그가 너어어어무 심해요... 데이터 와이파이 빵빵해도 계속 튕기고 버즈도 핸드폰도 멀쩡하고 빵빵 완충에 몇 번이나 껐다 켜고 소리 다 체크해도 구스덕 소리가 안 들릴 때가 많아요... 멜론도 1분 미리 듣기 해주는데 여기는 10초 미리 듣기네요 진짜 하다가 너무 화가나서 구스덕 지웠다가 다시 깔았어요 울 뻔했네요... 오류 좀 고쳐주세요 진짜 너무 재밌는데 오류가 오져요... 그리고 말 할 때 스피커 입는데 겨울왕국 안나처럼 갖다대고 크으게 말 해야 들린대요 설정해도 그래요... 진짜 오류만 고쳐주시면 5점 드릴게요 리뷰 지우셨네요... 그래서 다시 올려요 제 지인들도 다 똑같은 일 겪었어요 주변인이나 리뷰만해도 10명은 훌쩍 넘네요
Goose Goose Duck,재밌긴 한데 움직일때 모바일에서 하기가 좀 불편해요. 조이스틱으로 차라리 초짜도 잘할수 있게 바꾸면 좋겠어요. 개인적으로 이거랑 로딩 빼곤 문제가 없네요.
Goose Goose Duck,재밌고 좋은데 일일서버점검 때문에 재밌게 잘 놀던 사람들 냅두고 나와서 방을 다시 찾아야 한다는게 너무 미워요. 좋은사람 많은 방에서 잘 놀고 맀었는데 판 끝나니까 나가져서 방 다시 찾으려니 없고 ... 이쁨이였나 그 방에서 페페론치노 저에요!!!
Goose Goose Duck,그 광고보는 페이지에서 게임시작하기 버튼이 있어야 게임을 할 수 있는데 시작하기 버튼이 사라져서 아무것도 할 수가 없어요.. 아니면 로딩중 페이지에서 자꾸 메인메뉴 버튼만 나오고.... 이미 게임도 다시 삭제했다가 깔고 폰도 재부팅 했는게 뭐가 문제죠?ㅜㅠ
Goose Goose Duck,"어몽어스 즐겨했는데, 그 뒤로 이어질 게임이 새로 나와서 좋네여😊 재밌어요!! 모드도 다양하고, 음성채팅도 되고, 직업도 다양해서 강추👍👍"
Goose Goose Duck,왜 업데이트 할 때마다 업데이트를 하ㅓ나 앱을 삭제했다가 다시 깔아도 업데이트 하라는 공지가 뜹니까ㅠㅠㅠ 2월달에도 문의했는데 안 고쳐졌네요. 핸드폰 목소리 울림도 아직도 그대로 에요 ㅡㅡㅡㅡㅡㅡㅡㅡㅡㅡㅡㅡㅡㅡㅡㅡㅡㅡ 핸드폰으로 할 때 소리 울림 현상 좀 고쳐주세요 그리고 오늘 갑자기 업데이트하라는 창이 뜨는데 어플을 삭제하고 다시 설치해도 계속 떠요
Goose Goose Duck,너무 재미있어요!!강추! 업댓 느린건 좀아쉽지만 직업다양하네요
Goose Goose Duck,답변도 매우 빠르시고 무엇보다 게임성이 높습니다. 다만 금색 재화를 얻는 방법이 광고나 미션 밖에 없다는 것이 아쉽네요. 항상 재밌게 하고 있습니다.
Goose Goose Duck,재밌긴 한데 그 이어폰 헤드셋 버즈 이런거 꼈을때 대부분 말이 안들리고 말 인식도 안돼서 아주 불편하거든요... 안꼈을땐 잘 들리고 말도 잘 말할수있어서 좋은데 이것만 좀 고쳐 주었으면 좋겠습니다. 다른건 다 좋아요!
Goose Goose Duck,아이패드 프로5세대로 게임하면 게임 소리가 너무 작아요 제발 고쳐주세요 ㅠㅠ 게임 소리가 너무작아요 아이패드로 플레이하면ㅠ
Goose Goose Duck,와 진짜 강추 합니다 어몽어스는 계속 랙 걸려서 불편 했는데 이거는 랙도 안걸리고 게임도 재미있어서 친구들 이랑 하면 재미 있어요!!그리고 직업도 다양해서 질리지 않고 계속 하게 되네요!!! 강추 합니다!
Goose Goose Duck,업데이트 하기전까지는 잘만됬는데 업데이트 이후로 자꾸 네트워크 문제로 팅기네요. 네트워크는 4칸인데요. 그리고 팅길때마다 계속 로그인도 다시 하게 하네요. 빨리 고쳐주세요... 잘하다가 갑자기 많이 불편해졌어요...
Goose Goose Duck,재밌습니다 다만 마이크오류심해요 어떤때는 잘되고 어떤때는 마이크안들린다고 하네요 안들린다고 하는때가 많습니다
Goose Goose Duck,완벽하다 Among us는 퇴물되고 비슷한겜중 좋은쪽에 속함 우선 직업많고 맵도모드도 많다 근데 옷 (스킨) 얻을려면 돈이 조금 많이 필요한거 빼고는 완벽 거위도 귀엽고 스릴도 있고 이겼을 때 쾌감은 정말 끝내줌 앞으로도 잘부탁 합니다
Goose Goose Duck,게임 자체는 잘 만들었지만 버그가 가끔 나타납니다 제가 지금까지 본 버그는 게임 시작했는데 한명만 로비에 남아서 시작을 못 하는 버그랑 게임중 플레이어가 나가면 그 판이 끝난후에 중간 퇴장 플레이어가 아직 있는걸로 표시되어 방장이 시작을 못 합니다
Goose Goose Duck,"정말 재밌어요 근데 직업좀 추가해주세요.예를들어 1거위:다른거위에게 다가가 연구버튼을 총2번 누르면 그의 직업을 알수있다(쿨타임15초) 2거위:시체로 변장할수있다.거위의 눈에 보이지는 않지만 오리,중립의 눈에는 보이고 신고도 할수있다 물론 자신은 살아있다 3거위:20초동안 은신을할수있다.(쿨타임15초) 4거위:익명투표방이라면 누가 누구를 투표했는지 색을볼수 있다 5거위:모두의 직업을 알수있다 하지만 자신이 죽으면 오리나 송골매의 승리가된다 6오리:시체를 가져갈수있다 시체를가져가 다른데다 놔둘수있다 하지만20초가 지나면 자동으로 시체가 빠져나온다 7오리:자신이 투표한 사람이 다음턴에 움직일수없다 8오리:주변에 거위가 여러명 있다면 한번에 모두다 죽일수있다 하지만 벤트,숨는행동을 할수없다 (최대4명을 죽일수 있음) 9중립:특정시간동안 가만히 있으면 승리한다 10중립:자신만의 공간에 다른거위와 오리들을 넣을수있다 한턴에총2번 넣을수 있으며 자신의 공간에 오리와중립이 모두 있으면 승리한다"
Goose Goose Duck,컴으로 하다가 이번에 폰으로 하게 되었는데 소리가 들리다가 체팅을 치려고 하니 아무 소리도 안들립니다. 몇번이나 껏다 켜보았지만 고쳐지지 않아서 결국 게임을 하지 못했네요. 뭔 개같은 버그인지 몰라도 얼른 고쳐주길 바랍니다.
Goose Goose Duck,게임하려고하는데 시작화면만 뜨고 다음으로 안넘어가집니다. 로딩중이랑 메인메뉴 버튼만 뜨는데 메인메뉴 버튼 누르면 아무 변화없이 그냥 로딩중으로 다시 떠요ㅜㅅㅜ 서버가 터진걸까요..?
Goose Goose Duck,오류도 없고 정말 편안해요! 여러 모드들도 있고! 역할도 정말 많고 음성통화 할수있어서!진짜 좋아요 !
Goose Goose Duck,오디오 권한은 항상 부여 했습니다 제가 많이 해보니까 말할때는 문제없는데 채팅창 들어가서 치려고 하는순간 끊켜서 재접속을 해야하는 버그가 있습니다
Goose Goose Duck,와...이게임 진짜 좋아요. 이게임 하고싶어서 스팀을 깔아보았지만 로그인이 안돼서 못했는데 어느날 스토어 순위에 들어와보니깐 이게 있더라고요. 처음엔 짭인줄 알았는데 직접 플레이 하니깐 똑같더라고요 ㅋㅋㅋ 음성대화도 잘돼고 꾸밀수도있고 직업도 똑같이 있어서 놀랐네요. 버그가 있다 하시는 분들이 있는데 버그가 생기고 안생기고 하시는 분들이 있는거 같아요. 저는 버그 없었어요. 어쨌든 진짜 재밌네욬ㅋㅋ 친구들이랑 같이하니깐 더 재밌곸ㅋㅋ 짱짱
Goose Goose Duck,제미는 있는데 욕하는 사람이많고요 공개서버에서도 근거리 음성 되면 좋겠네요!!
Goose Goose Duck,일단 재밌긴한데 항상 업데이트가 항상 안되네요 문제점는그것빼고없습니다
Goose Goose Duck,재미있기는하지만 매인메뉴에서 채팅을 상대방한테 못하는게 너무 큰 단점임 친추되어있는 사람들끼리도 채팅이 가능하게 해야함
Goose Goose Duck,정말 재밌지만 오디오가 헤드셋이나 이어폰에 연결했을 때 하나도 들리지가 않아요..이건 정말 개선해주셔야할 것 같아요. 게임진행에 큰 방해가 됩니다.
Goose Goose Duck,"1차적으로 유선이어폰이나 무선 에어팟이나 둘다 마이크 인식이 안됌, 2차적으로 이어폰or에어팟을 뺐다가 다시 끼면 방을 나갔다가 오는게 아니면 다른사람들의 마이크가 안들림 핸드폰 구구덕은 가장 먼저 마이크문제를 해결해주는 바람으로 리뷰적습니다."
Goose Goose Duck,게임 자체는 재밌으나 마이크 볼륨이 유선이든 블루투스든 제대로 인식이 안되거나 아주 작게들림 마이크 증폭 앱키고해도 잠시 커졌다 다시 작아짐
Goose Goose Duck,보이스 문제가 왜 갈 수록 안좋아지죠? 처음엔 버즈는 이상해도 이어폰은 잘 되더니 업데이트 뒤로 이어폰도 마이크 안먹고 이번 업데이트 뒤로는 소리도 못듣네요
Goose Goose Duck,모바일이라 폰이 좋지않은사람은 조금 랙이 걸릴수 있지만 굉장히 잘만든 게임이다. 여러가지 직업이있기에 계속 생각을 해야하며 극적인 상황에서 이겼을때 기분은 말로 할수없다. 만약 이 글을 누군가 본다면 이게임을 당장 까는걸 추천한다. (인싸들만 할수있음)
Goose Goose Duck,앱이 주기적으로 튕기고 튕기면 와이파이가 끊어집니다... 모바일데이터(5g) 사용상태로 로그인하면 게임이 메뉴까지 가지도 못하고 무한 로딩됩니다.
Goose Goose Duck,음성을 포함한 모든 사운드가 갑자기 사라지는 버그 덕분에 게임 한판을 제대로 못하.... 재밌어보여서 너무 해보고 싶었는데.. 버그를 고쳐주지를 않아요 왜..ㅠㅠㅠ 어쩌다 한번 그러는것도 아니고 게임 접속만 했다하면..!!! 왜..!!ㅠ
Goose Goose Duck,어몽보다 직업많고 맵도많음 물론 모드는 더 많지만 깔기가 복잡함 그리고 옷좀 더 추가해주세요 그리고 색깔도 쉽게 바꿀수있게 그리고 사람들이 보이는 지도도 만들어주세요 꼭까세요 강추
Goose Goose Duck,저번에 구글계정 로그인이 안된다고 말했었는데 지금은 무한로딩도 풀려있고 모바일로 이용할수 있어서 좋습니다 솔직히 어몽어스보다 훨신더 재미있고 거위(크루원)들도 직업이 있어 게임하기 좋아요 😀 미션도 어려워 더 재미있고요 한번씩 다운받으셔서 게임하는걸 추천드립니다
Goose Goose Duck,처음 이용약관이 너무길긴 하지만 게임도 재밌고 직업도 여러가지 인데다 좋으신 분들도 많고 적극 추천합니다.새로운 모드와 직업이 나오면 더 좋을것 같네요. 어몽어스랑 비교하지 마시고 오직 구스구스덕만을 생각하며 플레이해주세요.이상 마치겠습니다.
Goose Goose Duck,미션 중에 보이스가 안되는 오류가 발생합니다. 투표 때는 보이스가 됩니다만 미션 중엔 안됩니다. 오류인 것 같은데 수정되나요 ?
Goose Goose Duck,게임성은 좋은데 모험가나 복수자같은 거의 무능한 직업 추가 안 해줬으면 좋겠다.
Goose Goose Duck,음성 채팅이 있어서 좋긴 한데 렉이 너무 많이 걸리네요 그리고 게임 조작도 힘들고 공간이 너무 넓어서 게임을 하기는 커녕 시체를 찻기도 힘드네요. 이점만 고치면 재밌게 할수잇을것 같습니다.
Goose Goose Duck,아주 재미있습니다 얼래 어몽어스만 했는데 덕은 직업도 많아서 재밌습니다굿~~
Goose Goose Duck,1.갑자기 와이파이 끊겼다함 와이파이 잘작동하는데 끊겼다는게 말이되나 그리고 자동 튕겨서 다시 들갔는데 몇분 있어야함 진짜 랙으로 튕긴사람은 뭐가됩니까.... 2.도전과제다깨도 골드 100개? 못모음 현질해야만 얻을수있는게 많음 3.마피아 어몽어스 짬뽕해서 만든건 괜찮음 로딩?엄청늦음 자리남았다는데 들가니까 갑자기 꽉참 로딩 엄청 느려터져서 로딩7번 걸리면 겜 한판한시간임 이거좀 고쳐줘여 재밌긴한데
Goose Goose Duck,정말 재밌는데 에어팟으로 하면 다른사람들 소리가 안들립니다 이 문제점 해결 부탁드려요!
Goose Goose Duck,다 좋은데 모바일 컨트롤 개선 해주세요 터치 이동 방식일때 버튼 누르면 그쪽으로 이동하는거 막아주시고 그리고 모바일 마이크 개선 좀 해주세요 계속 로봇소리처럼 갈라진데요
Goose Goose Duck,너무 재밌어요 저이게임1년째하고있는 유저입니다 너무나재밌어 학교에서도 몰라할정도로 너무재밌습니다 혹시라고 않해봐다면 해보시면 좋울거같습니다 근데욕하는 사람이 좀많은거같기도하네요 맨날 공부는않하고 이게임만할정도!! 이게임꼭 추천해드리고싶네요 이게임 한번이라도 해보세요아! 맞다 이게임 하면 빠져나울수없다는점!!빠져은 나울수있습니다
Goose Goose Duck,아니 다 괜찮은데 업데이트 된거중에 직업이 만약 탐정이면 조사할때 버튼이 오른쪽에 있었는데 왜 왼쪽으로 갔어요??? 누르기 불편하게시리;;;; 그거만 다시 원래대로 바꿔주시면 좋을거같아요
Goose Goose Duck,"갤럭시 버즈로 이용시, 음성채팅 활성화가 되지 않습니다 게임소리만 들리고, 사람들 목소리와 제 목소리가 들리지 않는다는 단점이 있어요 이점만 개선된다면 모바일 유저들이 더 많이 할 것 같아요"
Goose Goose Duck,"재밌게 하고있어요. 그런데, 비공개방에서도 공개방처럼 채팅차단시스템이 있으면 좋겠어요. 불리하면 욕하는 비매너유저가 많습니다."
Goose Goose Duck,주식좀 주세요 임무 ㄹㅇ주식얻을수있는임무만 100번넘게한거같음 진짜 뒤졌다 깨어나도 안줘 다른재료는 조금씨 채워지고있는데 진짜로 개너무한거아님? 아무튼 좋은게임이고 어몽어스랑은 차이점이있음 매커니즘은 같은데 어몽어스하던거처럼하면 적응못함 오히려 느려짐
Goose Goose Duck,다 재밌습니다. 근데 한가지 아쉬운 부분은 게임도중 마이크로 소통이 안돼는 것입니다. 업데이트로 인해 된걸로 알고있는데 이 부분 좀 다시 해주시면 안됄까요?..
Goose Goose Duck,일단 어몽어스를 따라한것 같아서 4점 드립니다 또 광고가 없는게 완전 좋죠
Goose Goose Duck,일단 어떤 사람이 준비를 안하면 추방을 못하고 욕도 많이 하는 사람들이 몇명있고 친플로 인해 한명을 이기겨 의김을 일부러 하는 그런 사람들이 몇명있습니다ㅜㅜ 그런건 거의 자제하게 해주세요ㅜㅜ 버그는 저번에 이상한 방이 하나 생겼다가 사라졌어요 방장도 없고 시작도 안되고 움직여지지도 않았ㅇ어요ㅜㅜ
Goose Goose Duck,내 이어폰 문제인건지 폰 문제인건지 게임 문제인지는 모르겠는데 게임을 진행하다가 갑자기 인겜 소리와 마이크 다른 사람 소리가 안 들린다던지 인겜 소리만 들리고 다른 사람 소리는 안 들리는 문제가 발생합니다(들리다가 갑자기 뚝뚝 끊김) 이것만 고치면 좋을듯 싶습니다
Goose Goose Duck,구스구스덕같은 게임에서 중퇴시 입장제한 있으면 안된다 생각함ㅋㅋㅋㅋ 퍼블이면 겜 나가지...ㅋㅋㅋㅋㅋㅋ 이거 패치 안하면 떡락할듯함
Goose Goose Duck,"어몽어스랑 비슷하지만 다양한 직업들이 많아요, 완전 꿀잼! 추천드릴게요!"
Goose Goose Duck,안녕하세요 구스구스덕 플레이어 인데요 제가 이게임을 할때 계속 와이파이가 1로 주는데요 그럴때마다 튕겨서 너무 짜증이나요 그런점 고쳐주시면 좋겠고요 다른건 다좋은데 튕기는거만 고쳐주시면 별5개 드리겠습니다 :>
Goose Goose Duck,버그만 없다면 거의 완벽한게임이에요!! 모드도 다양해서 질리지않고 즐길수있어요 친구들과 함께한다면 정말 재밌는게임입니다
Goose Goose Duck,친구가 추천해줘서 시작했는데 어몽어스와 비슷하더라구요 그런데 역할도 더 많고 마이크도 있어서 대화도 할수있어서 좋은것 같아요 어몽어스 같은 게임 좋아하시는 분들 에게는 추천 드립니다
Goose Goose Duck,너무 재미있고 좋은데 마이크가 없는사람들은 소리가 작아서 불편해요ㅠㅠ
Goose Goose Duck,업데이트 전에는 오류가 없었는데 업데이트 이후로 삼성 버즈로 플레이 할때 오디오와 마이크 연결이 이상해요ㅠㅠ
Goose Goose Duck,모든 부분이 만족스러우나 투표를 받아서 죽기전에 나가버리면 방에 갇혀버립니다
